MUNNOMBRE;CANNOMBRE;PARNOMBRE;VOTOS
SANTANA;Elber Gamboa Chacon;Alianza Verde;57
SANTANA;Partido Social De Unidad Nacional;Partido de la U;57
SANTANA;Julieta Fajardo Mosquera;Partido Liberal Colombiano;56
SANTANA;Partido Liberal Colombiano;Partido Liberal Colombiano;53
SANTANA;Ramiro Nino Benavides;Alianza Verde;47
SANTANA;Stella Cruz Fontecha;Partido Liberal Colombiano;47
SANTANA;Ayde Quitian Rodriguez;Alianza Social Independiente;45
SANTANA;Hector Jose Bolivar Hurtado;Alianza Verde;36
SANTANA;Helena Vargas Ostos;Alianza Social Independiente;20
SANTANA;Jenny Alida Moreno Rodriguez;Partido de la U;19
SANTANA;Libardo Olarte Ramirez;Alianza Verde;18
SANTANA;Gloria Isabel Fernandez Munoz;Partido Liberal Colombiano;17
SANTANA;Partido Verde;Alianza Verde;15
SANTANA;Sandra Patricia Hernandez Cristancho;Partido de la U;10
SANTANA;Leidy Paola Zarate Quiroga;Alianza Verde;6
SANTANA;Rosa Xiomara Bermudez Suarez;Alianza Social Independiente;6
SANTANA;Nelcy Villamil Cuca;Alianza Verde;5
SANTANA;Leidy Catherine Corredor Mejia;Alianza Verde;3
SATIVANORTE;Hilario Martinez Gomez;Partido de la U;164
SATIVANORTE;Blanca Ines Gomez Quintero;Partido Conservador Colombiano;108
SATIVANORTE;Guillermo Aparicio Monsalve;Partido Conservador Colombiano;102
SATIVANORTE;Maria Claudia Avila;Partido Conservador Colombiano;86
SATIVANORTE;Hugo Bayardo Gomez Arenas;Partido Conservador Colombiano;83
SATIVANORTE;Irma Yineth Velandia Sandoval;Partido de la U;83
SATIVANORTE;Aura Alicia Gomez Sandoval;Partido Conservador Colombiano;80
SATIVANORTE;Jose Elicio Mejia Higuera;Alianza Verde;79
SATIVANORTE;Oscar Figueredo Baez;Opción Ciudadana;73
SATIVANORTE;Carlos Gilberto Nova Calderon;Partido Conservador Colombiano;66
SATIVANORTE;Jeison Lizarazo Monsalve;Cambio Radical;66
SATIVANORTE;Jaime Cordoba Aparicio;Partido Conservador Colombiano;64
SATIVANORTE;Jefferson Avila Rodriguez;Partido de la U;64
SATIVANORTE;Ana Mariela Velandia Sandoval;Partido de la U;63
SATIVANORTE;Luis Esteban Gomez Ronderos;Cambio Radical;62
SATIVANORTE;Segundo Arquimedes Quintero Gomez;Alianza Verde;55
SATIVANORTE;Carlos Julio Perez Perez;Opción Ciudadana;54
SATIVANORTE;Elquin Augusto Quintero Aparicio;Partido de la U;52
SATIVANORTE;Isaias Baez Sanchez;Alianza Verde;49
SATIVANORTE;Mauro Antonio Joya Sandoval;Cambio Radical;42
SATIVANORTE;Victor Julio Duarte;Partido de la U;42
SATIVANORTE;Partido Social De Unidad Nacional;Partido de la U;40
SATIVANORTE;Sandra Milena Baez Suarez;Alianza Verde;34
SATIVANORTE;Rosa Maria Baez Baez;Cambio Radical;24
SATIVANORTE;Partido Verde;Alianza Verde;18
SATIVANORTE;Henry Camacho Velandia;Opción Ciudadana;15
SATIVANORTE;Partido Conservador Colombiano;Partido Conservador Colombiano;13
SATIVANORTE;Diana Mayerly Palencia Estupinan;Cambio Radical;12
SATIVANORTE;Josefina Orozco Joya;Opción Ciudadana;12
SATIVANORTE;Silvia Veronica Orozco Ronderos;Opción Ciudadana;12
SATIVANORTE;Flor Francisca Salazar Aparicio;Alianza Verde;10
SATIVANORTE;Fabio Alonso Aparicio Quintero;Alianza Verde;9
SATIVANORTE;Partido Cambio Radical;Cambio Radical;7
SATIVANORTE;Rosa Herminia Gomez Ronderos;Alianza Verde;6
SATIVANORTE;Alba Lucia Blanco Lizarazo;Opción Ciudadana;5
SATIVANORTE;Partido De Integracion Nacional;Opción Ciudadana;4
SATIVANORTE;Javier Patino Hernandez;Opción Ciudadana;3
SATIVASUR;Norberto Barajas Blanco;Partido Conservador Colombiano;92
SATIVASUR;Henry Aldemar Diaz Gomez;Partido Conservador Colombiano;89
SATIVASUR;Nelson Enrique Mejia Mejia;Partido Liberal Colombiano;76
SATIVASUR;Lelis Nova Guerrero;Partido de la U;74
SATIVASUR;Jose Ivan Salazar Martinez;Partido Conservador Colombiano;70
SATIVASUR;Jose Leonardo Mojica Garcia;Partido Liberal Colombiano;52
SATIVASUR;Luis Alfredo Silva;Partido Conservador Colombiano;48
SATIVASUR;Carlos Abel Patino;Partido Liberal Colombiano;46
SATIVASUR;Lidya Rocio Nova Velandia;Partido Conservador Colombiano;43
SATIVASUR;Ana Isabel Barajas Vega;Partido Conservador Colombiano;42
SATIVASUR;Araminta Aparicio Lopez;Partido Conservador Colombiano;41
SATIVASUR;Mary Nelcy Mejia Pita;Partido Liberal Colombiano;40
SATIVASUR;Siervo Benigno Mejia Gomez;Partido de la U;35
SATIVASUR;Cesar Dositeo Garzon Nova;Partido de la U;33
SATIVASUR;Jose Hipolito Nova Nova;Partido Liberal Colombiano;32
SATIVASUR;Monica Mejia Marino;Partido Liberal Colombiano;31
SATIVASUR;Partido Liberal Colombiano;Partido Liberal Colombiano;18
SATIVASUR;Partido Conservador Colombiano;Partido Conservador Colombiano;17
SATIVASUR;Gladys Maria Diaz Telles;Partido Liberal Colombiano;16
SATIVASUR;Partido Social De Unidad Nacional;Partido de la U;3
SIACHOQUE;Luis German Amaya Florez;Alianza Verde;155
SIACHOQUE;Juan Carlos Arias Albarracin;Opción Ciudadana;154
SIACHOQUE;Jose Absalon Boyaca Desalbador;Opción Ciudadana;145
SIACHOQUE;Hector Augusto Morcote Catolico;Partido Conservador Colombiano;136
SIACHOQUE;Gerardo Antonio Zipasuca Quemba;Partido Conservador Colombiano;132
SIACHOQUE;Pablo Jose Tibata Daza;Opción Ciudadana;132
SIACHOQUE;Carlos Humberto Tibagan Calderon;Alianza Verde;126
SIACHOQUE;Luis Eduardo Acuna Choconta;Partido Liberal Colombiano;120
SIACHOQUE;Uriel Parada Jimenez;Alianza Social Independiente;119
SIACHOQUE;Melquecidec Cuervo Acuna;Cambio Radical;116
SIACHOQUE;Luis Alfredo Hernandez Avila;Alianza Social Independiente;113
SIACHOQUE;Noe Moreno Pirazan;Partido Conservador Colombiano;113
SIACHOQUE;Luz Herminda Vargas;Opción Ciudadana;109
SIACHOQUE;Jose Alirio Ramirez Lopez;Opción Ciudadana;103
SIACHOQUE;Wilmar Fernando Sierra Espinosa;Alianza Social Independiente;102
SIACHOQUE;Israel Sosa Espitia;Alianza Social Independiente;100
SIACHOQUE;Luis Alejandro Baron Bernal;Partido Liberal Colombiano;100
SIACHOQUE;Martha Lucia Soto Avila;Alianza Social Independiente;95
SIACHOQUE;Armando Garcia Ruiz;Partido de la U;87
SIACHOQUE;William Orlando Avila Leon;Polo Democrático Alternativo;87
SIACHOQUE;Edelmira Reyes Fuquen;Opción Ciudadana;81
SIACHOQUE;Jorge Emilio Nova Lopez;Partido Liberal Colombiano;78
SIACHOQUE;Fabio Enrique Guevara Garcia;Alianza Social Independiente;77
SIACHOQUE;Fulvio Avila;Alianza Verde;76
SIACHOQUE;Luis Gerardo Raigoso Pacanchique;Alianza Verde;71
SIACHOQUE;Segundo Jorge Hernandez Ortega;Partido de la U;70
SIACHOQUE;Jaime Danilo Rojas Valenzuela;Alianza Verde;68
SIACHOQUE;Edison Oswaldo Aguilar Granados;Cambio Radical;67
SIACHOQUE;Alberto Jose Rativa;Opción Ciudadana;61
SIACHOQUE;Partido Verde;Alianza Verde;59
SIACHOQUE;Edgar Enrique Pirazan Morcote;Partido de la U;58
SIACHOQUE;Jose Maximino Galindo Sanabria;Alianza Verde;55
SIACHOQUE;Martha Isabel Motavita Silva;Alianza Verde;55
SIACHOQUE;Jose Adriano Cifuentes;Polo Democrático Alternativo;54
SIACHOQUE;Jose Gabriel Tibasosa Quemba;Alianza Social Independiente;49
SIACHOQUE;Carlos Julio Moreno Castelblanco;Partido Liberal Colombiano;48
SIACHOQUE;Eugenio Sanchez Tibata;Cambio Radical;47
SIACHOQUE;Partido De Integracion Nacional;Opción Ciudadana;46
SIACHOQUE;Julio Alberto Sanchez Neira;Partido Conservador Colombiano;42
SIACHOQUE;Margareth Daniela Moreno Silva;Partido de la U;42
SIACHOQUE;Laura Consuelo Avila Soto;Partido de la U;41
SIACHOQUE;Joaquin Farias Garcia;Partido de la U;39
SIACHOQUE;Hector Cristobal Vargas Soto;Partido de la U;37
SIACHOQUE;Vitalia Monroy Vargas;Partido Conservador Colombiano;37
SIACHOQUE;Maria Ana Ortega Aguilar;Opción Ciudadana;35
SIACHOQUE;Luis Eduardo Chitivo Santafe;Partido Conservador Colombiano;33
SIACHOQUE;Partido Social De Unidad Nacional;Partido de la U;33
SIACHOQUE;Marcos Alfonso Calderon Tenza;Partido de la U;32
SIACHOQUE;Adriana Stella Carreno Alonso;Polo Democrático Alternativo;23
SIACHOQUE;John Fredy Amaya Tibasosa;Polo Democrático Alternativo;21
SIACHOQUE;Lucy Stella Rodriguez Espinosa;Cambio Radical;19
SIACHOQUE;Partido Alianza Social Independiente;Alianza Social Independiente;19
SIACHOQUE;Nancy Esperanza Hernandez Vargas;Alianza Verde;17
SIACHOQUE;Ana Margarita Sanabria Tiusaba;Partido Conservador Colombiano;16
SIACHOQUE;Partido Conservador Colombiano;Partido Conservador Colombiano;15
SIACHOQUE;Jose Alcides Nova Calderon;Partido Conservador Colombiano;14
SIACHOQUE;Maria Del Pilar Garcia Tibata;Partido Conservador Colombiano;14
SIACHOQUE;Maria Catalina Pirazan Suesca;Alianza Verde;12
SIACHOQUE;Partido Liberal Colombiano;Partido Liberal Colombiano;12
SIACHOQUE;Jorge Alberto Monroy Rodriguez;Cambio Radical;10
SIACHOQUE;Maria Dolores Rodriguez Saganome;Alianza Social Independiente;9
SIACHOQUE;Eliana Isabel Rodriguez Jimenez;Partido Liberal Colombiano;7
SIACHOQUE;Margarita Catolico Gutierrez;Alianza Social Independiente;7
SIACHOQUE;Olga Yasmin Salazar Espinosa;Cambio Radical;7
SIACHOQUE;Partido Cambio Radical;Cambio Radical;7
SIACHOQUE;Segundo Rosendo Avila Cruz;Polo Democrático Alternativo;6
SIACHOQUE;Zulma Margarita Soler Rodriguez;Cambio Radical;6
SIACHOQUE;Diana Matilde Quemba Lopez;Partido Liberal Colombiano;5
SIACHOQUE;Fernando Eulogio Guerrero Sanabria;Partido Liberal Colombiano;4
SIACHOQUE;Carlos Julio Roa Bernal;Cambio Radical;3
SIACHOQUE;Flor Imirida Acosta Cardenas;Polo Democrático Alternativo;3
SIACHOQUE;Luis Espinel Espinosa;Polo Democrático Alternativo;3
SIACHOQUE;Polo Democratico Alternativo;Polo Democrático Alternativo;3
SIACHOQUE;Diana Carolina Rodriguez Sanchez;Partido Liberal Colombiano;1
SIACHOQUE;Fanny Alicia Quiroz Nova;Polo Democrático Alternativo;1
SIACHOQUE;Jose Alberto Rodriguez Carabuena;Partido Liberal Colombiano;1
SOATA;Javier Pinzon Paez;Partido de la U;312
SOATA;Carlos German Delgado Fuentes;Partido de la U;255
SOATA;Jose Antonio Baez Mojica;Partido de la U;226
SOATA;Carlos Barrera;Partido de la U;223
SOATA;Luis Argelio Sepulveda Archila;Partido Conservador Colombiano;219
SOATA;Myriam Consuelo Rodriguez De Socha;Partido Conservador Colombiano;203
SOATA;Luis Alirio Mojica Rincon;Partido Conservador Colombiano;191
SOATA;Maria Esperanza Rojas Mojica;Partido de la U;185
SOATA;John Diaz Fuentes;Partido de la U;178
SOATA;Paulina Gomez Gonzalez;Partido Conservador Colombiano;169
SOATA;Luis Angel Baez Camacho;Cambio Radical;164
SOATA;Carlos Alfonso Gonzalez;Partido Liberal Colombiano;153
SOATA;Ramiro Salcedo Reyes;Cambio Radical;151
SOATA;Maria Isabel Veloza Lopez;Partido de la U;145
SOATA;Julio Roberto Rodriguez Estupinan;Partido Conservador Colombiano;135
SOATA;Camilo Roberto Villarreal Marquez;Partido Conservador Colombiano;133
SOATA;Juan Segundo Vargas Salcedo;Partido Conservador Colombiano;133
SOATA;Jose Del Carmen Sanchez Prieto;Partido de la U;116
SOATA;Milton Javier Gomez Santos;Partido Conservador Colombiano;101
SOATA;Carlos German Rubiano Lopez;Cambio Radical;100
SOATA;Carlos Julio Diaz Diaz;Cambio Radical;97
SOATA;Carlos Ernesto Rojas Coronado;Cambio Radical;89
SOATA;Ramiro Antonio Medina Lopez;Partido Liberal Colombiano;86
SOATA;Astrid Susana Mancipe Gomez;Partido de la U;75
SOATA;Pedro Abel Granados Gomez;Partido Liberal Colombiano;74
SOATA;Jairo Enrique Bernal Caro;Partido Liberal Colombiano;67
SOATA;Odilia Sandoval Bustos;Partido Conservador Colombiano;63
SOATA;Francisco Fabian Briceno Cordero;Cambio Radical;58
SOATA;Partido Social De Unidad Nacional;Partido de la U;55
SOATA;Zandra Patricia Alfonso Baez;Cambio Radical;51
SOATA;Gustavo Rodriguez Angarita;Alianza Verde;48
SOATA;Luis Alejandro Uyaban Benitez;Partido Liberal Colombiano;45
SOATA;Angel Yesid Perez Sierra;Alianza Verde;38
SOATA;Blanca Myriam Buitrago Perez;Alianza Verde;36
SOATA;Partido Conservador Colombiano;Partido Conservador Colombiano;35
SOATA;Ruby Consuelo Barajas Meneses;Partido Liberal Colombiano;33
SOATA;Jose Daniel Cudris Duarte;Alianza Verde;32
SOATA;Luz Marina Araque Baez;Cambio Radical;30
SOATA;Alvaro Rodriguez Machuca;Alianza Verde;28
SOATA;Horacio Jose Manrique Gomez;Alianza Verde;28
SOATA;Claudia Pilar Aconcha Bonilla;Alianza Verde;26
SOATA;Jaime Andres Martinez Fuentes;Partido Liberal Colombiano;26
SOATA;Monica Lisette Velandia Llanes;Cambio Radical;17
SOATA;Partido Cambio Radical;Cambio Radical;16
SOATA;Partido Liberal Colombiano;Partido Liberal Colombiano;16
SOATA;Partido Verde;Alianza Verde;12
SOATA;Angela Viviana Delgado Oliveros;Partido Liberal Colombiano;11
SOATA;Marisol Velandia Sanchez;Partido Liberal Colombiano;7
SOATA;Aleidy Marcela Mayorga Duarte;Alianza Verde;3
SOCHA;Oscar Antonio Hurtado Carvajal;Partido Liberal Colombiano;263
SOCHA;Jose Clemente Diaz Diaz;Partido Conservador Colombiano;215
SOCHA;Maria Rebeca Carreno Carvajal;Partido Conservador Colombiano;211
SOCHA;Jose Roberto Amaya Rojas;Partido Conservador Colombiano;210
SOCHA;Marianela De La Coromoto Araque Garcia;Partido Liberal Colombiano;173
SOCHA;Gilberto Alexander Cristiano Estupinan;Cambio Radical;171
SOCHA;Angel Maria Angel Estupinan;Partido Liberal Colombiano;160
SOCHA;Susan Carlin Torres Gomez;Partido de la U;150
SOCHA;Rafael Augusto Socadagui Leon;Partido Conservador Colombiano;131
SOCHA;Maria Enide Benitez Patino;Partido Conservador Colombiano;128
SOCHA;Partido Social De Unidad Nacional;Partido de la U;124
SOCHA;Hildebrando Santos Perez;Partido Liberal Colombiano;116
SOCHA;Edgar Alfonso Estepa Gomez;Alianza Verde;115
SOCHA;Alonso Cuevas Goyeneche;Partido Conservador Colombiano;108
SOCHA;Alexander Fuentes Vargas;Cambio Radical;102
SOCHA;Alvaro Malpica Rincon;Partido Liberal Colombiano;95
SOCHA;Gabriel Antonio Bernal Lopez;Partido Conservador Colombiano;93
SOCHA;Jose Orlando Arciniegas Vargas;Partido de la U;91
SOCHA;Pedro Marceliano Perez Estupinan;Partido Liberal Colombiano;87
SOCHA;Carlos Alfonso Lopez Toca;Partido Conservador Colombiano;84
SOCHA;Juan Pablo Carreno Manrique;Cambio Radical;82
SOCHA;Helber Enrique Malpica Malpica;Partido de la U;75
SOCHA;Partido Liberal Colombiano;Partido Liberal Colombiano;73
SOCHA;Jose Belarmino Uscategui Malpica;Partido de la U;70
SOCHA;Juan De Jesus Espindola Diaz;Partido Liberal Colombiano;68
SOCHA;Lizeth Oliva Uscategui Sarmiento;Partido Conservador Colombiano;68
SOCHA;Carmen Eliza Romero Malpica;Partido Liberal Colombiano;66
SOCHA;Pedro Jose Cely Soledad;Alianza Verde;66
SOCHA;Ana Eugenia Morales De Mejia;Partido Liberal Colombiano;64
SOCHA;Astrid Guisla Baron Goyeneche;Partido de la U;60
SOCHA;Partido Conservador Colombiano;Partido Conservador Colombiano;52
SOCHA;German Alonso Garcia Araque;Partido de la U;48
SOCHA;Diana Isabel Cardenas Abril;Alianza Verde;43
SOCHA;Alicia Ballesteros Salamanca;Partido de la U;42
SOCHA;Maria Fernanda Fonseca Mojica;Alianza Verde;28
SOCHA;Partido Verde;Alianza Verde;22
SOCHA;Maria Estela Toca Soto;Cambio Radical;20
SOCHA;Dora Luz Manrique Estupinan;Cambio Radical;19
SOCHA;Maria Antonia Hernandez Lopez;Cambio Radical;17
SOCHA;Carlos Alfonso Duran Manrique;Alianza Verde;14
SOCHA;Partido Cambio Radical;Cambio Radical;7
SOCOTA;Adiel Panqueba Chia;Partido Liberal Colombiano;174
SOCOTA;Eulises Siempira Vargas;Alianza Verde;142
SOCOTA;Maria Eugenia Castro Diaz;Partido Liberal Colombiano;125
SOCOTA;Jesus Nino Mendivelso;MOVIMIENTO POLITICO AFROVIDES;123
SOCOTA;Rosebel Cucunuba Duran;Cambio Radical;111
SOCOTA;Elias Mendivelso Benitez;Partido Liberal Colombiano;108
SOCOTA;Reinaldo Mendivelso Leal;Cambio Radical;106
SOCOTA;Jose Oliverio Gomez Cardenas;Alianza Social Independiente;101
SOCOTA;Luz Pohema Cristiano Ojeda;Cambio Radical;99
SOCOTA;Fredy Alexander Goyeneche Carreno;Partido Liberal Colombiano;98
SOCOTA;Edwin Alexander Bolanos Toncon;MOVIMIENTO POLITICO AFROVIDES;97
SOCOTA;Hermes Elias Rodriguez Masmela;MOVIMIENTO POLITICO AFROVIDES;96
SOCOTA;Luis Guillermo Rodriguez Ojeda;Partido de la U;89
SOCOTA;Julio Raul Gomez Garcia;Partido Liberal Colombiano;80
SOCOTA;Pedro Montoya Romero;Cambio Radical;80
SOCOTA;Jairo Montoya;Partido Liberal Colombiano;78
SOCOTA;Israel Chia Duran;Alianza Verde;77
SOCOTA;Yamile Benitez Velandia;Partido de la U;75
SOCOTA;Luis Alberto Perez Cristiano;Partido Liberal Colombiano;72
SOCOTA;Jose Diomedes Goyeneche Angarita;Alianza Social Independiente;69
SOCOTA;Eduardo Velandia Mendivelso;Alianza Verde;66
SOCOTA;Agueda Yaneth Velandia Ojeda;Cambio Radical;65
SOCOTA;Carlos Arturo Torres Riano;Cambio Radical;62
SOCOTA;Pablo Emilio Gallo Pasachoa;Alianza Verde;60
SOCOTA;Amparo Alexandra Velandia Carvajal;Alianza Social Independiente;58
SOCOTA;Martin Sua Salcedo;Alianza Verde;57
SOCOTA;Bayardo Rodriguez Diaz;Partido Liberal Colombiano;56
SOCOTA;Partido Liberal Colombiano;Partido Liberal Colombiano;55
SOCOTA;Melba Leonith Montoya Rodriguez;Partido Liberal Colombiano;54
SOCOTA;Samir Eduardo Rodriguez Leal;Alianza Social Independiente;52
SOCOTA;Nuvia Edid Cogollo Avellaneda;Partido Liberal Colombiano;51
SOCOTA;Jose Domingo Blanco Salamanca;Partido Conservador Colombiano;50
SOCOTA;Maximiliano Ravelo Velandia;Partido de la U;49
SOCOTA;Luis Alfredo Garcia Mesa;Alianza Social Independiente;47
SOCOTA;Lulio Bello Nino;Alianza Verde;45
SOCOTA;Dubin Javier Romero Hormaza;Partido de la U;41
SOCOTA;Mercedes Acero Colmenares;Partido de la U;41
SOCOTA;Pedro Ojeda Cruz;Partido de la U;41
SOCOTA;Movimiento Politico Afrovides;Movimiento Politico Afrovides;34
SOCOTA;Orlando Benitez Mendivelso;Cambio Radical;34
SOCOTA;Partido Verde;Alianza Verde;32
SOCOTA;Maria Elena Duran Cardenas;Partido de la U;31
SOCOTA;Partido Social De Unidad Nacional;Partido de la U;31
SOCOTA;Jose Lombardo Goyeneche Cantor;Alianza Verde;29
SOCOTA;Partido Cambio Radical;Cambio Radical;28
SOCOTA;Luz Neyla Calderon Vega;Partido Conservador Colombiano;27
SOCOTA;Eduin Mauricio Vega Arismendy;Partido de la U;26
SOCOTA;Jose Vicente Estepa Mendivelso;Partido Conservador Colombiano;26
SOCOTA;Julio Cesar Ravelo Toncon;Opción Ciudadana;26
SOCOTA;Iri Yohana Rios Caicedo;Alianza Verde;24
SOCOTA;Maricela Medina Jara;Alianza Social Independiente;24
SOCOTA;Climaco Cruz Merchan;Opción Ciudadana;23
SOCOTA;Juan Santos Calderon Vega;Cambio Radical;22
SOCOTA;Herminda Herrera Cuevas;MOVIMIENTO POLITICO AFROVIDES;20
SOCOTA;Monica Johana Gomez Granados;Alianza Social Independiente;20
SOCOTA;Partido Alianza Social Independiente;Alianza Social Independiente;20
SOCOTA;Yomara Medina Cristiano;MOVIMIENTO POLITICO AFROVIDES;20
SOCOTA;Hugo Panqueva Mendivelso;Opción Ciudadana;18
SOCOTA;Ariel Soto Vega;Alianza Social Independiente;17
SOCOTA;Mary Nelsa Nino Nino;Cambio Radical;16
SOCOTA;Carlos Arturo Perez Perez;MOVIMIENTO POLITICO AFROVIDES;14
SOCOTA;Alexi Jazmin Gomez Baron;Opción Ciudadana;12
SOCOTA;Claudia Moreno Leal;Alianza Verde;12
SOCOTA;Edith Barrera Bonilla;Opción Ciudadana;11
SOCOTA;Ana Delia Leal Gualteros;Cambio Radical;9
SOCOTA;Partido Conservador Colombiano;Partido Conservador Colombiano;9
SOCOTA;Juan Manuel Gomez Fernandez;Alianza Social Independiente;8
SOCOTA;Partido De Integracion Nacional;Opción Ciudadana;7
SOCOTA;Alicia Azucena Mendivelso;Alianza Verde;6
SOCOTA;Ana Zulma Mendivelso Gomez;Partido Conservador Colombiano;6
SOCOTA;Luis German Velandia Porras;Cambio Radical;5
SOGAMOSO;Sandro Nestor Condia Perez;Partido Liberal Colombiano;1201
SOGAMOSO;Movimiento Mira;Movimiento MIRA;1105
SOGAMOSO;Marco Alirio Marquez Quintero;Partido Liberal Colombiano;990
SOGAMOSO;Luz Stella Fernandez Chaparro;Partido Liberal Colombiano;918
SOGAMOSO;Diana Carolina Estepa Estepa;Partido de la U;872
SOGAMOSO;Pablo Camargo Puerto;Partido Liberal Colombiano;857
SOGAMOSO;Luis Antonio Farfan Siachoque;Partido de la U;842
SOGAMOSO;Partido Liberal Colombiano;Partido Liberal Colombiano;831
SOGAMOSO;Hugo Alberto Barrera Benavides;Partido de la U;791
SOGAMOSO;Juan Pablo Rodriguez Lemus;Partido de la U;790
SOGAMOSO;Helena Sofia Figueroa Cogollos;Cambio Radical;728
SOGAMOSO;Luis Eduardo Suarez Norato;Partido de la U;709
SOGAMOSO;Wilmer Leal Perez;Alianza Verde;701
SOGAMOSO;Willian Rodrigo Palacios Alvarado;Partido de la U;691
SOGAMOSO;Diego Fernando Fagua Torres;Partido Liberal Colombiano;660
SOGAMOSO;Jaime Antonio Chaparro Barrera;Partido Liberal Colombiano;659
SOGAMOSO;Partido Social De Unidad Nacional;Partido de la U;650
SOGAMOSO;Uriel Ernesto Rojas Avella;Cambio Radical;641
SOGAMOSO;Ricardo Andres Caro Guevara;Partido Liberal Colombiano;640
SOGAMOSO;Roman Hernando Ortega Hernandez;MOVIMIENTO DE INCLUSION Y OPORTUNIDADES;572
SOGAMOSO;Juan Pablo Parra Isaza;Cambio Radical;568
SOGAMOSO;Gustavo Adolfo Alarcon Lopez;Alianza Verde;564
SOGAMOSO;Ricardo Andres Blanco Leguizamo;Alianza Verde;528
SOGAMOSO;Rodolfo Cely Condia;Partido Liberal Colombiano;497
SOGAMOSO;Carlos Alberto Porras Castro;Opción Ciudadana;494
SOGAMOSO;Edwin Jardiel Benavides Benavides;Alianza Verde;493
SOGAMOSO;Jaime Gomez;Partido de la U;490
SOGAMOSO;Hugo Jairo Perez Pena;Partido Liberal Colombiano;487
SOGAMOSO;Jorge Dilker Sanchez Moreno;Opción Ciudadana;486
SOGAMOSO;Andres Rodriguez Calixto;Opción Ciudadana;456
SOGAMOSO;Jose Anyelo Naranjo Amaya;Opción Ciudadana;454
SOGAMOSO;William Avellaneda Pedraza;Alianza Social Independiente;447
SOGAMOSO;German Rincon Herrera;Opción Ciudadana;442
SOGAMOSO;Jose Ubaldo Poveda Poveda;Partido de la U;441
SOGAMOSO;Cesar Augusto Barrera Martinez;Alianza Verde;437
SOGAMOSO;Blanca Cecilia Martinez Ortiz;Alianza Verde;435
SOGAMOSO;Juan Jose Castillo Lopez;MOVIMIENTO DE INCLUSION Y OPORTUNIDADES;433
SOGAMOSO;Fredy Alexander Perez Pinto;Cambio Radical;426
SOGAMOSO;Yaneth Gonzalez Barrera;Partido Liberal Colombiano;424
SOGAMOSO;Wilson Torres Supelano;AICO;394
SOGAMOSO;Miguel Armando Araque Vargas;Partido Liberal Colombiano;385
SOGAMOSO;Whilfredo Rivera Cogua;Alianza Verde;376
SOGAMOSO;Jhon Jairo Medina Cely;Cambio Radical;371
SOGAMOSO;Hector Fernando Alarcon Leon;Alianza Social Independiente;367
SOGAMOSO;Luis Enrique Orduz Ojeda;Partido de la U;362
SOGAMOSO;Julian Mauricio Camargo Montana;Opción Ciudadana;360
SOGAMOSO;Manuel Steven Alvarez Pulido;Alianza Social Independiente;355
SOGAMOSO;Estella Marquez Rodriguez;Opción Ciudadana;354
SOGAMOSO;Partido Verde;Alianza Verde;348
SOGAMOSO;Benito Vega Pinto;Cambio Radical;341
SOGAMOSO;Reyes Fernandez Alarcon;Alianza Social Independiente;334
SOGAMOSO;Leonor Perez Prieto;Partido de la U;324
SOGAMOSO;Holman Quintero Barajas;Partido Liberal Colombiano;323
SOGAMOSO;Pablo Castro Ruiz;Alianza Verde;317
SOGAMOSO;Marisol Quijano Cortes;Partido de la U;313
SOGAMOSO;Luz Mery Sanchez Alfonso;MOVIMIENTO DE INCLUSION Y OPORTUNIDADES;312
SOGAMOSO;Orlando Riano;AICO;312
SOGAMOSO;Clara Yanid Monroy Barreto;Partido Liberal Colombiano;306
SOGAMOSO;Luis Eduardo Arenas Prada;Cambio Radical;303
SOGAMOSO;Maria Elsa Rodriguez Gomez;Partido de la U;300
SOGAMOSO;Jose Ismael Montana Moreno;Opción Ciudadana;288
SOGAMOSO;Lissette Carolina Salcedo Naranjo;Opción Ciudadana;283
SOGAMOSO;Maria Del Carmen Vargas Camargo;MOVIMIENTO DE INCLUSION Y OPORTUNIDADES;283
SOGAMOSO;Gonzalo Ballesteros Monsalve;Cambio Radical;281
SOGAMOSO;Jose Edilberto Martinez Lopez;AICO;272
SOGAMOSO;Fabio Barrera Medina;AICO;260
SOGAMOSO;Ricardo Rios Plazas;Cambio Radical;255
SOGAMOSO;Luis Emilio Lopez Rodriguez;MOVIMIENTO DE INCLUSION Y OPORTUNIDADES;254
SOGAMOSO;Henry Amezquita Perez;Opción Ciudadana;249
SOGAMOSO;Nemesio Alarcon Torres;MOVIMIENTO DE INCLUSION Y OPORTUNIDADES;247
SOGAMOSO;Juan Bautista Viancha Viancha;Polo Democrático Alternativo;243
SOGAMOSO;Juan Manuel Gomez Rios;Alianza Verde;237
SOGAMOSO;Manuel Alban Barreto Garcia;Alianza Social Independiente;235
SOGAMOSO;Sandra Tatiana Sandoval Gallo;Partido de la U;230
SOGAMOSO;Lisimaco Ramirez Cabrera;Partido de la U;229
SOGAMOSO;Fanny Mireya Murillo Acero;Partido Liberal Colombiano;228
SOGAMOSO;Martha Cecilia Rueda Montanez;Partido Liberal Colombiano;228
SOGAMOSO;William Fernando Granados;Cambio Radical;215
SOGAMOSO;Henry Estupinan Estupinan;Alianza Verde;208
SOGAMOSO;Mauricio Eduardo Salamanca Aponte;MOVIMIENTO DE INCLUSION Y OPORTUNIDADES;206
SOGAMOSO;Juan Carlos Perez Nino;Alianza Verde;203
SOGAMOSO;Fernando Lopez Alvarado;MOVIMIENTO DE INCLUSION Y OPORTUNIDADES;201
SOGAMOSO;Jorge Eliecer Fernandez Pedraza;Alianza Social Independiente;200
SOGAMOSO;William Martinez Arias;MOVIMIENTO DE INCLUSION Y OPORTUNIDADES;199
SOGAMOSO;Gustavo Guzman Perez;Alianza Social Independiente;183
SOGAMOSO;Rosana Judith Hozman Mora;Alianza Verde;175
SOGAMOSO;Sandra Patricia Pena Castillo;Partido de la U;175
SOGAMOSO;Maricela Pesca Moreno;AICO;169
SOGAMOSO;Partido Cambio Radical;Cambio Radical;168
SOGAMOSO;Pedro Garcia Aranda;AICO;168
SOGAMOSO;Jose Del Carmen Barrera Plazas;Cambio Radical;162
SOGAMOSO;Fabio Martin Vargas;AICO;160
SOGAMOSO;Victor Emilio Pedraza Chaparro;Partido de la U;158
SOGAMOSO;Ana Ruth Bolivar Camargo;Alianza Verde;157
SOGAMOSO;Luis Hipolito Rodriguez Perez;Alianza Social Independiente;157
SOGAMOSO;Gabriel Torres Alfonso;Alianza Social Independiente;154
SOGAMOSO;Jairo Alexander Cadena Rincon;Alianza Verde;145
SOGAMOSO;Gabriel Alexander Garcia Munoz;MOVIMIENTO DE INCLUSION Y OPORTUNIDADES;144
SOGAMOSO;Nestor Armando Alvarez Montoya;Opción Ciudadana;134
SOGAMOSO;Felix Leonardo Plazas Estepa;Cambio Radical;130
SOGAMOSO;Pedro Arturo Cardozo Montana;AICO;127
SOGAMOSO;Edwin Geovanny Zorro Nino;Alianza Social Independiente;122
SOGAMOSO;Jorge Monroy Perez;Partido de la U;120
SOGAMOSO;Ana Maria Castro Murillo;Opción Ciudadana;116
SOGAMOSO;Luis Alberto Perez;MOVIMIENTO DE INCLUSION Y OPORTUNIDADES;116
SOGAMOSO;Douglas Joaquin Donoso Orozco;Opción Ciudadana;114
SOGAMOSO;Javier Gutierrez Perez;Partido Liberal Colombiano;114
SOGAMOSO;Alexandra Mesa Leon;AICO;113
SOGAMOSO;Leidy Marcela Gomez Ramirez;MOVIMIENTO DE INCLUSION Y OPORTUNIDADES;110
SOGAMOSO;Alfredo Lara Buitrago;MOVIMIENTO DE INCLUSION Y OPORTUNIDADES;107
SOGAMOSO;Jairo Arturo Perez Perez;Opción Ciudadana;107
SOGAMOSO;Yury Viviana Diaz Cristancho;Partido Liberal Colombiano;106
SOGAMOSO;Julio Alberto Parra Maldonado;AICO;103
SOGAMOSO;Henry Octavio Sanchez Hurtado;AICO;102
SOGAMOSO;Isnardo Antonio Grandas Rincon;Polo Democrático Alternativo;98
SOGAMOSO;Omar Morales Barrera;AICO;92
SOGAMOSO;Hector Joselin Barrera Alvarez;AICO;91
SOGAMOSO;Polo Democratico Alternativo;Polo Democrático Alternativo;88
SOGAMOSO;Rocio Cardenas Fuentes;MOVIMIENTO DE INCLUSION Y OPORTUNIDADES;84
SOGAMOSO;Partido De Integracion Nacional;Opción Ciudadana;77
SOGAMOSO;Hector Miguel Ramirez Sanchez;MOVIMIENTO DE INCLUSION Y OPORTUNIDADES;75
