MUNNOMBRE;CANNOMBRE;PARNOMBRE;VOTOS
DUITAMA;ALBA LUZ AMEZQUITA INFANTE;Cambio Radical;89
DUITAMA;ALVARO FABIAN MAYORGA GUERRERO;Alianza Verde;491
DUITAMA;ALVARO RODRIGUEZ PRADA;Cambio Radical;101
DUITAMA;ANA SOFIA SUAREZ REYES;Cambio Radical;122
DUITAMA;ANAYANCY NATIVIDAD CAMARGO MANOSALVA;Partido Liberal Colombiano;372
DUITAMA;ANDRES FELIPE TAMARA GOMEZ;Centro Democrático;69
DUITAMA;ANGELA MARIA LOAIZA ESCAMILLA;Cambio Radical;97
DUITAMA;CAMILO ANDRES VARGAS ESTUPIÑAN;Alianza Verde;397
DUITAMA;CESAR HUMBERTO JAIME DIAZ;Alianza Verde;427
DUITAMA;CRISTIAN CAMILO BARRERA BARBOSA;Cambio Radical;130
DUITAMA;DEISSY YADIRA OJEDA JAIMES;Cambio Radical;117
DUITAMA;DIEGO ALEJANDRO SIACHOQUE BARRETO;Cambio Radical;132
DUITAMA;DORA INES MEDINA ROJAS;Cambio Radical;296
DUITAMA;EDELMIRA IBAÑEZ PEREZ;Cambio Radical;63
DUITAMA;EDWIN LEANDRO PITA PEREZ;Cambio Radical;262
DUITAMA;ENRIQUE DE JESUS MARIA RODRIGUEZ CONTRERAS;Cambio Radical;272
DUITAMA;FANY ESTER CORTES BAEZ;Cambio Radical;58
DUITAMA;HEIDI MILENA BARRAGAN ARIZA;Alianza Verde;31
DUITAMA;INELDA DUARTE QUINTERO;Cambio Radical;94
DUITAMA;JOHN CARLOS BECERRA BECERRA;Centro Democrático;31
DUITAMA;JORGE ARMANDO CASTRO BOLIVAR;Cambio Radical;63
DUITAMA;JORGE ENRIQUE NITOLA CHAPARRO;PARTIDO POLO DEMOCRATICO ALTERNATIVO;90
DUITAMA;JOSE HUMBERTO MENDOZA SILVA;Cambio Radical;155
DUITAMA;JOSE JOAQUIN FRANCO ARANGO;PARTIDO SOCIAL DE UNIDAD NACIONAL  PARTIDO DE LA U;464
DUITAMA;JOSE RAMON CARDENAS CARDENAS;Cambio Radical;377
DUITAMA;JUAN CARLOS MONTAÑEZ JOYA;Alianza Verde;398
DUITAMA;JULIO ENRIQUE AMEZQUITA CARREÑO;Cambio Radical;246
DUITAMA;LAURA NATALY PUERTO PAIPA;PARTIDO SOCIAL DE UNIDAD NACIONAL  PARTIDO DE LA U;51
DUITAMA;LINA MARIA BAYONA CUSPOCA;Centro Democrático;20
DUITAMA;LUIS ALBERTO NIÑO MORENO;Alianza Verde;422
DUITAMA;LUIS FELIPE ROJAS BARRERA;Centro Democrático;64
DUITAMA;LUZ MAYERLI PERALTA NOSSA;PARTIDO POLO DEMOCRATICO ALTERNATIVO;159
DUITAMA;LYDIA YOLANDA BECERRA PACHECO;Alianza Verde;349
DUITAMA;MAGDA LIZETH MERCHAN ZABALA;PARTIDO SOCIAL DE UNIDAD NACIONAL  PARTIDO DE LA U;124
DUITAMA;MANUEL RICARDO PARRA VARGAS;Alianza Verde;1204
DUITAMA;MARIA CENAIDA CARREÑO BLANCO;Cambio Radical;650
DUITAMA;MARIA DEL CARMEN AMADO RAVELO;Alianza Verde;46
DUITAMA;MARIA PAULA DIAZ SANABRIA;Alianza Verde;741
DUITAMA;MARIA ROSALBA VALDERRAMA ALVARADO;Centro Democrático;12
DUITAMA;MARIANO LUIS HERNANDEZ GONZALEZ;Alianza Verde;584
DUITAMA;MARITZA FERNANDA SUANCHA CASTRO;Partido Liberal Colombiano;398
DUITAMA;MARTHA EUGENIA TANGARIFE ARANGO;Cambio Radical;100
DUITAMA;MARTHA ISABEL VILLAMIL CELIS;Cambio Radical;82
DUITAMA;MARTHA LILIANA DELGADO FUENTES;Cambio Radical;228
DUITAMA;MAURICIO GAMBOA VELANDIA;Alianza Verde;88
DUITAMA;MIGUEL ANGEL RUEDA NARANJO;Cambio Radical;140
DUITAMA;MYRIAM LUCIA BECERRA INFANTE;Alianza Verde;226
DUITAMA;NUBIA HELENA ROJAS MENDIVELSO;Cambio Radical;140
DUITAMA;NURY MABEL DIAZ TORRES;Alianza Verde;456
DUITAMA;OLGA LUCIA RINCON GRANADOS;Cambio Radical;292
DUITAMA;ORLANDO LOPEZ GUTIERREZ;PARTIDO SOCIAL DE UNIDAD NACIONAL  PARTIDO DE LA U;96
DUITAMA;OSCAR ADOLFO ACEVEDO LOPEZ;Alianza Verde;245
DUITAMA;OSCAR JAVIER TIBADUIZA GARCIA;Alianza Verde;177
DUITAMA;PAOLA ANDREA BAUTISTA GUZMAN;Alianza Verde;95
DUITAMA;PAOLA YOLANDA LOPEZ VEGA;Alianza Verde;283
DUITAMA;PARTIDO ALIANZA VERDE;Alianza Verde;2217
DUITAMA;PARTIDO CAMBIO RADICAL;Cambio Radical;1219
DUITAMA;PARTIDO CENTRO DEMOCRATICO;Centro Democrático;39
DUITAMA;PARTIDO COLOMBIA JUSTA LIBRES;PARTIDO COLOMBIA JUSTA LIBRES;3186
DUITAMA;PARTIDO LIBERAL COLOMBIANO;Partido Liberal Colombiano;295
DUITAMA;PARTIDO POLO DEMOCRATICO ALTERNATIVO;PARTIDO POLO DEMOCRATICO ALTERNATIVO;67
DUITAMA;PARTIDO SOCIAL DE UNIDAD NACIONAL  PARTIDO DE LA U;PARTIDO SOCIAL DE UNIDAD NACIONAL  PARTIDO DE LA U;356
DUITAMA;PATRICIA PELAEZ ROBAYO;Alianza Verde;519
DUITAMA;PLINIO JIMENEZ CUBIDES;PARTIDO SOCIAL DE UNIDAD NACIONAL  PARTIDO DE LA U;183
DUITAMA;ROSA MARIA BAEZ;Cambio Radical;187
DUITAMA;SANDRA PATRICIA ALARCON VILLAR;PARTIDO SOCIAL DE UNIDAD NACIONAL  PARTIDO DE LA U;42
DUITAMA;SANTIAGO PEREZ SISA;Cambio Radical;431
DUITAMA;SAUL ELIAS ALARCON CARDOZO;Cambio Radical;96
DUITAMA;VERONICA TORRES DE TORRES;Cambio Radical;21
DUITAMA;VICTOR ALFONSO ALARCON CEPEDA;Cambio Radical;67
DUITAMA;VIVIANA ANDREA CASTRO BECERRA;Cambio Radical;22
DUITAMA;WILLIAM ERNESTO AYALA AYALA;Cambio Radical;310
DUITAMA;YEIMMY KATHERINE RODRIGUEZ;Cambio Radical;65
DUITAMA;YONATHAN MANUEL BECERRA GONZALEZ;Alianza Verde;298
DUITAMA;YUDY ANDREA ZAMBRANO ARDILA;Cambio Radical;85
DUITAMA;YURGEN DIAZ CELYS;Alianza Verde;643
PAIPA;BERNARDO ANTONIO NIÑO BENAVIDES;PARTIDO ALIANZA SOCIAL INDEPENDIENTE ASI;10
PAIPA;DIANA MARIA BENAVIDES LOPEZ;Partido Conservador Colombiano;31
PAIPA;FERNANDO TAMAYO MATEUS;Partido Conservador Colombiano;51
PAIPA;GILBERTO MEDINA TAMAYO;Alianza Verde;40
PAIPA;GILMA TAMAYO CHACON;Alianza Verde;31
PAIPA;JABIER JIMENEZ VEGA;Alianza Verde;70
PAIPA;JAVIER ALBERTO MEDINA BENAVIDES;Centro Democrático;47
PAIPA;JOSE ANGEL PAMPLONA NIÑO;PARTIDO ALIANZA SOCIAL INDEPENDIENTE ASI;18
PAIPA;JOSUE OSVALDO HIGUERA MEDINA;Partido Conservador Colombiano;51
PAIPA;LINA MARIA BRAVO BENAVIDES;PARTIDO ALIANZA SOCIAL INDEPENDIENTE ASI;40
PAIPA;LISANDRO DIAZ TAMAYO;Partido Conservador Colombiano;20
PAIPA;LUIS JAIME BARON PALACIOS;Alianza Verde;17
PAIPA;MAGDALENA PALACIOS LOPEZ;Partido Conservador Colombiano;14
PAIPA;MARIA ELENA DIAZ DIAZ;Partido Conservador Colombiano;47
PAIPA;MARIA ROSALIA HERRERA BENAVIDES;Alianza Verde;11
PAIPA;MARIA YORLENY GONZALEZ DIAZ;Centro Democrático;9
PAIPA;MARTHA PATRICIA AVELLA AVELLA;Partido Conservador Colombiano;37
PAIPA;PARTIDO ALIANZA SOCIAL INDEPENDIENTE ASI;PARTIDO ALIANZA SOCIAL INDEPENDIENTE ASI;2
PAIPA;PARTIDO ALIANZA VERDE;Alianza Verde;6
PAIPA;PARTIDO CENTRO DEMOCRATICO;Centro Democrático;9
PAIPA;PARTIDO CONSERVADOR COLOMBIANO;Partido Conservador Colombiano;14
PAIPA;REINEL ANTONIO NIÑO VEGA;Centro Democrático;46
PAIPA;WILINTON BENAVIDES PAMPLONA;Alianza Verde;18
PAIPA;YAQUELINE MEDINA CHACON;Alianza Verde;6
PUERTO BOYACA;ALDEMAR RUA TORRES;Alianza Verde;21
PUERTO BOYACA;ARMANDO SIERVO GARAVITO;Centro Democrático;4
PUERTO BOYACA;ASTRID CAROLINA MARTINEZ BEJARANO;Alianza Verde;32
PUERTO BOYACA;BREYNER VILLADA AYALA;Alianza Verde;145
PUERTO BOYACA;CARLOS JULIO RAMIREZ QUINTERO;Alianza Verde;4
PUERTO BOYACA;DANILO BUSTOS;Alianza Verde;38
PUERTO BOYACA;DEISY MARIA DELGADO DE PEREIRA;Alianza Verde;15
PUERTO BOYACA;DELFIN SERNA DIAZ;Partido Liberal Colombiano;43
PUERTO BOYACA;DEYANIRA TRUJILLO RUA;Centro Democrático;20
PUERTO BOYACA;DIANA MARITZA HOYOS TEJEDOR;Partido Liberal Colombiano;75
PUERTO BOYACA;DIEGO FERNANDO SALCEDO TREJOS;Alianza Verde;17
PUERTO BOYACA;DISNEY CHICA BEDOYA;Centro Democrático;11
PUERTO BOYACA;DORALBA GARCIA GONZALEZ;Alianza Verde;59
PUERTO BOYACA;EDGAR JAVIER URQUIJO BELTRAN;Alianza Verde;58
PUERTO BOYACA;EDWIN DE JESUS SERNA SEPULVEDA;Alianza Verde;44
PUERTO BOYACA;EMILES ALBERTO ALVAREZ MENCO;Partido Liberal Colombiano;302
PUERTO BOYACA;FERNANDO RAMIREZ CARDENAS;Alianza Verde;16
PUERTO BOYACA;GERARDO ANTONIO QUINTERO JARAMILLO;Alianza Verde;20
PUERTO BOYACA;GLORIA RODRIGUEZ ARCINIEGAS;Alianza Verde;13
PUERTO BOYACA;HUGO ALBERTO GARCIA;Partido Liberal Colombiano;77
PUERTO BOYACA;HUGO ALBERTO TRUJILLO CUADRADO;Cambio Radical;214
PUERTO BOYACA;JESUS ANTONIO IDARRAGA MORENO;Alianza Verde;30
PUERTO BOYACA;JHONATAN STYVENS PRIETO BUSTOS;Partido Liberal Colombiano;36
PUERTO BOYACA;JUANA VALENTINA GONZALEZ VERA;Alianza Verde;8
PUERTO BOYACA;LAURA CAMILA HENAO BERNAL;Partido Liberal Colombiano;20
PUERTO BOYACA;LEIDY JOHANNA VALLEJO CALLE;Alianza Verde;6
PUERTO BOYACA;LEIDY JOHANNA VEGA GUERRERO;Alianza Verde;10
PUERTO BOYACA;LEONARDO TOQUICA;PARTIDO ALIANZA SOCIAL INDEPENDIENTE ASI;51
PUERTO BOYACA;LUISA FERNANDA SEGURA PATIÑO;Alianza Verde;62
PUERTO BOYACA;LUZ ADRIANA PAVAS RUIZ;Alianza Verde;22
PUERTO BOYACA;MAIRON ALFONSO MONTAÑO RINCON;Alianza Verde;28
PUERTO BOYACA;MARIA CRISTINA ARDILA VALDES;Alianza Verde;30
PUERTO BOYACA;MARIA EUGENIA PINILLA BUSTAMANTE;PARTIDO ALIANZA SOCIAL INDEPENDIENTE ASI;90
PUERTO BOYACA;MARIA TERESA VASQUEZ CHICA;Alianza Verde;36
PUERTO BOYACA;MARIBEL RODAS GARZON;Alianza Verde;13
PUERTO BOYACA;MARTHA CERQUERA RUBIO;Alianza Verde;52
PUERTO BOYACA;MARYELY RODRIGUEZ VARGAS;Alianza Verde;83
PUERTO BOYACA;MAURICIO GUTIERREZ GONZALEZ;Centro Democrático;16
PUERTO BOYACA;MONICA TORRES AGUIRRE;Alianza Verde;10
PUERTO BOYACA;NAUM SEGURA PENAGOS;Alianza Verde;26
PUERTO BOYACA;NELSON AUGUSTO SANCHEZ PARRA;Alianza Verde;93
PUERTO BOYACA;NELSON MAHECHA OVIEDO;Partido Liberal Colombiano;19
PUERTO BOYACA;OLGA RAMIREZ ALVAREZ;Alianza Verde;26
PUERTO BOYACA;PAOLA ANDREA CRUZ CAMPOS;Partido Liberal Colombiano;44
PUERTO BOYACA;PARTIDO ALIANZA SOCIAL INDEPENDIENTE ASI;PARTIDO ALIANZA SOCIAL INDEPENDIENTE ASI;16
PUERTO BOYACA;PARTIDO ALIANZA VERDE;Alianza Verde;227
PUERTO BOYACA;PARTIDO CAMBIO RADICAL;Cambio Radical;124
PUERTO BOYACA;PARTIDO CENTRO DEMOCRATICO;Centro Democrático;21
PUERTO BOYACA;PARTIDO LIBERAL COLOMBIANO;Partido Liberal Colombiano;189
PUERTO BOYACA;ROBERTO ANTONIO BERRIO CEBALLOS;Centro Democrático;19
PUERTO BOYACA;SELEGNE MANYELI DONATO;Partido Liberal Colombiano;15
PUERTO BOYACA;WILLIAM CASTILLA BRAVO;Alianza Verde;5
PUERTO BOYACA;YESENIA GALINDEZ GOMEZ;PARTIDO ALIANZA SOCIAL INDEPENDIENTE ASI;23
PUERTO BOYACA;YOANI ALEXANDER SANCHEZ BETANCOURT;Partido Liberal Colombiano;1
