MUNNOMBRE;CANNOMBRE;PARNOMBRE;VOTOS
ALMEIDA;CALDERON CARDENAS JAIRO ANTONIO;PARTIDO SOCIAL DE UNIDAD NACIONAL;420
ALMEIDA;CALDERON PERILLA FRAIVER HERNANDO;PARTIDO SOCIAL DE UNIDAD NACIONAL;105
ALMEIDA;SANCHEZ LESMES JUAN CARLOS;PARTIDO CAMBIO RADICAL;72
ALMEIDA;CALDERON CARDENAS JORGE ALONSO;PARTIDO SOCIAL DE UNIDAD NACIONAL;63
ALMEIDA;PINZON VACA GLORIA INES;PARTIDO SOCIAL DE UNIDAD NACIONAL;60
ALMEIDA;ALVARADO MONDRAGON MANUEL ANTONIO;PARTIDO CAMBIO RADICAL;57
ALMEIDA;VALLEJO CALDERON ANA LEONILA;PARTIDO CAMBIO RADICAL;50
ALMEIDA;LOPEZ LOPEZ NUBIA MARCELA;PARTIDO SOCIAL DE UNIDAD NACIONAL;45
ALMEIDA;SANCHEZ ALFONSO ALBA INES;PARTIDO CAMBIO RADICAL;45
ALMEIDA;SANCHEZ MARTIN JOSE HERNANDO;PARTIDO SOCIAL DE UNIDAD NACIONAL;43
ALMEIDA;GUTIERREZ DAZA FLOR STELLA;PARTIDO CONSERVADOR COLOMBIANO;39
ALMEIDA;PARTIDO SOCIAL DE UNIDAD NACIONAL;PARTIDO SOCIAL DE UNIDAD NACIONAL;25
ALMEIDA;CASTANEDA VARGAS SANDRA PATRICIA;PARTIDO SOCIAL DE UNIDAD NACIONAL;24
ALMEIDA;MARTINEZ DE GONZALEZ LILIA INES;PARTIDO ALIANZA SOCIAL INDEPENDIENTE;23
ALMEIDA;ROMERO SANCHEZ ELBA MARIA;PARTIDO CONSERVADOR COLOMBIANO;23
ALMEIDA;VARGAS SANCHEZ ERICZON;PARTIDO CONSERVADOR COLOMBIANO;22
ALMEIDA;ROMERO GONZALEZ ALBA HERMELINDA;PARTIDO CAMBIO RADICAL;20
ALMEIDA;LESMES SANCHEZ YAN ESTER;PARTIDO CAMBIO RADICAL;17
ALMEIDA;LOPEZ SANCHEZ JOSE MANUEL ANTONIO;PARTIDO CAMBIO RADICAL;15
ALMEIDA;MORALES DAZA WILBER ERNESTO;PARTIDO CONSERVADOR COLOMBIANO;12
ALMEIDA;PARTIDO CAMBIO RADICAL;PARTIDO CAMBIO RADICAL;12
ALMEIDA;ROSERO DUENAS ERIKA VIVIANA;PARTIDO CONSERVADOR COLOMBIANO;12
ALMEIDA;MONTENEGRO CASTANEDA CARLOS HERNAN;PARTIDO ALIANZA SOCIAL INDEPENDIENTE;9
ALMEIDA;DAZA VACA WILSON HENRY;PARTIDO CONSERVADOR COLOMBIANO;7
ALMEIDA;PARTIDO CONSERVADOR COLOMBIANO;PARTIDO CONSERVADOR COLOMBIANO;6
ALMEIDA;RODRIGUEZ OLIVEROS CLAUDIA MERCED;PARTIDO ALIANZA SOCIAL INDEPENDIENTE;4
ALMEIDA;CASTILLO NOVOA NELCE YANETH;PARTIDO CONSERVADOR COLOMBIANO;3
ALMEIDA;MARTIN DAZA ALICIA MERY;PARTIDO ALIANZA SOCIAL INDEPENDIENTE;2
ALMEIDA;CHIVATA CASTILLO FELIX;PARTIDO ALIANZA SOCIAL INDEPENDIENTE;1
ALMEIDA;LOPEZ ACOSTA ADELAIDA;PARTIDO ALIANZA SOCIAL INDEPENDIENTE;1
ALMEIDA;PARTIDO ALIANZA SOCIAL INDEPENDIENTE  ASI;PARTIDO ALIANZA SOCIAL INDEPENDIENTE  ASI;0
AQUITANIA;PLAZAS BOLIVAR IVAN ELIAS;MOVIMIENTO AUTORIDADES INDIGENAS DE COLOMBIA;302
AQUITANIA;ROJAS RODRIGUEZ LUIS ANGEL;PARTIDO VERDE;256
AQUITANIA;PIRAGAUTA PESCA JULIO ENRIQUE;PARTIDO DE INTEGRACION NACIONAL;248
AQUITANIA;CHAPARRO MUNEVAR GERMAN;PARTIDO CONSERVADOR COLOMBIANO;231
AQUITANIA;RIOS TRUJILLO SEGUNDO VENANCIO;PARTIDO VERDE;219
AQUITANIA;TORRES RIVEROS LUCIO LEONEL;PARTIDO CAMBIO RADICAL;206
AQUITANIA;PARTIDO LIBERAL COLOMBIANO;PARTIDO LIBERAL COLOMBIANO;199
AQUITANIA;CEPEDA CEPEDA ALBEIRO ARMANDO;MOVIMIENTO AUTORIDADES INDIGENAS DE COLOMBIA;188
AQUITANIA;MONTANA MONTANA CRISPOLO GERMAN;PARTIDO SOCIAL DE UNIDAD NACIONAL;187
AQUITANIA;CAMARGO MONTANA RAFAEL ANGEL;PARTIDO CONSERVADOR COLOMBIANO;179
AQUITANIA;CEPEDA ARIZA OMAR HERNANDO;PARTIDO VERDE;179
AQUITANIA;PARTIDO VERDE;PARTIDO VERDE;178
AQUITANIA;SANTOS CAMARGO HERNEY ARTURO;PARTIDO CONSERVADOR COLOMBIANO;165
AQUITANIA;GUTIERREZ PEREZ SEGUNDO GILBERTO;PARTIDO CAMBIO RADICAL;164
AQUITANIA;LEMUS CHAPARRO HECTOR ORLANDO;PARTIDO VERDE;155
AQUITANIA;GUANUME ALARCON JORGE;MOVIMIENTO DE INCLUSION Y OPORTUNIDADES;152
AQUITANIA;PRECIADO GUTIERREZ JAVIER ALBEIRO;PARTIDO CONSERVADOR COLOMBIANO;148
AQUITANIA;CHAPARRO ALARCON MAURICIO;PARTIDO VERDE;147
AQUITANIA;PLAZAS MESA EDGAR ORLANDO;PARTIDO SOCIAL DE UNIDAD NACIONAL;147
AQUITANIA;LEON LUIS FERNANDO;MOVIMIENTO DE INCLUSION Y OPORTUNIDADES;146
AQUITANIA;PRECIADO MUNEVAR ANDREA DEL PILAR;PARTIDO VERDE;144
AQUITANIA;MONTANA ALARCON REYES;PARTIDO CONSERVADOR COLOMBIANO;141
AQUITANIA;PARADA HERNANDEZ EDGAR ANDRES;PARTIDO DE INTEGRACION NACIONAL;135
AQUITANIA;ALARCON CADENA JOSE NAIRO;PARTIDO VERDE;134
AQUITANIA;CARDENAS RODRIGUEZ NELSON RENE;MOVIMIENTO DE INCLUSION Y OPORTUNIDADES;130
AQUITANIA;MONTANA PEREZ LUIS OCTAVIO;PARTIDO DE INTEGRACION NACIONAL;130
AQUITANIA;SALAMANCA RICO MIGUEL ANTONIO;PARTIDO SOCIAL DE UNIDAD NACIONAL;125
AQUITANIA;SANCHEZ MUNEVAR FRANKY HERNAN;MOVIMIENTO DE INCLUSION Y OPORTUNIDADES;123
AQUITANIA;MONTANA MONTANA IGNACIO;PARTIDO SOCIAL DE UNIDAD NACIONAL;114
AQUITANIA;MARTINEZ MORENO NAIRO ERNESTO;MOVIMIENTO DE INCLUSION Y OPORTUNIDADES;113
AQUITANIA;RINCON PEREZ ARY YANERITH;MOVIMIENTO AUTORIDADES INDIGENAS DE COLOMBIA;113
AQUITANIA;CADENA ACEVEDO LUIS ENRIQUE;PARTIDO DE INTEGRACION NACIONAL;109
AQUITANIA;BARRERA CASTILLO NILSON ALBEIRO;MOVIMIENTO AUTORIDADES INDIGENAS DE COLOMBIA;105
AQUITANIA;CANDIDATA RETIRADA;CANDIDATA RETIRADA;100
AQUITANIA;ROJAS VARGAS ELBA LUCERO;PARTIDO ALIANZA SOCIAL INDEPENDIENTE;94
AQUITANIA;LOPEZ FIGUEREDO VICTOR GERMAN;PARTIDO DE INTEGRACION NACIONAL;92
AQUITANIA;PESCA CONTRERAS MARCO ISAAC;PARTIDO DE INTEGRACION NACIONAL;92
AQUITANIA;URRUTIA MONTANA MARIA ALEJANDRA;PARTIDO DE INTEGRACION NACIONAL;92
AQUITANIA;RIVEROS SANCHEZ LIGIA PAOLA;MOVIMIENTO DE INCLUSION Y OPORTUNIDADES;90
AQUITANIA;RAMIREZ MESA LUZ DARY;PARTIDO CONSERVADOR COLOMBIANO;85
AQUITANIA;MESA MESA DANILO ANTONIO;MOVIMIENTO AUTORIDADES INDIGENAS DE COLOMBIA;84
AQUITANIA;SAMACA PESCA ERIKA PATRICIA;MOVIMIENTO DE INCLUSION Y OPORTUNIDADES;80
AQUITANIA;PARTIDO CONSERVADOR COLOMBIANO;PARTIDO CONSERVADOR COLOMBIANO;73
AQUITANIA;GUTIERREZ LEMUS MILTON ARMANDO;PARTIDO SOCIAL DE UNIDAD NACIONAL;72
AQUITANIA;CHAPARRO TORRES CAROLINA;PARTIDO VERDE;71
AQUITANIA;PEREZ CHAPARRO EDSON GILBERTO;PARTIDO CONSERVADOR COLOMBIANO;71
AQUITANIA;CHAPARRO RAMIREZ LUIS ALFREDO;PARTIDO DE INTEGRACION NACIONAL;65
AQUITANIA;MORENO PEREZ HECTOR EMIRO;MOVIMIENTO DE INCLUSION Y OPORTUNIDADES;65
AQUITANIA;PARTIDO SOCIAL DE UNIDAD NACIONAL;PARTIDO SOCIAL DE UNIDAD NACIONAL;49
AQUITANIA;RICO PATINO ELIECER;PARTIDO ALIANZA SOCIAL INDEPENDIENTE;49
AQUITANIA;RIVEROS LEMUS ROSANA;PARTIDO CONSERVADOR COLOMBIANO;49
AQUITANIA;PARTIDO DE INTEGRACION NACIONAL;PARTIDO DE INTEGRACION NACIONAL;48
AQUITANIA;FONSECA VARGAS DIANA PAOLA;PARTIDO SOCIAL DE UNIDAD NACIONAL;46
AQUITANIA;PLAZAS LEGUIZAMON JOSE MIGUEL;PARTIDO VERDE;46
AQUITANIA;CHAPARRO LEMUS MARIA LUISA;PARTIDO VERDE;44
AQUITANIA;MORENO ALVAREZ SAUL;PARTIDO CONSERVADOR COLOMBIANO;44
AQUITANIA;CASAS ABRIL LIBIA MARIA;MOVIMIENTO AUTORIDADES INDIGENAS DE COLOMBIA;43
AQUITANIA;MORENO VARGAS CARLOS DARIO;PARTIDO ALIANZA SOCIAL INDEPENDIENTE;43
AQUITANIA;RAMIREZ VARGAS DEYCY CAROLINA;PARTIDO ALIANZA SOCIAL INDEPENDIENTE;43
AQUITANIA;AGUILAR AGUILAR OLGA YANIRA;PARTIDO DE INTEGRACION NACIONAL;39
AQUITANIA;SATOBA CHAPARRO EDGAR FABIAN;MOVIMIENTO AUTORIDADES INDIGENAS DE COLOMBIA;38
AQUITANIA;ACEVEDO NOMEZQUE CARLOS GILBERTO;PARTIDO ALIANZA SOCIAL INDEPENDIENTE;37
AQUITANIA;AMEZQUITA FLOREZ ISAURA EDILIA;PARTIDO VERDE;35
AQUITANIA;SARMIENTO AVELLA MARIA ALEJANDRA;PARTIDO CAMBIO RADICAL;35
AQUITANIA;MOVIMIENTO DE INCLUSION Y OPORTUNIDADES;MOVIMIENTO DE INCLUSION Y OPORTUNIDADES;32
AQUITANIA;CHAPARRO SANCHEZ GUSTAVO;PARTIDO SOCIAL DE UNIDAD NACIONAL;31
AQUITANIA;ACEVEDO CORREA WILMER HERNANDO;PARTIDO CAMBIO RADICAL;30
AQUITANIA;RODRIGUEZ CARDOZO WILLIAM JAVIER;MOVIMIENTO AUTORIDADES INDIGENAS DE COLOMBIA;30
AQUITANIA;MORENO PESCA CESAR AUGUSTO;PARTIDO SOCIAL DE UNIDAD NACIONAL;29
AQUITANIA;ROSAS RIVEROS PROSPERO ANTONIO;PARTIDO CAMBIO RADICAL;28
AQUITANIA;BARINAS MACIAS ELIA CARMENZA;PARTIDO CAMBIO RADICAL;27
AQUITANIA;CHAPARRO ALARCON YULY CAROLINA;PARTIDO DE INTEGRACION NACIONAL;27
AQUITANIA;ROSAS DAZA CRISTIAN CAMILO;MOVIMIENTO DE INCLUSION Y OPORTUNIDADES;26
AQUITANIA;MOVIMIENTO AUTORIDADES INDIGENAS DE COLOMBIA;MOVIMIENTO AUTORIDADES INDIGENAS DE COLOMBIA;25
AQUITANIA;CANDIDATO RETIRADO;CANDIDATO RETIRADO;24
AQUITANIA;CEPEDA PEREZ OTILIA;MOVIMIENTO AUTORIDADES INDIGENAS DE COLOMBIA;24
AQUITANIA;RAMIREZ AGUILAR NELSY YANETH;PARTIDO DE INTEGRACION NACIONAL;23
AQUITANIA;COSTO CHAPARRO MAURO ERNESTO;PARTIDO ALIANZA SOCIAL INDEPENDIENTE;22
AQUITANIA;NARANJO FAVIO HUMBERTO;MOVIMIENTO AUTORIDADES INDIGENAS DE COLOMBIA;21
AQUITANIA;DUQUE DIAZ DIANA YUSLIBA;PARTIDO CONSERVADOR COLOMBIANO;20
AQUITANIA;MORENO VARGAS CONSUELO DEL CARMEN;PARTIDO SOCIAL DE UNIDAD NACIONAL;20
AQUITANIA;GOMEZ RINCON DORIS;MOVIMIENTO DE INCLUSION Y OPORTUNIDADES;19
AQUITANIA;LEMUS PATARROYO MARCO ANTONIO;PARTIDO CAMBIO RADICAL;17
AQUITANIA;MONTANA CHAPARRO GLORIA YOLIMA;PARTIDO CAMBIO RADICAL;17
AQUITANIA;PARTIDO CAMBIO RADICAL;PARTIDO CAMBIO RADICAL;16
AQUITANIA;TORRES TORRES MARISOL;PARTIDO ALIANZA SOCIAL INDEPENDIENTE;16
AQUITANIA;RINCON PEREZ YENI ANDREA;PARTIDO CONSERVADOR COLOMBIANO;12
AQUITANIA;PARTIDO ALIANZA SOCIAL INDEPENDIENTE;PARTIDO ALIANZA SOCIAL INDEPENDIENTE;9
AQUITANIA;ALARCON PEDRAZA AURA ALICIA;PARTIDO SOCIAL DE UNIDAD NACIONAL;8
AQUITANIA;RODRIGUEZ PEREZ KEITH MADELEIN;PARTIDO CAMBIO RADICAL;6
AQUITANIA;SALAMANCA FIGUEREDO ROSA HELENA;MOVIMIENTO AUTORIDADES INDIGENAS DE COLOMBIA;5
AQUITANIA;CEPEDA AGUIRRE FABIO ORLANDO;PARTIDO ALIANZA SOCIAL INDEPENDIENTE;4
AQUITANIA;MORENO CASTRO DIANA CAROLINA;PARTIDO SOCIAL DE UNIDAD NACIONAL;4
AQUITANIA;NARANJO CAMILO ANDRES;PARTIDO CAMBIO RADICAL;3
AQUITANIA;SANCHEZ CABALLERO JAVIER;PARTIDO ALIANZA SOCIAL INDEPENDIENTE;1
ARCABUCO;ALBA IVAN ALIRIO;PARTIDO SOCIAL DE UNIDAD NACIONAL;210
ARCABUCO;BENITEZ RONCANCIO WILFREDO;PARTIDO VERDE;179
ARCABUCO;GUERRERO FORERO JAIME ANTONIO;PARTIDO CONSERVADOR COLOMBIANO;176
ARCABUCO;JIMENEZ CADENA SONIA;PARTIDO SOCIAL DE UNIDAD NACIONAL;174
ARCABUCO;AUNTA SUAREZ JOSE EDUARDO;PARTIDO SOCIAL DE UNIDAD NACIONAL;143
ARCABUCO;POVEDA AGUILERA HECTOR JAIME;PARTIDO LIBERAL COLOMBIANO;131
ARCABUCO;AVILA ROJAS LUIS ALFREDO;PARTIDO SOCIAL DE UNIDAD NACIONAL;117
ARCABUCO;LIZCANO HERNANDEZ JONH FREDDY;PARTIDO CONSERVADOR COLOMBIANO;106
ARCABUCO;RODRIGUEZ CASTELLANOS ISRAEL;PARTIDO VERDE;103
ARCABUCO;CAMARGO ROBLES DIOGENES;PARTIDO LIBERAL COLOMBIANO;99
ARCABUCO;BUITRAGO RIOS MARIA YOLANDA;PARTIDO CONSERVADOR COLOMBIANO;89
ARCABUCO;GUZMAN GUZMAN EDILBERTO LEON;PARTIDO CONSERVADOR COLOMBIANO;89
ARCABUCO;BUSTOS RABA FERNANDO;PARTIDO SOCIAL DE UNIDAD NACIONAL;81
ARCABUCO;MOLINA ALBA ANA BETY;PARTIDO VERDE;75
ARCABUCO;GUERRERO SAAVEDRA ALEXIS ARMANDO;PARTIDO CONSERVADOR COLOMBIANO;72
ARCABUCO;CUESTA HERNANDEZ RAFAEL EDUARDO;PARTIDO CAMBIO RADICAL;70
ARCABUCO;SUAREZ BUSTOS REINALDO;PARTIDO VERDE;70
ARCABUCO;BALLEN TORRES GIOVANNY;PARTIDO SOCIAL DE UNIDAD NACIONAL;63
ARCABUCO;GUARIN ACERO GLADYS AMPARO;PARTIDO CAMBIO RADICAL;60
ARCABUCO;FUQUENE CATIVE MARTIN EMILIO;PARTIDO VERDE;57
ARCABUCO;LOPEZ TORRES BERCELI;PARTIDO CONSERVADOR COLOMBIANO;57
ARCABUCO;PACHECO VILLAMIL DIEGO ARMANDO;PARTIDO VERDE;54
ARCABUCO;RUIZ TORRES HECTOR JULIO;PARTIDO LIBERAL COLOMBIANO;48
ARCABUCO;RODRIGUEZ CORTES EDWIN ALEJANDRO;PARTIDO SOCIAL DE UNIDAD NACIONAL;47
ARCABUCO;GUZMAN POVEDA MARCELA JANNETH;PARTIDO CONSERVADOR COLOMBIANO;43
ARCABUCO;MORENO TORRES YAMID MANUEL;PARTIDO CONSERVADOR COLOMBIANO;41
ARCABUCO;PAEZ TARAZONA MARIO ALFONSO;PARTIDO CAMBIO RADICAL;38
ARCABUCO;MALAGON POVEDA GINA MILENA;PARTIDO VERDE;37
ARCABUCO;PARTIDO SOCIAL DE UNIDAD NACIONAL;PARTIDO SOCIAL DE UNIDAD NACIONAL;35
ARCABUCO;ROBLES SIMIJACA ABEL ARNULFO;PARTIDO CAMBIO RADICAL;35
ARCABUCO;CASTELBLANCO CARLOS ANDRES;PARTIDO LIBERAL COLOMBIANO;31
ARCABUCO;PARTIDO VERDE;PARTIDO VERDE;31
ARCABUCO;CRUZ RODRIGUEZ MAURO ISMAEL;PARTIDO LIBERAL COLOMBIANO;27
ARCABUCO;CUADROS ROLDAN FLOR MARIA;PARTIDO SOCIAL DE UNIDAD NACIONAL;27
ARCABUCO;BENITEZ HERNANDEZ JOSE MELQUISEDEC;PARTIDO VERDE;23
ARCABUCO;SAENZ SAAVEDRA NOHORA HERMELINDA;PARTIDO SOCIAL DE UNIDAD NACIONAL;23
ARCABUCO;ORREGO ORTIZ ELIANA CRISTINA;PARTIDO LIBERAL COLOMBIANO;21
ARCABUCO;PARTIDO CONSERVADOR COLOMBIANO;PARTIDO CONSERVADOR COLOMBIANO;21
ARCABUCO;POVEDA ALFONSO FAUSTO RICARDO;PARTIDO CAMBIO RADICAL;21
ARCABUCO;ROJAS PEREZ MARICEL;PARTIDO LIBERAL COLOMBIANO;17
ARCABUCO;PINILLA BERMUDEZ WILMAR;PARTIDO CAMBIO RADICAL;15
ARCABUCO;CONTRERAS CABRERA LUIS HERNANDO;PARTIDO CAMBIO RADICAL;14
ARCABUCO;MEZA SEVERICHE MARIA LEONOR;PARTIDO CAMBIO RADICAL;13
ARCABUCO;PARTIDO LIBERAL COLOMBIANO;PARTIDO LIBERAL COLOMBIANO;11
ARCABUCO;ACERO PINILLA NUBIA;PARTIDO CAMBIO RADICAL;9
ARCABUCO;TELLEZ RODRIGUEZ TERESA ISABEL;PARTIDO LIBERAL COLOMBIANO;9
ARCABUCO;PARTIDO CAMBIO RADICAL;PARTIDO CAMBIO RADICAL;8
ARCABUCO;AGUILERA YUDY TATIANA;PARTIDO CONSERVADOR COLOMBIANO;6
ARCABUCO;GONZALEZ SANTIAGO JOSE ISMAEL;PARTIDO LIBERAL COLOMBIANO;5
ARCABUCO;TOVAR PUENTES YENY CONSTANZA;PARTIDO VERDE;2
BELEN;SILVA ALARCON HERMES;PARTIDO CONSERVADOR COLOMBIANO;309
BELEN;PORRAS SANDOVAL SEGUNDO ARCENIO;PARTIDO CONSERVADOR COLOMBIANO;288
BELEN;TORRES CASTRO WILLTON EMILIO;PARTIDO CONSERVADOR COLOMBIANO;262
BELEN;AYALA OJEDA JON FREDY;PARTIDO LIBERAL COLOMBIANO;260
BELEN;GALLO PINEDA LUIS ADRIAN;PARTIDO LIBERAL COLOMBIANO;239
BELEN;GOMEZ GUERRERO ALDEMAR;PARTIDO LIBERAL COLOMBIANO;225
BELEN;GUERRERO MORANTES ORLANDO;PARTIDO CONSERVADOR COLOMBIANO;221
BELEN;TOLEDO URIBE ALVARO;PARTIDO LIBERAL COLOMBIANO;218
BELEN;PEREZ DIAZ ORLANDO;PARTIDO LIBERAL COLOMBIANO;191
BELEN;ROJAS BALAGUERA VICTOR HUMBERTO;PARTIDO CONSERVADOR COLOMBIANO;185
BELEN;VALDERRAMA VEGA MAURICIO;PARTIDO SOCIAL DE UNIDAD NACIONAL;184
BELEN;RINCON GUERRERO FABIO;PARTIDO LIBERAL COLOMBIANO;177
BELEN;FERNANDEZ FERNANDEZ ESGAR FERNEY;PARTIDO LIBERAL COLOMBIANO;169
BELEN;ESPINDOLA MATEUS ARTURO;PARTIDO LIBERAL COLOMBIANO;167
BELEN;CASTELLANOS DIAZ ISIDRO DE JESUS;PARTIDO CONSERVADOR COLOMBIANO;165
BELEN;VARGAS CHIQUILLO CARLOS HELY;PARTIDO SOCIAL DE UNIDAD NACIONAL;159
BELEN;BALAGUERA RODRIGUEZ WILSON DARIO;PARTIDO CONSERVADOR COLOMBIANO;150
BELEN;AMADO RINCON MARTHA CECILIA;PARTIDO CONSERVADOR COLOMBIANO;133
BELEN;RODRIGUEZ MENDOZA MAURICIO;PARTIDO SOCIAL DE UNIDAD NACIONAL;129
BELEN;CRISTANCHO ALBARRACIN OSWALDO;PARTIDO CONSERVADOR COLOMBIANO;127
BELEN;MACHUCA BALAGUERA MARIA CRISTINA;PARTIDO SOCIAL DE UNIDAD NACIONAL;111
BELEN;ROJAS SILVA LUIS ALFREDO;PARTIDO SOCIAL DE UNIDAD NACIONAL;81
BELEN;MONTANEZ JUAN PABLO;PARTIDO LIBERAL COLOMBIANO;79
BELEN;DIAZ SALVADOR;PARTIDO SOCIAL DE UNIDAD NACIONAL;61
BELEN;PARTIDO LIBERAL COLOMBIANO;PARTIDO LIBERAL COLOMBIANO;57
BELEN;PARTIDO CONSERVADOR COLOMBIANO;PARTIDO CONSERVADOR COLOMBIANO;50
BELEN;TORRES BARRERA ROSALBA;PARTIDO SOCIAL DE UNIDAD NACIONAL;41
BELEN;BALAGUERA DAZA LUIS AUGUSTO;PARTIDO SOCIAL DE UNIDAD NACIONAL;36
BELEN;PARTIDO SOCIAL DE UNIDAD NACIONAL;PARTIDO SOCIAL DE UNIDAD NACIONAL;19
BELEN;DIAZ BALAGUERA YOLANDA;PARTIDO SOCIAL DE UNIDAD NACIONAL;15
BERBEO;LOPEZ VALLEJO DANIEL;PARTIDO VERDE;79
BERBEO;CUBIDES MARTINEZ DISANDER ARNALDO;PARTIDO ALIANZA SOCIAL INDEPENDIENTE;67
BERBEO;VEGA ROA ROLFE URIEL;PARTIDO SOCIAL DE UNIDAD NACIONAL;62
BERBEO;VARGAS CONTRERAS MIYER JOSE;PARTIDO SOCIAL DE UNIDAD NACIONAL;60
BERBEO;MENDOZA ALFONSO MARLEN;PARTIDO CAMBIO RADICAL;50
BERBEO;MORENO CAMACHO ALBA MERCEDES;PARTIDO DE INTEGRACION NACIONAL;46
BERBEO;CRUZ MANRIQUE CARLOS ANDRES;PARTIDO DE INTEGRACION NACIONAL;43
BERBEO;MARTINEZ GRANADOS BERTO JULIO;PARTIDO ALIANZA SOCIAL INDEPENDIENTE;43
BERBEO;BUITRAGO BUITRAGO JORGE EDILGAR;PARTIDO CAMBIO RADICAL;41
BERBEO;CORTES HERNANDEZ CARLOS ALBERTO;PARTIDO LIBERAL COLOMBIANO;41
BERBEO;ROA UMANA MARIA BETANIA;PARTIDO SOCIAL DE UNIDAD NACIONAL;37
BERBEO;VEGA PENA YUBER DANIEL;PARTIDO VERDE;35
BERBEO;VARGAS DANIEL GUSTAVO;PARTIDO ALIANZA SOCIAL INDEPENDIENTE;32
BERBEO;RODRIGUEZ PIRATEQUE CLAUDIA;PARTIDO VERDE;31
BERBEO;LEGUIZAMO BOHORQUEZ CRISTOBAL;PARTIDO LIBERAL COLOMBIANO;30
BERBEO;CADENA VALERO LEONEL;PARTIDO CAMBIO RADICAL;29
BERBEO;CADENA ROJAS YALILE;PARTIDO VERDE;28
BERBEO;GRANADOS OBANDO OFIRALID;PARTIDO CAMBIO RADICAL;26
BERBEO;MARTINEZ LOPEZ JAIRO ADRIAN;PARTIDO LIBERAL COLOMBIANO;25
BERBEO;BAUTISTA HERRERA EDGAR MARIO;PARTIDO ALIANZA SOCIAL INDEPENDIENTE;24
BERBEO;SALAMANCA CASTELBLANCO BEYMAR;PARTIDO CAMBIO RADICAL;24
BERBEO;JUEZ VARGAS HECTOR HERNAN;PARTIDO DE INTEGRACION NACIONAL;23
BERBEO;DIAZ CASTANO MARIA NELCY;PARTIDO LIBERAL COLOMBIANO;22
BERBEO;GUZMAN PRECIADO GLORIA INES;PARTIDO LIBERAL COLOMBIANO;22
BERBEO;DIAZ DIAZ MARTHA CECILIA;PARTIDO SOCIAL DE UNIDAD NACIONAL;20
BERBEO;CIFUENTES PULIDO NELSON NOLBERTO;PARTIDO VERDE;15
BERBEO;MONTANEZ VARGAS ELSON ISMAEL;PARTIDO SOCIAL DE UNIDAD NACIONAL;15
BERBEO;HIGUA ESPITIA MAURICIO;PARTIDO DE INTEGRACION NACIONAL;12
BERBEO;PARTIDO LIBERAL COLOMBIANO;PARTIDO LIBERAL COLOMBIANO;11
BERBEO;MENDOZA COLMENARES MILTON JULIO;PARTIDO VERDE;10
BERBEO;MONROY VEGA EMILCEN;PARTIDO DE INTEGRACION NACIONAL;10
BERBEO;PARTIDO SOCIAL DE UNIDAD NACIONAL;PARTIDO SOCIAL DE UNIDAD NACIONAL;10
BERBEO;BOHORQUEZ CARRANZA FREDY JHOANE;PARTIDO DE INTEGRACION NACIONAL;8
BERBEO;CASTRO MARTINEZ SANDRA PATRICIA;PARTIDO VERDE;8
BERBEO;LOPEZ MAHECHA CARMELINA;PARTIDO CAMBIO RADICAL;8
BERBEO;BOHADA RIANO ALEJANDRO;PARTIDO SOCIAL DE UNIDAD NACIONAL;7
BERBEO;PARTIDO ALIANZA SOCIAL INDEPENDIENTE;PARTIDO ALIANZA SOCIAL INDEPENDIENTE;7
BERBEO;VARGAS REINOSO LEYDY JOHANA;PARTIDO ALIANZA SOCIAL INDEPENDIENTE;7
BERBEO;MARTINEZ QUINTANA JOSE DONALDO;PARTIDO CAMBIO RADICAL;6
BERBEO;GRANADOS PARRA MAYRA ROCIO;PARTIDO SOCIAL DE UNIDAD NACIONAL;5
BERBEO;MONROY DIAZ ROCIO;PARTIDO ALIANZA SOCIAL INDEPENDIENTE;5
BERBEO;ALFONSO VALLEJO LUZ ANGELA;PARTIDO ALIANZA SOCIAL INDEPENDIENTE;4
BERBEO;PARTIDO VERDE;PARTIDO VERDE;4
BERBEO;PARTIDO CAMBIO RADICAL;PARTIDO CAMBIO RADICAL;3
BERBEO;MUNOZ GAMBA EDGAR YESID;PARTIDO LIBERAL COLOMBIANO;2
BERBEO;PARTIDO DE INTEGRACION NACIONAL;PARTIDO DE INTEGRACION NACIONAL;1
BETEITIVA;PEREZ ARAQUE VICTOR JULIO;PARTIDO CAMBIO RADICAL;127
BETEITIVA;CORREA CARDENAS WILLMAN;PARTIDO SOCIAL DE UNIDAD NACIONAL;115
BETEITIVA;ROJAS CELY DANIEL;PARTIDO CAMBIO RADICAL;114
BETEITIVA;CELY CELY MARY LUZ;PARTIDO LIBERAL COLOMBIANO;87
BETEITIVA;CORREA CELY SARA YASMID;PARTIDO SOCIAL DE UNIDAD NACIONAL;71
BETEITIVA;ALFONSO MORENO JUAN CARLOS;PARTIDO SOCIAL DE UNIDAD NACIONAL;66
BETEITIVA;GIL CARDENAS EDILBERTO;PARTIDO LIBERAL COLOMBIANO;63
BETEITIVA;VARGAS VARGAS ROBINSON JAVIER;PARTIDO VERDE;62
BETEITIVA;CORREA ALVAREZ WILMER ALFONSO;PARTIDO LIBERAL COLOMBIANO;61
BETEITIVA;ANGARITA CARDENAS CRISTOBAL;PARTIDO CAMBIO RADICAL;59
BETEITIVA;CRISTANCHO SAAVEDRA JUSTO LUIS;PARTIDO SOCIAL DE UNIDAD NACIONAL;51
BETEITIVA;PEREZ SAAVEDRA ALVARO;PARTIDO VERDE;47
BETEITIVA;PERICO DE BECERRA MARIA GEMMA;PARTIDO SOCIAL DE UNIDAD NACIONAL;42
BETEITIVA;SOLANO PEREZ MARIA DE LA CRUZ;PARTIDO VERDE;41
BETEITIVA;BERDUGO GONZALEZ MARIA ELVIA;PARTIDO SOCIAL DE UNIDAD NACIONAL;39
BETEITIVA;ROJAS VARGAS MERARDO ANTONIO;PARTIDO LIBERAL COLOMBIANO;38
BETEITIVA;SILVA GIL JOSE MARTIN;PARTIDO DE INTEGRACION NACIONAL;38
BETEITIVA;GALLO CARDENAS HECTOR JULIO;PARTIDO SOCIAL DE UNIDAD NACIONAL;36
BETEITIVA;CRISTANCHO DE ROJAS JOSEFA;PARTIDO VERDE;33
BETEITIVA;VARGAS ROJAS ELIAS;PARTIDO LIBERAL COLOMBIANO;32
BETEITIVA;AMADO DE CARDENAS YOLANDA;PARTIDO CAMBIO RADICAL;28
BETEITIVA;ACERO CELY JOSE ANTONIO;PARTIDO VERDE;25
BETEITIVA;LEON PEREZ CANDELARIA;PARTIDO VERDE;25
BETEITIVA;SILVA CELY ANA REINA;PARTIDO CAMBIO RADICAL;20
BETEITIVA;DAZA FERNANDEZ LUIS ANTONIO;PARTIDO VERDE;18
BETEITIVA;ROJAS GONZALEZ IRMA INES;PARTIDO DE INTEGRACION NACIONAL;16
BETEITIVA;ANGARITA ANGARITA DORIS;PARTIDO DE INTEGRACION NACIONAL;9
BETEITIVA;PARTIDO LIBERAL COLOMBIANO;PARTIDO LIBERAL COLOMBIANO;9
BETEITIVA;PARTIDO VERDE;PARTIDO VERDE;8
BETEITIVA;PARTIDO SOCIAL DE UNIDAD NACIONAL;PARTIDO SOCIAL DE UNIDAD NACIONAL;7
BETEITIVA;UCHAMOCHA DAZA LEONEL;PARTIDO DE INTEGRACION NACIONAL;6
BETEITIVA;HERNANDEZ RINCON SONIA;PARTIDO LIBERAL COLOMBIANO;5
BETEITIVA;MOGOLLON FERNANDEZ CARLOS ALIRIO;PARTIDO DE INTEGRACION NACIONAL;5
BETEITIVA;PARTIDO CAMBIO RADICAL;PARTIDO CAMBIO RADICAL;4
BETEITIVA;PARTIDO DE INTEGRACION NACIONAL;PARTIDO DE INTEGRACION NACIONAL;1
BOAVITA;OSORIO LIZARAZO MARLEN;PARTIDO VERDE;276
BOAVITA;APONTE GARCIA OLIVA;PARTIDO VERDE;211
BOAVITA;DIAZ SANCHEZ JORGE ARTURO;PARTIDO CONSERVADOR COLOMBIANO;210
BOAVITA;DIAZ LAGOS JAIRO;PARTIDO SOCIAL DE UNIDAD NACIONAL;159
BOAVITA;GALLO UMANA PEDRO JOSE;PARTIDO ALIANZA SOCIAL INDEPENDIENTE;138
BOAVITA;TARAZONA ANGARITA FABIO;PARTIDO CONSERVADOR COLOMBIANO;138
BOAVITA;DUITAMA LUIS DANIEL;PARTIDO CONSERVADOR COLOMBIANO;127
BOAVITA;GALVIS CORDOBA HERMINIO;PARTIDO VERDE;123
BOAVITA;SANDOVAL VALCARCEL ALBERTO;PARTIDO CONSERVADOR COLOMBIANO;114
BOAVITA;OSORIO SEPULVEDA LUCAS ARMANDO;PARTIDO SOCIAL DE UNIDAD NACIONAL;113
BOAVITA;BAEZ GOMEZ ANGELA ROCIO;PARTIDO ALIANZA SOCIAL INDEPENDIENTE;104
BOAVITA;HERNANDEZ AYALA IGNACIO;PARTIDO SOCIAL DE UNIDAD NACIONAL;102
BOAVITA;AYALA SANCHEZ CARLOS ENRIQUE;PARTIDO CONSERVADOR COLOMBIANO;100
BOAVITA;BARON MEDINA CARLOS RAFAEL;PARTIDO SOCIAL DE UNIDAD NACIONAL;98
BOAVITA;OSORIO DE DUENAS SILVIA;PARTIDO CONSERVADOR COLOMBIANO;92
BOAVITA;LIZARAZO MALDONADO IGNACIO;PARTIDO VERDE;89
BOAVITA;DIAZ BURGOS INES;PARTIDO VERDE;86
BOAVITA;VELASCO LUIS ARIEL;PARTIDO CONSERVADOR COLOMBIANO;78
BOAVITA;FUENTES GARCIA MARIA IMELDA;PARTIDO ALIANZA SOCIAL INDEPENDIENTE;67
BOAVITA;ROJAS ARIAS DOMINGO;PARTIDO SOCIAL DE UNIDAD NACIONAL;65
BOAVITA;GARCIA TARAZONA CATALINA;PARTIDO ALIANZA SOCIAL INDEPENDIENTE;63
BOAVITA;CORREA HILDEBRANDO;PARTIDO ALIANZA SOCIAL INDEPENDIENTE;59
BOAVITA;MEDINA CABREJO CLEOTILDE;PARTIDO CONSERVADOR COLOMBIANO;55
BOAVITA;QUINTERO DAVILA VICTOR MANUEL;PARTIDO SOCIAL DE UNIDAD NACIONAL;49
BOAVITA;DIAZ DIAZ ARISTOBULO;PARTIDO VERDE;46
BOAVITA;RIVERA BONILLA MONICA MARIA;PARTIDO ALIANZA SOCIAL INDEPENDIENTE;45
BOAVITA;PARTIDO VERDE;PARTIDO VERDE;41
BOAVITA;PARTIDO CONSERVADOR COLOMBIANO;PARTIDO CONSERVADOR COLOMBIANO;39
BOAVITA;ARIAS DE VEGA AMINTA;PARTIDO VERDE;23
BOAVITA;BARON DIAZ ADRIANO;PARTIDO VERDE;23
BOAVITA;ARIAS DE VELASCO BEATRIZ;PARTIDO CONSERVADOR COLOMBIANO;22
BOAVITA;VELOZA MEDINA JOSE DOMINGO;PARTIDO CAMBIO RADICAL;21
BOAVITA;APONTE JULIO DANIEL;PARTIDO ALIANZA SOCIAL INDEPENDIENTE;18
BOAVITA;LIZARAZO CARRILLO RUTH CAROLINA;PARTIDO SOCIAL DE UNIDAD NACIONAL;18
BOAVITA;PARTIDO ALIANZA SOCIAL INDEPENDIENTE;PARTIDO ALIANZA SOCIAL INDEPENDIENTE;17
BOAVITA;PARTIDO SOCIAL DE UNIDAD NACIONAL;PARTIDO SOCIAL DE UNIDAD NACIONAL;14
BOAVITA;PINZON BURGOS MYRIAM;PARTIDO CAMBIO RADICAL;11
BOAVITA;HERNANDEZ CARRENO MARIA EUGENIA;PARTIDO SOCIAL DE UNIDAD NACIONAL;9
BOAVITA;PARTIDO CAMBIO RADICAL;PARTIDO CAMBIO RADICAL;6
BOAVITA;GUIO FUENTES SANDRA CAROLINA;PARTIDO SOCIAL DE UNIDAD NACIONAL;5
BOYACA;CUPA BERNAL JOSE DARIO;PARTIDO DE INTEGRACION NACIONAL;195
BOYACA;BOADA MORA ALEJANDRO;PARTIDO SOCIAL DE UNIDAD NACIONAL;150
BOYACA;CIFUENTES SOSA JOSE PEPE;PARTIDO LIBERAL COLOMBIANO;145
BOYACA;BERMUDEZ BARAJAS JOSE EDILBERTO;PARTIDO LIBERAL COLOMBIANO;144
BOYACA;CARO CAMARGO JAIRO ENRIQUE;PARTIDO LIBERAL COLOMBIANO;137
BOYACA;PARADA RATIVA PEDRO JULIO;PARTIDO LIBERAL COLOMBIANO;132
BOYACA;MANCILLA GAONA ANA EDELMIRA;PARTIDO SOCIAL DE UNIDAD NACIONAL;125
BOYACA;CAMELO TORRES ALFONSO;PARTIDO LIBERAL COLOMBIANO;121
BOYACA;MONTES SUARIQUE WILSON;PARTIDO SOCIAL DE UNIDAD NACIONAL;106
BOYACA;MUNOZ CIFUENTES RAFAEL HUMBERTO;PARTIDO DE INTEGRACION NACIONAL;97
BOYACA;LEGUIZAMON DE BOHORQUEZ MAXIMA ABIGAIL;PARTIDO LIBERAL COLOMBIANO;93
BOYACA;PARTIDO LIBERAL COLOMBIANO;PARTIDO LIBERAL COLOMBIANO;90
BOYACA;CIFUENTES CIFUENTES OMAR DE JESUS;PARTIDO SOCIAL DE UNIDAD NACIONAL;89
BOYACA;MERCHAN CALLEJAS LUIS ANTONIO;PARTIDO DE INTEGRACION NACIONAL;88
BOYACA;BOHORQUEZ TOBAR LUIS ENRIQUE;PARTIDO SOCIAL DE UNIDAD NACIONAL;79
BOYACA;CRUZ ARCOS OLGA LUCIA;PARTIDO SOCIAL DE UNIDAD NACIONAL;78
BOYACA;TOVAR CIFUENTES JORGE TIBERIO;PARTIDO CAMBIO RADICAL;73
BOYACA;SORA ARIAS PEDRO JOSE;PARTIDO LIBERAL COLOMBIANO;71
BOYACA;TORRES SORA AURA JEANET;PARTIDO LIBERAL COLOMBIANO;71
BOYACA;CUPA GARCIA JORGE ENRIQUE;PARTIDO SOCIAL DE UNIDAD NACIONAL;60
BOYACA;SANCHEZ MOLANO CARLOS ALBERTO;PARTIDO VERDE;55
BOYACA;GUTIERREZ BOHORQUEZ SANDRA MILENA;PARTIDO CAMBIO RADICAL;50
BOYACA;PLAZAS ORTIZ ALVEIRO;PARTIDO VERDE;46
BOYACA;PARTIDO SOCIAL DE UNIDAD NACIONAL;PARTIDO SOCIAL DE UNIDAD NACIONAL;40
BOYACA;MORENO RINCON PEDRO;PARTIDO SOCIAL DE UNIDAD NACIONAL;38
BOYACA;SANABRIA MUNOZ DELIO;PARTIDO CAMBIO RADICAL;38
BOYACA;GRANADOS CALDERON MARIA CRISTINA;PARTIDO LIBERAL COLOMBIANO;36
BOYACA;MANCILLA MANCILLA OMAR YESID;PARTIDO DE INTEGRACION NACIONAL;33
BOYACA;QUINTERO MALAGON MARIA CLAUDIA;PARTIDO DE INTEGRACION NACIONAL;33
BOYACA;MARTINEZ ORTIZ RODRIGO;PARTIDO VERDE;32
BOYACA;VARGAS QUINTERO LUZ MARINA;PARTIDO DE INTEGRACION NACIONAL;25
BOYACA;PARTIDO DE INTEGRACION NACIONAL;PARTIDO DE INTEGRACION NACIONAL;20
BOYACA;RATIVA GARCIA ALIRIO;PARTIDO DE INTEGRACION NACIONAL;19
BOYACA;VARGAS RATIVA MYRIAM YULIE;PARTIDO DE INTEGRACION NACIONAL;19
BOYACA;VARGAS SOSA CAROLINA;PARTIDO VERDE;19
BOYACA;VARGAS RATIVA JAIME;PARTIDO CAMBIO RADICAL;13
BOYACA;CALLEJAS ALICIA;PARTIDO SOCIAL DE UNIDAD NACIONAL;12
BOYACA;APONTE PAEZ FREDY ALONSO;PARTIDO DE INTEGRACION NACIONAL;11
BOYACA;PARTIDO CAMBIO RADICAL;PARTIDO CAMBIO RADICAL;11
BOYACA;NEIRA SOSA SEGUNDO;PARTIDO VERDE;10
BOYACA;RIOS GAONA HENRY;PARTIDO VERDE;10
BOYACA;ROMERO BARAJAS MARIA EMILCE;PARTIDO VERDE;10
BOYACA;SOSA SANCHEZ REINEL;PARTIDO CAMBIO RADICAL;10
BOYACA;RAMIREZ CASTELBLANCO BERENICE;PARTIDO CAMBIO RADICAL;9
BOYACA;PARTIDO VERDE;PARTIDO VERDE;8
BOYACA;CIFUENTES CIFUENTES MARTHA CECILIA;PARTIDO VERDE;7
BRICENO;FLORIAN CORTES NAYIBE ALEXANDRA;PARTIDO CAMBIO RADICAL;114
BRICENO;ROCHA PENA FABIO ENRIQUE;PARTIDO VERDE;105
BRICENO;DURAN GOMEZ MALELY;PARTIDO CONSERVADOR COLOMBIANO;98
BRICENO;RAMIREZ PENA CELIO GONZALO;PARTIDO ALIANZA SOCIAL INDEPENDIENTE;94
BRICENO;PENA MASMELA EVELIA;PARTIDO DE INTEGRACION NACIONAL;74
BRICENO;MONTANEZ ABRIL MARCOS FLORINDO;PARTIDO CONSERVADOR COLOMBIANO;64
BRICENO;PARRA FIGUEREDO WAULDINO;PARTIDO ALIANZA SOCIAL INDEPENDIENTE;64
BRICENO;ORTIZ MURCIA REINALDO HUMBERTO;PARTIDO ALIANZA SOCIAL INDEPENDIENTE;61
BRICENO;SANCHEZ ORTIZ GREGORIO HERNANDO;PARTIDO VERDE;57
BRICENO;ORTIZ PEDROZA PUBLIO JOAQUIN;PARTIDO ALIANZA SOCIAL INDEPENDIENTE;55
BRICENO;PENA CARVAJAL MARCO TULIO;PARTIDO CONSERVADOR COLOMBIANO;54
BRICENO;BENITEZ MEDINA JAVIER EMILIO;PARTIDO CONSERVADOR COLOMBIANO;53
BRICENO;SAZA LEMUS FERNEY;PARTIDO DE INTEGRACION NACIONAL;41
BRICENO;CORTES BALLARES ABEL ALFONSO;PARTIDO SOCIAL DE UNIDAD NACIONAL;34
