MUNNOMBRE,PARNOMBRE,TOTALVOTOSVALIDOS,PORCENTAJE
DUITAMA;YAMIT ALFONSO OCHOA MARTINEZ;MOVIMIENTO MIRA;184,DUITAMA;Yamit Alfonso Ochoa Martinez;MOVIMIENTO MIRA;184,0.0,0.0
DUITAMA;YANETH PATRICIA CLAROS;PARTIDO VERDE;152,DUITAMA;Yaneth Patricia Claros;PARTIDO VERDE;152,0.0,0.0
DUITAMA;YEBRAIL LIZARAZO RAMIREZ;PARTIDO LIBERAL COLOMBIANO;236,DUITAMA;Yebrail Lizarazo Ramirez;PARTIDO LIBERAL COLOMBIANO;236,0.0,0.0
DUITAMA;YENNY BELKIS SANDOVAL BUITRAGO;PARTIDO ALIANZA SOCIAL INDEPENDIENTE;18,DUITAMA;Yenny Belkis Sandoval Buitrago;PARTIDO ALIANZA SOCIAL INDEPENDIENTE;18,0.0,0.0
DUITAMA;YOLIMA ANELET OROZCO MARTINEZ;MOVIMIENTO MIRA;58,DUITAMA;Yolima Anelet Orozco Martinez;MOVIMIENTO MIRA;58,0.0,0.0
DUITAMA;YUDY MARIA GALEANO MONSALVE;PARTIDO SOCIAL DE UNIDAD NACIONAL;366,DUITAMA;Yudy Maria Galeano Monsalve;PARTIDO SOCIAL DE UNIDAD NACIONAL;366,0.0,0.0
DUITAMA;YULEYMI PAMELA PUERTO SIMBAQUEVA;PARTIDO LIBERAL COLOMBIANO;78,DUITAMA;Yuleymi Pamela Puerto Simbaqueva;PARTIDO LIBERAL COLOMBIANO;78,0.0,0.0
DUITAMA;YULY ANDREA BARRERA MUNOZ;MOVIMIENTO MIRA;76,DUITAMA;Yuly Andrea Barrera Munoz;MOVIMIENTO MIRA;76,0.0,0.0
EL COCUY;ANDRES MANRIQUE MANTILLA;PARTIDO LIBERAL COLOMBIANO;58,EL COCUY;Andres Manrique Mantilla;PARTIDO LIBERAL COLOMBIANO;58,0.0,0.0
EL COCUY;BERNARDO VELANDIA RODRIGUEZ;PARTIDO ALIANZA SOCIAL INDEPENDIENTE;34,EL COCUY;Bernardo Velandia Rodriguez;PARTIDO ALIANZA SOCIAL INDEPENDIENTE;34,0.0,0.0
EL COCUY;BLANCA LOURDES TORRES BERNAL;PARTIDO LIBERAL COLOMBIANO;58,EL COCUY;Blanca Lourdes Torres Bernal;PARTIDO LIBERAL COLOMBIANO;58,0.0,0.0
EL COCUY;CAMPOS TARAZONA;PARTIDO LIBERAL COLOMBIANO;216,EL COCUY;Campos Tarazona;PARTIDO LIBERAL COLOMBIANO;216,0.0,0.0
EL COCUY;CARLOS JULIO LOPEZ CORREA;PARTIDO CONSERVADOR COLOMBIANO;137,EL COCUY;Carlos Julio Lopez Correa;PARTIDO CONSERVADOR COLOMBIANO;137,0.0,0.0
EL COCUY;CAROLINA ALVAREZ MARTINEZ;PARTIDO CONSERVADOR COLOMBIANO;22,EL COCUY;Carolina Alvarez Martinez;PARTIDO CONSERVADOR COLOMBIANO;22,0.0,0.0
EL COCUY;CENAIDA HERRERA CORREA;PARTIDO CONSERVADOR COLOMBIANO;54,EL COCUY;Cenaida Herrera Correa;PARTIDO CONSERVADOR COLOMBIANO;54,0.0,0.0
EL COCUY;EDITH ECHEVERRIA SILVA;PARTIDO SOCIAL DE UNIDAD NACIONAL;31,EL COCUY;Edith Echeverria Silva;PARTIDO SOCIAL DE UNIDAD NACIONAL;31,0.0,0.0
EL COCUY;EDWAR HERNANDO CARRERO MORA;PARTIDO CONSERVADOR COLOMBIANO;161,EL COCUY;Edwar Hernando Carrero Mora;PARTIDO CONSERVADOR COLOMBIANO;161,0.0,0.0
EL COCUY;ELVIA LILIANA ALVARADO VELANDIA;PARTIDO SOCIAL DE UNIDAD NACIONAL;33,EL COCUY;Elvia Liliana Alvarado Velandia;PARTIDO SOCIAL DE UNIDAD NACIONAL;33,0.0,0.0
EL COCUY;ESTEBAN SILVA WILCHEZ;PARTIDO LIBERAL COLOMBIANO;110,EL COCUY;Esteban Silva Wilchez;PARTIDO LIBERAL COLOMBIANO;110,0.0,0.0
EL COCUY;FABIO OLIVARES DIAZ;PARTIDO SOCIAL DE UNIDAD NACIONAL;21,EL COCUY;Fabio Olivares Diaz;PARTIDO SOCIAL DE UNIDAD NACIONAL;21,0.0,0.0
EL COCUY;HERMES PICO SOLEDAD;PARTIDO CONSERVADOR COLOMBIANO;14,EL COCUY;Hermes Pico Soledad;PARTIDO CONSERVADOR COLOMBIANO;14,0.0,0.0
EL COCUY;IRMA YISETH OVIEDO OVIEDO;PARTIDO CONSERVADOR COLOMBIANO;43,EL COCUY;Irma Yiseth Oviedo Oviedo;PARTIDO CONSERVADOR COLOMBIANO;43,0.0,0.0
EL COCUY;JAIRO HUMBERTO CARRENO MORA;PARTIDO LIBERAL COLOMBIANO;126,EL COCUY;Jairo Humberto Carreno Mora;PARTIDO LIBERAL COLOMBIANO;126,0.0,0.0
EL COCUY;JOAQUIN ORLANDO ROBAYO PUENTES;PARTIDO SOCIAL DE UNIDAD NACIONAL;22,EL COCUY;Joaquin Orlando Robayo Puentes;PARTIDO SOCIAL DE UNIDAD NACIONAL;22,0.0,0.0
EL COCUY;JORGE ELIECER ALVARADO SILVA;PARTIDO LIBERAL COLOMBIANO;155,EL COCUY;Jorge Eliecer Alvarado Silva;PARTIDO LIBERAL COLOMBIANO;155,0.0,0.0
EL COCUY;JOSE DE JESUS MUNOZ;PARTIDO ALIANZA SOCIAL INDEPENDIENTE;11,EL COCUY;Jose De Jesus Munoz;PARTIDO ALIANZA SOCIAL INDEPENDIENTE;11,0.0,0.0
EL COCUY;JULIO ANIBAL RUIZ SILVA;PARTIDO LIBERAL COLOMBIANO;37,EL COCUY;Julio Anibal Ruiz Silva;PARTIDO LIBERAL COLOMBIANO;37,0.0,0.0
EL COCUY;LEONOR DIAZ QUINTERO;PARTIDO LIBERAL COLOMBIANO;215,EL COCUY;Leonor Diaz Quintero;PARTIDO LIBERAL COLOMBIANO;215,0.0,0.0
EL COCUY;LUIS GERMAN MORA BARENO;PARTIDO CONSERVADOR COLOMBIANO;151,EL COCUY;Luis German Mora Bareno;PARTIDO CONSERVADOR COLOMBIANO;151,0.0,0.0
EL COCUY;MARTHA LUCILA LOPEZ MORA;PARTIDO ALIANZA SOCIAL INDEPENDIENTE;7,EL COCUY;Martha Lucila Lopez Mora;PARTIDO ALIANZA SOCIAL INDEPENDIENTE;7,0.0,0.0
EL COCUY;MICHEL ALEXIS GARCIA PICO;PARTIDO ALIANZA SOCIAL INDEPENDIENTE;11,EL COCUY;Michel Alexis Garcia Pico;PARTIDO ALIANZA SOCIAL INDEPENDIENTE;11,0.0,0.0
EL COCUY;NURY ALEXANDRA NINO BUITRAGO;PARTIDO ALIANZA SOCIAL INDEPENDIENTE;10,EL COCUY;Nury Alexandra Nino Buitrago;PARTIDO ALIANZA SOCIAL INDEPENDIENTE;10,0.0,0.0
EL COCUY;OMAIRA NUNEZ PICO;PARTIDO LIBERAL COLOMBIANO;119,EL COCUY;Omaira Nunez Pico;PARTIDO LIBERAL COLOMBIANO;119,0.0,0.0
EL COCUY;OSCAR FERNANDO BENAVIDES SOLEDAD;PARTIDO SOCIAL DE UNIDAD NACIONAL;20,EL COCUY;Oscar Fernando Benavides Soledad;PARTIDO SOCIAL DE UNIDAD NACIONAL;20,0.0,0.0
EL COCUY;PARTIDO ALIANZA SOCIAL INDEPENDIENTE;PARTIDO ALIANZA SOCIAL INDEPENDIENTE;4,EL COCUY;Partido Alianza Social Independiente;Partido Alianza Social Independiente;4,0.0,0.0
EL COCUY;PARTIDO CONSERVADOR COLOMBIANO;PARTIDO CONSERVADOR COLOMBIANO;28,EL COCUY;Partido Conservador Colombiano;Partido Conservador Colombiano;28,0.0,0.0
EL COCUY;PARTIDO LIBERAL COLOMBIANO;PARTIDO LIBERAL COLOMBIANO;70,EL COCUY;Partido Liberal Colombiano;Partido Liberal Colombiano;70,0.0,0.0
EL COCUY;PARTIDO SOCIAL DE UNIDAD NACIONAL;PARTIDO SOCIAL DE UNIDAD NACIONAL;9,EL COCUY;Partido Social De Unidad Nacional;Partido Social De Unidad Nacional;9,0.0,0.0
EL COCUY;PEDRO IGNACIO BARON MORA;PARTIDO CONSERVADOR COLOMBIANO;152,EL COCUY;Pedro Ignacio Baron Mora;PARTIDO CONSERVADOR COLOMBIANO;152,0.0,0.0
EL COCUY;PEDRO MANUEL BLANCO BLANCO;PARTIDO SOCIAL DE UNIDAD NACIONAL;34,EL COCUY;Pedro Manuel Blanco Blanco;PARTIDO SOCIAL DE UNIDAD NACIONAL;34,0.0,0.0
EL COCUY;RAMIRO URIEL MORA LOPEZ;PARTIDO CONSERVADOR COLOMBIANO;121,EL COCUY;Ramiro Uriel Mora Lopez;PARTIDO CONSERVADOR COLOMBIANO;121,0.0,0.0
EL COCUY;YANETH PATRICIA VALDERRAMA VALDERRAMA;PARTIDO ALIANZA SOCIAL INDEPENDIENTE;27,EL COCUY;Yaneth Patricia Valderrama Valderrama;PARTIDO ALIANZA SOCIAL INDEPENDIENTE;27,0.0,0.0
EL ESPINO;ARGEMIRO MUNOZ ROJAS;PARTIDO VERDE;3,EL ESPINO;Argemiro Munoz Rojas;PARTIDO VERDE;3,0.0,0.0
EL ESPINO;BERTHA BENILDA RINCON TOSCANO;PARTIDO CAMBIO RADICAL;49,EL ESPINO;Bertha Benilda Rincon Toscano;PARTIDO CAMBIO RADICAL;49,0.0,0.0
EL ESPINO;CLAUDIA LILIANA SACHICA GUEVARA;PARTIDO CONSERVADOR COLOMBIANO;11,EL ESPINO;Claudia Liliana Sachica Guevara;PARTIDO CONSERVADOR COLOMBIANO;11,0.0,0.0
EL ESPINO;DIMAS ARAQUE RUIZ;PARTIDO SOCIAL DE UNIDAD NACIONAL;40,EL ESPINO;Dimas Araque Ruiz;PARTIDO SOCIAL DE UNIDAD NACIONAL;40,0.0,0.0
EL ESPINO;EDGAR HERNANDEZ PACHECO;PARTIDO VERDE;31,EL ESPINO;Edgar Hernandez Pacheco;PARTIDO VERDE;31,0.0,0.0
EL ESPINO;EDICSSON PUENTES GOMEZ;PARTIDO SOCIAL DE UNIDAD NACIONAL;39,EL ESPINO;Edicsson Puentes Gomez;PARTIDO SOCIAL DE UNIDAD NACIONAL;39,0.0,0.0
EL ESPINO;ELINEBARDO PACHECO QUINTANA;PARTIDO CAMBIO RADICAL;81,EL ESPINO;Elinebardo Pacheco Quintana;PARTIDO CAMBIO RADICAL;81,0.0,0.0
EL ESPINO;FERNANDO PEDRAZA PUENTES;PARTIDO SOCIAL DE UNIDAD NACIONAL;89,EL ESPINO;Fernando Pedraza Puentes;PARTIDO SOCIAL DE UNIDAD NACIONAL;89,0.0,0.0
EL ESPINO;FLOR DEL CARMEN NINO MUNOZ;PARTIDO SOCIAL DE UNIDAD NACIONAL;19,EL ESPINO;Flor Del Carmen Nino Munoz;PARTIDO SOCIAL DE UNIDAD NACIONAL;19,0.0,0.0
EL ESPINO;HERMINIO MENDEZ QUINTANA;PARTIDO VERDE;28,EL ESPINO;Herminio Mendez Quintana;PARTIDO VERDE;28,0.0,0.0
EL ESPINO;HERNANDO BLANCO PINTO;PARTIDO CAMBIO RADICAL;79,EL ESPINO;Hernando Blanco Pinto;PARTIDO CAMBIO RADICAL;79,0.0,0.0
EL ESPINO;JORGE ARMANDO IZA HERNANDEZ;PARTIDO VERDE;46,EL ESPINO;Jorge Armando Iza Hernandez;PARTIDO VERDE;46,0.0,0.0
EL ESPINO;JOSE ALEJO USSA LOPEZ;PARTIDO CONSERVADOR COLOMBIANO;39,EL ESPINO;Jose Alejo Ussa Lopez;PARTIDO CONSERVADOR COLOMBIANO;39,0.0,0.0
EL ESPINO;LUBIA BUITRAGO HERNANDEZ;PARTIDO VERDE;52,EL ESPINO;Lubia Buitrago Hernandez;PARTIDO VERDE;52,0.0,0.0
EL ESPINO;LUDY CARRENO SANDOVAL;PARTIDO SOCIAL DE UNIDAD NACIONAL;75,EL ESPINO;Ludy Carreno Sandoval;PARTIDO SOCIAL DE UNIDAD NACIONAL;75,0.0,0.0
EL ESPINO;LUZ MERY MOJICA MANCIPE;PARTIDO CAMBIO RADICAL;66,EL ESPINO;Luz Mery Mojica Mancipe;PARTIDO CAMBIO RADICAL;66,0.0,0.0
EL ESPINO;MARCELINO BUITRAGO BUITRAGO;PARTIDO CONSERVADOR COLOMBIANO;23,EL ESPINO;Marcelino Buitrago Buitrago;PARTIDO CONSERVADOR COLOMBIANO;23,0.0,0.0
EL ESPINO;MARIA EUGENIA PEREZ NUNEZ;PARTIDO SOCIAL DE UNIDAD NACIONAL;156,EL ESPINO;Maria Eugenia Perez Nunez;PARTIDO SOCIAL DE UNIDAD NACIONAL;156,0.0,0.0
EL ESPINO;MARTHA BRIGITH CARRENO;PARTIDO CAMBIO RADICAL;28,EL ESPINO;Martha Brigith Carreno;PARTIDO CAMBIO RADICAL;28,0.0,0.0
EL ESPINO;NYDIA MARCELA BARON BARON;PARTIDO CONSERVADOR COLOMBIANO;22,EL ESPINO;Nydia Marcela Baron Baron;PARTIDO CONSERVADOR COLOMBIANO;22,0.0,0.0
EL ESPINO;PARTIDO CAMBIO RADICAL;PARTIDO CAMBIO RADICAL;25,EL ESPINO;Partido Cambio Radical;Partido Cambio Radical;25,0.0,0.0
EL ESPINO;PARTIDO CONSERVADOR COLOMBIANO;PARTIDO CONSERVADOR COLOMBIANO;6,EL ESPINO;Partido Conservador Colombiano;Partido Conservador Colombiano;6,0.0,0.0
EL ESPINO;PARTIDO SOCIAL DE UNIDAD NACIONAL;PARTIDO SOCIAL DE UNIDAD NACIONAL;20,EL ESPINO;Partido Social De Unidad Nacional;Partido Social De Unidad Nacional;20,0.0,0.0
EL ESPINO;PARTIDO VERDE;PARTIDO VERDE;9,EL ESPINO;Partido Verde;Partido Verde;9,0.0,0.0
EL ESPINO;PASTORA DIMAS ACOMCHA;PARTIDO CONSERVADOR COLOMBIANO;52,EL ESPINO;Pastora Dimas Acomcha;PARTIDO CONSERVADOR COLOMBIANO;52,0.0,0.0
EL ESPINO;PEDRO ANTONIO CARDENAS CARRENO;PARTIDO CONSERVADOR COLOMBIANO;27,EL ESPINO;Pedro Antonio Cardenas Carreno;PARTIDO CONSERVADOR COLOMBIANO;27,0.0,0.0
EL ESPINO;RAQUEL ZAMBRANO PEDRAZA;PARTIDO VERDE;28,EL ESPINO;Raquel Zambrano Pedraza;PARTIDO VERDE;28,0.0,0.0
EL ESPINO;RICARDO CACERES BARON;PARTIDO CAMBIO RADICAL;120,EL ESPINO;Ricardo Caceres Baron;PARTIDO CAMBIO RADICAL;120,0.0,0.0
EL ESPINO;RODULFO PUENTES HERNANDEZ;PARTIDO CONSERVADOR COLOMBIANO;57,EL ESPINO;Rodulfo Puentes Hernandez;PARTIDO CONSERVADOR COLOMBIANO;57,0.0,0.0
EL ESPINO;SAULO YEBRAIL ESTEBAN ABRIL;PARTIDO CAMBIO RADICAL;67,EL ESPINO;Saulo Yebrail Esteban Abril;PARTIDO CAMBIO RADICAL;67,0.0,0.0
EL ESPINO;WILSON MANUEL CELY TORRES;PARTIDO SOCIAL DE UNIDAD NACIONAL;44,EL ESPINO;Wilson Manuel Cely Torres;PARTIDO SOCIAL DE UNIDAD NACIONAL;44,0.0,0.0
EL ESPINO;YANETH BUITRAGO ABRIL;PARTIDO VERDE;54,EL ESPINO;Yaneth Buitrago Abril;PARTIDO VERDE;54,0.0,0.0
FIRAVITOBA;ADAN MAURICIO CHAPARRO FERRUCHO;PARTIDO LIBERAL COLOMBIANO;175,FIRAVITOBA;Adan Mauricio Chaparro Ferrucho;PARTIDO LIBERAL COLOMBIANO;175,0.0,0.0
FIRAVITOBA;ALONSO ZEA DIAZ;PARTIDO VERDE;44,FIRAVITOBA;Alonso Zea Diaz;PARTIDO VERDE;44,0.0,0.0
FIRAVITOBA;ALVARO SAMACA;PARTIDO LIBERAL COLOMBIANO;144,FIRAVITOBA;Alvaro Samaca;PARTIDO LIBERAL COLOMBIANO;144,0.0,0.0
FIRAVITOBA;ANA MARIA MESA VARGAS;PARTIDO LIBERAL COLOMBIANO;11,FIRAVITOBA;Ana Maria Mesa Vargas;PARTIDO LIBERAL COLOMBIANO;11,0.0,0.0
FIRAVITOBA;CLAUDIA MERCEDES VARGAS UNIVIO;PARTIDO CONSERVADOR COLOMBIANO;80,FIRAVITOBA;Claudia Mercedes Vargas Univio;PARTIDO CONSERVADOR COLOMBIANO;80,0.0,0.0
FIRAVITOBA;DANIEL FERNANDO OCHOA ZAMBRANO;PARTIDO VERDE;134,FIRAVITOBA;Daniel Fernando Ochoa Zambrano;PARTIDO VERDE;134,0.0,0.0
FIRAVITOBA;DAVID FONSECA SALAMANCA;POLO DEMOCRATICO ALTERNATIVO;26,FIRAVITOBA;David Fonseca Salamanca;POLO DEMOCRATICO ALTERNATIVO;26,0.0,0.0
FIRAVITOBA;EDWIN GEOVANNI QUINA FIGUEROA;POLO DEMOCRATICO ALTERNATIVO;95,FIRAVITOBA;Edwin Geovanni Quina Figueroa;POLO DEMOCRATICO ALTERNATIVO;95,0.0,0.0
FIRAVITOBA;FREDI ZEA ZEA;PARTIDO VERDE;150,FIRAVITOBA;Fredi Zea Zea;PARTIDO VERDE;150,0.0,0.0
FIRAVITOBA;JAIRO ENRIQUE PEREZ FORERO;PARTIDO VERDE;94,FIRAVITOBA;Jairo Enrique Perez Forero;PARTIDO VERDE;94,0.0,0.0
FIRAVITOBA;JAIRO ZIPA CADENA;PARTIDO LIBERAL COLOMBIANO;82,FIRAVITOBA;Jairo Zipa Cadena;PARTIDO LIBERAL COLOMBIANO;82,0.0,0.0
FIRAVITOBA;JESUS SALVADOR PATINO PATINO;PARTIDO CONSERVADOR COLOMBIANO;206,FIRAVITOBA;Jesus Salvador Patino Patino;PARTIDO CONSERVADOR COLOMBIANO;206,0.0,0.0
FIRAVITOBA;JORGE ERNESTO CUBIDES DIAZ;PARTIDO LIBERAL COLOMBIANO;198,FIRAVITOBA;Jorge Ernesto Cubides Diaz;PARTIDO LIBERAL COLOMBIANO;198,0.0,0.0
FIRAVITOBA;JOSE ALEXANDER ROMERO AVELLA;PARTIDO LIBERAL COLOMBIANO;152,FIRAVITOBA;Jose Alexander Romero Avella;PARTIDO LIBERAL COLOMBIANO;152,0.0,0.0
FIRAVITOBA;JOSE GABRIEL PATINO VARGAS;PARTIDO CONSERVADOR COLOMBIANO;41,FIRAVITOBA;Jose Gabriel Patino Vargas;PARTIDO CONSERVADOR COLOMBIANO;41,0.0,0.0
FIRAVITOBA;JOSE HUGO HERNANDEZ AVELLA;PARTIDO LIBERAL COLOMBIANO;168,FIRAVITOBA;Jose Hugo Hernandez Avella;PARTIDO LIBERAL COLOMBIANO;168,0.0,0.0
FIRAVITOBA;JOSELYN PRIETO BARRERA;POLO DEMOCRATICO ALTERNATIVO;34,FIRAVITOBA;Joselyn Prieto Barrera;POLO DEMOCRATICO ALTERNATIVO;34,0.0,0.0
FIRAVITOBA;LADY CRISTINA MOGOLLON ROSAS;PARTIDO CONSERVADOR COLOMBIANO;141,FIRAVITOBA;Lady Cristina Mogollon Rosas;PARTIDO CONSERVADOR COLOMBIANO;141,0.0,0.0
FIRAVITOBA;LADY YOLIMA ZORRO RODRIGUEZ;PARTIDO VERDE;108,FIRAVITOBA;Lady Yolima Zorro Rodriguez;PARTIDO VERDE;108,0.0,0.0
FIRAVITOBA;LAUREANO CUBIDES LOPEZ;PARTIDO CONSERVADOR COLOMBIANO;134,FIRAVITOBA;Laureano Cubides Lopez;PARTIDO CONSERVADOR COLOMBIANO;134,0.0,0.0
FIRAVITOBA;LUCILA SANABRIA ZAMBRANO;PARTIDO CONSERVADOR COLOMBIANO;116,FIRAVITOBA;Lucila Sanabria Zambrano;PARTIDO CONSERVADOR COLOMBIANO;116,0.0,0.0
FIRAVITOBA;LUIS ALBERTO LOPEZ VARGAS;PARTIDO VERDE;28,FIRAVITOBA;Luis Alberto Lopez Vargas;PARTIDO VERDE;28,0.0,0.0
FIRAVITOBA;LUIS ANTONIO ACOSTA ZAMBRANO;PARTIDO CONSERVADOR COLOMBIANO;140,FIRAVITOBA;Luis Antonio Acosta Zambrano;PARTIDO CONSERVADOR COLOMBIANO;140,0.0,0.0
FIRAVITOBA;LUIS JACOBO SALAMANCA VARGAS;PARTIDO VERDE;16,FIRAVITOBA;Luis Jacobo Salamanca Vargas;PARTIDO VERDE;16,0.0,0.0
FIRAVITOBA;LYDA YADIRA ROJAS TORRES;PARTIDO VERDE;48,FIRAVITOBA;Lyda Yadira Rojas Torres;PARTIDO VERDE;48,0.0,0.0
FIRAVITOBA;MARIA DEL CARMEN CHAPARRO GUTIERREZ;POLO DEMOCRATICO ALTERNATIVO;6,FIRAVITOBA;Maria Del Carmen Chaparro Gutierrez;POLO DEMOCRATICO ALTERNATIVO;6,0.0,0.0
FIRAVITOBA;MARICELA SILVA BARRERA;PARTIDO LIBERAL COLOMBIANO;92,FIRAVITOBA;Maricela Silva Barrera;PARTIDO LIBERAL COLOMBIANO;92,0.0,0.0
FIRAVITOBA;OMAIRA RIVAS RIVAS;PARTIDO LIBERAL COLOMBIANO;104,FIRAVITOBA;Omaira Rivas Rivas;PARTIDO LIBERAL COLOMBIANO;104,0.0,0.0
FIRAVITOBA;OMAR QUIJANO FIGUEROA;POLO DEMOCRATICO ALTERNATIVO;28,FIRAVITOBA;Omar Quijano Figueroa;POLO DEMOCRATICO ALTERNATIVO;28,0.0,0.0
FIRAVITOBA;PARTIDO CONSERVADOR COLOMBIANO;PARTIDO CONSERVADOR COLOMBIANO;53,FIRAVITOBA;Partido Conservador Colombiano;Partido Conservador Colombiano;53,0.0,0.0
FIRAVITOBA;PARTIDO LIBERAL COLOMBIANO;PARTIDO LIBERAL COLOMBIANO;50,FIRAVITOBA;Partido Liberal Colombiano;Partido Liberal Colombiano;50,0.0,0.0
FIRAVITOBA;PARTIDO VERDE;PARTIDO VERDE;27,FIRAVITOBA;Partido Verde;Partido Verde;27,0.0,0.0
FIRAVITOBA;PEDRO ACOSTA ZEA;PARTIDO CONSERVADOR COLOMBIANO;135,FIRAVITOBA;Pedro Acosta Zea;PARTIDO CONSERVADOR COLOMBIANO;135,0.0,0.0
FIRAVITOBA;POLO DEMOCRATICO ALTERNATIVO;POLO DEMOCRATICO ALTERNATIVO;5,FIRAVITOBA;Polo Democratico Alternativo;Polo Democratico Alternativo;5,0.0,0.0
FIRAVITOBA;RODRIGO TORRES TORRES;PARTIDO CONSERVADOR COLOMBIANO;132,FIRAVITOBA;Rodrigo Torres Torres;PARTIDO CONSERVADOR COLOMBIANO;132,0.0,0.0
FIRAVITOBA;ROSA ELENA MOYANO FONSECA;POLO DEMOCRATICO ALTERNATIVO;3,FIRAVITOBA;Rosa Elena Moyano Fonseca;POLO DEMOCRATICO ALTERNATIVO;3,0.0,0.0
FIRAVITOBA;SANDRA PATRICIA CABEZAS BAYONA;PARTIDO VERDE;4,FIRAVITOBA;Sandra Patricia Cabezas Bayona;PARTIDO VERDE;4,0.0,0.0
FLORESTA;ADRIAN ALEXANDER PRIETO RINCON;PARTIDO VERDE;77,FLORESTA;Adrian Alexander Prieto Rincon;PARTIDO VERDE;77,0.0,0.0
FLORESTA;ALEIDA VIVIANA CELY VARGAS;PARTIDO CAMBIO RADICAL;13,FLORESTA;Aleida Viviana Cely Vargas;PARTIDO CAMBIO RADICAL;13,0.0,0.0
FLORESTA;ALFONSO GALLO ARAQUE;PARTIDO VERDE;44,FLORESTA;Alfonso Gallo Araque;PARTIDO VERDE;44,0.0,0.0
FLORESTA;BARBARA ORDUZ CELY;PARTIDO CONSERVADOR COLOMBIANO;20,FLORESTA;Barbara Orduz Cely;PARTIDO CONSERVADOR COLOMBIANO;20,0.0,0.0
FLORESTA;CLARA EMILIA RINCON RINCON;PARTIDO CAMBIO RADICAL;8,FLORESTA;Clara Emilia Rincon Rincon;PARTIDO CAMBIO RADICAL;8,0.0,0.0
FLORESTA;CLELIA LOZANO GRANADOS;MOVIMIENTO DE INCLUSION Y OPORTUNIDADES;10,FLORESTA;Clelia Lozano Granados;MOVIMIENTO DE INCLUSION Y OPORTUNIDADES;10,0.0,0.0
FLORESTA;CONSUELO GUARIN GRANADOS;PARTIDO CONSERVADOR COLOMBIANO;87,FLORESTA;Consuelo Guarin Granados;PARTIDO CONSERVADOR COLOMBIANO;87,0.0,0.0
FLORESTA;DIANA ISABEL FONSECA TORRES;PARTIDO VERDE;17,FLORESTA;Diana Isabel Fonseca Torres;PARTIDO VERDE;17,0.0,0.0
FLORESTA;DORA PATRICIA VARGAS MANOSALBA;PARTIDO SOCIAL DE UNIDAD NACIONAL;89,FLORESTA;Dora Patricia Vargas Manosalba;PARTIDO SOCIAL DE UNIDAD NACIONAL;89,0.0,0.0
FLORESTA;EDGAR AUGUSTO CRISTANCHO BECERRA;PARTIDO CAMBIO RADICAL;107,FLORESTA;Edgar Augusto Cristancho Becerra;PARTIDO CAMBIO RADICAL;107,0.0,0.0
FLORESTA;FERNANDO DE JESUS ARAQUE RINCON;PARTIDO SOCIAL DE UNIDAD NACIONAL;15,FLORESTA;Fernando De Jesus Araque Rincon;PARTIDO SOCIAL DE UNIDAD NACIONAL;15,0.0,0.0
FLORESTA;GLADIS VARGAS CELY;PARTIDO SOCIAL DE UNIDAD NACIONAL;24,FLORESTA;Gladis Vargas Cely;PARTIDO SOCIAL DE UNIDAD NACIONAL;24,0.0,0.0
FLORESTA;JAVIER TORRES SANCHEZ;PARTIDO SOCIAL DE UNIDAD NACIONAL;56,FLORESTA;Javier Torres Sanchez;PARTIDO SOCIAL DE UNIDAD NACIONAL;56,0.0,0.0
FLORESTA;JUAN CARLOS TORRES OLIVARES;PARTIDO SOCIAL DE UNIDAD NACIONAL;127,FLORESTA;Juan Carlos Torres Olivares;PARTIDO SOCIAL DE UNIDAD NACIONAL;127,0.0,0.0
FLORESTA;JUAN PAULO ALBARRACIN CELY;MOVIMIENTO DE INCLUSION Y OPORTUNIDADES;114,FLORESTA;Juan Paulo Albarracin Cely;MOVIMIENTO DE INCLUSION Y OPORTUNIDADES;114,0.0,0.0
FLORESTA;JULIO CESAR HIGUERA QUINTANA;PARTIDO CAMBIO RADICAL;62,FLORESTA;Julio Cesar Higuera Quintana;PARTIDO CAMBIO RADICAL;62,0.0,0.0
FLORESTA;LUIS ANTONIO BECERRA RINCON;PARTIDO CONSERVADOR COLOMBIANO;75,FLORESTA;Luis Antonio Becerra Rincon;PARTIDO CONSERVADOR COLOMBIANO;75,0.0,0.0
FLORESTA;LUIS ANTONIO GOMEZ VELANDIA;MOVIMIENTO DE INCLUSION Y OPORTUNIDADES;101,FLORESTA;Luis Antonio Gomez Velandia;MOVIMIENTO DE INCLUSION Y OPORTUNIDADES;101,0.0,0.0
FLORESTA;MARIA MERCEDES CHINOME CHINOME;PARTIDO VERDE;6,FLORESTA;Maria Mercedes Chinome Chinome;PARTIDO VERDE;6,0.0,0.0
FLORESTA;MARIA YASMIN MURILLO RINCON;PARTIDO CAMBIO RADICAL;10,FLORESTA;Maria Yasmin Murillo Rincon;PARTIDO CAMBIO RADICAL;10,0.0,0.0
FLORESTA;MARIO AUGUSTO MARTINEZ MEDRANO;PARTIDO VERDE;104,FLORESTA;Mario Augusto Martinez Medrano;PARTIDO VERDE;104,0.0,0.0
FLORESTA;MOVIMIENTO DE INCLUSION Y OPORTUNIDADES;MOVIMIENTO DE INCLUSION Y OPORTUNIDADES;3,FLORESTA;Movimiento De Inclusion Y Oportunidades;Movimiento De Inclusion Y Oportunidades;3,0.0,0.0
FLORESTA;OLGA LUCIA CRISTANCHO HIGUERA;PARTIDO VERDE;9,FLORESTA;Olga Lucia Cristancho Higuera;PARTIDO VERDE;9,0.0,0.0
FLORESTA;ORLANDO ANTONIO VARGAS RINCON;MOVIMIENTO DE INCLUSION Y OPORTUNIDADES;34,FLORESTA;Orlando Antonio Vargas Rincon;MOVIMIENTO DE INCLUSION Y OPORTUNIDADES;34,0.0,0.0
FLORESTA;PARTIDO CAMBIO RADICAL;PARTIDO CAMBIO RADICAL;3,FLORESTA;Partido Cambio Radical;Partido Cambio Radical;3,0.0,0.0
FLORESTA;PARTIDO CONSERVADOR COLOMBIANO;PARTIDO CONSERVADOR COLOMBIANO;18,FLORESTA;Partido Conservador Colombiano;Partido Conservador Colombiano;18,0.0,0.0
FLORESTA;PARTIDO SOCIAL DE UNIDAD NACIONAL;PARTIDO SOCIAL DE UNIDAD NACIONAL;7,FLORESTA;Partido Social De Unidad Nacional;Partido Social De Unidad Nacional;7,0.0,0.0
FLORESTA;PARTIDO VERDE;PARTIDO VERDE;15,FLORESTA;Partido Verde;Partido Verde;15,0.0,0.0
FLORESTA;PEDRO GUSTAVO SALAMANCA GUECHA;PARTIDO CAMBIO RADICAL;43,FLORESTA;Pedro Gustavo Salamanca Guecha;PARTIDO CAMBIO RADICAL;43,0.0,0.0
FLORESTA;PEDRO NINO HERNANDEZ;PARTIDO CONSERVADOR COLOMBIANO;29,FLORESTA;Pedro Nino Hernandez;PARTIDO CONSERVADOR COLOMBIANO;29,0.0,0.0
FLORESTA;REINALDO CORDOBA BERNAL;PARTIDO CONSERVADOR COLOMBIANO;36,FLORESTA;Reinaldo Cordoba Bernal;PARTIDO CONSERVADOR COLOMBIANO;36,0.0,0.0
FLORESTA;SAUL MURCIA MORENO;PARTIDO CAMBIO RADICAL;70,FLORESTA;Saul Murcia Moreno;PARTIDO CAMBIO RADICAL;70,0.0,0.0
FLORESTA;SOLVEY VIVIANA MARINO IZAQUITA;MOVIMIENTO DE INCLUSION Y OPORTUNIDADES;10,FLORESTA;Solvey Viviana Marino Izaquita;MOVIMIENTO DE INCLUSION Y OPORTUNIDADES;10,0.0,0.0
FLORESTA;SONIA QUIROGA CORREA;PARTIDO CONSERVADOR COLOMBIANO;197,FLORESTA;Sonia Quiroga Correa;PARTIDO CONSERVADOR COLOMBIANO;197,0.0,0.0
FLORESTA;WILMAR JULIAN RINCON MARINO;PARTIDO SOCIAL DE UNIDAD NACIONAL;216,FLORESTA;Wilmar Julian Rincon Marino;PARTIDO SOCIAL DE UNIDAD NACIONAL;216,0.0,0.0
FLORESTA;YOBANY ROBERTO BECERRA MARTINEZ;PARTIDO CONSERVADOR COLOMBIANO;126,FLORESTA;Yobany Roberto Becerra Martinez;PARTIDO CONSERVADOR COLOMBIANO;126,0.0,0.0
FLORESTA;YOVANY ANTONIO HOLGUIN;PARTIDO VERDE;71,FLORESTA;Yovany Antonio Holguin;PARTIDO VERDE;71,0.0,0.0
FLORESTA;YURLEY CATHERINE OROZCO PENALOZA;MOVIMIENTO DE INCLUSION Y OPORTUNIDADES;21,FLORESTA;Yurley Catherine Orozco Penaloza;MOVIMIENTO DE INCLUSION Y OPORTUNIDADES;21,0.0,0.0
GACHANTIVA;ALVARO GUERRERO PARDO;PARTIDO ALIANZA SOCIAL INDEPENDIENTE;31,GACHANTIVA;Alvaro Guerrero Pardo;PARTIDO ALIANZA SOCIAL INDEPENDIENTE;31,0.0,0.0
GACHANTIVA;ANA MILENA CASTRO VILLAMIL;PARTIDO LIBERAL COLOMBIANO;5,GACHANTIVA;Ana Milena Castro Villamil;PARTIDO LIBERAL COLOMBIANO;5,0.0,0.0
GACHANTIVA;ANGEL MARIA FORERO RABA;PARTIDO DE INTEGRACION NACIONAL;30,GACHANTIVA;Angel Maria Forero Raba;PARTIDO DE INTEGRACION NACIONAL;30,0.0,0.0
GACHANTIVA;ANGEL SANTIAGO PENA ACERO;PARTIDO VERDE;23,GACHANTIVA;Angel Santiago Pena Acero;PARTIDO VERDE;23,0.0,0.0
GACHANTIVA;BELQUIS OLANDA MERCHAN CASTILLO;PARTIDO DE INTEGRACION NACIONAL;25,GACHANTIVA;Belquis Olanda Merchan Castillo;PARTIDO DE INTEGRACION NACIONAL;25,0.0,0.0
GACHANTIVA;BLANCA LUCILA LOPEZ SAENZ;PARTIDO CAMBIO RADICAL;6,GACHANTIVA;Blanca Lucila Lopez Saenz;PARTIDO CAMBIO RADICAL;6,0.0,0.0
GACHANTIVA;CARMENZA MALAGON QUINTERO;PARTIDO LIBERAL COLOMBIANO;17,GACHANTIVA;Carmenza Malagon Quintero;PARTIDO LIBERAL COLOMBIANO;17,0.0,0.0
GACHANTIVA;DELCY LILIANA CETINA PENA;PARTIDO LIBERAL COLOMBIANO;17,GACHANTIVA;Delcy Liliana Cetina Pena;PARTIDO LIBERAL COLOMBIANO;17,0.0,0.0
GACHANTIVA;DIEGO MIGUEL CASTRO HERNANDEZ;PARTIDO CONSERVADOR COLOMBIANO;77,GACHANTIVA;Diego Miguel Castro Hernandez;PARTIDO CONSERVADOR COLOMBIANO;77,0.0,0.0
GACHANTIVA;DUSTANO PENA PIZA;PARTIDO VERDE;106,GACHANTIVA;Dustano Pena Piza;PARTIDO VERDE;106,0.0,0.0
GACHANTIVA;ELVA MYRIAM RABA SAAVEDRA;PARTIDO CONSERVADOR COLOMBIANO;22,GACHANTIVA;Elva Myriam Raba Saavedra;PARTIDO CONSERVADOR COLOMBIANO;22,0.0,0.0
GACHANTIVA;FABIOLA PATRICIA FORERO;PARTIDO VERDE;24,GACHANTIVA;Fabiola Patricia Forero;PARTIDO VERDE;24,0.0,0.0
GACHANTIVA;GLORIA ESPERANZA NONTOA MARTINEZ;PARTIDO SOCIAL DE UNIDAD NACIONAL;5,GACHANTIVA;Gloria Esperanza Nontoa Martinez;PARTIDO SOCIAL DE UNIDAD NACIONAL;5,0.0,0.0
GACHANTIVA;GLORIA MARLEN CORREDOR PENA;PARTIDO ALIANZA SOCIAL INDEPENDIENTE;2,GACHANTIVA;Gloria Marlen Corredor Pena;PARTIDO ALIANZA SOCIAL INDEPENDIENTE;2,0.0,0.0
GACHANTIVA;HECTOR ANDRES MOLINA POVEDA;PARTIDO DE INTEGRACION NACIONAL;34,GACHANTIVA;Hector Andres Molina Poveda;PARTIDO DE INTEGRACION NACIONAL;34,0.0,0.0
GACHANTIVA;HECTOR DIAZ PENA;PARTIDO CAMBIO RADICAL;30,GACHANTIVA;Hector Diaz Pena;PARTIDO CAMBIO RADICAL;30,0.0,0.0
GACHANTIVA;IBON CAROLINA RONDON GONZALEZ;PARTIDO CAMBIO RADICAL;1,GACHANTIVA;Ibon Carolina Rondon Gonzalez;PARTIDO CAMBIO RADICAL;1,0.0,0.0
GACHANTIVA;JAIRO VEGA VEGA OBREGON;PARTIDO LIBERAL COLOMBIANO;51,GACHANTIVA;Jairo Vega Vega Obregon;PARTIDO LIBERAL COLOMBIANO;51,0.0,0.0
GACHANTIVA;JAVIER HERNANDO MONTANA CASTILLO;PARTIDO ALIANZA SOCIAL INDEPENDIENTE;9,GACHANTIVA;Javier Hernando Montana Castillo;PARTIDO ALIANZA SOCIAL INDEPENDIENTE;9,0.0,0.0
GACHANTIVA;JEFERSSON VLADIMIR SOACHA SANABRIA;PARTIDO LIBERAL COLOMBIANO;116,GACHANTIVA;Jefersson Vladimir Soacha Sanabria;PARTIDO LIBERAL COLOMBIANO;116,0.0,0.0
GACHANTIVA;JORGE WILLIAM PUENTES SUAREZ;PARTIDO CONSERVADOR COLOMBIANO;92,GACHANTIVA;Jorge William Puentes Suarez;PARTIDO CONSERVADOR COLOMBIANO;92,0.0,0.0
GACHANTIVA;JOSE ALBERTO RONCANCIO SAENZ;PARTIDO CAMBIO RADICAL;56,GACHANTIVA;Jose Alberto Roncancio Saenz;PARTIDO CAMBIO RADICAL;56,0.0,0.0
GACHANTIVA;JOSE ANTONIO CASTILLO FORERO;PARTIDO CONSERVADOR COLOMBIANO;33,GACHANTIVA;Jose Antonio Castillo Forero;PARTIDO CONSERVADOR COLOMBIANO;33,0.0,0.0
GACHANTIVA;JOSE ARCESIO MONROY CASTILLO;PARTIDO DE INTEGRACION NACIONAL;4,GACHANTIVA;Jose Arcesio Monroy Castillo;PARTIDO DE INTEGRACION NACIONAL;4,0.0,0.0
GACHANTIVA;JOSE MAURICIO PENA LOPEZ;PARTIDO DE INTEGRACION NACIONAL;54,GACHANTIVA;Jose Mauricio Pena Lopez;PARTIDO DE INTEGRACION NACIONAL;54,0.0,0.0
GACHANTIVA;JUAN DE JESUS AGUDELO RUIZ;PARTIDO CAMBIO RADICAL;9,GACHANTIVA;Juan De Jesus Agudelo Ruiz;PARTIDO CAMBIO RADICAL;9,0.0,0.0
GACHANTIVA;JULIO RAFAEL AGUILERA SUAREZ;PARTIDO LIBERAL COLOMBIANO;64,GACHANTIVA;Julio Rafael Aguilera Suarez;PARTIDO LIBERAL COLOMBIANO;64,0.0,0.0
GACHANTIVA;LEYDY ELIANA CUELLAR MONSALVE;PARTIDO CONSERVADOR COLOMBIANO;25,GACHANTIVA;Leydy Eliana Cuellar Monsalve;PARTIDO CONSERVADOR COLOMBIANO;25,0.0,0.0
GACHANTIVA;LUIS CARLOS GUERRERO;PARTIDO ALIANZA SOCIAL INDEPENDIENTE;112,GACHANTIVA;Luis Carlos Guerrero;PARTIDO ALIANZA SOCIAL INDEPENDIENTE;112,0.0,0.0
GACHANTIVA;LUIS FERNANDO SAAVEDRA BUITRAGO;PARTIDO SOCIAL DE UNIDAD NACIONAL;89,GACHANTIVA;Luis Fernando Saavedra Buitrago;PARTIDO SOCIAL DE UNIDAD NACIONAL;89,0.0,0.0
GACHANTIVA;MARIA AMPARO GUERRERO PENA;PARTIDO VERDE;18,GACHANTIVA;Maria Amparo Guerrero Pena;PARTIDO VERDE;18,0.0,0.0
GACHANTIVA;MARIA CONSUELO PIZZA FORERO;PARTIDO ALIANZA SOCIAL INDEPENDIENTE;7,GACHANTIVA;Maria Consuelo Pizza Forero;PARTIDO ALIANZA SOCIAL INDEPENDIENTE;7,0.0,0.0
GACHANTIVA;MARIA DEL CARMEN REYES SAAVEDRA;PARTIDO CAMBIO RADICAL;9,GACHANTIVA;Maria Del Carmen Reyes Saavedra;PARTIDO CAMBIO RADICAL;9,0.0,0.0
GACHANTIVA;MARIO CARDENAS PARDO;PARTIDO SOCIAL DE UNIDAD NACIONAL;28,GACHANTIVA;Mario Cardenas Pardo;PARTIDO SOCIAL DE UNIDAD NACIONAL;28,0.0,0.0
