MUNNOMBRE;CANNOMBRE;PARNOMBRE;VOTOS
PAJARITO;Ismael Ayala Galvis;PARTIDO CENTRO DEMOCRATICO;51
PAJARITO;Jorge Enrique Yanquen Sanchez;PARTIDO ALIANZA SOCIAL INDEPENDIENTE;40
PAJARITO;Olga Maria Chaparro;PARTIDO OPCION CIUDADANA;39
PAJARITO;Diego Alejandro Fernandez Gutierrez;PARTIDO LIBERAL COLOMBIANO;35
PAJARITO;Alfonso Uribe;PARTIDO CAMBIO RADICAL;33
PAJARITO;Benjamin Cardenas Fuquen;PARTIDO LIBERAL COLOMBIANO;33
PAJARITO;Ana Elisa Garnica Gomez;PARTIDO LIBERAL COLOMBIANO;32
PAJARITO;Manuel Antonio Galindo Vega;PARTIDO CENTRO DEMOCRATICO;32
PAJARITO;Javier Graciano Nino Becerra;PARTIDO DE LA U;31
PAJARITO;Edgar Nestor Barrero Vega;PARTIDO OPCION CIUDADANA;25
PAJARITO;Maria Dory Cardenas Perez;PARTIDO CAMBIO RADICAL;23
PAJARITO;Partido De La U;Partido De La U;20
PAJARITO;Rodrigo Torres Sanabria;PARTIDO DE LA U;20
PAJARITO;Reinaldo Corredor Penagos;PARTIDO LIBERAL COLOMBIANO;19
PAJARITO;Rafael Piragauta Patino;PARTIDO ALIANZA SOCIAL INDEPENDIENTE;18
PAJARITO;Cristina Rojas Bayona;PARTIDO ALIANZA SOCIAL INDEPENDIENTE;17
PAJARITO;Miryam Perez Garcia;PARTIDO LIBERAL COLOMBIANO;15
PAJARITO;Partido Liberal Colombiano;Partido Liberal Colombiano;13
PAJARITO;Olga Alicia Granados Vargas;PARTIDO CENTRO DEMOCRATICO;8
PAJARITO;Soraida Barrera Soler;MOVIMIENTO AUTORIDADES INDIGENAS DE COLOMBIA;8
PAJARITO;Blanca Lilia Molina Rincon;PARTIDO DE LA U;7
PAJARITO;Alirio Salcedo Inocencio;PARTIDO POLO DEMOCRATICO ALTERNATIVO;6
PAJARITO;Juvenal Guzman Nocove;PARTIDO OPCION CIUDADANA;5
PAJARITO;Partido Cambio Radical;Partido Cambio Radical;4
PAJARITO;Adriana Lizeth Marino Leon;MOVIMIENTO AUTORIDADES INDIGENAS DE COLOMBIA;2
PAJARITO;Manuel Enilson Amezquita Barrera;MOVIMIENTO AUTORIDADES INDIGENAS DE COLOMBIA;2
PAJARITO;Miguel Montana Rivera;PARTIDO POLO DEMOCRATICO ALTERNATIVO;2
PAJARITO;Partido Opcion Ciudadana;Partido Opcion Ciudadana;2
PAJARITO;Revocado (A);Revocado (A);2
PAJARITO;Rodolfo Isnoel Buitrago Rodriguez;PARTIDO CENTRO DEMOCRATICO;2
PAJARITO;William Fernando Montana Vivas;PARTIDO DE LA U;2
PAJARITO;Edgar Alberto Diaz Barreto;PARTIDO CENTRO DEMOCRATICO;1
PAJARITO;Gerardo Miguel Acevedo Cruz;PARTIDO POLO DEMOCRATICO ALTERNATIVO;1
PAJARITO;Luz Marina Chaparro Lemus;PARTIDO POLO DEMOCRATICO ALTERNATIVO;1
PAJARITO;Partido Alianza Social Independiente;Partido Alianza Social Independiente;1
PAJARITO;Partido Centro Democratico;Partido Centro Democratico;1
PAJARITO;Partido Polo Democratico Alternativo;Partido Polo Democratico Alternativo;1
PAJARITO;Movimiento Autoridades Indigenas De Colombia  Aico;Movimiento Autoridades Indigenas De Colombia  Aico;0
PANQUEBA;Ermes Hernando Cuevas Cely;PARTIDO CENTRO DEMOCRATICO;131
PANQUEBA;Jairo Alonso Rojas Garcia;PARTIDO LIBERAL COLOMBIANO;99
PANQUEBA;Rigoberto Jaime Angarita;PARTIDO CENTRO DEMOCRATICO;95
PANQUEBA;Jenny Rocio Nunez Bautista;PARTIDO CENTRO DEMOCRATICO;93
PANQUEBA;Aura Cecilia Nieto Velandia;PARTIDO DE LA U;90
PANQUEBA;Juan De Dios Silva Lizarazo;PARTIDO CENTRO DEMOCRATICO;71
PANQUEBA;Omaira Carrillo Rivera;PARTIDO CENTRO DEMOCRATICO;71
PANQUEBA;Pedro Manuel Bello Bernal;PARTIDO DE LA U;66
PANQUEBA;Luis Alberto Velandia Hurtado;PARTIDO DE LA U;52
PANQUEBA;Jairo Wilches Puentes;PARTIDO LIBERAL COLOMBIANO;49
PANQUEBA;Nancy Marlen Olivares Velandia;PARTIDO DE LA U;45
PANQUEBA;Mary Nelsy Rodriguez Eslava;PARTIDO CENTRO DEMOCRATICO;44
PANQUEBA;Jairo Guillermo Perez Perez;PARTIDO CONSERVADOR COLOMBIANO;43
PANQUEBA;Jose Armando Barrera Velandia;PARTIDO CONSERVADOR COLOMBIANO;42
PANQUEBA;Roselino Albarracin Orozco;PARTIDO DE LA U;34
PANQUEBA;Alix Albarracin De Mojica;PARTIDO CONSERVADOR COLOMBIANO;24
PANQUEBA;Ciro Antonio Romero Garcia;PARTIDO DE LA U;23
PANQUEBA;Yuly Consuelo Nino Garcia;PARTIDO LIBERAL COLOMBIANO;18
PANQUEBA;Cesar Ovidio Moreno Vargas;PARTIDO CONSERVADOR COLOMBIANO;17
PANQUEBA;Jose Ceferino Correa Hernandez;PARTIDO CENTRO DEMOCRATICO;12
PANQUEBA;Guillermo Ballesteros Carrillo;PARTIDO CONSERVADOR COLOMBIANO;11
PANQUEBA;Maria Teresa Velasquez Moreno;PARTIDO DE LA U;9
PANQUEBA;Partido Centro Democratico;Partido Centro Democratico;9
PANQUEBA;Leidy Paola Oliveros Estupinan;PARTIDO CONSERVADOR COLOMBIANO;4
PANQUEBA;Partido De La U;Partido De La U;3
PANQUEBA;Partido Liberal Colombiano;Partido Liberal Colombiano;1
PANQUEBA;Sandra Patricia Espinel Castiblanco;PARTIDO LIBERAL COLOMBIANO;1
PAUNA;Jose Israel Florian Florian;PARTIDO CONSERVADOR COLOMBIANO;209
PAUNA;Henry Jobanny Suarez Buitrago;PARTIDO CENTRO DEMOCRATICO;180
PAUNA;Diego Edilberto Gonzalez Guerrero;PARTIDO CENTRO DEMOCRATICO;169
PAUNA;Cesar Andres Vargas Rodriguez;PARTIDO CONSERVADOR COLOMBIANO;168
PAUNA;Luis Enrique Martinez Canon;PARTIDO CONSERVADOR COLOMBIANO;168
PAUNA;Miguel Angel Lancheros Garcia;PARTIDO CENTRO DEMOCRATICO;159
PAUNA;Tarjetas No Marcados;nan;157
PAUNA;Flavio Amadeo Canon Canon;PARTIDO DE LA U;150
PAUNA;Diana Raquel Diaz Zapata;PARTIDO ALIANZA VERDE;144
PAUNA;Jose Reinel Garcia Paez;PARTIDO CONSERVADOR COLOMBIANO;133
PAUNA;Jorge Humberto Pinilla Rodriguez;PARTIDO CAMBIO RADICAL;132
PAUNA;Yeison Fernando Quinones Poveda;PARTIDO ALIANZA VERDE;112
PAUNA;Pedro Armando Salazar Garcia;PARTIDO CONSERVADOR COLOMBIANO;99
PAUNA;Vicente Ortiz Villamil;PARTIDO CONSERVADOR COLOMBIANO;93
PAUNA;Luz Mery Vega Parra;PARTIDO DE LA U;90
PAUNA;Ana Silvia Delgado Villalobos;PARTIDO CAMBIO RADICAL;86
PAUNA;Pedro Nel Forero Garcia;PARTIDO CAMBIO RADICAL;86
PAUNA;Fredy Humberto Pineda Gonzalez;PARTIDO CENTRO DEMOCRATICO;83
PAUNA;Jose Dario Celis Gonzalez;PARTIDO DE LA U;79
PAUNA;Dario Roa Camargo;PARTIDO ALIANZA SOCIAL INDEPENDIENTE;78
PAUNA;Blanca Luzmila Murcia Torres;PARTIDO ALIANZA VERDE;77
PAUNA;Jose Domingo Castro Avila;PARTIDO ALIANZA SOCIAL INDEPENDIENTE;72
PAUNA;Omar Neiza Ortiz;PARTIDO CENTRO DEMOCRATICO;71
PAUNA;Paula Andrea Rodriguez Urbano;PARTIDO CONSERVADOR COLOMBIANO;64
PAUNA;Fanny Elsa Castro Pena;PARTIDO ALIANZA SOCIAL INDEPENDIENTE;62
PAUNA;Luis Gerardo Lopez Pena;PARTIDO CAMBIO RADICAL;58
PAUNA;Samuel Orjuela Lancheros;PARTIDO CAMBIO RADICAL;56
PAUNA;Jose De Jesus Pena Paez;PARTIDO CONSERVADOR COLOMBIANO;53
PAUNA;Jose Silvestre Rojas Rojas;PARTIDO CAMBIO RADICAL;50
PAUNA;Jose De Jesus Cortes Yepes;PARTIDO ALIANZA SOCIAL INDEPENDIENTE;47
PAUNA;Hernando Arturo Gonzalez Castro;PARTIDO ALIANZA SOCIAL INDEPENDIENTE;46
PAUNA;Flor Alcira Torres Sanchez;PARTIDO ALIANZA SOCIAL INDEPENDIENTE;44
PAUNA;Hugo Jose Ramos Cortes;PARTIDO CENTRO DEMOCRATICO;44
PAUNA;Partido Cambio Radical;Partido Cambio Radical;41
PAUNA;Partido Conservador Colombiano;Partido Conservador Colombiano;41
PAUNA;Dora Alcira Torres Benitez;PARTIDO CAMBIO RADICAL;39
PAUNA;Marco Antonio Carrillo Sierra;PARTIDO ALIANZA SOCIAL INDEPENDIENTE;39
PAUNA;Maria Gladys Gualdron Cely;PARTIDO CONSERVADOR COLOMBIANO;39
PAUNA;Jose Del Carmen Diaz Fandino;PARTIDO CAMBIO RADICAL;38
PAUNA;Julieth Karina Beltran Vega;PARTIDO CAMBIO RADICAL;38
PAUNA;Juan Pablo Poveda Aponte;PARTIDO CENTRO DEMOCRATICO;36
PAUNA;Partido Centro Democratico;Partido Centro Democratico;36
PAUNA;Marina Paez Ovalle;PARTIDO CONSERVADOR COLOMBIANO;35
PAUNA;Mery Cecilia Garcia Rodriguez;PARTIDO CAMBIO RADICAL;32
PAUNA;Leidy Yasmin Campos Moreno;PARTIDO DE LA U;28
PAUNA;Luis Enrique Castro Ritiva;PARTIDO ALIANZA VERDE;27
PAUNA;Claudia Anparo Puentes;PARTIDO CENTRO DEMOCRATICO;26
PAUNA;Julio Clemente Rojas Arevalo;PARTIDO DE LA U;25
PAUNA;Yeny Esperanza Chaparro Pinilla;PARTIDO DE LA U;25
PAUNA;German Humberto Alfonso Solano;PARTIDO DE LA U;23
PAUNA;Juan Carlos Garcia Rivera;PARTIDO DE LA U;22
PAUNA;Omar De Jesus Pena Pena;PARTIDO DE LA U;21
PAUNA;Freddy Alonso Sotelo Caro;PARTIDO OPCION CIUDADANA;20
PAUNA;Partido Alianza Verde;Partido Alianza Verde;20
PAUNA;Partido De La U;Partido De La U;19
PAUNA;Clara Ines Ortiz Zabala;PARTIDO ALIANZA SOCIAL INDEPENDIENTE;18
PAUNA;Flor Eneida Bernal Gonzalez;PARTIDO DE LA U;18
PAUNA;Sandra Lucrecia Florian Chiquiza;PARTIDO ALIANZA VERDE;18
PAUNA;Serafin Peralta Lancheros;PARTIDO ALIANZA SOCIAL INDEPENDIENTE;18
PAUNA;Adriana Patricia Gonzalez Castellanos;PARTIDO ALIANZA VERDE;16
PAUNA;Alvaro De Jesus Guevara Lara;PARTIDO CAMBIO RADICAL;16
PAUNA;Augusto Rafael Cubillos Castro;PARTIDO DE LA U;16
PAUNA;Luz Dora Garcia Alfonso;PARTIDO CONSERVADOR COLOMBIANO;15
PAUNA;Partido Alianza Social Independiente;Partido Alianza Social Independiente;15
PAUNA;Javier Antonio Sanchez Bernal;PARTIDO ALIANZA VERDE;14
PAUNA;Laura Valentina Gonzalez Poveda;PARTIDO OPCION CIUDADANA;14
PAUNA;Jose Floresmiro Murcia Garcia;PARTIDO ALIANZA SOCIAL INDEPENDIENTE;13
PAUNA;Nacttinyes Nino Alfonso;PARTIDO CENTRO DEMOCRATICO;13
PAUNA;Yeny Marcela Gonzalez Prieto;PARTIDO CENTRO DEMOCRATICO;13
PAUNA;Marisol Barreto Leon;PARTIDO OPCION CIUDADANA;12
PAUNA;Maurisio Barreto Solano;PARTIDO OPCION CIUDADANA;11
PAUNA;Siervo De Jesus Murcia;PARTIDO ALIANZA VERDE;10
PAUNA;Liliana Del Pilar Caro Ritiva;PARTIDO CENTRO DEMOCRATICO;9
PAUNA;Jose Turbay Castiblanco Gomez;PARTIDO OPCION CIUDADANA;7
PAUNA;Luis Adan Buitrago Villamil;PARTIDO OPCION CIUDADANA;7
PAUNA;Ricardo Ramos Nunez;PARTIDO OPCION CIUDADANA;7
PAUNA;Tatiana Massiel Rueda Anzola;PARTIDO ALIANZA SOCIAL INDEPENDIENTE;7
PAUNA;Partido Opcion Ciudadana;Partido Opcion Ciudadana;5
PAUNA;Cristina Leon Ortiz;PARTIDO OPCION CIUDADANA;3
PAYA;Tarjetas No Marcados;nan;92
PAYA;Omaira Perez Vega;PARTIDO DE LA U;89
PAYA;Jose Alberto Vergara Maldonado;PARTIDO OPCION CIUDADANA;64
PAYA;Yeny Lucila Moreno Vivas;PARTIDO CAMBIO RADICAL;61
PAYA;Zuleyma Perez Catano;PARTIDO ALIANZA VERDE;52
PAYA;Pedro Antonio Maldonado Rivera;PARTIDO CAMBIO RADICAL;45
PAYA;German Higuera Cardenas;PARTIDO DE LA U;44
PAYA;Ferney Garcia Perez;PARTIDO ALIANZA VERDE;43
PAYA;Maribel Abril Fernandez;PARTIDO CAMBIO RADICAL;43
PAYA;Jorge Tabaco Largo;PARTIDO OPCION CIUDADANA;41
PAYA;Jose Guzman Rojas Barchiloa;PARTIDO OPCION CIUDADANA;41
PAYA;Robinson Neir Rivera Garcia;PARTIDO ALIANZA SOCIAL INDEPENDIENTE;40
PAYA;Adriana Milena Roldan Higuera;PARTIDO OPCION CIUDADANA;27
PAYA;Cipriano Alberto Molina Montana;PARTIDO ALIANZA VERDE;27
PAYA;Maribel Africano Acevedo;PARTIDO OPCION CIUDADANA;26
PAYA;Jose Eiler Garcia Teatin;PARTIDO CAMBIO RADICAL;25
PAYA;Eliecer Caro Ortiz;PARTIDO CONSERVADOR COLOMBIANO;24
PAYA;Fredy Pena Cepeda;PARTIDO CAMBIO RADICAL;23
PAYA;Abigail Egue Cachay;PARTIDO ALIANZA SOCIAL INDEPENDIENTE;22
PAYA;Roberto Duran Gomez;PARTIDO CONSERVADOR COLOMBIANO;19
PAYA;Maria Del Carmen Torres Pereira;PARTIDO CAMBIO RADICAL;18
PAYA;Dora Maria Lesmes De Walteros;PARTIDO DE LA U;17
PAYA;Nicandro Garcia Perez;PARTIDO CONSERVADOR COLOMBIANO;16
PAYA;Evaristo Perez Gutierrez;PARTIDO ALIANZA SOCIAL INDEPENDIENTE;14
PAYA;Luis Alberto Ibica Arismendy;PARTIDO ALIANZA VERDE;14
PAYA;Maria Rosalbina Sotaban;PARTIDO CONSERVADOR COLOMBIANO;14
PAYA;Partido Opcion Ciudadana;Partido Opcion Ciudadana;14
PAYA;Fredy Montana Pacagui;PARTIDO ALIANZA SOCIAL INDEPENDIENTE;13
PAYA;Nestor Catano Guina;PARTIDO CAMBIO RADICAL;13
PAYA;Alexi Giovanna Perez Botello;PARTIDO OPCION CIUDADANA;12
PAYA;Ana Maria Pena Laverde;PARTIDO DE LA U;12
PAYA;Blanca Ines Rivera Perez;PARTIDO ALIANZA VERDE;12
PAYA;Ever Garces Corredor;PARTIDO ALIANZA SOCIAL INDEPENDIENTE;12
PAYA;Omar Eliecer Maldonado Lombana;PARTIDO DE LA U;12
PAYA;Maria Consuelo Garcia Egue;PARTIDO CONSERVADOR COLOMBIANO;11
PAYA;Nelson Catano Catano;PARTIDO ALIANZA VERDE;10
PAYA;Partido De La U;Partido De La U;10
PAYA;Jose Libardo Garcia Rivera;PARTIDO CONSERVADOR COLOMBIANO;9
PAYA;Partido Cambio Radical;Partido Cambio Radical;9
PAYA;Edgar Antonio Lopez Berrio;PARTIDO OPCION CIUDADANA;7
PAYA;Nelcy Cecilia Rodriguez Nossa;PARTIDO CONSERVADOR COLOMBIANO;7
PAYA;Rosa Alcira Teatin;PARTIDO ALIANZA SOCIAL INDEPENDIENTE;7
PAYA;Partido Alianza Social Independiente;Partido Alianza Social Independiente;6
PAYA;Partido Conservador Colombiano;Partido Conservador Colombiano;6
PAYA;Partido Alianza Verde;Partido Alianza Verde;5
PAYA;Maria Cecilia Socha Cruz;PARTIDO DE LA U;1
PAZ DE RIO;Juan Manuel Gomez Caceres;PARTIDO LIBERAL COLOMBIANO;309
PAZ DE RIO;Blanca Ceneth Caceres Martinez;PARTIDO LIBERAL COLOMBIANO;188
PAZ DE RIO;Pedro Jesus Estepa Silva;PARTIDO LIBERAL COLOMBIANO;168
PAZ DE RIO;Laura Mariana Cely Gomez;PARTIDO ALIANZA VERDE;150
PAZ DE RIO;Jose Danilo Triana Gallo;PARTIDO LIBERAL COLOMBIANO;149
PAZ DE RIO;Gloria Emilia Perez;PARTIDO LIBERAL COLOMBIANO;132
PAZ DE RIO;Gustavo Gil Fonseca;PARTIDO LIBERAL COLOMBIANO;109
PAZ DE RIO;Carlos Gilberto Alvarado Merchan;PARTIDO ALIANZA VERDE;107
PAZ DE RIO;Dialile Martinez Gallo;PARTIDO CAMBIO RADICAL;106
PAZ DE RIO;Yohn Eduardo Cardenas Goyeneche;PARTIDO CONSERVADOR COLOMBIANO;100
PAZ DE RIO;Wilson Alexander Riano Manrique;PARTIDO CAMBIO RADICAL;97
PAZ DE RIO;Reinaldo Gomez Gomez;PARTIDO CONSERVADOR COLOMBIANO;94
PAZ DE RIO;Jose Rogelio Gomez Lizarazo;PARTIDO CAMBIO RADICAL;91
PAZ DE RIO;Juan Humberto Rojas Rojas;PARTIDO ALIANZA VERDE;87
PAZ DE RIO;Tarjetas No Marcados;nan;84
PAZ DE RIO;Jorge Elias Buitrago Mejia;PARTIDO LIBERAL COLOMBIANO;82
PAZ DE RIO;Milton Manuel Puentes Solano;PARTIDO CONSERVADOR COLOMBIANO;82
PAZ DE RIO;Yimy Rolando Martinez Siza;PARTIDO ALIANZA VERDE;76
PAZ DE RIO;Yolanda Manrique Nausa;PARTIDO LIBERAL COLOMBIANO;75
PAZ DE RIO;Edgar Humberto Joya Botia;PARTIDO CAMBIO RADICAL;67
PAZ DE RIO;Maria Eugenia Hernandez Reyes;PARTIDO ALIANZA VERDE;59
PAZ DE RIO;Mary Luz Naranjo Amaya;PARTIDO CAMBIO RADICAL;58
PAZ DE RIO;Elver Yesid Lizarazo;PARTIDO CAMBIO RADICAL;56
PAZ DE RIO;Gabino Duran Acuna;PARTIDO CONSERVADOR COLOMBIANO;54
PAZ DE RIO;Partido Liberal Colombiano;Partido Liberal Colombiano;46
PAZ DE RIO;Nelba Triana Avellaneda;PARTIDO CAMBIO RADICAL;45
PAZ DE RIO;Julian Idelbrando Nausa Triana;PARTIDO LIBERAL COLOMBIANO;43
PAZ DE RIO;Erika Alexandra Avellaneda Medrano;PARTIDO CONSERVADOR COLOMBIANO;41
PAZ DE RIO;Salomon Estupinan Avellaneda;PARTIDO CAMBIO RADICAL;40
PAZ DE RIO;Blanca Cecilia Riano Uscategui;PARTIDO CAMBIO RADICAL;39
PAZ DE RIO;David Mora Reyes;PARTIDO ALIANZA VERDE;28
PAZ DE RIO;Gilberto Miranda Diaz;PARTIDO ALIANZA SOCIAL INDEPENDIENTE;28
PAZ DE RIO;Astrid Lorena Arismendy Avellaneda;PARTIDO ALIANZA VERDE;24
PAZ DE RIO;Luis Alfonso Bermudez Vargas;PARTIDO ALIANZA SOCIAL INDEPENDIENTE;24
PAZ DE RIO;Partido Cambio Radical;Partido Cambio Radical;23
PAZ DE RIO;Alba Azucena Fuentes Garavito;PARTIDO ALIANZA SOCIAL INDEPENDIENTE;21
PAZ DE RIO;Hercilia Carvajal Leal;PARTIDO ALIANZA VERDE;21
PAZ DE RIO;Partido Conservador Colombiano;Partido Conservador Colombiano;14
PAZ DE RIO;Partido Alianza Verde;Partido Alianza Verde;9
PAZ DE RIO;Sandra Milena Estupinan Avellaneda;PARTIDO ALIANZA SOCIAL INDEPENDIENTE;7
PAZ DE RIO;Yoris Elmer Miranda Avila;PARTIDO ALIANZA VERDE;7
PAZ DE RIO;Elsa Julia Franco Botia;PARTIDO CONSERVADOR COLOMBIANO;3
PAZ DE RIO;Partido Alianza Social Independiente;Partido Alianza Social Independiente;2
PESCA;Nestor Dario Chaparro Silva;PARTIDO OPCION CIUDADANA;270
PESCA;Angel Custodio Rivas Bayona;PARTIDO CONSERVADOR COLOMBIANO;161
PESCA;Dilson Favian Chaparro Guerrero;MOVIMIENTO AUTORIDADES INDIGENAS DE COLOMBIA;154
PESCA;Maria Yesmith Chaparro Moreno;PARTIDO CONSERVADOR COLOMBIANO;151
PESCA;Marvi Ruth Calderon Nino;PARTIDO DE LA U;143
PESCA;Gladys Edilsa Martinez Castro;PARTIDO OPCION CIUDADANA;133
PESCA;Oromairo Amaya Mendoza;PARTIDO CONSERVADOR COLOMBIANO;130
PESCA;Diego Armando Lopez Arias;PARTIDO OPCION CIUDADANA;125
PESCA;Luis Agustin Alba Camargo;PARTIDO ALIANZA VERDE;122
PESCA;Hector Julio Chaparro Maldonado;PARTIDO CAMBIO RADICAL;118
PESCA;Saul Antonio Rivas Bayona;PARTIDO ALIANZA VERDE;118
PESCA;Hugo Hernando Camargo Camargo;PARTIDO DE LA U;106
PESCA;Ignacio Osma Tibocha;PARTIDO CENTRO DEMOCRATICO;106
PESCA;Gustavo Farias Rodriguez;PARTIDO CAMBIO RADICAL;105
PESCA;Pedro Elias Martinez Pirajan;PARTIDO ALIANZA VERDE;104
PESCA;Hernando Martinez Aranguren;PARTIDO LIBERAL COLOMBIANO;103
PESCA;Diego Fernando Vargas Camargo;PARTIDO ALIANZA VERDE;97
PESCA;Misael Benavides Soler;PARTIDO DE LA U;97
PESCA;Jose Jaime Pirajan Vargas;PARTIDO CAMBIO RADICAL;91
PESCA;Yimer Alonso Ferrucho Alba;PARTIDO OPCION CIUDADANA;90
PESCA;Tarjetas No Marcados;nan;83
PESCA;Idelfonso Patino Nieto;PARTIDO ALIANZA SOCIAL INDEPENDIENTE;74
PESCA;Moises Zorro Camargo;PARTIDO OPCION CIUDADANA;74
PESCA;Ovidio Benavides Bocachica;PARTIDO CAMBIO RADICAL;69
PESCA;Jose Agustin Quesada Lopez;PARTIDO CONSERVADOR COLOMBIANO;67
PESCA;German Pedroza Pulido;PARTIDO CONSERVADOR COLOMBIANO;63
PESCA;Joaquin Martinez Moreno;PARTIDO CONSERVADOR COLOMBIANO;54
PESCA;Norberto Bautista Sanchez;PARTIDO ALIANZA VERDE;54
PESCA;Mariela Cruz Camargo;PARTIDO ALIANZA VERDE;47
PESCA;Romulo Rodriguez Suesca;MOVIMIENTO AUTORIDADES INDIGENAS DE COLOMBIA;47
PESCA;Jorge Eliecer Rincon Pedraza;PARTIDO OPCION CIUDADANA;46
PESCA;Julio Hernando Bautista Rodriguez;PARTIDO DE LA U;46
PESCA;Carlos Humberto Plazas Pena;PARTIDO LIBERAL COLOMBIANO;45
PESCA;Sonia Marcela Camargo Perez;PARTIDO CENTRO DEMOCRATICO;43
PESCA;Gustavo Rodriguez Limas;PARTIDO CONSERVADOR COLOMBIANO;42
PESCA;Maria Teresa Rodriguez;MOVIMIENTO AUTORIDADES INDIGENAS DE COLOMBIA;42
PESCA;Rafael Sanchez Amaya;MOVIMIENTO AUTORIDADES INDIGENAS DE COLOMBIA;42
PESCA;Jose Del Carmen Vargas Martinez;PARTIDO CAMBIO RADICAL;41
PESCA;Adriana Sanchez Diaz;PARTIDO ALIANZA SOCIAL INDEPENDIENTE;39
PESCA;Carlos Alberto Guerrero Guzman;MOVIMIENTO AUTORIDADES INDIGENAS DE COLOMBIA;36
PESCA;Hugo Armando Montana Sanabria;PARTIDO CENTRO DEMOCRATICO;35
PESCA;Jose Agustin Rodriguez Cruz;PARTIDO ALIANZA SOCIAL INDEPENDIENTE;35
PESCA;Jose Misael Cruz Vasquez;PARTIDO CENTRO DEMOCRATICO;35
PESCA;Aristobulo Lagos Cardenas;PARTIDO OPCION CIUDADANA;30
PESCA;Sandra Milena Rodriguez Perez;PARTIDO CONSERVADOR COLOMBIANO;29
PESCA;Partido Conservador Colombiano;Partido Conservador Colombiano;27
PESCA;Ana Mireya Rodriguez Lopez;PARTIDO ALIANZA VERDE;25
PESCA;Carlos Enrique Talero Roldan;PARTIDO ALIANZA SOCIAL INDEPENDIENTE;24
PESCA;Maria Elena Joya Cardozo;PARTIDO DE LA U;24
PESCA;Gloria Esperanza Maldonado Bayona;MOVIMIENTO AUTORIDADES INDIGENAS DE COLOMBIA;23
PESCA;Leidy Yarledy Sanchez Martinez;PARTIDO ALIANZA SOCIAL INDEPENDIENTE;22
PESCA;Claudia Patricia Rugeles Leguizamon;PARTIDO ALIANZA SOCIAL INDEPENDIENTE;20
PESCA;Jaime Bayona Sanchez;PARTIDO ALIANZA SOCIAL INDEPENDIENTE;19
PESCA;David Alfonso Pedroza Melo;PARTIDO LIBERAL COLOMBIANO;18
PESCA;Horacio Espinel Mendoza;MOVIMIENTO AUTORIDADES INDIGENAS DE COLOMBIA;18
PESCA;Luis Alirio Vasquez Roldan;PARTIDO LIBERAL COLOMBIANO;18
PESCA;Martha Elizabeth Tenjo Cordoba;PARTIDO CAMBIO RADICAL;18
PESCA;Jhon Jaime Tambo Sanchez;MOVIMIENTO AUTORIDADES INDIGENAS DE COLOMBIA;17
PESCA;Maria Estela Aranguren Joya;PARTIDO LIBERAL COLOMBIANO;17
PESCA;Ana Yaneth Limas Rodriguez;PARTIDO CONSERVADOR COLOMBIANO;16
PESCA;Partido Alianza Verde;Partido Alianza Verde;16
PESCA;Rosa Maria Maldonado Cepeda;PARTIDO DE LA U;15
PESCA;Lina Marcela Roso Huerfano;PARTIDO ALIANZA VERDE;14
PESCA;Pompilio Rodriguez Guio;PARTIDO DE LA U;14
PESCA;Ana Lucia Aranguren Cuervo;PARTIDO OPCION CIUDADANA;12
PESCA;Monica Milena Duquino Moreno;PARTIDO LIBERAL COLOMBIANO;11
PESCA;Carlos Eduardo Ardila Ramos;PARTIDO LIBERAL COLOMBIANO;10
PESCA;Ana Isabel Cardozo Rodriguez;PARTIDO LIBERAL COLOMBIANO;9
PESCA;Claudia Marcela Martinez Rodriguez;PARTIDO CENTRO DEMOCRATICO;9
PESCA;Jorge Alirio Chaparro Herrera;PARTIDO ALIANZA SOCIAL INDEPENDIENTE;9
PESCA;Partido Alianza Social Independiente;Partido Alianza Social Independiente;9
PESCA;Partido Centro Democratico;Partido Centro Democratico;9
PESCA;Luz Herlinda Vasquez Moreno;PARTIDO CAMBIO RADICAL;8
PESCA;Partido Cambio Radical;Partido Cambio Radical;8
PESCA;Partido De La U;Partido De La U;8
PESCA;Partido Liberal Colombiano;Partido Liberal Colombiano;8
PESCA;Partido Opcion Ciudadana;Partido Opcion Ciudadana;8
PESCA;Miguel Angel Bolivar Soraca;PARTIDO ALIANZA SOCIAL INDEPENDIENTE;7
PESCA;Diego Fernando Ramirez Plazas;PARTIDO DE LA U;5
PESCA;Dora Ligia Talero Talero;PARTIDO OPCION CIUDADANA;5
PESCA;Martha Cecilia Gil Forero;PARTIDO CENTRO DEMOCRATICO;5
PESCA;Movimiento Autoridades Indigenas De Colombia;Movimiento Autoridades Indigenas De Colombia;5
PESCA;Juan Sebastian Riano Fernandez;PARTIDO CENTRO DEMOCRATICO;4
PESCA;Ana Carolina Tenjo Joya;MOVIMIENTO AUTORIDADES INDIGENAS DE COLOMBIA;3
PESCA;Luis Eduardo Cordoba Vergara;PARTIDO DE LA U;2
PESCA;Rigoberto Herrera;PARTIDO CAMBIO RADICAL;2
PESCA;Sonia Tambo Maldonado;PARTIDO CAMBIO RADICAL;2
PESCA;Maria Yolanda Buitrago Rios;PARTIDO CENTRO DEMOCRATICO;1
PISBA;Rosalba Pidiache Estupinan;PARTIDO ALIANZA VERDE;62
PISBA;Raquelina Calderon Gomez;PARTIDO OPCION CIUDADANA;53
PISBA;Favian Pidiache Ruiz;PARTIDO OPCION CIUDADANA;43
PISBA;Jose Ismael Manrique;PARTIDO ALIANZA VERDE;33
PISBA;Emerio Cucunuba Cantor;PARTIDO DE LA U;32
PISBA;Alvaro Maldonado Maldonado;PARTIDO ALIANZA VERDE;30
PISBA;Jaime Alfonso Duran Duran;PARTIDO DE LA U;29
PISBA;Miguel Torres Cantor;PARTIDO DE LA U;29
PISBA;Adrian Levi Herrera Maldonado;PARTIDO CAMBIO RADICAL;28
PISBA;Luis Hernando Estupinan Cusba;PARTIDO CAMBIO RADICAL;28
PISBA;Luis Hernando Gomez Tabaco;PARTIDO OPCION CIUDADANA;28
PISBA;Milton Eduardo Millan Gomez;PARTIDO CONSERVADOR COLOMBIANO;28
PISBA;Fredy Robles Cely;PARTIDO ALIANZA SOCIAL INDEPENDIENTE;25
PISBA;Tarjetas No Marcados;nan;25
PISBA;Luz Marina Ruiz Correa;PARTIDO CONSERVADOR COLOMBIANO;24
PISBA;Querubin Cuellar Alvarez;PARTIDO OPCION CIUDADANA;24
PISBA;Luis Fernando Cuevas Sandoval;PARTIDO ALIANZA SOCIAL INDEPENDIENTE;23
PISBA;Lenny Bernarda Gomez Cuevas;PARTIDO ALIANZA VERDE;20
PISBA;Milton Alfonso Maldonado Maldonado;PARTIDO POLO DEMOCRATICO ALTERNATIVO;20
PISBA;Martha Lucia Vega Nocove;PARTIDO CONSERVADOR COLOMBIANO;18
PISBA;Ana Dorely Tabaco Socha;PARTIDO ALIANZA SOCIAL INDEPENDIENTE;16
PISBA;Jose Elicio Tabaco Pidiache;PARTIDO CONSERVADOR COLOMBIANO;16
PISBA;Manuel Augusto Fuentes Mojica;PARTIDO ALIANZA VERDE;16
PISBA;Emiro Plazas Vega;PARTIDO DE LA U;13
PISBA;Fernando Garcia Gomez;PARTIDO OPCION CIUDADANA;13
PISBA;Carlos Socha Leon;PARTIDO ALIANZA SOCIAL INDEPENDIENTE;9
PISBA;Guillermo Sanchez Tabaco;PARTIDO CONSERVADOR COLOMBIANO;9
PISBA;Cristy Alexandra Lombana Maldonado;PARTIDO DE LA U;8
PISBA;Ilce Luz Tabaco Pinzon;PARTIDO CAMBIO RADICAL;8
PISBA;Jose Bayardo Tabaco;PARTIDO CONSERVADOR COLOMBIANO;8
PISBA;Luis Eduardo Maldonado Maldonado;PARTIDO CAMBIO RADICAL;8
PISBA;Serafina Leon Ruiz;PARTIDO DE LA U;8
PISBA;Gloria Nely Martinez Herrera;PARTIDO POLO DEMOCRATICO ALTERNATIVO;7
PISBA;Partido Opcion Ciudadana;Partido Opcion Ciudadana;7
PISBA;Martha Isabel Tabaco Socha;PARTIDO CAMBIO RADICAL;5
PISBA;Partido Alianza Verde;Partido Alianza Verde;5
PISBA;Luis Martinez Piraban;PARTIDO CAMBIO RADICAL;4
PISBA;Nancy Correa Pidiache;PARTIDO ALIANZA SOCIAL INDEPENDIENTE;4
PISBA;Partido Conservador Colombiano;Partido Conservador Colombiano;4
PISBA;Emilsen Johana Tabaco Maldonado;PARTIDO ALIANZA VERDE;3
PISBA;Gloria Elena Manrique Aldana;PARTIDO CONSERVADOR COLOMBIANO;3
PISBA;Maria Antonia Herrera Cucunuba;PARTIDO POLO DEMOCRATICO ALTERNATIVO;3
PISBA;Mariela Maldonado Maldonado;PARTIDO OPCION CIUDADANA;3
PISBA;Crisanto De Jesus Gomez Tabaco;PARTIDO ALIANZA VERDE;2
PISBA;Jose Costantino Maldonado Duran;PARTIDO POLO DEMOCRATICO ALTERNATIVO;2
PISBA;Partido Alianza Social Independiente;Partido Alianza Social Independiente;2
PISBA;Partido Cambio Radical;Partido Cambio Radical;2
PISBA;Partido De La U;Partido De La U;2
PISBA;Anaide Sanchez Maldonado;PARTIDO OPCION CIUDADANA;1
PISBA;Martin Vergara Tumay;PARTIDO POLO DEMOCRATICO ALTERNATIVO;1
PISBA;Partido Polo Democratico Alternativo;Partido Polo Democratico Alternativo;1
PUERTO BOYACA;Tarjetas No Marcados;nan;938
PUERTO BOYACA;Norman De Jesus Quintero Gallego;PARTIDO LIBERAL COLOMBIANO;712
PUERTO BOYACA;Ruben Dario Orozco Saldarriaga;PARTIDO DE LA U;652
PUERTO BOYACA;Hernan Orozco Montoya;PARTIDO ALIANZA SOCIAL INDEPENDIENTE;625
PUERTO BOYACA;Jose Gabriel Alfaro Rios;PARTIDO LIBERAL COLOMBIANO;566
PUERTO BOYACA;Oscar Arturo Garzon Guevara;PARTIDO LIBERAL COLOMBIANO;516
PUERTO BOYACA;William Esquivel Rubio;PARTIDO ALIANZA SOCIAL INDEPENDIENTE;508
PUERTO BOYACA;Barbara Machado Nagles;PARTIDO LIBERAL COLOMBIANO;457
PUERTO BOYACA;Juan Fernando Delgado Vasquez;PARTIDO OPCION CIUDADANA;457
PUERTO BOYACA;Jorge Eliecer Miranda Burbano;PARTIDO DE LA U;429
PUERTO BOYACA;Luis Alberto Palacios Morales;PARTIDO CAMBIO RADICAL;416
PUERTO BOYACA;Robinson Montoya Perez;PARTIDO ALIANZA VERDE;407
PUERTO BOYACA;Jhon Feiber Urrea Cifuentes;PARTIDO CAMBIO RADICAL;402
PUERTO BOYACA;Jorge Orlando Toro Alzate;PARTIDO CONSERVADOR COLOMBIANO;401
PUERTO BOYACA;Gertrudis Gallego Osorio;PARTIDO OPCION CIUDADANA;400
PUERTO BOYACA;Omar Bernal Gonzalez;PARTIDO DE LA U;370
PUERTO BOYACA;Luz Dary Sevillano Guerrero;PARTIDO ALIANZA VERDE;361
PUERTO BOYACA;Gladis Ramirez Betancurth;PARTIDO LIBERAL COLOMBIANO;348
PUERTO BOYACA;Marco Antonio Aldana Orjuela;PARTIDO ALIANZA SOCIAL INDEPENDIENTE;345
PUERTO BOYACA;Cesar Eduardo Gutierrez Perez;PARTIDO DE LA U;343
PUERTO BOYACA;Jaime Efrain Medina Ramirez;PARTIDO CAMBIO RADICAL;322
PUERTO BOYACA;Wilmer Hernandez Caro;PARTIDO DE LA U;299
PUERTO BOYACA;Adriana Carolina Lopez Basto;PARTIDO CAMBIO RADICAL;281
PUERTO BOYACA;Rodolfo Vidal Lafory;PARTIDO CAMBIO RADICAL;276
PUERTO BOYACA;Yesid Mahecha Mahecha;PARTIDO CAMBIO RADICAL;272
PUERTO BOYACA;Abrahan Alvarez Suarez;PARTIDO CAMBIO RADICAL;264
PUERTO BOYACA;Oliverio Rojas Corrales;PARTIDO ALIANZA SOCIAL INDEPENDIENTE;257
PUERTO BOYACA;Partido Alianza Verde;Partido Alianza Verde;255
PUERTO BOYACA;Carlos Sanchez Reyes;PARTIDO CAMBIO RADICAL;244
PUERTO BOYACA;Alfredo Nunez Rodriguez;PARTIDO CONSERVADOR COLOMBIANO;240
PUERTO BOYACA;Daniel Parra Posada;PARTIDO ALIANZA VERDE;236
PUERTO BOYACA;Yanira Herrera Garcia;PARTIDO ALIANZA SOCIAL INDEPENDIENTE;211
PUERTO BOYACA;Frans Dimaz Soto Alzate;PARTIDO ALIANZA VERDE;208
PUERTO BOYACA;Martha Cecilia Ossa Castano;PARTIDO LIBERAL COLOMBIANO;205
PUERTO BOYACA;Sandra Liliana Alvarez Triana;PARTIDO ALIANZA VERDE;193
PUERTO BOYACA;Jairo Hernan Sandoval Alvarez;PARTIDO OPCION CIUDADANA;183
PUERTO BOYACA;Jhon Reyes Catica;PARTIDO ALIANZA VERDE;183
