MUNNOMBRE,PARNOMBRE,TOTALVOTOSVALIDOS,PORCENTAJE
SOCOTA;NUVIA EDID COGOLLO AVELLANEDA;PARTIDO LIBERAL COLOMBIANO;51,SOCOTA;Nuvia Edid Cogollo Avellaneda;PARTIDO LIBERAL COLOMBIANO;51,0.0,0.0
SOCOTA;ORLANDO BENITEZ MENDIVELSO;PARTIDO CAMBIO RADICAL;34,SOCOTA;Orlando Benitez Mendivelso;PARTIDO CAMBIO RADICAL;34,0.0,0.0
SOCOTA;PABLO EMILIO GALLO PASACHOA;PARTIDO VERDE;60,SOCOTA;Pablo Emilio Gallo Pasachoa;PARTIDO VERDE;60,0.0,0.0
SOCOTA;PARTIDO ALIANZA SOCIAL INDEPENDIENTE;PARTIDO ALIANZA SOCIAL INDEPENDIENTE;20,SOCOTA;Partido Alianza Social Independiente;Partido Alianza Social Independiente;20,0.0,0.0
SOCOTA;PARTIDO CAMBIO RADICAL;PARTIDO CAMBIO RADICAL;28,SOCOTA;Partido Cambio Radical;Partido Cambio Radical;28,0.0,0.0
SOCOTA;PARTIDO CONSERVADOR COLOMBIANO;PARTIDO CONSERVADOR COLOMBIANO;9,SOCOTA;Partido Conservador Colombiano;Partido Conservador Colombiano;9,0.0,0.0
SOCOTA;PARTIDO DE INTEGRACION NACIONAL;PARTIDO DE INTEGRACION NACIONAL;7,SOCOTA;Partido De Integracion Nacional;Partido De Integracion Nacional;7,0.0,0.0
SOCOTA;PARTIDO LIBERAL COLOMBIANO;PARTIDO LIBERAL COLOMBIANO;55,SOCOTA;Partido Liberal Colombiano;Partido Liberal Colombiano;55,0.0,0.0
SOCOTA;PARTIDO SOCIAL DE UNIDAD NACIONAL;PARTIDO SOCIAL DE UNIDAD NACIONAL;31,SOCOTA;Partido Social De Unidad Nacional;Partido Social De Unidad Nacional;31,0.0,0.0
SOCOTA;PARTIDO VERDE;PARTIDO VERDE;32,SOCOTA;Partido Verde;Partido Verde;32,0.0,0.0
SOCOTA;PEDRO MONTOYA ROMERO;PARTIDO CAMBIO RADICAL;80,SOCOTA;Pedro Montoya Romero;PARTIDO CAMBIO RADICAL;80,0.0,0.0
SOCOTA;PEDRO OJEDA CRUZ;PARTIDO SOCIAL DE UNIDAD NACIONAL;41,SOCOTA;Pedro Ojeda Cruz;PARTIDO SOCIAL DE UNIDAD NACIONAL;41,0.0,0.0
SOCOTA;REINALDO MENDIVELSO LEAL;PARTIDO CAMBIO RADICAL;106,SOCOTA;Reinaldo Mendivelso Leal;PARTIDO CAMBIO RADICAL;106,0.0,0.0
SOCOTA;ROSEBEL CUCUNUBA DURAN;PARTIDO CAMBIO RADICAL;111,SOCOTA;Rosebel Cucunuba Duran;PARTIDO CAMBIO RADICAL;111,0.0,0.0
SOCOTA;SAMIR EDUARDO RODRIGUEZ LEAL;PARTIDO ALIANZA SOCIAL INDEPENDIENTE;52,SOCOTA;Samir Eduardo Rodriguez Leal;PARTIDO ALIANZA SOCIAL INDEPENDIENTE;52,0.0,0.0
SOCOTA;YAMILE BENITEZ VELANDIA;PARTIDO SOCIAL DE UNIDAD NACIONAL;75,SOCOTA;Yamile Benitez Velandia;PARTIDO SOCIAL DE UNIDAD NACIONAL;75,0.0,0.0
SOCOTA;YOMARA MEDINA CRISTIANO;MOVIMIENTO POLITICO AFROVIDES;20,SOCOTA;Yomara Medina Cristiano;MOVIMIENTO POLITICO AFROVIDES;20,0.0,0.0
SOGAMOSO;ALEXANDRA MESA LEON;MOVIMIENTO AUTORIDADES INDIGENAS DE COLOMBIA;113,SOGAMOSO;Alexandra Mesa Leon;MOVIMIENTO AUTORIDADES INDIGENAS DE COLOMBIA;113,0.0,0.0
SOGAMOSO;ALFREDO LARA BUITRAGO;MOVIMIENTO DE INCLUSION Y OPORTUNIDADES;107,SOGAMOSO;Alfredo Lara Buitrago;MOVIMIENTO DE INCLUSION Y OPORTUNIDADES;107,0.0,0.0
SOGAMOSO;ALVARO PINEDA VERDUGO;POLO DEMOCRATICO ALTERNATIVO;73,SOGAMOSO;Alvaro Pineda Verdugo;POLO DEMOCRATICO ALTERNATIVO;73,0.0,0.0
SOGAMOSO;ANA MARIA CASTRO MURILLO;PARTIDO DE INTEGRACION NACIONAL;116,SOGAMOSO;Ana Maria Castro Murillo;PARTIDO DE INTEGRACION NACIONAL;116,0.0,0.0
SOGAMOSO;ANA RUTH BOLIVAR CAMARGO;PARTIDO VERDE;157,SOGAMOSO;Ana Ruth Bolivar Camargo;PARTIDO VERDE;157,0.0,0.0
SOGAMOSO;ANDRES RODRIGUEZ CALIXTO;PARTIDO DE INTEGRACION NACIONAL;456,SOGAMOSO;Andres Rodriguez Calixto;PARTIDO DE INTEGRACION NACIONAL;456,0.0,0.0
SOGAMOSO;AURA LILIANA GONZALEZ RINCON;MOVIMIENTO DE INCLUSION Y OPORTUNIDADES;25,SOGAMOSO;Aura Liliana Gonzalez Rincon;MOVIMIENTO DE INCLUSION Y OPORTUNIDADES;25,0.0,0.0
SOGAMOSO;BENITO VEGA PINTO;PARTIDO CAMBIO RADICAL;341,SOGAMOSO;Benito Vega Pinto;PARTIDO CAMBIO RADICAL;341,0.0,0.0
SOGAMOSO;BLANCA CECILIA MARTINEZ ORTIZ;PARTIDO VERDE;435,SOGAMOSO;Blanca Cecilia Martinez Ortiz;PARTIDO VERDE;435,0.0,0.0
SOGAMOSO;CARLOS ALBERTO PORRAS CASTRO;PARTIDO DE INTEGRACION NACIONAL;494,SOGAMOSO;Carlos Alberto Porras Castro;PARTIDO DE INTEGRACION NACIONAL;494,0.0,0.0
SOGAMOSO;CATALINA RIOS MORENO;PARTIDO CAMBIO RADICAL;68,SOGAMOSO;Catalina Rios Moreno;PARTIDO CAMBIO RADICAL;68,0.0,0.0
SOGAMOSO;CESAR AUGUSTO BARRERA MARTINEZ;PARTIDO VERDE;437,SOGAMOSO;Cesar Augusto Barrera Martinez;PARTIDO VERDE;437,0.0,0.0
SOGAMOSO;CLARA INES TAPIAS PAREDES;MOVIMIENTO AUTORIDADES INDIGENAS DE COLOMBIA;31,SOGAMOSO;Clara Ines Tapias Paredes;MOVIMIENTO AUTORIDADES INDIGENAS DE COLOMBIA;31,0.0,0.0
SOGAMOSO;CLARA YANID MONROY BARRETO;PARTIDO LIBERAL COLOMBIANO;306,SOGAMOSO;Clara Yanid Monroy Barreto;PARTIDO LIBERAL COLOMBIANO;306,0.0,0.0
SOGAMOSO;CLAUDIA YANNETH CASTELBLANCO BEDOYA;PARTIDO ALIANZA SOCIAL INDEPENDIENTE;42,SOGAMOSO;Claudia Yanneth Castelblanco Bedoya;PARTIDO ALIANZA SOCIAL INDEPENDIENTE;42,0.0,0.0
SOGAMOSO;DIANA CAROLINA ESTEPA ESTEPA;PARTIDO SOCIAL DE UNIDAD NACIONAL;872,SOGAMOSO;Diana Carolina Estepa Estepa;PARTIDO SOCIAL DE UNIDAD NACIONAL;872,0.0,0.0
SOGAMOSO;DIANA LIZETH FERRARO ROBERTO;MOVIMIENTO AUTORIDADES INDIGENAS DE COLOMBIA;48,SOGAMOSO;Diana Lizeth Ferraro Roberto;MOVIMIENTO AUTORIDADES INDIGENAS DE COLOMBIA;48,0.0,0.0
SOGAMOSO;DIANNA CAMILA DAVILA GARZON;POLO DEMOCRATICO ALTERNATIVO;26,SOGAMOSO;Dianna Camila Davila Garzon;POLO DEMOCRATICO ALTERNATIVO;26,0.0,0.0
SOGAMOSO;DIEGO FERNANDO FAGUA TORRES;PARTIDO LIBERAL COLOMBIANO;660,SOGAMOSO;Diego Fernando Fagua Torres;PARTIDO LIBERAL COLOMBIANO;660,0.0,0.0
SOGAMOSO;DOUGLAS JOAQUIN DONOSO OROZCO;PARTIDO DE INTEGRACION NACIONAL;114,SOGAMOSO;Douglas Joaquin Donoso Orozco;PARTIDO DE INTEGRACION NACIONAL;114,0.0,0.0
SOGAMOSO;EDILMA MARIA MENDOZA BOHORQUEZ;MOVIMIENTO AUTORIDADES INDIGENAS DE COLOMBIA;15,SOGAMOSO;Edilma Maria Mendoza Bohorquez;MOVIMIENTO AUTORIDADES INDIGENAS DE COLOMBIA;15,0.0,0.0
SOGAMOSO;EDWIN GEOVANNY ZORRO NINO;PARTIDO ALIANZA SOCIAL INDEPENDIENTE;122,SOGAMOSO;Edwin Geovanny Zorro Nino;PARTIDO ALIANZA SOCIAL INDEPENDIENTE;122,0.0,0.0
SOGAMOSO;EDWIN JARDIEL BENAVIDES BENAVIDES;PARTIDO VERDE;493,SOGAMOSO;Edwin Jardiel Benavides Benavides;PARTIDO VERDE;493,0.0,0.0
SOGAMOSO;ERIKA YANETH PEREZ ACOSTA;PARTIDO VERDE;64,SOGAMOSO;Erika Yaneth Perez Acosta;PARTIDO VERDE;64,0.0,0.0
SOGAMOSO;ESPERANZA AMADOR ALARCON;MOVIMIENTO AUTORIDADES INDIGENAS DE COLOMBIA;30,SOGAMOSO;Esperanza Amador Alarcon;MOVIMIENTO AUTORIDADES INDIGENAS DE COLOMBIA;30,0.0,0.0
SOGAMOSO;ESTELLA MARQUEZ RODRIGUEZ;PARTIDO DE INTEGRACION NACIONAL;354,SOGAMOSO;Estella Marquez Rodriguez;PARTIDO DE INTEGRACION NACIONAL;354,0.0,0.0
SOGAMOSO;FABIO BARRERA MEDINA;MOVIMIENTO AUTORIDADES INDIGENAS DE COLOMBIA;260,SOGAMOSO;Fabio Barrera Medina;MOVIMIENTO AUTORIDADES INDIGENAS DE COLOMBIA;260,0.0,0.0
SOGAMOSO;FABIO MARTIN VARGAS;MOVIMIENTO AUTORIDADES INDIGENAS DE COLOMBIA;160,SOGAMOSO;Fabio Martin Vargas;MOVIMIENTO AUTORIDADES INDIGENAS DE COLOMBIA;160,0.0,0.0
SOGAMOSO;FANNY MIREYA MURILLO ACERO;PARTIDO LIBERAL COLOMBIANO;228,SOGAMOSO;Fanny Mireya Murillo Acero;PARTIDO LIBERAL COLOMBIANO;228,0.0,0.0
SOGAMOSO;FELIX LEONARDO PLAZAS ESTEPA;PARTIDO CAMBIO RADICAL;130,SOGAMOSO;Felix Leonardo Plazas Estepa;PARTIDO CAMBIO RADICAL;130,0.0,0.0
SOGAMOSO;FERNANDO LOPEZ ALVARADO;MOVIMIENTO DE INCLUSION Y OPORTUNIDADES;201,SOGAMOSO;Fernando Lopez Alvarado;MOVIMIENTO DE INCLUSION Y OPORTUNIDADES;201,0.0,0.0
SOGAMOSO;FLOR ANGELA BOTELLO ALFONSO;PARTIDO DE INTEGRACION NACIONAL;31,SOGAMOSO;Flor Angela Botello Alfonso;PARTIDO DE INTEGRACION NACIONAL;31,0.0,0.0
SOGAMOSO;FREDY ALEXANDER PEREZ PINTO;PARTIDO CAMBIO RADICAL;426,SOGAMOSO;Fredy Alexander Perez Pinto;PARTIDO CAMBIO RADICAL;426,0.0,0.0
SOGAMOSO;GABRIEL ALEXANDER GARCIA MUNOZ;MOVIMIENTO DE INCLUSION Y OPORTUNIDADES;144,SOGAMOSO;Gabriel Alexander Garcia Munoz;MOVIMIENTO DE INCLUSION Y OPORTUNIDADES;144,0.0,0.0
SOGAMOSO;GABRIEL TORRES ALFONSO;PARTIDO ALIANZA SOCIAL INDEPENDIENTE;154,SOGAMOSO;Gabriel Torres Alfonso;PARTIDO ALIANZA SOCIAL INDEPENDIENTE;154,0.0,0.0
SOGAMOSO;GERMAN RINCON HERRERA;PARTIDO DE INTEGRACION NACIONAL;442,SOGAMOSO;German Rincon Herrera;PARTIDO DE INTEGRACION NACIONAL;442,0.0,0.0
SOGAMOSO;GLORIA ESPERANZA PEREZ TORRES;PARTIDO CAMBIO RADICAL;44,SOGAMOSO;Gloria Esperanza Perez Torres;PARTIDO CAMBIO RADICAL;44,0.0,0.0
SOGAMOSO;GONZALO BALLESTEROS MONSALVE;PARTIDO CAMBIO RADICAL;281,SOGAMOSO;Gonzalo Ballesteros Monsalve;PARTIDO CAMBIO RADICAL;281,0.0,0.0
SOGAMOSO;GUSTAVO ADOLFO ALARCON LOPEZ;PARTIDO VERDE;564,SOGAMOSO;Gustavo Adolfo Alarcon Lopez;PARTIDO VERDE;564,0.0,0.0
SOGAMOSO;GUSTAVO GUZMAN PEREZ;PARTIDO ALIANZA SOCIAL INDEPENDIENTE;183,SOGAMOSO;Gustavo Guzman Perez;PARTIDO ALIANZA SOCIAL INDEPENDIENTE;183,0.0,0.0
SOGAMOSO;HECTOR FERNANDO ALARCON LEON;PARTIDO ALIANZA SOCIAL INDEPENDIENTE;367,SOGAMOSO;Hector Fernando Alarcon Leon;PARTIDO ALIANZA SOCIAL INDEPENDIENTE;367,0.0,0.0
SOGAMOSO;HECTOR JOSELIN BARRERA ALVAREZ;MOVIMIENTO AUTORIDADES INDIGENAS DE COLOMBIA;91,SOGAMOSO;Hector Joselin Barrera Alvarez;MOVIMIENTO AUTORIDADES INDIGENAS DE COLOMBIA;91,0.0,0.0
SOGAMOSO;HECTOR MIGUEL RAMIREZ SANCHEZ;MOVIMIENTO DE INCLUSION Y OPORTUNIDADES;75,SOGAMOSO;Hector Miguel Ramirez Sanchez;MOVIMIENTO DE INCLUSION Y OPORTUNIDADES;75,0.0,0.0
SOGAMOSO;HELENA SOFIA FIGUEROA COGOLLOS;PARTIDO CAMBIO RADICAL;728,SOGAMOSO;Helena Sofia Figueroa Cogollos;PARTIDO CAMBIO RADICAL;728,0.0,0.0
SOGAMOSO;HENRY AMEZQUITA PEREZ;PARTIDO DE INTEGRACION NACIONAL;249,SOGAMOSO;Henry Amezquita Perez;PARTIDO DE INTEGRACION NACIONAL;249,0.0,0.0
SOGAMOSO;HENRY ESTUPINAN ESTUPINAN;PARTIDO VERDE;208,SOGAMOSO;Henry Estupinan Estupinan;PARTIDO VERDE;208,0.0,0.0
SOGAMOSO;HENRY OCTAVIO SANCHEZ HURTADO;MOVIMIENTO AUTORIDADES INDIGENAS DE COLOMBIA;102,SOGAMOSO;Henry Octavio Sanchez Hurtado;MOVIMIENTO AUTORIDADES INDIGENAS DE COLOMBIA;102,0.0,0.0
SOGAMOSO;HOLMAN QUINTERO BARAJAS;PARTIDO LIBERAL COLOMBIANO;323,SOGAMOSO;Holman Quintero Barajas;PARTIDO LIBERAL COLOMBIANO;323,0.0,0.0
SOGAMOSO;HUGO ALBERTO BARRERA BENAVIDES;PARTIDO SOCIAL DE UNIDAD NACIONAL;791,SOGAMOSO;Hugo Alberto Barrera Benavides;PARTIDO SOCIAL DE UNIDAD NACIONAL;791,0.0,0.0
SOGAMOSO;HUGO JAIRO PEREZ PENA;PARTIDO LIBERAL COLOMBIANO;487,SOGAMOSO;Hugo Jairo Perez Pena;PARTIDO LIBERAL COLOMBIANO;487,0.0,0.0
SOGAMOSO;ISNARDO ANTONIO GRANDAS RINCON;POLO DEMOCRATICO ALTERNATIVO;98,SOGAMOSO;Isnardo Antonio Grandas Rincon;POLO DEMOCRATICO ALTERNATIVO;98,0.0,0.0
SOGAMOSO;JAIME ANTONIO CHAPARRO BARRERA;PARTIDO LIBERAL COLOMBIANO;659,SOGAMOSO;Jaime Antonio Chaparro Barrera;PARTIDO LIBERAL COLOMBIANO;659,0.0,0.0
SOGAMOSO;JAIME GOMEZ;PARTIDO SOCIAL DE UNIDAD NACIONAL;490,SOGAMOSO;Jaime Gomez;PARTIDO SOCIAL DE UNIDAD NACIONAL;490,0.0,0.0
SOGAMOSO;JAIRO ALEXANDER CADENA RINCON;PARTIDO VERDE;145,SOGAMOSO;Jairo Alexander Cadena Rincon;PARTIDO VERDE;145,0.0,0.0
SOGAMOSO;JAIRO ARTURO PEREZ PEREZ;PARTIDO DE INTEGRACION NACIONAL;107,SOGAMOSO;Jairo Arturo Perez Perez;PARTIDO DE INTEGRACION NACIONAL;107,0.0,0.0
SOGAMOSO;JAVIER GUTIERREZ PEREZ;PARTIDO LIBERAL COLOMBIANO;114,SOGAMOSO;Javier Gutierrez Perez;PARTIDO LIBERAL COLOMBIANO;114,0.0,0.0
SOGAMOSO;JHON ALEJANDRO CAICEDO GONZALEZ;POLO DEMOCRATICO ALTERNATIVO;52,SOGAMOSO;Jhon Alejandro Caicedo Gonzalez;POLO DEMOCRATICO ALTERNATIVO;52,0.0,0.0
SOGAMOSO;JHON JAIRO MEDINA CELY;PARTIDO CAMBIO RADICAL;371,SOGAMOSO;Jhon Jairo Medina Cely;PARTIDO CAMBIO RADICAL;371,0.0,0.0
SOGAMOSO;JORGE DILKER SANCHEZ MORENO;PARTIDO DE INTEGRACION NACIONAL;486,SOGAMOSO;Jorge Dilker Sanchez Moreno;PARTIDO DE INTEGRACION NACIONAL;486,0.0,0.0
SOGAMOSO;JORGE ELIECER FERNANDEZ PEDRAZA;PARTIDO ALIANZA SOCIAL INDEPENDIENTE;200,SOGAMOSO;Jorge Eliecer Fernandez Pedraza;PARTIDO ALIANZA SOCIAL INDEPENDIENTE;200,0.0,0.0
SOGAMOSO;JORGE MONROY PEREZ;PARTIDO SOCIAL DE UNIDAD NACIONAL;120,SOGAMOSO;Jorge Monroy Perez;PARTIDO SOCIAL DE UNIDAD NACIONAL;120,0.0,0.0
SOGAMOSO;JOSE ANYELO NARANJO AMAYA;PARTIDO DE INTEGRACION NACIONAL;454,SOGAMOSO;Jose Anyelo Naranjo Amaya;PARTIDO DE INTEGRACION NACIONAL;454,0.0,0.0
SOGAMOSO;JOSE DEL CARMEN BARRERA PLAZAS;PARTIDO CAMBIO RADICAL;162,SOGAMOSO;Jose Del Carmen Barrera Plazas;PARTIDO CAMBIO RADICAL;162,0.0,0.0
SOGAMOSO;JOSE EDILBERTO MARTINEZ LOPEZ;MOVIMIENTO AUTORIDADES INDIGENAS DE COLOMBIA;272,SOGAMOSO;Jose Edilberto Martinez Lopez;MOVIMIENTO AUTORIDADES INDIGENAS DE COLOMBIA;272,0.0,0.0
SOGAMOSO;JOSE ISMAEL MONTANA MORENO;PARTIDO DE INTEGRACION NACIONAL;288,SOGAMOSO;Jose Ismael Montana Moreno;PARTIDO DE INTEGRACION NACIONAL;288,0.0,0.0
SOGAMOSO;JOSE UBALDO POVEDA POVEDA;PARTIDO SOCIAL DE UNIDAD NACIONAL;441,SOGAMOSO;Jose Ubaldo Poveda Poveda;PARTIDO SOCIAL DE UNIDAD NACIONAL;441,0.0,0.0
SOGAMOSO;JUAN BAUTISTA VIANCHA VIANCHA;POLO DEMOCRATICO ALTERNATIVO;243,SOGAMOSO;Juan Bautista Viancha Viancha;POLO DEMOCRATICO ALTERNATIVO;243,0.0,0.0
SOGAMOSO;JUAN CARLOS PEREZ NINO;PARTIDO VERDE;203,SOGAMOSO;Juan Carlos Perez Nino;PARTIDO VERDE;203,0.0,0.0
SOGAMOSO;JUAN JOSE CASTILLO LOPEZ;MOVIMIENTO DE INCLUSION Y OPORTUNIDADES;433,SOGAMOSO;Juan Jose Castillo Lopez;MOVIMIENTO DE INCLUSION Y OPORTUNIDADES;433,0.0,0.0
SOGAMOSO;JUAN MANUEL GOMEZ RIOS;PARTIDO VERDE;237,SOGAMOSO;Juan Manuel Gomez Rios;PARTIDO VERDE;237,0.0,0.0
SOGAMOSO;JUAN PABLO PARRA ISAZA;PARTIDO CAMBIO RADICAL;568,SOGAMOSO;Juan Pablo Parra Isaza;PARTIDO CAMBIO RADICAL;568,0.0,0.0
SOGAMOSO;JUAN PABLO RODRIGUEZ LEMUS;PARTIDO SOCIAL DE UNIDAD NACIONAL;790,SOGAMOSO;Juan Pablo Rodriguez Lemus;PARTIDO SOCIAL DE UNIDAD NACIONAL;790,0.0,0.0
SOGAMOSO;JULIAN MAURICIO CAMARGO MONTANA;PARTIDO DE INTEGRACION NACIONAL;360,SOGAMOSO;Julian Mauricio Camargo Montana;PARTIDO DE INTEGRACION NACIONAL;360,0.0,0.0
SOGAMOSO;JULIO ALBERTO PARRA MALDONADO;MOVIMIENTO AUTORIDADES INDIGENAS DE COLOMBIA;103,SOGAMOSO;Julio Alberto Parra Maldonado;MOVIMIENTO AUTORIDADES INDIGENAS DE COLOMBIA;103,0.0,0.0
SOGAMOSO;LEIDY MARCELA GOMEZ RAMIREZ;MOVIMIENTO DE INCLUSION Y OPORTUNIDADES;110,SOGAMOSO;Leidy Marcela Gomez Ramirez;MOVIMIENTO DE INCLUSION Y OPORTUNIDADES;110,0.0,0.0
SOGAMOSO;LEONOR PEREZ PRIETO;PARTIDO SOCIAL DE UNIDAD NACIONAL;324,SOGAMOSO;Leonor Perez Prieto;PARTIDO SOCIAL DE UNIDAD NACIONAL;324,0.0,0.0
SOGAMOSO;LINA MARCELA VEGA ALBARRACIN;PARTIDO CAMBIO RADICAL;41,SOGAMOSO;Lina Marcela Vega Albarracin;PARTIDO CAMBIO RADICAL;41,0.0,0.0
SOGAMOSO;LISIMACO RAMIREZ CABRERA;PARTIDO SOCIAL DE UNIDAD NACIONAL;229,SOGAMOSO;Lisimaco Ramirez Cabrera;PARTIDO SOCIAL DE UNIDAD NACIONAL;229,0.0,0.0
SOGAMOSO;LISSETTE CAROLINA SALCEDO NARANJO;PARTIDO DE INTEGRACION NACIONAL;283,SOGAMOSO;Lissette Carolina Salcedo Naranjo;PARTIDO DE INTEGRACION NACIONAL;283,0.0,0.0
SOGAMOSO;LUIS ALBERTO PEREZ;MOVIMIENTO DE INCLUSION Y OPORTUNIDADES;116,SOGAMOSO;Luis Alberto Perez;MOVIMIENTO DE INCLUSION Y OPORTUNIDADES;116,0.0,0.0
SOGAMOSO;LUIS ANTONIO FARFAN SIACHOQUE;PARTIDO SOCIAL DE UNIDAD NACIONAL;842,SOGAMOSO;Luis Antonio Farfan Siachoque;PARTIDO SOCIAL DE UNIDAD NACIONAL;842,0.0,0.0
SOGAMOSO;LUIS EDUARDO ARENAS PRADA;PARTIDO CAMBIO RADICAL;303,SOGAMOSO;Luis Eduardo Arenas Prada;PARTIDO CAMBIO RADICAL;303,0.0,0.0
SOGAMOSO;LUIS EDUARDO SUAREZ NORATO;PARTIDO SOCIAL DE UNIDAD NACIONAL;709,SOGAMOSO;Luis Eduardo Suarez Norato;PARTIDO SOCIAL DE UNIDAD NACIONAL;709,0.0,0.0
SOGAMOSO;LUIS EMILIO LOPEZ RODRIGUEZ;MOVIMIENTO DE INCLUSION Y OPORTUNIDADES;254,SOGAMOSO;Luis Emilio Lopez Rodriguez;MOVIMIENTO DE INCLUSION Y OPORTUNIDADES;254,0.0,0.0
SOGAMOSO;LUIS ENRIQUE ORDUZ OJEDA;PARTIDO SOCIAL DE UNIDAD NACIONAL;362,SOGAMOSO;Luis Enrique Orduz Ojeda;PARTIDO SOCIAL DE UNIDAD NACIONAL;362,0.0,0.0
SOGAMOSO;LUIS HIPOLITO RODRIGUEZ PEREZ;PARTIDO ALIANZA SOCIAL INDEPENDIENTE;157,SOGAMOSO;Luis Hipolito Rodriguez Perez;PARTIDO ALIANZA SOCIAL INDEPENDIENTE;157,0.0,0.0
SOGAMOSO;LUISA FERNANDA VANEGAS ZAMBRANO;PARTIDO VERDE;68,SOGAMOSO;Luisa Fernanda Vanegas Zambrano;PARTIDO VERDE;68,0.0,0.0
SOGAMOSO;LUZ EMERITA BARRERA CARDENAS;PARTIDO ALIANZA SOCIAL INDEPENDIENTE;32,SOGAMOSO;Luz Emerita Barrera Cardenas;PARTIDO ALIANZA SOCIAL INDEPENDIENTE;32,0.0,0.0
SOGAMOSO;LUZ MERY SANCHEZ ALFONSO;MOVIMIENTO DE INCLUSION Y OPORTUNIDADES;312,SOGAMOSO;Luz Mery Sanchez Alfonso;MOVIMIENTO DE INCLUSION Y OPORTUNIDADES;312,0.0,0.0
SOGAMOSO;LUZ STELLA FERNANDEZ CHAPARRO;PARTIDO LIBERAL COLOMBIANO;918,SOGAMOSO;Luz Stella Fernandez Chaparro;PARTIDO LIBERAL COLOMBIANO;918,0.0,0.0
SOGAMOSO;MANUEL ALBAN BARRETO GARCIA;PARTIDO ALIANZA SOCIAL INDEPENDIENTE;235,SOGAMOSO;Manuel Alban Barreto Garcia;PARTIDO ALIANZA SOCIAL INDEPENDIENTE;235,0.0,0.0
SOGAMOSO;MANUEL STEVEN ALVAREZ PULIDO;PARTIDO ALIANZA SOCIAL INDEPENDIENTE;355,SOGAMOSO;Manuel Steven Alvarez Pulido;PARTIDO ALIANZA SOCIAL INDEPENDIENTE;355,0.0,0.0
SOGAMOSO;MARCO ALIRIO MARQUEZ QUINTERO;PARTIDO LIBERAL COLOMBIANO;990,SOGAMOSO;Marco Alirio Marquez Quintero;PARTIDO LIBERAL COLOMBIANO;990,0.0,0.0
SOGAMOSO;MARIA DEL CARMEN VARGAS CAMARGO;MOVIMIENTO DE INCLUSION Y OPORTUNIDADES;283,SOGAMOSO;Maria Del Carmen Vargas Camargo;MOVIMIENTO DE INCLUSION Y OPORTUNIDADES;283,0.0,0.0
SOGAMOSO;MARIA ELSA RODRIGUEZ GOMEZ;PARTIDO SOCIAL DE UNIDAD NACIONAL;300,SOGAMOSO;Maria Elsa Rodriguez Gomez;PARTIDO SOCIAL DE UNIDAD NACIONAL;300,0.0,0.0
SOGAMOSO;MARICELA PESCA MORENO;MOVIMIENTO AUTORIDADES INDIGENAS DE COLOMBIA;169,SOGAMOSO;Maricela Pesca Moreno;MOVIMIENTO AUTORIDADES INDIGENAS DE COLOMBIA;169,0.0,0.0
SOGAMOSO;MARISOL QUIJANO CORTES;PARTIDO SOCIAL DE UNIDAD NACIONAL;313,SOGAMOSO;Marisol Quijano Cortes;PARTIDO SOCIAL DE UNIDAD NACIONAL;313,0.0,0.0
SOGAMOSO;MARTA ROCIO ZARATE RESTREPO;PARTIDO DE INTEGRACION NACIONAL;29,SOGAMOSO;Marta Rocio Zarate Restrepo;PARTIDO DE INTEGRACION NACIONAL;29,0.0,0.0
SOGAMOSO;MARTHA CECILIA RUEDA MONTANEZ;PARTIDO LIBERAL COLOMBIANO;228,SOGAMOSO;Martha Cecilia Rueda Montanez;PARTIDO LIBERAL COLOMBIANO;228,0.0,0.0
SOGAMOSO;MARTHA ESTELA ESPINEL RIOS;PARTIDO CAMBIO RADICAL;34,SOGAMOSO;Martha Estela Espinel Rios;PARTIDO CAMBIO RADICAL;34,0.0,0.0
SOGAMOSO;MARTHA ROCIO BARRERA CARRILLO;PARTIDO ALIANZA SOCIAL INDEPENDIENTE;9,SOGAMOSO;Martha Rocio Barrera Carrillo;PARTIDO ALIANZA SOCIAL INDEPENDIENTE;9,0.0,0.0
SOGAMOSO;MARYLUZ PENA FERNANDEZ;MOVIMIENTO DE INCLUSION Y OPORTUNIDADES;23,SOGAMOSO;Maryluz Pena Fernandez;MOVIMIENTO DE INCLUSION Y OPORTUNIDADES;23,0.0,0.0
SOGAMOSO;MAURICIO EDUARDO SALAMANCA APONTE;MOVIMIENTO DE INCLUSION Y OPORTUNIDADES;206,SOGAMOSO;Mauricio Eduardo Salamanca Aponte;MOVIMIENTO DE INCLUSION Y OPORTUNIDADES;206,0.0,0.0
SOGAMOSO;MIGUEL ARMANDO ARAQUE VARGAS;PARTIDO LIBERAL COLOMBIANO;385,SOGAMOSO;Miguel Armando Araque Vargas;PARTIDO LIBERAL COLOMBIANO;385,0.0,0.0
SOGAMOSO;MOVIMIENTO AUTORIDADES INDIGENAS DE COLOMBIA;MOVIMIENTO AUTORIDADES INDIGENAS DE COLOMBIA;59,SOGAMOSO;Movimiento Autoridades Indigenas De Colombia;Movimiento Autoridades Indigenas De Colombia;59,0.0,0.0
SOGAMOSO;MOVIMIENTO DE INCLUSION Y OPORTUNIDADES;MOVIMIENTO DE INCLUSION Y OPORTUNIDADES;72,SOGAMOSO;Movimiento De Inclusion Y Oportunidades;Movimiento De Inclusion Y Oportunidades;72,0.0,0.0
SOGAMOSO;MOVIMIENTO MIRA;MOVIMIENTO MIRA;1105,SOGAMOSO;Movimiento Mira;Movimiento Mira;1105,0.0,0.0
SOGAMOSO;MYRIAM LUZ PATINO ACEVEDO;PARTIDO ALIANZA SOCIAL INDEPENDIENTE;17,SOGAMOSO;Myriam Luz Patino Acevedo;PARTIDO ALIANZA SOCIAL INDEPENDIENTE;17,0.0,0.0
SOGAMOSO;NANCY JOHANA PATINO RUIZ;PARTIDO DE INTEGRACION NACIONAL;59,SOGAMOSO;Nancy Johana Patino Ruiz;PARTIDO DE INTEGRACION NACIONAL;59,0.0,0.0
SOGAMOSO;NEMESIO ALARCON TORRES;MOVIMIENTO DE INCLUSION Y OPORTUNIDADES;247,SOGAMOSO;Nemesio Alarcon Torres;MOVIMIENTO DE INCLUSION Y OPORTUNIDADES;247,0.0,0.0
SOGAMOSO;NESTOR ARMANDO ALVAREZ MONTOYA;PARTIDO DE INTEGRACION NACIONAL;134,SOGAMOSO;Nestor Armando Alvarez Montoya;PARTIDO DE INTEGRACION NACIONAL;134,0.0,0.0
SOGAMOSO;NIDYA INES PEREZ GONZALEZ;POLO DEMOCRATICO ALTERNATIVO;69,SOGAMOSO;Nidya Ines Perez Gonzalez;POLO DEMOCRATICO ALTERNATIVO;69,0.0,0.0
SOGAMOSO;NUSFRADIA SULID SIERRA FERNANDEZ;PARTIDO ALIANZA SOCIAL INDEPENDIENTE;14,SOGAMOSO;Nusfradia Sulid Sierra Fernandez;PARTIDO ALIANZA SOCIAL INDEPENDIENTE;14,0.0,0.0
SOGAMOSO;OLGA LUCIA BOTELLO ALFONSO;PARTIDO ALIANZA SOCIAL INDEPENDIENTE;25,SOGAMOSO;Olga Lucia Botello Alfonso;PARTIDO ALIANZA SOCIAL INDEPENDIENTE;25,0.0,0.0
SOGAMOSO;OMAR MORALES BARRERA;MOVIMIENTO AUTORIDADES INDIGENAS DE COLOMBIA;92,SOGAMOSO;Omar Morales Barrera;MOVIMIENTO AUTORIDADES INDIGENAS DE COLOMBIA;92,0.0,0.0
SOGAMOSO;ORLANDO RIANO;MOVIMIENTO AUTORIDADES INDIGENAS DE COLOMBIA;312,SOGAMOSO;Orlando Riano;MOVIMIENTO AUTORIDADES INDIGENAS DE COLOMBIA;312,0.0,0.0
SOGAMOSO;PABLO CAMARGO PUERTO;PARTIDO LIBERAL COLOMBIANO;857,SOGAMOSO;Pablo Camargo Puerto;PARTIDO LIBERAL COLOMBIANO;857,0.0,0.0
SOGAMOSO;PABLO CASTRO RUIZ;PARTIDO VERDE;317,SOGAMOSO;Pablo Castro Ruiz;PARTIDO VERDE;317,0.0,0.0
SOGAMOSO;PARTIDO ALIANZA SOCIAL INDEPENDIENTE;PARTIDO ALIANZA SOCIAL INDEPENDIENTE;70,SOGAMOSO;Partido Alianza Social Independiente;Partido Alianza Social Independiente;70,0.0,0.0
SOGAMOSO;PARTIDO CAMBIO RADICAL;PARTIDO CAMBIO RADICAL;168,SOGAMOSO;Partido Cambio Radical;Partido Cambio Radical;168,0.0,0.0
SOGAMOSO;PARTIDO DE INTEGRACION NACIONAL;PARTIDO DE INTEGRACION NACIONAL;77,SOGAMOSO;Partido De Integracion Nacional;Partido De Integracion Nacional;77,0.0,0.0
SOGAMOSO;PARTIDO LIBERAL COLOMBIANO;PARTIDO LIBERAL COLOMBIANO;831,SOGAMOSO;Partido Liberal Colombiano;Partido Liberal Colombiano;831,0.0,0.0
SOGAMOSO;PARTIDO SOCIAL DE UNIDAD NACIONAL;PARTIDO SOCIAL DE UNIDAD NACIONAL;650,SOGAMOSO;Partido Social De Unidad Nacional;Partido Social De Unidad Nacional;650,0.0,0.0
SOGAMOSO;PARTIDO VERDE;PARTIDO VERDE;348,SOGAMOSO;Partido Verde;Partido Verde;348,0.0,0.0
SOGAMOSO;PEDRO ARTURO CARDOZO MONTANA;MOVIMIENTO AUTORIDADES INDIGENAS DE COLOMBIA;127,SOGAMOSO;Pedro Arturo Cardozo Montana;MOVIMIENTO AUTORIDADES INDIGENAS DE COLOMBIA;127,0.0,0.0
SOGAMOSO;PEDRO GARCIA ARANDA;MOVIMIENTO AUTORIDADES INDIGENAS DE COLOMBIA;168,SOGAMOSO;Pedro Garcia Aranda;MOVIMIENTO AUTORIDADES INDIGENAS DE COLOMBIA;168,0.0,0.0
SOGAMOSO;POLO DEMOCRATICO ALTERNATIVO;POLO DEMOCRATICO ALTERNATIVO;88,SOGAMOSO;Polo Democratico Alternativo;Polo Democratico Alternativo;88,0.0,0.0
SOGAMOSO;REYES FERNANDEZ ALARCON;PARTIDO ALIANZA SOCIAL INDEPENDIENTE;334,SOGAMOSO;Reyes Fernandez Alarcon;PARTIDO ALIANZA SOCIAL INDEPENDIENTE;334,0.0,0.0
SOGAMOSO;RICARDO ANDRES BLANCO LEGUIZAMO;PARTIDO VERDE;528,SOGAMOSO;Ricardo Andres Blanco Leguizamo;PARTIDO VERDE;528,0.0,0.0
SOGAMOSO;RICARDO ANDRES CARO GUEVARA;PARTIDO LIBERAL COLOMBIANO;640,SOGAMOSO;Ricardo Andres Caro Guevara;PARTIDO LIBERAL COLOMBIANO;640,0.0,0.0
SOGAMOSO;RICARDO RIOS PLAZAS;PARTIDO CAMBIO RADICAL;255,SOGAMOSO;Ricardo Rios Plazas;PARTIDO CAMBIO RADICAL;255,0.0,0.0
SOGAMOSO;ROCIO CARDENAS FUENTES;MOVIMIENTO DE INCLUSION Y OPORTUNIDADES;84,SOGAMOSO;Rocio Cardenas Fuentes;MOVIMIENTO DE INCLUSION Y OPORTUNIDADES;84,0.0,0.0
SOGAMOSO;RODOLFO CELY CONDIA;PARTIDO LIBERAL COLOMBIANO;497,SOGAMOSO;Rodolfo Cely Condia;PARTIDO LIBERAL COLOMBIANO;497,0.0,0.0
SOGAMOSO;ROMAN HERNANDO ORTEGA HERNANDEZ;MOVIMIENTO DE INCLUSION Y OPORTUNIDADES;572,SOGAMOSO;Roman Hernando Ortega Hernandez;MOVIMIENTO DE INCLUSION Y OPORTUNIDADES;572,0.0,0.0
SOGAMOSO;ROSANA JUDITH HOZMAN MORA;PARTIDO VERDE;175,SOGAMOSO;Rosana Judith Hozman Mora;PARTIDO VERDE;175,0.0,0.0
SOGAMOSO;SANDRA PATRICIA PENA CASTILLO;PARTIDO SOCIAL DE UNIDAD NACIONAL;175,SOGAMOSO;Sandra Patricia Pena Castillo;PARTIDO SOCIAL DE UNIDAD NACIONAL;175,0.0,0.0
SOGAMOSO;SANDRA TATIANA SANDOVAL GALLO;PARTIDO SOCIAL DE UNIDAD NACIONAL;230,SOGAMOSO;Sandra Tatiana Sandoval Gallo;PARTIDO SOCIAL DE UNIDAD NACIONAL;230,0.0,0.0
SOGAMOSO;SANDRO NESTOR CONDIA PEREZ;PARTIDO LIBERAL COLOMBIANO;1201,SOGAMOSO;Sandro Nestor Condia Perez;PARTIDO LIBERAL COLOMBIANO;1201,0.0,0.0
SOGAMOSO;SONIA BEATRIZ QUINTERO RODRIGUEZ;PARTIDO VERDE;51,SOGAMOSO;Sonia Beatriz Quintero Rodriguez;PARTIDO VERDE;51,0.0,0.0
SOGAMOSO;URIEL ERNESTO ROJAS AVELLA;PARTIDO CAMBIO RADICAL;641,SOGAMOSO;Uriel Ernesto Rojas Avella;PARTIDO CAMBIO RADICAL;641,0.0,0.0
SOGAMOSO;VICTOR EMILIO PEDRAZA CHAPARRO;PARTIDO SOCIAL DE UNIDAD NACIONAL;158,SOGAMOSO;Victor Emilio Pedraza Chaparro;PARTIDO SOCIAL DE UNIDAD NACIONAL;158,0.0,0.0
SOGAMOSO;WHILFREDO RIVERA COGUA;PARTIDO VERDE;376,SOGAMOSO;Whilfredo Rivera Cogua;PARTIDO VERDE;376,0.0,0.0
SOGAMOSO;WILLIAM AVELLANEDA PEDRAZA;PARTIDO ALIANZA SOCIAL INDEPENDIENTE;447,SOGAMOSO;William Avellaneda Pedraza;PARTIDO ALIANZA SOCIAL INDEPENDIENTE;447,0.0,0.0
SOGAMOSO;WILLIAM FERNANDO GRANADOS;PARTIDO CAMBIO RADICAL;215,SOGAMOSO;William Fernando Granados;PARTIDO CAMBIO RADICAL;215,0.0,0.0
SOGAMOSO;WILLIAM MARTINEZ ARIAS;MOVIMIENTO DE INCLUSION Y OPORTUNIDADES;199,SOGAMOSO;William Martinez Arias;MOVIMIENTO DE INCLUSION Y OPORTUNIDADES;199,0.0,0.0
SOGAMOSO;WILLIAN RODRIGO PALACIOS ALVARADO;PARTIDO SOCIAL DE UNIDAD NACIONAL;691,SOGAMOSO;Willian Rodrigo Palacios Alvarado;PARTIDO SOCIAL DE UNIDAD NACIONAL;691,0.0,0.0
SOGAMOSO;WILMER LEAL PEREZ;PARTIDO VERDE;701,SOGAMOSO;Wilmer Leal Perez;PARTIDO VERDE;701,0.0,0.0
SOGAMOSO;WILSON TORRES SUPELANO;MOVIMIENTO AUTORIDADES INDIGENAS DE COLOMBIA;394,SOGAMOSO;Wilson Torres Supelano;MOVIMIENTO AUTORIDADES INDIGENAS DE COLOMBIA;394,0.0,0.0
SOGAMOSO;YANETH GONZALEZ BARRERA;PARTIDO LIBERAL COLOMBIANO;424,SOGAMOSO;Yaneth Gonzalez Barrera;PARTIDO LIBERAL COLOMBIANO;424,0.0,0.0
SOGAMOSO;YOLANDA CHAPARRO FONSECA;PARTIDO CAMBIO RADICAL;27,SOGAMOSO;Yolanda Chaparro Fonseca;PARTIDO CAMBIO RADICAL;27,0.0,0.0
SOGAMOSO;YURY VIVIANA DIAZ CRISTANCHO;PARTIDO LIBERAL COLOMBIANO;106,SOGAMOSO;Yury Viviana Diaz Cristancho;PARTIDO LIBERAL COLOMBIANO;106,0.0,0.0
SOMONDOCO;ADRIANA DEL PILAR PERILLA VACCA;PARTIDO CONSERVADOR COLOMBIANO;106,SOMONDOCO;Adriana Del Pilar Perilla Vacca;PARTIDO CONSERVADOR COLOMBIANO;106,0.0,0.0
SOMONDOCO;ANA SILVIA DAZA VDA DE AVILA;PARTIDO SOCIAL DE UNIDAD NACIONAL;34,SOMONDOCO;Ana Silvia Daza Vda De Avila;PARTIDO SOCIAL DE UNIDAD NACIONAL;34,0.0,0.0
SOMONDOCO;ARTURO URUENA GALINDO;MOVIMIENTO POLITICO AFROVIDES;49,SOMONDOCO;Arturo Uruena Galindo;MOVIMIENTO POLITICO AFROVIDES;49,0.0,0.0
SOMONDOCO;BLANCA LILIA MORALES SALGADO;MOVIMIENTO POLITICO AFROVIDES;43,SOMONDOCO;Blanca Lilia Morales Salgado;MOVIMIENTO POLITICO AFROVIDES;43,0.0,0.0
SOMONDOCO;BLAS IGNACIO VACCA VACCA;MOVIMIENTO POLITICO AFROVIDES;18,SOMONDOCO;Blas Ignacio Vacca Vacca;MOVIMIENTO POLITICO AFROVIDES;18,0.0,0.0
SOMONDOCO;CESAR OSWALDO GONZALEZ DIAZ;PARTIDO CONSERVADOR COLOMBIANO;49,SOMONDOCO;Cesar Oswaldo Gonzalez Diaz;PARTIDO CONSERVADOR COLOMBIANO;49,0.0,0.0
SOMONDOCO;EDILBERTO SANCHEZ LESMES;MOVIMIENTO POLITICO AFROVIDES;82,SOMONDOCO;Edilberto Sanchez Lesmes;MOVIMIENTO POLITICO AFROVIDES;82,0.0,0.0
