MUNNOMBRE;CANNOMBRE;PARNOMBRE;VOTOS
FIRAVITOBA;SANABRIA ZAMBRANO LUCILA;PARTIDO CONSERVADOR COLOMBIANO;116
FIRAVITOBA;ZORRO RODRIGUEZ LADY YOLIMA;PARTIDO VERDE;108
FIRAVITOBA;RIVAS RIVAS OMAIRA;PARTIDO LIBERAL COLOMBIANO;104
FIRAVITOBA;QUINA FIGUEROA EDWIN GEOVANNI;POLO DEMOCRATICO ALTERNATIVO;95
FIRAVITOBA;PEREZ FORERO JAIRO ENRIQUE;PARTIDO VERDE;94
FIRAVITOBA;SILVA BARRERA MARICELA;PARTIDO LIBERAL COLOMBIANO;92
FIRAVITOBA;ZIPA CADENA JAIRO;PARTIDO LIBERAL COLOMBIANO;82
FIRAVITOBA;VARGAS UNIVIO CLAUDIA MERCEDES;PARTIDO CONSERVADOR COLOMBIANO;80
FIRAVITOBA;PARTIDO CONSERVADOR COLOMBIANO;PARTIDO CONSERVADOR COLOMBIANO;53
FIRAVITOBA;PARTIDO LIBERAL COLOMBIANO;PARTIDO LIBERAL COLOMBIANO;50
FIRAVITOBA;ROJAS TORRES LYDA YADIRA;PARTIDO VERDE;48
FIRAVITOBA;ZEA DIAZ ALONSO;PARTIDO VERDE;44
FIRAVITOBA;PATINO VARGAS JOSE GABRIEL;PARTIDO CONSERVADOR COLOMBIANO;41
FIRAVITOBA;PRIETO BARRERA JOSELYN;POLO DEMOCRATICO ALTERNATIVO;34
FIRAVITOBA;LOPEZ VARGAS LUIS ALBERTO;PARTIDO VERDE;28
FIRAVITOBA;QUIJANO FIGUEROA OMAR;POLO DEMOCRATICO ALTERNATIVO;28
FIRAVITOBA;PARTIDO VERDE;PARTIDO VERDE;27
FIRAVITOBA;FONSECA SALAMANCA DAVID;POLO DEMOCRATICO ALTERNATIVO;26
FIRAVITOBA;SALAMANCA VARGAS LUIS JACOBO;PARTIDO VERDE;16
FIRAVITOBA;MESA VARGAS ANA MARIA;PARTIDO LIBERAL COLOMBIANO;11
FIRAVITOBA;CHAPARRO GUTIERREZ MARIA DEL CARMEN;POLO DEMOCRATICO ALTERNATIVO;6
FIRAVITOBA;POLO DEMOCRATICO ALTERNATIVO;POLO DEMOCRATICO ALTERNATIVO;5
FIRAVITOBA;CABEZAS BAYONA SANDRA PATRICIA;PARTIDO VERDE;4
FIRAVITOBA;MOYANO FONSECA ROSA ELENA;POLO DEMOCRATICO ALTERNATIVO;3
FLORESTA;RINCON MARINO WILMAR JULIAN;PARTIDO SOCIAL DE UNIDAD NACIONAL;216
FLORESTA;QUIROGA CORREA SONIA;PARTIDO CONSERVADOR COLOMBIANO;197
FLORESTA;TORRES OLIVARES JUAN CARLOS;PARTIDO SOCIAL DE UNIDAD NACIONAL;127
FLORESTA;BECERRA MARTINEZ YOBANY ROBERTO;PARTIDO CONSERVADOR COLOMBIANO;126
FLORESTA;ALBARRACIN CELY JUAN PAULO;MOVIMIENTO DE INCLUSION Y OPORTUNIDADES;114
FLORESTA;CRISTANCHO BECERRA EDGAR AUGUSTO;PARTIDO CAMBIO RADICAL;107
FLORESTA;MARTINEZ MEDRANO MARIO AUGUSTO;PARTIDO VERDE;104
FLORESTA;GOMEZ VELANDIA LUIS ANTONIO;MOVIMIENTO DE INCLUSION Y OPORTUNIDADES;101
FLORESTA;VARGAS MANOSALBA DORA PATRICIA;PARTIDO SOCIAL DE UNIDAD NACIONAL;89
FLORESTA;GUARIN GRANADOS CONSUELO;PARTIDO CONSERVADOR COLOMBIANO;87
FLORESTA;PRIETO RINCON ADRIAN ALEXANDER;PARTIDO VERDE;77
FLORESTA;BECERRA RINCON LUIS ANTONIO;PARTIDO CONSERVADOR COLOMBIANO;75
FLORESTA;HOLGUIN YOVANY ANTONIO;PARTIDO VERDE;71
FLORESTA;MURCIA MORENO SAUL;PARTIDO CAMBIO RADICAL;70
FLORESTA;HIGUERA QUINTANA JULIO CESAR;PARTIDO CAMBIO RADICAL;62
FLORESTA;TORRES SANCHEZ JAVIER;PARTIDO SOCIAL DE UNIDAD NACIONAL;56
FLORESTA;GALLO ARAQUE ALFONSO;PARTIDO VERDE;44
FLORESTA;SALAMANCA GUECHA PEDRO GUSTAVO;PARTIDO CAMBIO RADICAL;43
FLORESTA;CORDOBA BERNAL REINALDO;PARTIDO CONSERVADOR COLOMBIANO;36
FLORESTA;VARGAS RINCON ORLANDO ANTONIO;MOVIMIENTO DE INCLUSION Y OPORTUNIDADES;34
FLORESTA;NINO HERNANDEZ PEDRO;PARTIDO CONSERVADOR COLOMBIANO;29
FLORESTA;VARGAS CELY GLADIS;PARTIDO SOCIAL DE UNIDAD NACIONAL;24
FLORESTA;OROZCO PENALOZA YURLEY CATHERINE;MOVIMIENTO DE INCLUSION Y OPORTUNIDADES;21
FLORESTA;ORDUZ CELY BARBARA;PARTIDO CONSERVADOR COLOMBIANO;20
FLORESTA;PARTIDO CONSERVADOR COLOMBIANO;PARTIDO CONSERVADOR COLOMBIANO;18
FLORESTA;FONSECA TORRES DIANA ISABEL;PARTIDO VERDE;17
FLORESTA;ARAQUE RINCON FERNANDO DE JESUS;PARTIDO SOCIAL DE UNIDAD NACIONAL;15
FLORESTA;PARTIDO VERDE;PARTIDO VERDE;15
FLORESTA;CELY VARGAS ALEIDA VIVIANA;PARTIDO CAMBIO RADICAL;13
FLORESTA;LOZANO GRANADOS CLELIA;MOVIMIENTO DE INCLUSION Y OPORTUNIDADES;10
FLORESTA;MARINO IZAQUITA SOLVEY VIVIANA;MOVIMIENTO DE INCLUSION Y OPORTUNIDADES;10
FLORESTA;MURILLO RINCON MARIA YASMIN;PARTIDO CAMBIO RADICAL;10
FLORESTA;CRISTANCHO HIGUERA OLGA LUCIA;PARTIDO VERDE;9
FLORESTA;RINCON RINCON CLARA EMILIA;PARTIDO CAMBIO RADICAL;8
FLORESTA;PARTIDO SOCIAL DE UNIDAD NACIONAL;PARTIDO SOCIAL DE UNIDAD NACIONAL;7
FLORESTA;CHINOME CHINOME MARIA MERCEDES;PARTIDO VERDE;6
FLORESTA;MOVIMIENTO DE INCLUSION Y OPORTUNIDADES;MOVIMIENTO DE INCLUSION Y OPORTUNIDADES;3
FLORESTA;PARTIDO CAMBIO RADICAL;PARTIDO CAMBIO RADICAL;3
GACHANTIVA;CASTILLO FORERO MELIANO ANDRES;PARTIDO VERDE;124
GACHANTIVA;SOACHA SANABRIA JEFERSSON VLADIMIR;PARTIDO LIBERAL COLOMBIANO;116
GACHANTIVA;GUERRERO LUIS CARLOS;PARTIDO ALIANZA SOCIAL INDEPENDIENTE;112
GACHANTIVA;PENA PIZA DUSTANO;PARTIDO VERDE;106
GACHANTIVA;PUENTES SUAREZ JORGE WILLIAM;PARTIDO CONSERVADOR COLOMBIANO;92
GACHANTIVA;SAAVEDRA BUITRAGO LUIS FERNANDO;PARTIDO SOCIAL DE UNIDAD NACIONAL;89
GACHANTIVA;CASTRO HERNANDEZ DIEGO MIGUEL;PARTIDO CONSERVADOR COLOMBIANO;77
GACHANTIVA;SANABRIA SAENZ VICTOR JULIO;PARTIDO VERDE;73
GACHANTIVA;GUERRERO PARDO PEDRO JOSE;PARTIDO SOCIAL DE UNIDAD NACIONAL;67
GACHANTIVA;AGUILERA SUAREZ JULIO RAFAEL;PARTIDO LIBERAL COLOMBIANO;64
GACHANTIVA;CASTILLO PIZZA NOHORA;PARTIDO CONSERVADOR COLOMBIANO;64
GACHANTIVA;CASTRO BARAJAS SIMON;PARTIDO CONSERVADOR COLOMBIANO;58
GACHANTIVA;RONCANCIO SAENZ JOSE ALBERTO;PARTIDO CAMBIO RADICAL;56
GACHANTIVA;SAENZ CASTILLO RODRIGO;PARTIDO LIBERAL COLOMBIANO;56
GACHANTIVA;PENA LOPEZ JOSE MAURICIO;PARTIDO DE INTEGRACION NACIONAL;54
GACHANTIVA;VEGA OBREGON JAIRO VEGA;PARTIDO LIBERAL COLOMBIANO;51
GACHANTIVA;GALLEGO ARBOLEDA TATIANA MARIA;PARTIDO SOCIAL DE UNIDAD NACIONAL;42
GACHANTIVA;MOLINA POVEDA HECTOR ANDRES;PARTIDO DE INTEGRACION NACIONAL;34
GACHANTIVA;CASTILLO FORERO JOSE ANTONIO;PARTIDO CONSERVADOR COLOMBIANO;33
GACHANTIVA;GUERRERO PARDO ALVARO;PARTIDO ALIANZA SOCIAL INDEPENDIENTE;31
GACHANTIVA;PARTIDO CONSERVADOR COLOMBIANO;PARTIDO CONSERVADOR COLOMBIANO;31
GACHANTIVA;PARTIDO SOCIAL DE UNIDAD NACIONAL;PARTIDO SOCIAL DE UNIDAD NACIONAL;31
GACHANTIVA;DIAZ PENA HECTOR;PARTIDO CAMBIO RADICAL;30
GACHANTIVA;FORERO RABA ANGEL MARIA;PARTIDO DE INTEGRACION NACIONAL;30
GACHANTIVA;CARDENAS PARDO MARIO;PARTIDO SOCIAL DE UNIDAD NACIONAL;28
GACHANTIVA;CUELLAR MONSALVE LEYDY ELIANA;PARTIDO CONSERVADOR COLOMBIANO;25
GACHANTIVA;MERCHAN CASTILLO BELQUIS OLANDA;PARTIDO DE INTEGRACION NACIONAL;25
GACHANTIVA;FORERO FABIOLA PATRICIA;PARTIDO VERDE;24
GACHANTIVA;PENA ACERO ANGEL SANTIAGO;PARTIDO VERDE;23
GACHANTIVA;RABA SAAVEDRA ELVA MYRIAM;PARTIDO CONSERVADOR COLOMBIANO;22
GACHANTIVA;CANDIDATO RETIRADO;CANDIDATO RETIRADO;20
GACHANTIVA;AGUDELO CASTILLO MARTHA LUCIA;PARTIDO SOCIAL DE UNIDAD NACIONAL;19
GACHANTIVA;GUERRERO PENA MARIA AMPARO;PARTIDO VERDE;18
GACHANTIVA;SANCHEZ BUITRAGO RAFAEL SEGUNDO;PARTIDO CAMBIO RADICAL;18
GACHANTIVA;CETINA PENA DELCY LILIANA;PARTIDO LIBERAL COLOMBIANO;17
GACHANTIVA;MALAGON QUINTERO CARMENZA;PARTIDO LIBERAL COLOMBIANO;17
GACHANTIVA;SAENZ ACERO SONIA ESPERANZA;PARTIDO VERDE;14
GACHANTIVA;PARTIDO VERDE;PARTIDO VERDE;10
GACHANTIVA;AGUDELO RUIZ JUAN DE JESUS;PARTIDO CAMBIO RADICAL;9
GACHANTIVA;MONTANA CASTILLO JAVIER HERNANDO;PARTIDO ALIANZA SOCIAL INDEPENDIENTE;9
GACHANTIVA;REYES SAAVEDRA MARIA DEL CARMEN;PARTIDO CAMBIO RADICAL;9
GACHANTIVA;SANABRIA VELASQUEZ ULDI MIREYA;PARTIDO DE INTEGRACION NACIONAL;9
GACHANTIVA;PARTIDO LIBERAL COLOMBIANO;PARTIDO LIBERAL COLOMBIANO;8
GACHANTIVA;PIZZA FORERO MARIA CONSUELO;PARTIDO ALIANZA SOCIAL INDEPENDIENTE;7
GACHANTIVA;GUERRERO FORERO ROSA ELENA;PARTIDO ALIANZA SOCIAL INDEPENDIENTE;6
GACHANTIVA;LOPEZ SAENZ BLANCA LUCILA;PARTIDO CAMBIO RADICAL;6
GACHANTIVA;PARTIDO CAMBIO RADICAL;PARTIDO CAMBIO RADICAL;6
GACHANTIVA;PARTIDO DE INTEGRACION NACIONAL;PARTIDO DE INTEGRACION NACIONAL;6
GACHANTIVA;CASTRO VILLAMIL ANA MILENA;PARTIDO LIBERAL COLOMBIANO;5
GACHANTIVA;NONTOA MARTINEZ GLORIA ESPERANZA;PARTIDO SOCIAL DE UNIDAD NACIONAL;5
GACHANTIVA;PARTIDO ALIANZA SOCIAL INDEPENDIENTE;PARTIDO ALIANZA SOCIAL INDEPENDIENTE;5
GACHANTIVA;PUENTES BELTRAN VICTOR HUGO;PARTIDO ALIANZA SOCIAL INDEPENDIENTE;5
GACHANTIVA;MONROY CASTILLO JOSE ARCESIO;PARTIDO DE INTEGRACION NACIONAL;4
GACHANTIVA;CORREDOR PENA GLORIA MARLEN;PARTIDO ALIANZA SOCIAL INDEPENDIENTE;2
GACHANTIVA;RONDON GONZALEZ IBON CAROLINA;PARTIDO CAMBIO RADICAL;1
GAMEZA;PEREZ HERRERA JOSE OLEGARIO;PARTIDO LIBERAL COLOMBIANO;212
GAMEZA;PUENTES CUSBA LUIS ANTONIO;PARTIDO CONSERVADOR COLOMBIANO;158
GAMEZA;TIBADUIZA RODRIGUEZ JESUS;PARTIDO CONSERVADOR COLOMBIANO;151
GAMEZA;SANABRIA SUAREZ JAIRO ANTONIO;PARTIDO CONSERVADOR COLOMBIANO;141
GAMEZA;NONTOA HERNANDEZ JORGE ELIECER;PARTIDO CAMBIO RADICAL;131
GAMEZA;RINCON PARRA RAFAEL ERNESTO;PARTIDO CAMBIO RADICAL;127
GAMEZA;OJEDA ACEVEDO ANGEL MARIA;PARTIDO SOCIAL DE UNIDAD NACIONAL;124
GAMEZA;HURTADO PEREZ SAMUEL;PARTIDO CAMBIO RADICAL;121
GAMEZA;MORALES TINJACA JOSE VICENTE;PARTIDO LIBERAL COLOMBIANO;115
GAMEZA;QUINTANA GONZALEZ EDGAR CUSTODIO;PARTIDO LIBERAL COLOMBIANO;115
GAMEZA;MORALES SERRANO CONSTANTINO;PARTIDO CONSERVADOR COLOMBIANO;112
GAMEZA;TIBADUIZA ALVARADO JORGE HUMBERTO;PARTIDO LIBERAL COLOMBIANO;88
GAMEZA;GARCIA ALFONSO JUAN CARLOS;PARTIDO VERDE;78
GAMEZA;PARRA RINCON MARCELINO;PARTIDO CONSERVADOR COLOMBIANO;77
GAMEZA;BARRERA CRISTANCHO LUIS JAIME;PARTIDO LIBERAL COLOMBIANO;59
GAMEZA;LEGUIZAMO VARGAS ELSY;PARTIDO LIBERAL COLOMBIANO;55
GAMEZA;AMARILLO GIRALDO DIEGO;PARTIDO VERDE;54
GAMEZA;TINJACA OCHICA JAIME;PARTIDO CAMBIO RADICAL;54
GAMEZA;SALAMANCA BENAVIDES CARLOS JULIO;PARTIDO VERDE;51
GAMEZA;RUIZ PINTO ALVARO ALONSO;PARTIDO CAMBIO RADICAL;46
GAMEZA;PARTIDO CONSERVADOR COLOMBIANO;PARTIDO CONSERVADOR COLOMBIANO;41
GAMEZA;SILVA CASTANEDA ARISTOBULO;PARTIDO CONSERVADOR COLOMBIANO;40
GAMEZA;CARO CRISTANCHO GUSTAVO ADOLFO;PARTIDO SOCIAL DE UNIDAD NACIONAL;39
GAMEZA;VEGA RUIZ JORGE ELIECER;PARTIDO CAMBIO RADICAL;38
GAMEZA;CARDENAS CARO MARIA MERCEDES;PARTIDO CAMBIO RADICAL;36
GAMEZA;PARTIDO CAMBIO RADICAL;PARTIDO CAMBIO RADICAL;36
GAMEZA;CARO DE CARDENAS MARIA DEL CARMEN;PARTIDO SOCIAL DE UNIDAD NACIONAL;34
GAMEZA;PARTIDO LIBERAL COLOMBIANO;PARTIDO LIBERAL COLOMBIANO;34
GAMEZA;CASTANEDA RUIZ NEBARDO;PARTIDO SOCIAL DE UNIDAD NACIONAL;33
GAMEZA;MORENO TORRES LUIS HERNANDO;PARTIDO VERDE;32
GAMEZA;QUINTANA OJEDA BLANCA DERNY;PARTIDO CAMBIO RADICAL;26
GAMEZA;RINCON RINCON MIGUEL ANGEL;PARTIDO VERDE;25
GAMEZA;CRUZ NONTOA MARIA LUISA;PARTIDO CONSERVADOR COLOMBIANO;22
GAMEZA;LOPEZ CRUZ ANA VERONICA;PARTIDO CONSERVADOR COLOMBIANO;21
GAMEZA;PARTIDO SOCIAL DE UNIDAD NACIONAL;PARTIDO SOCIAL DE UNIDAD NACIONAL;19
GAMEZA;PEREZ RUIZ MARIA BLANCA;PARTIDO VERDE;19
GAMEZA;MESA RODRIGUEZ JENNY LIZETH;PARTIDO CONSERVADOR COLOMBIANO;18
GAMEZA;CORREDOR MEDINA ANA DELSI;PARTIDO VERDE;16
GAMEZA;VARGAS COMBITA ROSA ELIZABETH;PARTIDO LIBERAL COLOMBIANO;16
GAMEZA;COMBITA CUSBA EDILBERTO;PARTIDO VERDE;15
GAMEZA;PARTIDO VERDE;PARTIDO VERDE;14
GAMEZA;ALVARADO ALVAREZ RUBEN;PARTIDO SOCIAL DE UNIDAD NACIONAL;13
GAMEZA;GONZALEZ QUINTANA YENY ALEXANDRA;PARTIDO LIBERAL COLOMBIANO;10
GAMEZA;TORRES NONTOA LUIS ALIRIO;PARTIDO DE INTEGRACION NACIONAL;8
GAMEZA;CURTIDOR HERNANDEZ LUZ NELLY;PARTIDO SOCIAL DE UNIDAD NACIONAL;7
GAMEZA;SIAUCHO CRISTANCHO LUIS EDUARDO;PARTIDO DE INTEGRACION NACIONAL;7
GAMEZA;CASTANEDA GONZALEZ JOSE CRISTOBAL;PARTIDO SOCIAL DE UNIDAD NACIONAL;6
GAMEZA;GONZALEZ CAMACHO ANA GLADYS;PARTIDO CAMBIO RADICAL;6
GAMEZA;CUTA ROMERO LUZ ELIDA;PARTIDO DE INTEGRACION NACIONAL;4
GAMEZA;MARTINEZ MARIELA;PARTIDO SOCIAL DE UNIDAD NACIONAL;4
GAMEZA;PARTIDO DE INTEGRACION NACIONAL;PARTIDO DE INTEGRACION NACIONAL;4
GAMEZA;HERNANDEZ OCHICA MARIA OMAIDA;PARTIDO VERDE;3
GARAGOA;MOVIMIENTO MIRA;MOVIMIENTO MIRA;275
GARAGOA;SOGAMOSO ALFONSO INGRID MARLEN;PARTIDO CONSERVADOR COLOMBIANO;265
GARAGOA;AREVALO FABIO AUGUSTO;PARTIDO LIBERAL COLOMBIANO;222
GARAGOA;LEGUIZAMON CLAUDIA HELENA;PARTIDO SOCIAL DE UNIDAD NACIONAL;210
GARAGOA;SEGURA AVILA ALIX MARINA;PARTIDO CAMBIO RADICAL;203
GARAGOA;MORENO LESMES DANIEL RAMIRO;PARTIDO DE INTEGRACION NACIONAL;202
GARAGOA;CUERVO DE VERGARA ANA GRACIELA;PARTIDO CAMBIO RADICAL;186
GARAGOA;CUESTA ALFONSO JORGE HONORIO;PARTIDO VERDE;183
GARAGOA;CARDENAS ALFONSO ANGEL MARIA;PARTIDO CONSERVADOR COLOMBIANO;174
GARAGOA;MOLINA RAMOS AURELIANO;PARTIDO CONSERVADOR COLOMBIANO;161
GARAGOA;PARTIDO CAMBIO RADICAL;PARTIDO CAMBIO RADICAL;155
GARAGOA;AVILA MACIAS TITO JOSE;PARTIDO CONSERVADOR COLOMBIANO;139
GARAGOA;GORDILLO SOLER MILTON HUMBERTO;PARTIDO VERDE;134
GARAGOA;LEGUIZAMON ALFONSO LUIS ALBERTO;PARTIDO CONSERVADOR COLOMBIANO;131
GARAGOA;FERNANDEZ ALFONSO HECTOR JULIO;PARTIDO CONSERVADOR COLOMBIANO;128
GARAGOA;RIVERA RIVERA MILTON HENRY;PARTIDO CONSERVADOR COLOMBIANO;119
GARAGOA;VEGA PARRA JORGE LUIS;PARTIDO LIBERAL COLOMBIANO;116
GARAGOA;VELASQUEZ MONTANEZ HECTOR SANTOS;PARTIDO ALIANZA SOCIAL INDEPENDIENTE;113
GARAGOA;GONZALEZ ESPINOSA NESTOR LEONEL;PARTIDO LIBERAL COLOMBIANO;109
GARAGOA;GUERRERO SARMIENTO MARIA ALIED;PARTIDO SOCIAL DE UNIDAD NACIONAL;103
GARAGOA;PARTIDO CONSERVADOR COLOMBIANO;PARTIDO CONSERVADOR COLOMBIANO;100
GARAGOA;RODRIGUEZ AVILA MARTHA JUDITH;PARTIDO LIBERAL COLOMBIANO;98
GARAGOA;SALGADO JIMENEZ JOSE ISIDRO;PARTIDO ALIANZA SOCIAL INDEPENDIENTE;97
GARAGOA;VALLEJO MARTINEZ ELIECER;PARTIDO ALIANZA SOCIAL INDEPENDIENTE;97
GARAGOA;MORA ESPITIA LUIS FERNANDO;PARTIDO SOCIAL DE UNIDAD NACIONAL;96
GARAGOA;PENA RIVERA JOSE ELEUTERIO;PARTIDO CONSERVADOR COLOMBIANO;96
GARAGOA;PARTIDO SOCIAL DE UNIDAD NACIONAL;PARTIDO SOCIAL DE UNIDAD NACIONAL;94
GARAGOA;MORA DIAZ ELCIDIA;PARTIDO CAMBIO RADICAL;92
GARAGOA;DIAZ MORA DAIRO NICOLAS;PARTIDO LIBERAL COLOMBIANO;91
GARAGOA;GUTIERREZ RUIZ RUTH YELI;PARTIDO VERDE;84
GARAGOA;TOLOZA BARRETO GELVER OVIDIO;PARTIDO CAMBIO RADICAL;82
GARAGOA;LESMES MONTANEZ PABLO ELISEO;PARTIDO VERDE;80
GARAGOA;CUESTA ARENAS JOSE HERNANDO;PARTIDO SOCIAL DE UNIDAD NACIONAL;77
GARAGOA;CUBIDES MONROY ELIAS ANTONIO;PARTIDO DE INTEGRACION NACIONAL;76
GARAGOA;VERA FORERO CARLOS ALBERTO;PARTIDO DE INTEGRACION NACIONAL;76
GARAGOA;DELGADO TORRES CAYETANO;PARTIDO DE INTEGRACION NACIONAL;73
GARAGOA;MONTANEZ CUBIDES MILLER ARLEY;PARTIDO VERDE;72
GARAGOA;PARADA ZAMUDIO MARIA CAMPOS;PARTIDO CAMBIO RADICAL;71
GARAGOA;CARDENAS ARIAS EDISON;PARTIDO SOCIAL DE UNIDAD NACIONAL;70
GARAGOA;PARTIDO VERDE;PARTIDO VERDE;70
GARAGOA;LEGUIZAMON LESMES AIDA MILENA;PARTIDO LIBERAL COLOMBIANO;69
GARAGOA;AMAYA CHACON CAMILO;PARTIDO ALIANZA SOCIAL INDEPENDIENTE;68
GARAGOA;ROA CARDENAS JULIO ROBERTO;PARTIDO DE INTEGRACION NACIONAL;64
GARAGOA;VEGA GUTIERREZ RUDY ESPERANZA;PARTIDO VERDE;60
GARAGOA;FERNANDEZ AGUIRRE FELIX EDUARDO;PARTIDO LIBERAL COLOMBIANO;57
GARAGOA;GUTIERREZ MONTANA GLORIA MARIA;PARTIDO ALIANZA SOCIAL INDEPENDIENTE;54
GARAGOA;ROA LESMES SONIA PASTORA;PARTIDO CONSERVADOR COLOMBIANO;54
GARAGOA;PARTIDO LIBERAL COLOMBIANO;PARTIDO LIBERAL COLOMBIANO;53
GARAGOA;MELO PINEDA FABIAN;PARTIDO VERDE;51
GARAGOA;MARTINEZ DE ARIAS ANA CECILIA;PARTIDO ALIANZA SOCIAL INDEPENDIENTE;48
GARAGOA;LEON MONTENEGRO MARIA NINFA;PARTIDO SOCIAL DE UNIDAD NACIONAL;47
GARAGOA;GUATAQUIRA CARRANZA ANA MARLEN;PARTIDO CONSERVADOR COLOMBIANO;45
GARAGOA;PINEDA GAMBA CARLOS ANTONIO;PARTIDO DE INTEGRACION NACIONAL;42
GARAGOA;VEGA JIMENEZ LADY PATRICIA;PARTIDO ALIANZA SOCIAL INDEPENDIENTE;39
GARAGOA;CUBILLOS VILLARREAL LUZ EMMA;PARTIDO LIBERAL COLOMBIANO;38
GARAGOA;VALLEJO ALFONSO GUSTAVO;PARTIDO LIBERAL COLOMBIANO;36
GARAGOA;VARGAS ROJAS JESUS ALBERTO;PARTIDO CAMBIO RADICAL;36
GARAGOA;FIGUEREDO IBANEZ OSCAR JAVIER;PARTIDO ALIANZA SOCIAL INDEPENDIENTE;33
GARAGOA;REYES ESCOBAR ABIGAIL;PARTIDO DE INTEGRACION NACIONAL;33
GARAGOA;PARTIDO DE INTEGRACION NACIONAL;PARTIDO DE INTEGRACION NACIONAL;31
GARAGOA;MARTINEZ RODRIGUEZ BLANCA LUCIA;PARTIDO LIBERAL COLOMBIANO;30
GARAGOA;PARRA JIMENEZ ALBEIRO HERNAN;PARTIDO SOCIAL DE UNIDAD NACIONAL;30
GARAGOA;VEGA GARCIA QUINTIN;PARTIDO CAMBIO RADICAL;29
GARAGOA;COLMENARES PINTO LUZ HERMINDA;PARTIDO VERDE;28
GARAGOA;PARTIDO ALIANZA SOCIAL INDEPENDIENTE;PARTIDO ALIANZA SOCIAL INDEPENDIENTE;28
GARAGOA;CUESTA JIMENEZ PEDRO MARIA;PARTIDO VERDE;27
GARAGOA;FRANCO AVILA LINO ARTURO;PARTIDO SOCIAL DE UNIDAD NACIONAL;27
GARAGOA;YANGUATIN BOTINA MARIA DEL CARMEN;PARTIDO ALIANZA SOCIAL INDEPENDIENTE;27
GARAGOA;HUEZA GALEANO HECTOR ENRIQUE;PARTIDO CAMBIO RADICAL;26
GARAGOA;MURCIA JOSE MANUEL;PARTIDO ALIANZA SOCIAL INDEPENDIENTE;25
GARAGOA;ROA MANRIQUE DEISY LORENA;PARTIDO VERDE;24
GARAGOA;VELASQUEZ VELASQUEZ JOHN WILSON;PARTIDO SOCIAL DE UNIDAD NACIONAL;23
GARAGOA;ACEVEDO MORENO RUBY YINETH;PARTIDO SOCIAL DE UNIDAD NACIONAL;22
GARAGOA;AVILA AVILA RICARDO;PARTIDO DE INTEGRACION NACIONAL;22
GARAGOA;CARRANZA RAMIREZ YERSON OSVALDO;PARTIDO VERDE;20
GARAGOA;PINEDA CASTANEDA ANA RUTH;PARTIDO DE INTEGRACION NACIONAL;20
GARAGOA;CASTILLO MAHECHA JOSE GUILLERMO;PARTIDO LIBERAL COLOMBIANO;17
GARAGOA;AVILA CABEZAS NELSON JAVIER;PARTIDO SOCIAL DE UNIDAD NACIONAL;16
GARAGOA;CARDENAS TOLOZA OLFA MAIRE;PARTIDO ALIANZA SOCIAL INDEPENDIENTE;16
GARAGOA;VELASQUEZ VELASQUEZ LEYDA YICETH;PARTIDO DE INTEGRACION NACIONAL;16
GARAGOA;MARTINEZ GOMEZ BENERANDA;PARTIDO CONSERVADOR COLOMBIANO;10
GARAGOA;VALENCIA VALENCIA JORGE ASDRUBAL;PARTIDO CAMBIO RADICAL;9
GARAGOA;MONTENEGRO DAZA RUTH YANETH;PARTIDO DE INTEGRACION NACIONAL;8
GUACAMAYAS;BLANCO PINTO LUIS ELEUTERIO;PARTIDO CONSERVADOR COLOMBIANO;118
GUACAMAYAS;SILVA GOMEZ FRANCISCO JAVIER;PARTIDO CONSERVADOR COLOMBIANO;104
GUACAMAYAS;BLANCO NEIRA RAFAEL;PARTIDO CONSERVADOR COLOMBIANO;99
GUACAMAYAS;JURADO JURADO JORGE SERAFIN;PARTIDO DE INTEGRACION NACIONAL;83
GUACAMAYAS;BLANCO NINO GERMAN RODRIGO;PARTIDO SOCIAL DE UNIDAD NACIONAL;80
GUACAMAYAS;PEDROZA WILCHES PEDRO JESUS;PARTIDO SOCIAL DE UNIDAD NACIONAL;78
GUACAMAYAS;BLANCO ALBARRACIN LUIS ALEJANDRO;PARTIDO CONSERVADOR COLOMBIANO;70
GUACAMAYAS;SUESCUN NINO RAMIRO IGNACIO;PARTIDO DE INTEGRACION NACIONAL;67
GUACAMAYAS;BUSTACARA GARCIA JOSELIN;PARTIDO DE INTEGRACION NACIONAL;66
GUACAMAYAS;BARON SIERRA NAPOLEON;PARTIDO DE INTEGRACION NACIONAL;65
GUACAMAYAS;GONZALEZ BUSTACARA LUIS FLAMINIO;PARTIDO SOCIAL DE UNIDAD NACIONAL;52
GUACAMAYAS;WILCHES PUENTES JOSE DE JESUS;PARTIDO CAMBIO RADICAL;49
GUACAMAYAS;BUITRAGO PINTO OLGA MATILDE;PARTIDO DE INTEGRACION NACIONAL;48
GUACAMAYAS;SILVA GOMEZ VICTOR MANUEL;PARTIDO SOCIAL DE UNIDAD NACIONAL;27
GUACAMAYAS;MANRIQUE GOMEZ OMAIRA;PARTIDO CONSERVADOR COLOMBIANO;22
GUACAMAYAS;NIETO GUAJE VICKY MARITZA;PARTIDO CONSERVADOR COLOMBIANO;21
GUACAMAYAS;TRIANA CARMEN CECILIA;PARTIDO CONSERVADOR COLOMBIANO;20
GUACAMAYAS;JURADO MONTANEZ LUIS JESUS;PARTIDO CAMBIO RADICAL;19
GUACAMAYAS;PINTO SIERRA LUIS ALEJANDRO;PARTIDO CAMBIO RADICAL;19
GUACAMAYAS;BARON SIERRA PAULA CAROLINA;PARTIDO DE INTEGRACION NACIONAL;16
GUACAMAYAS;LIZARAZO SEPULVEDA DORA CARMENZA;PARTIDO DE INTEGRACION NACIONAL;12
GUACAMAYAS;JURADO ROSA NELLY;PARTIDO CAMBIO RADICAL;10
GUACAMAYAS;PARTIDO CONSERVADOR COLOMBIANO;PARTIDO CONSERVADOR COLOMBIANO;9
GUACAMAYAS;PARTIDO CAMBIO RADICAL;PARTIDO CAMBIO RADICAL;8
GUACAMAYAS;RUDA LOZANO ADELA;PARTIDO SOCIAL DE UNIDAD NACIONAL;8
GUACAMAYAS;CELY BURGOS JOSE MIGUEL;PARTIDO CAMBIO RADICAL;7
GUACAMAYAS;BLANCO GARCIA LEIDY ESPERANZA;PARTIDO CAMBIO RADICAL;6
GUACAMAYAS;PARTIDO DE INTEGRACION NACIONAL;PARTIDO DE INTEGRACION NACIONAL;6
GUACAMAYAS;CORREDOR ORTEGATE DISNEY DANITZA;PARTIDO CAMBIO RADICAL;5
GUACAMAYAS;JURADO JURADO BLANCA AURORA;PARTIDO SOCIAL DE UNIDAD NACIONAL;4
GUACAMAYAS;BLANCO PENALOZA GRACIELA;PARTIDO SOCIAL DE UNIDAD NACIONAL;3
GUACAMAYAS;PARTIDO SOCIAL DE UNIDAD NACIONAL;PARTIDO SOCIAL DE UNIDAD NACIONAL;3
GUATEQUE;CAMERO ALFONSO IVAN CAMILO;PARTIDO CAMBIO RADICAL;362
GUATEQUE;PERILLA RAMIREZ JORGE AMELIO;PARTIDO VERDE;328
GUATEQUE;MORALES CASTILLO DAVID FRANCISCO;PARTIDO VERDE;321
GUATEQUE;ROA BERNAL MAURICIO HUMBERTO;PARTIDO SOCIAL DE UNIDAD NACIONAL;229
GUATEQUE;ROJAS BERMUDEZ RUBEN;PARTIDO CAMBIO RADICAL;227
GUATEQUE;GARZON ROA JOSE DANIEL;PARTIDO CAMBIO RADICAL;212
GUATEQUE;LEAL BORDA HELBERT;PARTIDO CAMBIO RADICAL;157
GUATEQUE;MOLINA URIBE AQUILEO HERNANDO;PARTIDO CAMBIO RADICAL;153
GUATEQUE;SORIANO CARRANZA JORGE ENRIQUE;PARTIDO VERDE;153
GUATEQUE;LEIVA PERILLA CARLOS ARTURO;PARTIDO SOCIAL DE UNIDAD NACIONAL;137
GUATEQUE;SASTOQUE LEIVA LUIS ALEJANDRO;PARTIDO LIBERAL COLOMBIANO;126
GUATEQUE;SUAREZ SANCHEZ WILLIAM HERNANDO;PARTIDO VERDE;124
GUATEQUE;CARRANZA AGUDELO LEIDY ALEJANDRA;PARTIDO SOCIAL DE UNIDAD NACIONAL;123
GUATEQUE;BARRERA LESMES OSCAR ORLANDO;PARTIDO SOCIAL DE UNIDAD NACIONAL;122
GUATEQUE;BERMUDEZ ALGARRA ELIECER;PARTIDO CAMBIO RADICAL;122
GUATEQUE;GONZALEZ GUACANEME LUIS FABIAN;PARTIDO LIBERAL COLOMBIANO;121
GUATEQUE;PARTIDO CAMBIO RADICAL;PARTIDO CAMBIO RADICAL;120
GUATEQUE;MOVIMIENTO MIRA;MOVIMIENTO MIRA;112
GUATEQUE;PARTIDO LIBERAL COLOMBIANO;PARTIDO LIBERAL COLOMBIANO;112
GUATEQUE;SANCHEZ AREVALO JHON JAIRO;PARTIDO LIBERAL COLOMBIANO;91
GUATEQUE;MORENO DUARTE DANIEL;PARTIDO LIBERAL COLOMBIANO;89
GUATEQUE;NINO PANADERO PEDRO PABLO;PARTIDO LIBERAL COLOMBIANO;79
GUATEQUE;PINEROS DONCEL JUAN RAMON;PARTIDO CONSERVADOR COLOMBIANO;70
GUATEQUE;FONSECA ARENAS MARCELINO;PARTIDO SOCIAL DE UNIDAD NACIONAL;65
GUATEQUE;MARTINEZ FLOR MARINA;PARTIDO CAMBIO RADICAL;64
GUATEQUE;HERNANDEZ ROMERO AGRIPINA;PARTIDO SOCIAL DE UNIDAD NACIONAL;58
GUATEQUE;LOPEZ DE VALERO DORA DEL CARMEN;PARTIDO LIBERAL COLOMBIANO;55
GUATEQUE;FERNANDEZ ALFONSO JORGE ELIECER;PARTIDO LIBERAL COLOMBIANO;52
GUATEQUE;SAAVEDRA CORTES ANA MILENA;PARTIDO CAMBIO RADICAL;51
GUATEQUE;VARGAS JUAN CRISTOBAL;PARTIDO LIBERAL COLOMBIANO;51
GUATEQUE;CALDERON LUZ ESTELA;PARTIDO VERDE;50
GUATEQUE;SANTOS ASTROZ KAREN TATIANA;PARTIDO LIBERAL COLOMBIANO;47
GUATEQUE;PARRA MARTINEZ YOHADRY LISBETH;PARTIDO SOCIAL DE UNIDAD NACIONAL;45
GUATEQUE;FANDINO BERMUDEZ MARIA CELMIRA;PARTIDO CAMBIO RADICAL;44
GUATEQUE;GUERRERO BARRETO NELSON HERIBERTO;PARTIDO VERDE;44
GUATEQUE;PARTIDO SOCIAL DE UNIDAD NACIONAL;PARTIDO SOCIAL DE UNIDAD NACIONAL;43
GUATEQUE;LEON TORRES ROBERTH HAROLD;PARTIDO VERDE;41
GUATEQUE;SANCHEZ RODRIGUEZ VITERLICIA;PARTIDO LIBERAL COLOMBIANO;41
GUATEQUE;SANTAMARIA PERILLA JOHN WILSON;PARTIDO CONSERVADOR COLOMBIANO;41
GUATEQUE;NIETO VARGAS HERNANDO;PARTIDO CONSERVADOR COLOMBIANO;40
GUATEQUE;PEREZ CUADROS LUZ MARINA;PARTIDO CONSERVADOR COLOMBIANO;40
GUATEQUE;PARTIDO VERDE;PARTIDO VERDE;39
GUATEQUE;ZAMORA FERNANDEZ HUMBERTO;PARTIDO CAMBIO RADICAL;39
GUATEQUE;BERNAL RUIZ NELCY ALEXANDRA;PARTIDO SOCIAL DE UNIDAD NACIONAL;38
GUATEQUE;ZIPAQUIRA RAMOS NELSON;PARTIDO VERDE;38
GUATEQUE;MORENO MORENO NELLY;PARTIDO CAMBIO RADICAL;34
GUATEQUE;ROLDAN VANEGAS MYRIAM OLIVA;PARTIDO VERDE;33
GUATEQUE;RAMIREZ GARZON NINFA ALICIA;PARTIDO SOCIAL DE UNIDAD NACIONAL;32
GUATEQUE;LEGUIZAMO BOHORQUEZ MAXIMILIANO;PARTIDO SOCIAL DE UNIDAD NACIONAL;28
GUATEQUE;PARTIDO CONSERVADOR COLOMBIANO;PARTIDO CONSERVADOR COLOMBIANO;23
GUATEQUE;HERNANDEZ NOVOA NANCY EDITH;PARTIDO VERDE;22
GUATEQUE;ZAMORA FERNANDEZ JORGE ALBERTO;PARTIDO SOCIAL DE UNIDAD NACIONAL;20
GUATEQUE;BOHORQUEZ DE SACRISTAN ISABELINA;PARTIDO CONSERVADOR COLOMBIANO;19
GUATEQUE;RUIZ SALAS RUBY;PARTIDO CONSERVADOR COLOMBIANO;17
GUATEQUE;VERA PATINO DENNY MAYERLY;PARTIDO VERDE;16
GUATEQUE;MEDINA SORIANO VIDAL;PARTIDO CONSERVADOR COLOMBIANO;13
GUATEQUE;VARGAS RODRIGUEZ JORGE ENRIQUE;PARTIDO CONSERVADOR COLOMBIANO;11
GUATEQUE;MENDOZA GARZON LEYDA NAIR;PARTIDO CONSERVADOR COLOMBIANO;10
GUAYATA;BARRETO ALFONSO YONSON MOISES;PARTIDO SOCIAL DE UNIDAD NACIONAL;245
GUAYATA;RAMIREZ ORJUELA JOSE DARIO;PARTIDO LIBERAL COLOMBIANO;130
GUAYATA;SIERRA PINEROS NIDIAN EUNICE;PARTIDO CONSERVADOR COLOMBIANO;125
GUAYATA;SANCHEZ RUIZ JENNY ROCIO;PARTIDO CONSERVADOR COLOMBIANO;124
GUAYATA;ARAGON GARZON PEDRO PABLO;PARTIDO LIBERAL COLOMBIANO;120
GUAYATA;DIAZ VARGAS SEGUNDO;PARTIDO CAMBIO RADICAL;114
GUAYATA;ORTIZ ALDANA CARLOS ARTURO;PARTIDO LIBERAL COLOMBIANO;102
GUAYATA;GUERRERO CASTRO WILLIAM ALONSO;PARTIDO CONSERVADOR COLOMBIANO;98
GUAYATA;MENDOZA CASTRO HELMAN FELIPE;PARTIDO CONSERVADOR COLOMBIANO;96
GUAYATA;PINEROS DE DUENAS BERTA BELEN;PARTIDO CONSERVADOR COLOMBIANO;94
GUAYATA;TOLOZA CIFUENTES JUAN DE JESUS;PARTIDO CAMBIO RADICAL;86
GUAYATA;LOPEZ MARTIN EDGAR HERNANDO;PARTIDO SOCIAL DE UNIDAD NACIONAL;85
GUAYATA;PARRA PINEROS HERNANDO;PARTIDO SOCIAL DE UNIDAD NACIONAL;76
GUAYATA;DUENAS RUIZ JAVIER HERNAN;PARTIDO CONSERVADOR COLOMBIANO;74
GUAYATA;RUBIO RAFAEL ANTONIO;PARTIDO LIBERAL COLOMBIANO;71
GUAYATA;PINEROS PINEROS HECTOR ALFONSO;PARTIDO CONSERVADOR COLOMBIANO;70
GUAYATA;PARTIDO SOCIAL DE UNIDAD NACIONAL;PARTIDO SOCIAL DE UNIDAD NACIONAL;69
GUAYATA;MARTINEZ ALDANA ALVARO;PARTIDO LIBERAL COLOMBIANO;67
GUAYATA;PARTIDO CONSERVADOR COLOMBIANO;PARTIDO CONSERVADOR COLOMBIANO;67
GUAYATA;PINEROS BARRETO DORA CLEMENCIA;PARTIDO SOCIAL DE UNIDAD NACIONAL;64
GUAYATA;PINEROS MARTIN LUIS ANTONIO;PARTIDO CONSERVADOR COLOMBIANO;64
GUAYATA;RUIZ CASTRO HERNANDO ALONSO;PARTIDO SOCIAL DE UNIDAD NACIONAL;53
GUAYATA;ALFONSO DUENAS YINA ROCIO;PARTIDO SOCIAL DE UNIDAD NACIONAL;46
GUAYATA;BUITRAGO MEDINA GUILLERMO;PARTIDO CAMBIO RADICAL;46
GUAYATA;HERRERA GAITAN SAULO VICENTE;PARTIDO SOCIAL DE UNIDAD NACIONAL;35
GUAYATA;PARTIDO LIBERAL COLOMBIANO;PARTIDO LIBERAL COLOMBIANO;35
GUAYATA;BARRETO DE MARTIN ANA DOLORES;PARTIDO CAMBIO RADICAL;34
GUAYATA;RAMOS ROLDAN JUAN ANTONIO;PARTIDO CAMBIO RADICAL;31
GUAYATA;RUIZ CARDENAS FADER ALEXANDER;PARTIDO CAMBIO RADICAL;30
GUAYATA;PINEROS PINTO JOSE;PARTIDO CONSERVADOR COLOMBIANO;29
GUAYATA;GUTIERREZ GUTIERREZ LUCILA;PARTIDO CAMBIO RADICAL;28
GUAYATA;MORENO PINEROS GLORIA OLIVA;PARTIDO SOCIAL DE UNIDAD NACIONAL;28
GUAYATA;ZAMORA BARRERA PEDRO PABLO;PARTIDO LIBERAL COLOMBIANO;26
GUAYATA;NOVOA MIREYA;PARTIDO LIBERAL COLOMBIANO;20
GUAYATA;MARTIN MONTENEGRO HERMENCIA;PARTIDO CAMBIO RADICAL;18
GUAYATA;PARTIDO CAMBIO RADICAL;PARTIDO CAMBIO RADICAL;18
GUAYATA;TOVAR YESID;PARTIDO CAMBIO RADICAL;14
GUAYATA;PENA BARRERA LUZ DARY;PARTIDO LIBERAL COLOMBIANO;7
GUAYATA;CANDIDATO RETIRADO;CANDIDATO RETIRADO;5
GUAYATA;ROA ROMERO SANDRA MILENA;PARTIDO LIBERAL COLOMBIANO;5
GUICAN DE LA SIERRA;PALACIOS LOPEZ HILDEBRANDO;PARTIDO VERDE;147
GUICAN DE LA SIERRA;CARRERO QUINTERO HERNANDO;PARTIDO VERDE;116
GUICAN DE LA SIERRA;MEDINA LOPEZ FABIO HUMBERTO;PARTIDO SOCIAL DE UNIDAD NACIONAL;102
GUICAN DE LA SIERRA;LOPEZ SILVA EDWING ALEJANDRO;PARTIDO SOCIAL DE UNIDAD NACIONAL;101
GUICAN DE LA SIERRA;CORREA NUNEZ VICTOR MANUEL;PARTIDO CAMBIO RADICAL;100
GUICAN DE LA SIERRA;SANTISTEBAN MUNOZ JUAN FELIX;PARTIDO CAMBIO RADICAL;74
GUICAN DE LA SIERRA;MUNOZ BRAVO HECTOR;PARTIDO CONSERVADOR COLOMBIANO;71
GUICAN DE LA SIERRA;LOPEZ PUENTES DIANA CONSTANZA;PARTIDO CONSERVADOR COLOMBIANO;65
