MUNNOMBRE,PARNOMBRE,TOTALVOTOSVALIDOS,PORCENTAJE
PACHAVITA;MARCO TULIO RUBIANO HUERTAS;PARTIDO VERDE;48,PACHAVITA;Marco Tulio Rubiano Huertas;PARTIDO VERDE;48,0.0,0.0
PACHAVITA;MARIA GLORIA CONTRERAS DIAZ;PARTIDO SOCIAL DE UNIDAD NACIONAL;25,PACHAVITA;Maria Gloria Contreras Diaz;PARTIDO SOCIAL DE UNIDAD NACIONAL;25,0.0,0.0
PACHAVITA;MARIA IRMA TORRES RIVERA;PARTIDO CONSERVADOR COLOMBIANO;74,PACHAVITA;Maria Irma Torres Rivera;PARTIDO CONSERVADOR COLOMBIANO;74,0.0,0.0
PACHAVITA;MARIA JACQUELINE GARCIA CUESTA;PARTIDO VERDE;10,PACHAVITA;Maria Jacqueline Garcia Cuesta;PARTIDO VERDE;10,0.0,0.0
PACHAVITA;MARIA MARCELA MENDOZA ARIAS;PARTIDO SOCIAL DE UNIDAD NACIONAL;8,PACHAVITA;Maria Marcela Mendoza Arias;PARTIDO SOCIAL DE UNIDAD NACIONAL;8,0.0,0.0
PACHAVITA;MARTIN EMILIO PRIETO HUERTAS;PARTIDO SOCIAL DE UNIDAD NACIONAL;23,PACHAVITA;Martin Emilio Prieto Huertas;PARTIDO SOCIAL DE UNIDAD NACIONAL;23,0.0,0.0
PACHAVITA;MIRYAM VARGAS AVILA;PARTIDO CONSERVADOR COLOMBIANO;12,PACHAVITA;Miryam Vargas Avila;PARTIDO CONSERVADOR COLOMBIANO;12,0.0,0.0
PACHAVITA;NANCY PEDREROS TORRES;PARTIDO VERDE;27,PACHAVITA;Nancy Pedreros Torres;PARTIDO VERDE;27,0.0,0.0
PACHAVITA;NELSON JAVIER MEDINA AREVALO;PARTIDO DE INTEGRACION NACIONAL;16,PACHAVITA;Nelson Javier Medina Arevalo;PARTIDO DE INTEGRACION NACIONAL;16,0.0,0.0
PACHAVITA;PARTIDO CONSERVADOR COLOMBIANO;PARTIDO CONSERVADOR COLOMBIANO;23,PACHAVITA;Partido Conservador Colombiano;Partido Conservador Colombiano;23,0.0,0.0
PACHAVITA;PARTIDO DE INTEGRACION NACIONAL;PARTIDO DE INTEGRACION NACIONAL;5,PACHAVITA;Partido De Integracion Nacional;Partido De Integracion Nacional;5,0.0,0.0
PACHAVITA;PARTIDO SOCIAL DE UNIDAD NACIONAL;PARTIDO SOCIAL DE UNIDAD NACIONAL;11,PACHAVITA;Partido Social De Unidad Nacional;Partido Social De Unidad Nacional;11,0.0,0.0
PACHAVITA;PARTIDO VERDE;PARTIDO VERDE;25,PACHAVITA;Partido Verde;Partido Verde;25,0.0,0.0
PAEZ;ALVARO VEGA MARTINEZ;PARTIDO CAMBIO RADICAL;49,PAEZ;Alvaro Vega Martinez;PARTIDO CAMBIO RADICAL;49,0.0,0.0
PAEZ;EDUAR EFREN ROMERO MENDOZA;PARTIDO VERDE;55,PAEZ;Eduar Efren Romero Mendoza;PARTIDO VERDE;55,0.0,0.0
PAEZ;ELSA MIREYA MUNOZ SANABRIA;PARTIDO VERDE;54,PAEZ;Elsa Mireya Munoz Sanabria;PARTIDO VERDE;54,0.0,0.0
PAEZ;FABIO SOLER MESA;PARTIDO SOCIAL DE UNIDAD NACIONAL;78,PAEZ;Fabio Soler Mesa;PARTIDO SOCIAL DE UNIDAD NACIONAL;78,0.0,0.0
PAEZ;GEIMY DIAZ BARRERA;PARTIDO SOCIAL DE UNIDAD NACIONAL;62,PAEZ;Geimy Diaz Barrera;PARTIDO SOCIAL DE UNIDAD NACIONAL;62,0.0,0.0
PAEZ;GERMAN ZUBIETA;PARTIDO SOCIAL DE UNIDAD NACIONAL;106,PAEZ;German Zubieta;PARTIDO SOCIAL DE UNIDAD NACIONAL;106,0.0,0.0
PAEZ;HECTOR ARIALDO PARDO ALFONSO;PARTIDO VERDE;130,PAEZ;Hector Arialdo Pardo Alfonso;PARTIDO VERDE;130,0.0,0.0
PAEZ;HECTOR BOHORQUEZ CARRANZA;PARTIDO CAMBIO RADICAL;41,PAEZ;Hector Bohorquez Carranza;PARTIDO CAMBIO RADICAL;41,0.0,0.0
PAEZ;JAIME MESA PULIDO;PARTIDO VERDE;104,PAEZ;Jaime Mesa Pulido;PARTIDO VERDE;104,0.0,0.0
PAEZ;JOSE ANCELMO CRUZ MORENO;PARTIDO CAMBIO RADICAL;72,PAEZ;Jose Ancelmo Cruz Moreno;PARTIDO CAMBIO RADICAL;72,0.0,0.0
PAEZ;LUD YELINA VARELA CONTRERAS;PARTIDO SOCIAL DE UNIDAD NACIONAL;97,PAEZ;Lud Yelina Varela Contreras;PARTIDO SOCIAL DE UNIDAD NACIONAL;97,0.0,0.0
PAEZ;LUIS GUILLERMO MAHECHA BOHORQUEZ;PARTIDO VERDE;67,PAEZ;Luis Guillermo Mahecha Bohorquez;PARTIDO VERDE;67,0.0,0.0
PAEZ;LUZ MIRYAM GARZON TORRES;PARTIDO CAMBIO RADICAL;39,PAEZ;Luz Miryam Garzon Torres;PARTIDO CAMBIO RADICAL;39,0.0,0.0
PAEZ;LUZ STELLA ARIAS ROJAS;PARTIDO CAMBIO RADICAL;39,PAEZ;Luz Stella Arias Rojas;PARTIDO CAMBIO RADICAL;39,0.0,0.0
PAEZ;MARISELA NOVA BAUTISTA;PARTIDO VERDE;12,PAEZ;Marisela Nova Bautista;PARTIDO VERDE;12,0.0,0.0
PAEZ;MAURICIO DAZA RUBIO;PARTIDO SOCIAL DE UNIDAD NACIONAL;43,PAEZ;Mauricio Daza Rubio;PARTIDO SOCIAL DE UNIDAD NACIONAL;43,0.0,0.0
PAEZ;PARTIDO CAMBIO RADICAL;PARTIDO CAMBIO RADICAL;17,PAEZ;Partido Cambio Radical;Partido Cambio Radical;17,0.0,0.0
PAEZ;PARTIDO SOCIAL DE UNIDAD NACIONAL;PARTIDO SOCIAL DE UNIDAD NACIONAL;72,PAEZ;Partido Social De Unidad Nacional;Partido Social De Unidad Nacional;72,0.0,0.0
PAEZ;PARTIDO VERDE;PARTIDO VERDE;43,PAEZ;Partido Verde;Partido Verde;43,0.0,0.0
PAEZ;SANDRA PATRICIA AGUIRRE ALONSO;PARTIDO VERDE;44,PAEZ;Sandra Patricia Aguirre Alonso;PARTIDO VERDE;44,0.0,0.0
PAEZ;TITO DAVIAN GOMEZ ROJAS;PARTIDO SOCIAL DE UNIDAD NACIONAL;107,PAEZ;Tito Davian Gomez Rojas;PARTIDO SOCIAL DE UNIDAD NACIONAL;107,0.0,0.0
PAEZ;WILSON RENE ROJAS ROJAS;PARTIDO CAMBIO RADICAL;86,PAEZ;Wilson Rene Rojas Rojas;PARTIDO CAMBIO RADICAL;86,0.0,0.0
PAIPA;ABRAHAM MARIA TAMAYO PUERTO;PARTIDO CONSERVADOR COLOMBIANO;187,PAIPA;Abraham Maria Tamayo Puerto;PARTIDO CONSERVADOR COLOMBIANO;187,0.0,0.0
PAIPA;ADRIANA PAOLA SEPULVEDA PARRA;PARTIDO CONSERVADOR COLOMBIANO;13,PAIPA;Adriana Paola Sepulveda Parra;PARTIDO CONSERVADOR COLOMBIANO;13,0.0,0.0
PAIPA;ALCIBIADES CIPAGAUTA MATEUS;POLO DEMOCRATICO ALTERNATIVO;48,PAIPA;Alcibiades Cipagauta Mateus;POLO DEMOCRATICO ALTERNATIVO;48,0.0,0.0
PAIPA;ALEJANDRO ARTURO FARFAN ORTIZ;PARTIDO VERDE;248,PAIPA;Alejandro Arturo Farfan Ortiz;PARTIDO VERDE;248,0.0,0.0
PAIPA;ANA MARCELA CONTRERAS HERNANDEZ;PARTIDO SOCIAL DE UNIDAD NACIONAL;19,PAIPA;Ana Marcela Contreras Hernandez;PARTIDO SOCIAL DE UNIDAD NACIONAL;19,0.0,0.0
PAIPA;ANA MERCEDES AGUILAR MARTINEZ;PARTIDO VERDE;92,PAIPA;Ana Mercedes Aguilar Martinez;PARTIDO VERDE;92,0.0,0.0
PAIPA;ANA MERCEDES FRAILE BENITEZ;PARTIDO CAMBIO RADICAL;6,PAIPA;Ana Mercedes Fraile Benitez;PARTIDO CAMBIO RADICAL;6,0.0,0.0
PAIPA;ANA ROSALIA PACHECO SUAREZ;PARTIDO LIBERAL COLOMBIANO;60,PAIPA;Ana Rosalia Pacheco Suarez;PARTIDO LIBERAL COLOMBIANO;60,0.0,0.0
PAIPA;ANYI MARCELA PUERTO AVENDANO;PARTIDO CAMBIO RADICAL;13,PAIPA;Anyi Marcela Puerto Avendano;PARTIDO CAMBIO RADICAL;13,0.0,0.0
PAIPA;BALDOMERO CAMARGO GARZON;PARTIDO SOCIAL DE UNIDAD NACIONAL;311,PAIPA;Baldomero Camargo Garzon;PARTIDO SOCIAL DE UNIDAD NACIONAL;311,0.0,0.0
PAIPA;BENJAMIN GALAN MALAVER;PARTIDO LIBERAL COLOMBIANO;169,PAIPA;Benjamin Galan Malaver;PARTIDO LIBERAL COLOMBIANO;169,0.0,0.0
PAIPA;CEDIEL DIAZ CIPAGAUTA;POLO DEMOCRATICO ALTERNATIVO;23,PAIPA;Cediel Diaz Cipagauta;POLO DEMOCRATICO ALTERNATIVO;23,0.0,0.0
PAIPA;CESAR EMIRO FUERTES FONSECA;PARTIDO SOCIAL DE UNIDAD NACIONAL;132,PAIPA;Cesar Emiro Fuertes Fonseca;PARTIDO SOCIAL DE UNIDAD NACIONAL;132,0.0,0.0
PAIPA;CLAUDIA ANDREA GARCIA CASTILLO;PARTIDO SOCIAL DE UNIDAD NACIONAL;149,PAIPA;Claudia Andrea Garcia Castillo;PARTIDO SOCIAL DE UNIDAD NACIONAL;149,0.0,0.0
PAIPA;CLAUDIA MARCELA ROJAS REYES;PARTIDO SOCIAL DE UNIDAD NACIONAL;100,PAIPA;Claudia Marcela Rojas Reyes;PARTIDO SOCIAL DE UNIDAD NACIONAL;100,0.0,0.0
PAIPA;CLAUDIA MIREYA BELTRAN BRACHO;PARTIDO VERDE;146,PAIPA;Claudia Mireya Beltran Bracho;PARTIDO VERDE;146,0.0,0.0
PAIPA;CLAUDIA PATRICIA PADILLA USEDA;PARTIDO CAMBIO RADICAL;35,PAIPA;Claudia Patricia Padilla Useda;PARTIDO CAMBIO RADICAL;35,0.0,0.0
PAIPA;CLAUDIA YANNETH GARZON CAMARGO;PARTIDO VERDE;349,PAIPA;Claudia Yanneth Garzon Camargo;PARTIDO VERDE;349,0.0,0.0
PAIPA;DANIEL ALFONSO MEDINA VELANDIA;MOVIMIENTO MIRA;42,PAIPA;Daniel Alfonso Medina Velandia;MOVIMIENTO MIRA;42,0.0,0.0
PAIPA;DANIEL HIGUERA FONSECA;PARTIDO CAMBIO RADICAL;172,PAIPA;Daniel Higuera Fonseca;PARTIDO CAMBIO RADICAL;172,0.0,0.0
PAIPA;DAVID FERNANDO RONDON RUIZ;PARTIDO ALIANZA SOCIAL INDEPENDIENTE;17,PAIPA;David Fernando Rondon Ruiz;PARTIDO ALIANZA SOCIAL INDEPENDIENTE;17,0.0,0.0
PAIPA;DEICY CAROLINA PEDRAZA PEDRAZA;PARTIDO ALIANZA SOCIAL INDEPENDIENTE;443,PAIPA;Deicy Carolina Pedraza Pedraza;PARTIDO ALIANZA SOCIAL INDEPENDIENTE;443,0.0,0.0
PAIPA;DIONICIA MOLANO PENA;PARTIDO CONSERVADOR COLOMBIANO;51,PAIPA;Dionicia Molano Pena;PARTIDO CONSERVADOR COLOMBIANO;51,0.0,0.0
PAIPA;EDWIN FABIAN ACERO RODRIGUEZ;PARTIDO CONSERVADOR COLOMBIANO;609,PAIPA;Edwin Fabian Acero Rodriguez;PARTIDO CONSERVADOR COLOMBIANO;609,0.0,0.0
PAIPA;EMILCE YANETH PABON ROA;PARTIDO CONSERVADOR COLOMBIANO;10,PAIPA;Emilce Yaneth Pabon Roa;PARTIDO CONSERVADOR COLOMBIANO;10,0.0,0.0
PAIPA;FABIAN RICARDO CORREDOR SANCHEZ;PARTIDO LIBERAL COLOMBIANO;65,PAIPA;Fabian Ricardo Corredor Sanchez;PARTIDO LIBERAL COLOMBIANO;65,0.0,0.0
PAIPA;FABIO ALONSO MORENO CARRENO;POLO DEMOCRATICO ALTERNATIVO;36,PAIPA;Fabio Alonso Moreno Carreno;POLO DEMOCRATICO ALTERNATIVO;36,0.0,0.0
PAIPA;FELIX DARIO TAMAYO TAMAYO;PARTIDO CONSERVADOR COLOMBIANO;504,PAIPA;Felix Dario Tamayo Tamayo;PARTIDO CONSERVADOR COLOMBIANO;504,0.0,0.0
PAIPA;FIDELIGNA LEGUIZAMON DE ALBA;POLO DEMOCRATICO ALTERNATIVO;12,PAIPA;Fideligna Leguizamon De Alba;POLO DEMOCRATICO ALTERNATIVO;12,0.0,0.0
PAIPA;FRANCISCO CESAR CALLEJAS MENDOZA;PARTIDO SOCIAL DE UNIDAD NACIONAL;362,PAIPA;Francisco Cesar Callejas Mendoza;PARTIDO SOCIAL DE UNIDAD NACIONAL;362,0.0,0.0
PAIPA;FRANCISCO JAVIER MONROY RAMIREZ;PARTIDO SOCIAL DE UNIDAD NACIONAL;215,PAIPA;Francisco Javier Monroy Ramirez;PARTIDO SOCIAL DE UNIDAD NACIONAL;215,0.0,0.0
PAIPA;GILBERTO MEDINA TAMAYO;PARTIDO VERDE;374,PAIPA;Gilberto Medina Tamayo;PARTIDO VERDE;374,0.0,0.0
PAIPA;HEIDY YOVANNA PORRAS QUIROZ;POLO DEMOCRATICO ALTERNATIVO;9,PAIPA;Heidy Yovanna Porras Quiroz;POLO DEMOCRATICO ALTERNATIVO;9,0.0,0.0
PAIPA;HELVER HERNAN SALOMON RUIZ;PARTIDO ALIANZA SOCIAL INDEPENDIENTE;192,PAIPA;Helver Hernan Salomon Ruiz;PARTIDO ALIANZA SOCIAL INDEPENDIENTE;192,0.0,0.0
PAIPA;HENRY CERINZA CERINZA LEAL;PARTIDO VERDE;14,PAIPA;Henry Cerinza Cerinza Leal;PARTIDO VERDE;14,0.0,0.0
PAIPA;HERLVER OSWALDO CHAPARRO QUIJANO;PARTIDO SOCIAL DE UNIDAD NACIONAL;212,PAIPA;Herlver Oswaldo Chaparro Quijano;PARTIDO SOCIAL DE UNIDAD NACIONAL;212,0.0,0.0
PAIPA;HUMBERTO VALDERRAMA VALDERRAMA;PARTIDO CONSERVADOR COLOMBIANO;290,PAIPA;Humberto Valderrama Valderrama;PARTIDO CONSERVADOR COLOMBIANO;290,0.0,0.0
PAIPA;IRMA PATRICIA RODRIGUEZ CASALLAS;POLO DEMOCRATICO ALTERNATIVO;25,PAIPA;Irma Patricia Rodriguez Casallas;POLO DEMOCRATICO ALTERNATIVO;25,0.0,0.0
PAIPA;ISIDRO ALEXANDER LACHE SANDOVAL;PARTIDO LIBERAL COLOMBIANO;488,PAIPA;Isidro Alexander Lache Sandoval;PARTIDO LIBERAL COLOMBIANO;488,0.0,0.0
PAIPA;IVAN ALEXANDER VELANDIA SUAREZ;PARTIDO VERDE;244,PAIPA;Ivan Alexander Velandia Suarez;PARTIDO VERDE;244,0.0,0.0
PAIPA;JAIME EDGARDO VALDERRAMA OCHOA;PARTIDO ALIANZA SOCIAL INDEPENDIENTE;231,PAIPA;Jaime Edgardo Valderrama Ochoa;PARTIDO ALIANZA SOCIAL INDEPENDIENTE;231,0.0,0.0
PAIPA;JAIRO ALBERTO ECHEVERRIA TEJADA;PARTIDO LIBERAL COLOMBIANO;65,PAIPA;Jairo Alberto Echeverria Tejada;PARTIDO LIBERAL COLOMBIANO;65,0.0,0.0
PAIPA;JAVIER OSWALDO RODRIGUEZ ROMERO;PARTIDO SOCIAL DE UNIDAD NACIONAL;40,PAIPA;Javier Oswaldo Rodriguez Romero;PARTIDO SOCIAL DE UNIDAD NACIONAL;40,0.0,0.0
PAIPA;JENNY FABIOLA FIGUEREDO MOLANO;POLO DEMOCRATICO ALTERNATIVO;6,PAIPA;Jenny Fabiola Figueredo Molano;POLO DEMOCRATICO ALTERNATIVO;6,0.0,0.0
PAIPA;JORGE ANTONIO RIVADENEIRA ZAFRA;PARTIDO SOCIAL DE UNIDAD NACIONAL;85,PAIPA;Jorge Antonio Rivadeneira Zafra;PARTIDO SOCIAL DE UNIDAD NACIONAL;85,0.0,0.0
PAIPA;JOSE ANGEL RAMIREZ ESPITIA;PARTIDO SOCIAL DE UNIDAD NACIONAL;267,PAIPA;Jose Angel Ramirez Espitia;PARTIDO SOCIAL DE UNIDAD NACIONAL;267,0.0,0.0
PAIPA;JOSE ANTONIO SALAZAR OTALORA;PARTIDO VERDE;371,PAIPA;Jose Antonio Salazar Otalora;PARTIDO VERDE;371,0.0,0.0
PAIPA;JOSE ESTEBAN PACHECO CAMARGO;PARTIDO CONSERVADOR COLOMBIANO;299,PAIPA;Jose Esteban Pacheco Camargo;PARTIDO CONSERVADOR COLOMBIANO;299,0.0,0.0
PAIPA;JOSE MEDARDO LEGUIZAMO DIAZ;POLO DEMOCRATICO ALTERNATIVO;365,PAIPA;Jose Medardo Leguizamo Diaz;POLO DEMOCRATICO ALTERNATIVO;365,0.0,0.0
PAIPA;JUAN CARLOS ROBERTO PINTO;PARTIDO VERDE;98,PAIPA;Juan Carlos Roberto Pinto;PARTIDO VERDE;98,0.0,0.0
PAIPA;JUAN FRANCISCO PUERTO NUNEZ;PARTIDO SOCIAL DE UNIDAD NACIONAL;226,PAIPA;Juan Francisco Puerto Nunez;PARTIDO SOCIAL DE UNIDAD NACIONAL;226,0.0,0.0
PAIPA;KAROL LUCIA SISSA PAIBA;PARTIDO VERDE;35,PAIPA;Karol Lucia Sissa Paiba;PARTIDO VERDE;35,0.0,0.0
PAIPA;LAZARO MARTINEZ CRUZ;PARTIDO ALIANZA SOCIAL INDEPENDIENTE;55,PAIPA;Lazaro Martinez Cruz;PARTIDO ALIANZA SOCIAL INDEPENDIENTE;55,0.0,0.0
PAIPA;LEIDY CAMARGO;PARTIDO SOCIAL DE UNIDAD NACIONAL;108,PAIPA;Leidy Camargo;PARTIDO SOCIAL DE UNIDAD NACIONAL;108,0.0,0.0
PAIPA;LEONELL ALFREDO RODRIGUEZ RODRIGUEZ;PARTIDO CONSERVADOR COLOMBIANO;301,PAIPA;Leonell Alfredo Rodriguez Rodriguez;PARTIDO CONSERVADOR COLOMBIANO;301,0.0,0.0
PAIPA;LUIS ALBERTO GARCIA RANGEL;MOVIMIENTO MIRA;26,PAIPA;Luis Alberto Garcia Rangel;MOVIMIENTO MIRA;26,0.0,0.0
PAIPA;LUIS ALEJANDRO PACHECO CAMARGO;POLO DEMOCRATICO ALTERNATIVO;135,PAIPA;Luis Alejandro Pacheco Camargo;POLO DEMOCRATICO ALTERNATIVO;135,0.0,0.0
PAIPA;LUIS ALEJANDRO SANCHEZ RODRIGUEZ;PARTIDO CAMBIO RADICAL;103,PAIPA;Luis Alejandro Sanchez Rodriguez;PARTIDO CAMBIO RADICAL;103,0.0,0.0
PAIPA;LUIS ERNESTO ORTIZ RUIZ;PARTIDO ALIANZA SOCIAL INDEPENDIENTE;175,PAIPA;Luis Ernesto Ortiz Ruiz;PARTIDO ALIANZA SOCIAL INDEPENDIENTE;175,0.0,0.0
PAIPA;LUIS FRANCISCO SANABRIA RODRIGUEZ;PARTIDO CAMBIO RADICAL;39,PAIPA;Luis Francisco Sanabria Rodriguez;PARTIDO CAMBIO RADICAL;39,0.0,0.0
PAIPA;LUIS GERMAN RODRIGUEZ DIAZ;PARTIDO LIBERAL COLOMBIANO;332,PAIPA;Luis German Rodriguez Diaz;PARTIDO LIBERAL COLOMBIANO;332,0.0,0.0
PAIPA;LUIS GUILLERMO REYES RODRIGUEZ;PARTIDO LIBERAL COLOMBIANO;340,PAIPA;Luis Guillermo Reyes Rodriguez;PARTIDO LIBERAL COLOMBIANO;340,0.0,0.0
PAIPA;LUZ MERY RINCON PACHECO;PARTIDO ALIANZA SOCIAL INDEPENDIENTE;9,PAIPA;Luz Mery Rincon Pacheco;PARTIDO ALIANZA SOCIAL INDEPENDIENTE;9,0.0,0.0
PAIPA;MANUEL DOLORES MARINO JIMENEZ;POLO DEMOCRATICO ALTERNATIVO;20,PAIPA;Manuel Dolores Marino Jimenez;POLO DEMOCRATICO ALTERNATIVO;20,0.0,0.0
PAIPA;MANUEL HUGO GALEANO HURTADO;PARTIDO VERDE;243,PAIPA;Manuel Hugo Galeano Hurtado;PARTIDO VERDE;243,0.0,0.0
PAIPA;MARCO EFREN CELIS ALBARRACIN;PARTIDO LIBERAL COLOMBIANO;79,PAIPA;Marco Efren Celis Albarracin;PARTIDO LIBERAL COLOMBIANO;79,0.0,0.0
PAIPA;MARIA DEL CARMEN VARGAS PUERTO;PARTIDO ALIANZA SOCIAL INDEPENDIENTE;146,PAIPA;Maria Del Carmen Vargas Puerto;PARTIDO ALIANZA SOCIAL INDEPENDIENTE;146,0.0,0.0
PAIPA;MARIA FRANCY MOLANO MATEUS;POLO DEMOCRATICO ALTERNATIVO;5,PAIPA;Maria Francy Molano Mateus;POLO DEMOCRATICO ALTERNATIVO;5,0.0,0.0
PAIPA;MARIA YANNETH FONSECA AVELLANEDA;PARTIDO ALIANZA SOCIAL INDEPENDIENTE;442,PAIPA;Maria Yanneth Fonseca Avellaneda;PARTIDO ALIANZA SOCIAL INDEPENDIENTE;442,0.0,0.0
PAIPA;MARIO CESAR MEJIA ZABALA;MOVIMIENTO MIRA;38,PAIPA;Mario Cesar Mejia Zabala;MOVIMIENTO MIRA;38,0.0,0.0
PAIPA;MARTHA ALICIA LAVERDE RAMIREZ;POLO DEMOCRATICO ALTERNATIVO;55,PAIPA;Martha Alicia Laverde Ramirez;POLO DEMOCRATICO ALTERNATIVO;55,0.0,0.0
PAIPA;MAYERLINE DUENEZ PACHECO;PARTIDO CONSERVADOR COLOMBIANO;12,PAIPA;Mayerline Duenez Pacheco;PARTIDO CONSERVADOR COLOMBIANO;12,0.0,0.0
PAIPA;MERY LUZ GUTIERREZ BENAVIDES;PARTIDO CAMBIO RADICAL;9,PAIPA;Mery Luz Gutierrez Benavides;PARTIDO CAMBIO RADICAL;9,0.0,0.0
PAIPA;MIGUEL ANGEL ZANGUNA ESPINOSA;PARTIDO CAMBIO RADICAL;190,PAIPA;Miguel Angel Zanguna Espinosa;PARTIDO CAMBIO RADICAL;190,0.0,0.0
PAIPA;MIRIAM EMILSE PUERTO AVENDANO;PARTIDO LIBERAL COLOMBIANO;28,PAIPA;Miriam Emilse Puerto Avendano;PARTIDO LIBERAL COLOMBIANO;28,0.0,0.0
PAIPA;MOVIMIENTO MIRA;MOVIMIENTO MIRA;20,PAIPA;Movimiento Mira;Movimiento Mira;20,0.0,0.0
PAIPA;NUBIA TRANSITO ACOSTA MATEUS;PARTIDO CAMBIO RADICAL;23,PAIPA;Nubia Transito Acosta Mateus;PARTIDO CAMBIO RADICAL;23,0.0,0.0
PAIPA;OLGA LUCIA VARGAS AVENDANO;PARTIDO LIBERAL COLOMBIANO;206,PAIPA;Olga Lucia Vargas Avendano;PARTIDO LIBERAL COLOMBIANO;206,0.0,0.0
PAIPA;ORLANDO LOPEZ GUTIERREZ;PARTIDO LIBERAL COLOMBIANO;135,PAIPA;Orlando Lopez Gutierrez;PARTIDO LIBERAL COLOMBIANO;135,0.0,0.0
PAIPA;PABLO CESAR CEPEDA DIAZ;PARTIDO ALIANZA SOCIAL INDEPENDIENTE;117,PAIPA;Pablo Cesar Cepeda Diaz;PARTIDO ALIANZA SOCIAL INDEPENDIENTE;117,0.0,0.0
PAIPA;PARTIDO ALIANZA SOCIAL INDEPENDIENTE;PARTIDO ALIANZA SOCIAL INDEPENDIENTE;39,PAIPA;Partido Alianza Social Independiente;Partido Alianza Social Independiente;39,0.0,0.0
PAIPA;PARTIDO CAMBIO RADICAL;PARTIDO CAMBIO RADICAL;14,PAIPA;Partido Cambio Radical;Partido Cambio Radical;14,0.0,0.0
PAIPA;PARTIDO CONSERVADOR COLOMBIANO;PARTIDO CONSERVADOR COLOMBIANO;66,PAIPA;Partido Conservador Colombiano;Partido Conservador Colombiano;66,0.0,0.0
PAIPA;PARTIDO LIBERAL COLOMBIANO;PARTIDO LIBERAL COLOMBIANO;85,PAIPA;Partido Liberal Colombiano;Partido Liberal Colombiano;85,0.0,0.0
PAIPA;PARTIDO SOCIAL DE UNIDAD NACIONAL;PARTIDO SOCIAL DE UNIDAD NACIONAL;184,PAIPA;Partido Social De Unidad Nacional;Partido Social De Unidad Nacional;184,0.0,0.0
PAIPA;PARTIDO VERDE;PARTIDO VERDE;137,PAIPA;Partido Verde;Partido Verde;137,0.0,0.0
PAIPA;PIEDAD LOPEZ LAYA;MOVIMIENTO MIRA;8,PAIPA;Piedad Lopez Laya;MOVIMIENTO MIRA;8,0.0,0.0
PAIPA;POLO DEMOCRATICO ALTERNATIVO;POLO DEMOCRATICO ALTERNATIVO;19,PAIPA;Polo Democratico Alternativo;Polo Democratico Alternativo;19,0.0,0.0
PAIPA;RAFAEL ANTONIO LARA RODRIGUEZ;PARTIDO ALIANZA SOCIAL INDEPENDIENTE;143,PAIPA;Rafael Antonio Lara Rodriguez;PARTIDO ALIANZA SOCIAL INDEPENDIENTE;143,0.0,0.0
PAIPA;ROBINSON LARROTTA RODRIGUEZ;PARTIDO VERDE;659,PAIPA;Robinson Larrotta Rodriguez;PARTIDO VERDE;659,0.0,0.0
PAIPA;RODOLFO EMIRO MEDINA PUERTO;POLO DEMOCRATICO ALTERNATIVO;15,PAIPA;Rodolfo Emiro Medina Puerto;POLO DEMOCRATICO ALTERNATIVO;15,0.0,0.0
PAIPA;RODRIGO JACINTO VASQUEZ AGUDELO;PARTIDO LIBERAL COLOMBIANO;65,PAIPA;Rodrigo Jacinto Vasquez Agudelo;PARTIDO LIBERAL COLOMBIANO;65,0.0,0.0
PAIPA;ROSA MARIA RODRIGUEZ RODRIGUEZ;MOVIMIENTO MIRA;76,PAIPA;Rosa Maria Rodriguez Rodriguez;MOVIMIENTO MIRA;76,0.0,0.0
PAIPA;SEGUNDO FRANCISCO ALBARRACIN MORENO;PARTIDO ALIANZA SOCIAL INDEPENDIENTE;26,PAIPA;Segundo Francisco Albarracin Moreno;PARTIDO ALIANZA SOCIAL INDEPENDIENTE;26,0.0,0.0
PAIPA;VICTOR JULIO AVELLANEDA HURTADO;PARTIDO ALIANZA SOCIAL INDEPENDIENTE;287,PAIPA;Victor Julio Avellaneda Hurtado;PARTIDO ALIANZA SOCIAL INDEPENDIENTE;287,0.0,0.0
PAIPA;VICTOR MANUEL CAMARGO CAMARGO;MOVIMIENTO MIRA;68,PAIPA;Victor Manuel Camargo Camargo;MOVIMIENTO MIRA;68,0.0,0.0
PAIPA;WILSON RENE PATARROYO DIAZ;PARTIDO CONSERVADOR COLOMBIANO;340,PAIPA;Wilson Rene Patarroyo Diaz;PARTIDO CONSERVADOR COLOMBIANO;340,0.0,0.0
PAIPA;YAMIL ARMANDO YATE CHINOME;PARTIDO VERDE;288,PAIPA;Yamil Armando Yate Chinome;PARTIDO VERDE;288,0.0,0.0
PAIPA;YURANY LOPEZ ALVAREZ;PARTIDO LIBERAL COLOMBIANO;57,PAIPA;Yurany Lopez Alvarez;PARTIDO LIBERAL COLOMBIANO;57,0.0,0.0
PAJARITO;AGUSTIN PEREZ ALARCON;PARTIDO LIBERAL COLOMBIANO;18,PAJARITO;Agustin Perez Alarcon;PARTIDO LIBERAL COLOMBIANO;18,0.0,0.0
PAJARITO;ALIRIO SALCEDO INOCENCIO;PARTIDO VERDE;10,PAJARITO;Alirio Salcedo Inocencio;PARTIDO VERDE;10,0.0,0.0
PAJARITO;ALYS AVELLA MONTANA;PARTIDO CAMBIO RADICAL;68,PAJARITO;Alys Avella Montana;PARTIDO CAMBIO RADICAL;68,0.0,0.0
PAJARITO;ANA ELISA GARNICA GOMEZ;PARTIDO VERDE;19,PAJARITO;Ana Elisa Garnica Gomez;PARTIDO VERDE;19,0.0,0.0
PAJARITO;ANGEL MARIA PEREZ JIMENEZ;PARTIDO VERDE;28,PAJARITO;Angel Maria Perez Jimenez;PARTIDO VERDE;28,0.0,0.0
PAJARITO;ATILANO MIRANDA CIFUENTES;PARTIDO CAMBIO RADICAL;46,PAJARITO;Atilano Miranda Cifuentes;PARTIDO CAMBIO RADICAL;46,0.0,0.0
PAJARITO;BILMA ESPERANZA LOPEZ CAMARGO;PARTIDO CAMBIO RADICAL;33,PAJARITO;Bilma Esperanza Lopez Camargo;PARTIDO CAMBIO RADICAL;33,0.0,0.0
PAJARITO;CARLOS ARTURO CRUZ VIASUS;PARTIDO SOCIAL DE UNIDAD NACIONAL;47,PAJARITO;Carlos Arturo Cruz Viasus;PARTIDO SOCIAL DE UNIDAD NACIONAL;47,0.0,0.0
PAJARITO;CENEN RODRIGUEZ BARRERA;PARTIDO CAMBIO RADICAL;44,PAJARITO;Cenen Rodriguez Barrera;PARTIDO CAMBIO RADICAL;44,0.0,0.0
PAJARITO;CLAUDIA ISABEL CARDENAS SANCHEZ;PARTIDO SOCIAL DE UNIDAD NACIONAL;91,PAJARITO;Claudia Isabel Cardenas Sanchez;PARTIDO SOCIAL DE UNIDAD NACIONAL;91,0.0,0.0
PAJARITO;CLAUDIA MARCELA GOMEZ;PARTIDO LIBERAL COLOMBIANO;28,PAJARITO;Claudia Marcela Gomez;PARTIDO LIBERAL COLOMBIANO;28,0.0,0.0
PAJARITO;GUILLERMO MONROY SANCHEZ;PARTIDO CAMBIO RADICAL;73,PAJARITO;Guillermo Monroy Sanchez;PARTIDO CAMBIO RADICAL;73,0.0,0.0
PAJARITO;HEIDI MARYURY FORERO TORRES;PARTIDO SOCIAL DE UNIDAD NACIONAL;94,PAJARITO;Heidi Maryury Forero Torres;PARTIDO SOCIAL DE UNIDAD NACIONAL;94,0.0,0.0
PAJARITO;HELIO JOSUE MONTANA RIVEROS;PARTIDO VERDE;45,PAJARITO;Helio Josue Montana Riveros;PARTIDO VERDE;45,0.0,0.0
PAJARITO;HUGO VILLAMARIN SUAREZ;PARTIDO VERDE;105,PAJARITO;Hugo Villamarin Suarez;PARTIDO VERDE;105,0.0,0.0
PAJARITO;ISRAEL ANGARITA CETINA;PARTIDO SOCIAL DE UNIDAD NACIONAL;28,PAJARITO;Israel Angarita Cetina;PARTIDO SOCIAL DE UNIDAD NACIONAL;28,0.0,0.0
PAJARITO;JAIME SANCHEZ CRUZ;PARTIDO SOCIAL DE UNIDAD NACIONAL;114,PAJARITO;Jaime Sanchez Cruz;PARTIDO SOCIAL DE UNIDAD NACIONAL;114,0.0,0.0
PAJARITO;JAVIER GRACIANO NINO BECERRA;PARTIDO SOCIAL DE UNIDAD NACIONAL;107,PAJARITO;Javier Graciano Nino Becerra;PARTIDO SOCIAL DE UNIDAD NACIONAL;107,0.0,0.0
PAJARITO;LUZ DARY HUERTAS MECHE;PARTIDO SOCIAL DE UNIDAD NACIONAL;3,PAJARITO;Luz Dary Huertas Meche;PARTIDO SOCIAL DE UNIDAD NACIONAL;3,0.0,0.0
PAJARITO;MARIA YENITH RINCON;PARTIDO VERDE;17,PAJARITO;Maria Yenith Rincon;PARTIDO VERDE;17,0.0,0.0
PAJARITO;MIGUEL MONTANA RIVERA;PARTIDO LIBERAL COLOMBIANO;14,PAJARITO;Miguel Montana Rivera;PARTIDO LIBERAL COLOMBIANO;14,0.0,0.0
PAJARITO;PARTIDO CAMBIO RADICAL;PARTIDO CAMBIO RADICAL;8,PAJARITO;Partido Cambio Radical;Partido Cambio Radical;8,0.0,0.0
PAJARITO;PARTIDO LIBERAL COLOMBIANO;PARTIDO LIBERAL COLOMBIANO;12,PAJARITO;Partido Liberal Colombiano;Partido Liberal Colombiano;12,0.0,0.0
PAJARITO;PARTIDO SOCIAL DE UNIDAD NACIONAL;PARTIDO SOCIAL DE UNIDAD NACIONAL;20,PAJARITO;Partido Social De Unidad Nacional;Partido Social De Unidad Nacional;20,0.0,0.0
PAJARITO;PARTIDO VERDE;PARTIDO VERDE;4,PAJARITO;Partido Verde;Partido Verde;4,0.0,0.0
PAJARITO;PEDRO ANTONIO LEON PEREZ;PARTIDO LIBERAL COLOMBIANO;13,PAJARITO;Pedro Antonio Leon Perez;PARTIDO LIBERAL COLOMBIANO;13,0.0,0.0
PAJARITO;YESICA NATALIA ROJAS NARANJO;PARTIDO LIBERAL COLOMBIANO;23,PAJARITO;Yesica Natalia Rojas Naranjo;PARTIDO LIBERAL COLOMBIANO;23,0.0,0.0
PAJARITO;YONFREDY SALAMANCA;PARTIDO LIBERAL COLOMBIANO;40,PAJARITO;Yonfredy Salamanca;PARTIDO LIBERAL COLOMBIANO;40,0.0,0.0
PANQUEBA;ALIX ALBARRACIN DE MOJICA;PARTIDO CONSERVADOR COLOMBIANO;63,PANQUEBA;Alix Albarracin De Mojica;PARTIDO CONSERVADOR COLOMBIANO;63,0.0,0.0
PANQUEBA;ANAMINTA BUSTACARA OCHOA;PARTIDO CONSERVADOR COLOMBIANO;35,PANQUEBA;Anaminta Bustacara Ochoa;PARTIDO CONSERVADOR COLOMBIANO;35,0.0,0.0
PANQUEBA;ANASTACIO SUAREZ LIZARAZO;PARTIDO LIBERAL COLOMBIANO;5,PANQUEBA;Anastacio Suarez Lizarazo;PARTIDO LIBERAL COLOMBIANO;5,0.0,0.0
PANQUEBA;AURA CECILIA NIETO VELANDIA;PARTIDO SOCIAL DE UNIDAD NACIONAL;107,PANQUEBA;Aura Cecilia Nieto Velandia;PARTIDO SOCIAL DE UNIDAD NACIONAL;107,0.0,0.0
PANQUEBA;BEATRIZ SILVA ZAMBRANO;PARTIDO SOCIAL DE UNIDAD NACIONAL;44,PANQUEBA;Beatriz Silva Zambrano;PARTIDO SOCIAL DE UNIDAD NACIONAL;44,0.0,0.0
PANQUEBA;CAYO SUA CORREA;PARTIDO SOCIAL DE UNIDAD NACIONAL;71,PANQUEBA;Cayo Sua Correa;PARTIDO SOCIAL DE UNIDAD NACIONAL;71,0.0,0.0
PANQUEBA;CIRO ANTONIO ROMERO GARCIA;PARTIDO SOCIAL DE UNIDAD NACIONAL;106,PANQUEBA;Ciro Antonio Romero Garcia;PARTIDO SOCIAL DE UNIDAD NACIONAL;106,0.0,0.0
PANQUEBA;FLOR OLIVA ESTUPINAN VELAZCO;PARTIDO LIBERAL COLOMBIANO;5,PANQUEBA;Flor Oliva Estupinan Velazco;PARTIDO LIBERAL COLOMBIANO;5,0.0,0.0
PANQUEBA;HECTOR ORLANDO MARTINEZ DURAN;PARTIDO LIBERAL COLOMBIANO;1,PANQUEBA;Hector Orlando Martinez Duran;PARTIDO LIBERAL COLOMBIANO;1,0.0,0.0
PANQUEBA;JAIRO GUILLERMO PEREZ PEREZ;PARTIDO CONSERVADOR COLOMBIANO;45,PANQUEBA;Jairo Guillermo Perez Perez;PARTIDO CONSERVADOR COLOMBIANO;45,0.0,0.0
PANQUEBA;JAIRO WILCHES PUENTES;PARTIDO LIBERAL COLOMBIANO;87,PANQUEBA;Jairo Wilches Puentes;PARTIDO LIBERAL COLOMBIANO;87,0.0,0.0
PANQUEBA;JAVIER FERNANDO ROJAS BETANCOURT;PARTIDO LIBERAL COLOMBIANO;74,PANQUEBA;Javier Fernando Rojas Betancourt;PARTIDO LIBERAL COLOMBIANO;74,0.0,0.0
PANQUEBA;JOSE ARMANDO BARRERA VELANDIA;PARTIDO CONSERVADOR COLOMBIANO;54,PANQUEBA;Jose Armando Barrera Velandia;PARTIDO CONSERVADOR COLOMBIANO;54,0.0,0.0
PANQUEBA;LUIS ALBERTO VELANDIA HURTADO;PARTIDO SOCIAL DE UNIDAD NACIONAL;60,PANQUEBA;Luis Alberto Velandia Hurtado;PARTIDO SOCIAL DE UNIDAD NACIONAL;60,0.0,0.0
PANQUEBA;LUIS ALFONSO ESTUPINAN;PARTIDO SOCIAL DE UNIDAD NACIONAL;36,PANQUEBA;Luis Alfonso Estupinan;PARTIDO SOCIAL DE UNIDAD NACIONAL;36,0.0,0.0
PANQUEBA;LUIS ALFREDO CARRILLO MARTINEZ;PARTIDO CONSERVADOR COLOMBIANO;35,PANQUEBA;Luis Alfredo Carrillo Martinez;PARTIDO CONSERVADOR COLOMBIANO;35,0.0,0.0
PANQUEBA;LUIS GABRIEL ROMERO DUARTE;PARTIDO CONSERVADOR COLOMBIANO;35,PANQUEBA;Luis Gabriel Romero Duarte;PARTIDO CONSERVADOR COLOMBIANO;35,0.0,0.0
PANQUEBA;MARIA TERESA VELASQUEZ MORENO;PARTIDO SOCIAL DE UNIDAD NACIONAL;94,PANQUEBA;Maria Teresa Velasquez Moreno;PARTIDO SOCIAL DE UNIDAD NACIONAL;94,0.0,0.0
PANQUEBA;PARTIDO CONSERVADOR COLOMBIANO;PARTIDO CONSERVADOR COLOMBIANO;11,PANQUEBA;Partido Conservador Colombiano;Partido Conservador Colombiano;11,0.0,0.0
PANQUEBA;PARTIDO LIBERAL COLOMBIANO;PARTIDO LIBERAL COLOMBIANO;5,PANQUEBA;Partido Liberal Colombiano;Partido Liberal Colombiano;5,0.0,0.0
PANQUEBA;PARTIDO SOCIAL DE UNIDAD NACIONAL;PARTIDO SOCIAL DE UNIDAD NACIONAL;10,PANQUEBA;Partido Social De Unidad Nacional;Partido Social De Unidad Nacional;10,0.0,0.0
PANQUEBA;ROSATILIA RINCON NINO;PARTIDO LIBERAL COLOMBIANO;9,PANQUEBA;Rosatilia Rincon Nino;PARTIDO LIBERAL COLOMBIANO;9,0.0,0.0
PAUNA;ANA FIDELIA DELGADILLO DELGADILLO;PARTIDO SOCIAL DE UNIDAD NACIONAL;45,PAUNA;Ana Fidelia Delgadillo Delgadillo;PARTIDO SOCIAL DE UNIDAD NACIONAL;45,0.0,0.0
PAUNA;ANA MERCEDES SALAZAR BALLEN;PARTIDO CONSERVADOR COLOMBIANO;302,PAUNA;Ana Mercedes Salazar Ballen;PARTIDO CONSERVADOR COLOMBIANO;302,0.0,0.0
PAUNA;ANGEL CUSTODIO CASTRO BENITEZ;PARTIDO VERDE;6,PAUNA;Angel Custodio Castro Benitez;PARTIDO VERDE;6,0.0,0.0
PAUNA;CARLOS ANDRES CANDELA MURCIA;PARTIDO CAMBIO RADICAL;33,PAUNA;Carlos Andres Candela Murcia;PARTIDO CAMBIO RADICAL;33,0.0,0.0
PAUNA;CESAR ANDRES VARGAS RODRIGUEZ;PARTIDO CONSERVADOR COLOMBIANO;155,PAUNA;Cesar Andres Vargas Rodriguez;PARTIDO CONSERVADOR COLOMBIANO;155,0.0,0.0
PAUNA;CORNELIO TIQUE PRADA;PARTIDO DE INTEGRACION NACIONAL;63,PAUNA;Cornelio Tique Prada;PARTIDO DE INTEGRACION NACIONAL;63,0.0,0.0
PAUNA;DIANA RAQUEL DIAZ ZAPATA;PARTIDO VERDE;164,PAUNA;Diana Raquel Diaz Zapata;PARTIDO VERDE;164,0.0,0.0
