MUNNOMBRE;CANNOMBRE;PARNOMBRE;VOTOS
SANTA SOFIA;GONZALEZ GAMBA VIDALIA;PARTIDO VERDE;7
SANTA SOFIA;PADILLA MALAGON YOVANNA;PARTIDO CAMBIO RADICAL;6
SANTA SOFIA;CONTRERAS BERMUDEZ ANGELA MARCELA;PARTIDO VERDE;5
SANTA SOFIA;PARTIDO VERDE;PARTIDO VERDE;5
SANTANA;MORENO WALTEROS RAUL FERNANDO;PARTIDO ALIANZA SOCIAL INDEPENDIENTE;393
SANTANA;SANCHEZ CORONADO CARLOS IVAN;PARTIDO ALIANZA SOCIAL INDEPENDIENTE;314
SANTANA;VEGA GUIZA RICARDO;PARTIDO SOCIAL DE UNIDAD NACIONAL;209
SANTANA;DELGADO ZARATE JOSE DEL CARMEN;PARTIDO SOCIAL DE UNIDAD NACIONAL;208
SANTANA;PENA MORALES RODOLFO;PARTIDO SOCIAL DE UNIDAD NACIONAL;205
SANTANA;NEIRA RUIZ PAUL ARTURO;PARTIDO SOCIAL DE UNIDAD NACIONAL;196
SANTANA;PINZON RAMIREZ LUIS FRANCISCO;PARTIDO ALIANZA SOCIAL INDEPENDIENTE;191
SANTANA;CHACON MOYA LORENZO;PARTIDO ALIANZA SOCIAL INDEPENDIENTE;189
SANTANA;SANTOYO DELGADO LIBIA ASTRID;PARTIDO SOCIAL DE UNIDAD NACIONAL;178
SANTANA;RUIZ MORA MILTON;PARTIDO ALIANZA SOCIAL INDEPENDIENTE;146
SANTANA;NOGUERA HERNANDEZ JORGE ARMANDO;PARTIDO SOCIAL DE UNIDAD NACIONAL;144
SANTANA;RIVERA AMADO JUAN ALBERTO;PARTIDO LIBERAL COLOMBIANO;134
SANTANA;FINO HERNANDEZ FREDY FERNANDO;PARTIDO VERDE;128
SANTANA;NOGUERA GAMBOA FABIAN ALBERTO;PARTIDO LIBERAL COLOMBIANO;120
SANTANA;ALARCON URREA SIGIFREDO;PARTIDO SOCIAL DE UNIDAD NACIONAL;118
SANTANA;CAMACHO CAMACHO ALVARO;PARTIDO ALIANZA SOCIAL INDEPENDIENTE;111
SANTANA;TAMAYO CARDENAS ANDRES FELIPE;PARTIDO LIBERAL COLOMBIANO;85
SANTANA;ANGULO RODRIGUEZ PEDRO NEL;PARTIDO VERDE;84
SANTANA;AREVALO SOSA BERNARDO;PARTIDO LIBERAL COLOMBIANO;79
SANTANA;PARTIDO ALIANZA SOCIAL INDEPENDIENTE;PARTIDO ALIANZA SOCIAL INDEPENDIENTE;65
SANTANA;GAMBOA CHACON ELBER;PARTIDO VERDE;57
SANTANA;PARTIDO SOCIAL DE UNIDAD NACIONAL;PARTIDO SOCIAL DE UNIDAD NACIONAL;57
SANTANA;FAJARDO MOSQUERA JULIETA;PARTIDO LIBERAL COLOMBIANO;56
SANTANA;PARTIDO LIBERAL COLOMBIANO;PARTIDO LIBERAL COLOMBIANO;53
SANTANA;CRUZ FONTECHA STELLA;PARTIDO LIBERAL COLOMBIANO;47
SANTANA;NINO BENAVIDES RAMIRO;PARTIDO VERDE;47
SANTANA;QUITIAN RODRIGUEZ AYDE;PARTIDO ALIANZA SOCIAL INDEPENDIENTE;45
SANTANA;BOLIVAR HURTADO HECTOR JOSE;PARTIDO VERDE;36
SANTANA;VARGAS OSTOS HELENA;PARTIDO ALIANZA SOCIAL INDEPENDIENTE;20
SANTANA;MORENO RODRIGUEZ JENNY ALIDA;PARTIDO SOCIAL DE UNIDAD NACIONAL;19
SANTANA;OLARTE RAMIREZ LIBARDO;PARTIDO VERDE;18
SANTANA;FERNANDEZ MUNOZ GLORIA ISABEL;PARTIDO LIBERAL COLOMBIANO;17
SANTANA;PARTIDO VERDE;PARTIDO VERDE;15
SANTANA;HERNANDEZ CRISTANCHO SANDRA PATRICIA;PARTIDO SOCIAL DE UNIDAD NACIONAL;10
SANTANA;BERMUDEZ SUAREZ ROSA XIOMARA;PARTIDO ALIANZA SOCIAL INDEPENDIENTE;6
SANTANA;ZARATE QUIROGA LEIDY PAOLA;PARTIDO VERDE;6
SANTANA;VILLAMIL CUCA NELCY;PARTIDO VERDE;5
SANTANA;CORREDOR MEJIA LEIDY CATHERINE;PARTIDO VERDE;3
SATIVANORTE;MARTINEZ GOMEZ HILARIO;PARTIDO SOCIAL DE UNIDAD NACIONAL;164
SATIVANORTE;GOMEZ QUINTERO BLANCA INES;PARTIDO CONSERVADOR COLOMBIANO;108
SATIVANORTE;APARICIO MONSALVE GUILLERMO;PARTIDO CONSERVADOR COLOMBIANO;102
SATIVANORTE;AVILA MARIA CLAUDIA;PARTIDO CONSERVADOR COLOMBIANO;86
SATIVANORTE;GOMEZ ARENAS HUGO BAYARDO;PARTIDO CONSERVADOR COLOMBIANO;83
SATIVANORTE;VELANDIA SANDOVAL IRMA YINETH;PARTIDO SOCIAL DE UNIDAD NACIONAL;83
SATIVANORTE;GOMEZ SANDOVAL AURA ALICIA;PARTIDO CONSERVADOR COLOMBIANO;80
SATIVANORTE;MEJIA HIGUERA JOSE ELICIO;PARTIDO VERDE;79
SATIVANORTE;FIGUEREDO BAEZ OSCAR;PARTIDO DE INTEGRACION NACIONAL;73
SATIVANORTE;LIZARAZO MONSALVE JEISON;PARTIDO CAMBIO RADICAL;66
SATIVANORTE;NOVA CALDERON CARLOS GILBERTO;PARTIDO CONSERVADOR COLOMBIANO;66
SATIVANORTE;AVILA RODRIGUEZ JEFFERSON;PARTIDO SOCIAL DE UNIDAD NACIONAL;64
SATIVANORTE;CORDOBA APARICIO JAIME;PARTIDO CONSERVADOR COLOMBIANO;64
SATIVANORTE;VELANDIA SANDOVAL ANA MARIELA;PARTIDO SOCIAL DE UNIDAD NACIONAL;63
SATIVANORTE;GOMEZ RONDEROS LUIS ESTEBAN;PARTIDO CAMBIO RADICAL;62
SATIVANORTE;QUINTERO GOMEZ SEGUNDO ARQUIMEDES;PARTIDO VERDE;55
SATIVANORTE;PEREZ PEREZ CARLOS JULIO;PARTIDO DE INTEGRACION NACIONAL;54
SATIVANORTE;QUINTERO APARICIO ELQUIN AUGUSTO;PARTIDO SOCIAL DE UNIDAD NACIONAL;52
SATIVANORTE;BAEZ SANCHEZ ISAIAS;PARTIDO VERDE;49
SATIVANORTE;DUARTE VICTOR JULIO;PARTIDO SOCIAL DE UNIDAD NACIONAL;42
SATIVANORTE;JOYA SANDOVAL MAURO ANTONIO;PARTIDO CAMBIO RADICAL;42
SATIVANORTE;PARTIDO SOCIAL DE UNIDAD NACIONAL;PARTIDO SOCIAL DE UNIDAD NACIONAL;40
SATIVANORTE;BAEZ SUAREZ SANDRA MILENA;PARTIDO VERDE;34
SATIVANORTE;BAEZ BAEZ ROSA MARIA;PARTIDO CAMBIO RADICAL;24
SATIVANORTE;PARTIDO VERDE;PARTIDO VERDE;18
SATIVANORTE;CAMACHO VELANDIA HENRY;PARTIDO DE INTEGRACION NACIONAL;15
SATIVANORTE;PARTIDO CONSERVADOR COLOMBIANO;PARTIDO CONSERVADOR COLOMBIANO;13
SATIVANORTE;OROZCO JOYA JOSEFINA;PARTIDO DE INTEGRACION NACIONAL;12
SATIVANORTE;OROZCO RONDEROS SILVIA VERONICA;PARTIDO DE INTEGRACION NACIONAL;12
SATIVANORTE;PALENCIA ESTUPINAN DIANA MAYERLY;PARTIDO CAMBIO RADICAL;12
SATIVANORTE;SALAZAR APARICIO FLOR FRANCISCA;PARTIDO VERDE;10
SATIVANORTE;APARICIO QUINTERO FABIO ALONSO;PARTIDO VERDE;9
SATIVANORTE;PARTIDO CAMBIO RADICAL;PARTIDO CAMBIO RADICAL;7
SATIVANORTE;GOMEZ RONDEROS ROSA HERMINIA;PARTIDO VERDE;6
SATIVANORTE;BLANCO LIZARAZO ALBA LUCIA;PARTIDO DE INTEGRACION NACIONAL;5
SATIVANORTE;PARTIDO DE INTEGRACION NACIONAL;PARTIDO DE INTEGRACION NACIONAL;4
SATIVANORTE;PATINO HERNANDEZ JAVIER;PARTIDO DE INTEGRACION NACIONAL;3
SATIVASUR;BARAJAS BLANCO NORBERTO;PARTIDO CONSERVADOR COLOMBIANO;92
SATIVASUR;DIAZ GOMEZ HENRY ALDEMAR;PARTIDO CONSERVADOR COLOMBIANO;89
SATIVASUR;MEJIA MEJIA NELSON ENRIQUE;PARTIDO LIBERAL COLOMBIANO;76
SATIVASUR;NOVA GUERRERO LELIS;PARTIDO SOCIAL DE UNIDAD NACIONAL;74
SATIVASUR;SALAZAR MARTINEZ JOSE IVAN;PARTIDO CONSERVADOR COLOMBIANO;70
SATIVASUR;MOJICA GARCIA JOSE LEONARDO;PARTIDO LIBERAL COLOMBIANO;52
SATIVASUR;SILVA LUIS ALFREDO;PARTIDO CONSERVADOR COLOMBIANO;48
SATIVASUR;PATINO CARLOS ABEL;PARTIDO LIBERAL COLOMBIANO;46
SATIVASUR;NOVA VELANDIA LIDYA ROCIO;PARTIDO CONSERVADOR COLOMBIANO;43
SATIVASUR;BARAJAS VEGA ANA ISABEL;PARTIDO CONSERVADOR COLOMBIANO;42
SATIVASUR;APARICIO LOPEZ ARAMINTA;PARTIDO CONSERVADOR COLOMBIANO;41
SATIVASUR;MEJIA PITA MARY NELCY;PARTIDO LIBERAL COLOMBIANO;40
SATIVASUR;MEJIA GOMEZ SIERVO BENIGNO;PARTIDO SOCIAL DE UNIDAD NACIONAL;35
SATIVASUR;GARZON NOVA CESAR DOSITEO;PARTIDO SOCIAL DE UNIDAD NACIONAL;33
SATIVASUR;NOVA NOVA JOSE HIPOLITO;PARTIDO LIBERAL COLOMBIANO;32
SATIVASUR;MEJIA MARINO MONICA;PARTIDO LIBERAL COLOMBIANO;31
SATIVASUR;PARTIDO LIBERAL COLOMBIANO;PARTIDO LIBERAL COLOMBIANO;18
SATIVASUR;PARTIDO CONSERVADOR COLOMBIANO;PARTIDO CONSERVADOR COLOMBIANO;17
SATIVASUR;DIAZ TELLES GLADYS MARIA;PARTIDO LIBERAL COLOMBIANO;16
SATIVASUR;PARTIDO SOCIAL DE UNIDAD NACIONAL;PARTIDO SOCIAL DE UNIDAD NACIONAL;3
SIACHOQUE;AMAYA FLOREZ LUIS GERMAN;PARTIDO VERDE;155
SIACHOQUE;ARIAS ALBARRACIN JUAN CARLOS;PARTIDO DE INTEGRACION NACIONAL;154
SIACHOQUE;BOYACA DESALBADOR JOSE ABSALON;PARTIDO DE INTEGRACION NACIONAL;145
SIACHOQUE;MORCOTE CATOLICO HECTOR AUGUSTO;PARTIDO CONSERVADOR COLOMBIANO;136
SIACHOQUE;TIBATA DAZA PABLO JOSE;PARTIDO DE INTEGRACION NACIONAL;132
SIACHOQUE;ZIPASUCA QUEMBA GERARDO ANTONIO;PARTIDO CONSERVADOR COLOMBIANO;132
SIACHOQUE;TIBAGAN CALDERON CARLOS HUMBERTO;PARTIDO VERDE;126
SIACHOQUE;ACUNA CHOCONTA LUIS EDUARDO;PARTIDO LIBERAL COLOMBIANO;120
SIACHOQUE;PARADA JIMENEZ URIEL;PARTIDO ALIANZA SOCIAL INDEPENDIENTE;119
SIACHOQUE;CUERVO ACUNA MELQUECIDEC;PARTIDO CAMBIO RADICAL;116
SIACHOQUE;HERNANDEZ AVILA LUIS ALFREDO;PARTIDO ALIANZA SOCIAL INDEPENDIENTE;113
SIACHOQUE;MORENO PIRAZAN NOE;PARTIDO CONSERVADOR COLOMBIANO;113
SIACHOQUE;VARGAS LUZ HERMINDA;PARTIDO DE INTEGRACION NACIONAL;109
SIACHOQUE;RAMIREZ LOPEZ JOSE ALIRIO;PARTIDO DE INTEGRACION NACIONAL;103
SIACHOQUE;SIERRA ESPINOSA WILMAR FERNANDO;PARTIDO ALIANZA SOCIAL INDEPENDIENTE;102
SIACHOQUE;BARON BERNAL LUIS ALEJANDRO;PARTIDO LIBERAL COLOMBIANO;100
SIACHOQUE;SOSA ESPITIA ISRAEL;PARTIDO ALIANZA SOCIAL INDEPENDIENTE;100
SIACHOQUE;SOTO AVILA MARTHA LUCIA;PARTIDO ALIANZA SOCIAL INDEPENDIENTE;95
SIACHOQUE;AVILA LEON WILLIAM ORLANDO;POLO DEMOCRATICO ALTERNATIVO;87
SIACHOQUE;GARCIA RUIZ ARMANDO;PARTIDO SOCIAL DE UNIDAD NACIONAL;87
SIACHOQUE;REYES FUQUEN EDELMIRA;PARTIDO DE INTEGRACION NACIONAL;81
SIACHOQUE;NOVA LOPEZ JORGE EMILIO;PARTIDO LIBERAL COLOMBIANO;78
SIACHOQUE;GUEVARA GARCIA FABIO ENRIQUE;PARTIDO ALIANZA SOCIAL INDEPENDIENTE;77
SIACHOQUE;AVILA FULVIO;PARTIDO VERDE;76
SIACHOQUE;RAIGOSO PACANCHIQUE LUIS GERARDO;PARTIDO VERDE;71
SIACHOQUE;HERNANDEZ ORTEGA SEGUNDO JORGE;PARTIDO SOCIAL DE UNIDAD NACIONAL;70
SIACHOQUE;ROJAS VALENZUELA JAIME DANILO;PARTIDO VERDE;68
SIACHOQUE;AGUILAR GRANADOS EDISON OSWALDO;PARTIDO CAMBIO RADICAL;67
SIACHOQUE;RATIVA ALBERTO JOSE;PARTIDO DE INTEGRACION NACIONAL;61
SIACHOQUE;PARTIDO VERDE;PARTIDO VERDE;59
SIACHOQUE;PIRAZAN MORCOTE EDGAR ENRIQUE;PARTIDO SOCIAL DE UNIDAD NACIONAL;58
SIACHOQUE;GALINDO SANABRIA JOSE MAXIMINO;PARTIDO VERDE;55
SIACHOQUE;MOTAVITA SILVA MARTHA ISABEL;PARTIDO VERDE;55
SIACHOQUE;CIFUENTES JOSE ADRIANO;POLO DEMOCRATICO ALTERNATIVO;54
SIACHOQUE;TIBASOSA QUEMBA JOSE GABRIEL;PARTIDO ALIANZA SOCIAL INDEPENDIENTE;49
SIACHOQUE;MORENO CASTELBLANCO CARLOS JULIO;PARTIDO LIBERAL COLOMBIANO;48
SIACHOQUE;SANCHEZ TIBATA EUGENIO;PARTIDO CAMBIO RADICAL;47
SIACHOQUE;PARTIDO DE INTEGRACION NACIONAL;PARTIDO DE INTEGRACION NACIONAL;46
SIACHOQUE;MORENO SILVA MARGARETH DANIELA;PARTIDO SOCIAL DE UNIDAD NACIONAL;42
SIACHOQUE;SANCHEZ NEIRA JULIO ALBERTO;PARTIDO CONSERVADOR COLOMBIANO;42
SIACHOQUE;AVILA SOTO LAURA CONSUELO;PARTIDO SOCIAL DE UNIDAD NACIONAL;41
SIACHOQUE;FARIAS GARCIA JOAQUIN;PARTIDO SOCIAL DE UNIDAD NACIONAL;39
SIACHOQUE;MONROY VARGAS VITALIA;PARTIDO CONSERVADOR COLOMBIANO;37
SIACHOQUE;VARGAS SOTO HECTOR CRISTOBAL;PARTIDO SOCIAL DE UNIDAD NACIONAL;37
SIACHOQUE;ORTEGA AGUILAR MARIA ANA;PARTIDO DE INTEGRACION NACIONAL;35
SIACHOQUE;CHITIVO SANTAFE LUIS EDUARDO;PARTIDO CONSERVADOR COLOMBIANO;33
SIACHOQUE;PARTIDO SOCIAL DE UNIDAD NACIONAL;PARTIDO SOCIAL DE UNIDAD NACIONAL;33
SIACHOQUE;CALDERON TENZA MARCOS ALFONSO;PARTIDO SOCIAL DE UNIDAD NACIONAL;32
SIACHOQUE;CARRENO ALONSO ADRIANA STELLA;POLO DEMOCRATICO ALTERNATIVO;23
SIACHOQUE;AMAYA TIBASOSA JOHN FREDY;POLO DEMOCRATICO ALTERNATIVO;21
SIACHOQUE;PARTIDO ALIANZA SOCIAL INDEPENDIENTE;PARTIDO ALIANZA SOCIAL INDEPENDIENTE;19
SIACHOQUE;RODRIGUEZ ESPINOSA LUCY STELLA;PARTIDO CAMBIO RADICAL;19
SIACHOQUE;HERNANDEZ VARGAS NANCY ESPERANZA;PARTIDO VERDE;17
SIACHOQUE;SANABRIA TIUSABA ANA MARGARITA;PARTIDO CONSERVADOR COLOMBIANO;16
SIACHOQUE;PARTIDO CONSERVADOR COLOMBIANO;PARTIDO CONSERVADOR COLOMBIANO;15
SIACHOQUE;GARCIA TIBATA MARIA DEL PILAR;PARTIDO CONSERVADOR COLOMBIANO;14
SIACHOQUE;NOVA CALDERON JOSE ALCIDES;PARTIDO CONSERVADOR COLOMBIANO;14
SIACHOQUE;PARTIDO LIBERAL COLOMBIANO;PARTIDO LIBERAL COLOMBIANO;12
SIACHOQUE;PIRAZAN SUESCA MARIA CATALINA;PARTIDO VERDE;12
SIACHOQUE;MONROY RODRIGUEZ JORGE ALBERTO;PARTIDO CAMBIO RADICAL;10
SIACHOQUE;RODRIGUEZ SAGANOME MARIA DOLORES;PARTIDO ALIANZA SOCIAL INDEPENDIENTE;9
SIACHOQUE;CATOLICO GUTIERREZ MARGARITA;PARTIDO ALIANZA SOCIAL INDEPENDIENTE;7
SIACHOQUE;PARTIDO CAMBIO RADICAL;PARTIDO CAMBIO RADICAL;7
SIACHOQUE;RODRIGUEZ JIMENEZ ELIANA ISABEL;PARTIDO LIBERAL COLOMBIANO;7
SIACHOQUE;SALAZAR ESPINOSA OLGA YASMIN;PARTIDO CAMBIO RADICAL;7
SIACHOQUE;AVILA CRUZ SEGUNDO ROSENDO;POLO DEMOCRATICO ALTERNATIVO;6
SIACHOQUE;CANDIDATO RETIRADO;CANDIDATO RETIRADO;6
SIACHOQUE;SOLER RODRIGUEZ ZULMA MARGARITA;PARTIDO CAMBIO RADICAL;6
SIACHOQUE;QUEMBA LOPEZ DIANA MATILDE;PARTIDO LIBERAL COLOMBIANO;5
SIACHOQUE;GUERRERO SANABRIA FERNANDO EULOGIO;PARTIDO LIBERAL COLOMBIANO;4
SIACHOQUE;ACOSTA CARDENAS FLOR IMIRIDA;POLO DEMOCRATICO ALTERNATIVO;3
SIACHOQUE;ESPINEL ESPINOSA LUIS;POLO DEMOCRATICO ALTERNATIVO;3
SIACHOQUE;POLO DEMOCRATICO ALTERNATIVO;POLO DEMOCRATICO ALTERNATIVO;3
SIACHOQUE;ROA BERNAL CARLOS JULIO;PARTIDO CAMBIO RADICAL;3
SIACHOQUE;QUIROZ NOVA FANNY ALICIA;POLO DEMOCRATICO ALTERNATIVO;1
SIACHOQUE;RODRIGUEZ CARABUENA JOSE ALBERTO;PARTIDO LIBERAL COLOMBIANO;1
SIACHOQUE;RODRIGUEZ SANCHEZ DIANA CAROLINA;PARTIDO LIBERAL COLOMBIANO;1
SOATA;PINZON PAEZ JAVIER;PARTIDO SOCIAL DE UNIDAD NACIONAL;312
SOATA;DELGADO FUENTES CARLOS GERMAN;PARTIDO SOCIAL DE UNIDAD NACIONAL;255
SOATA;BAEZ MOJICA JOSE ANTONIO;PARTIDO SOCIAL DE UNIDAD NACIONAL;226
SOATA;BARRERA CARLOS;PARTIDO SOCIAL DE UNIDAD NACIONAL;223
SOATA;SEPULVEDA ARCHILA LUIS ARGELIO;PARTIDO CONSERVADOR COLOMBIANO;219
SOATA;RODRIGUEZ DE SOCHA MYRIAM CONSUELO;PARTIDO CONSERVADOR COLOMBIANO;203
SOATA;MOJICA RINCON LUIS ALIRIO;PARTIDO CONSERVADOR COLOMBIANO;191
SOATA;ROJAS MOJICA MARIA ESPERANZA;PARTIDO SOCIAL DE UNIDAD NACIONAL;185
SOATA;DIAZ FUENTES JOHN;PARTIDO SOCIAL DE UNIDAD NACIONAL;178
SOATA;GOMEZ GONZALEZ PAULINA;PARTIDO CONSERVADOR COLOMBIANO;169
SOATA;BAEZ CAMACHO LUIS ANGEL;PARTIDO CAMBIO RADICAL;164
SOATA;GONZALEZ CARLOS ALFONSO;PARTIDO LIBERAL COLOMBIANO;153
SOATA;SALCEDO REYES RAMIRO;PARTIDO CAMBIO RADICAL;151
SOATA;VELOZA LOPEZ MARIA ISABEL;PARTIDO SOCIAL DE UNIDAD NACIONAL;145
SOATA;RODRIGUEZ ESTUPINAN JULIO ROBERTO;PARTIDO CONSERVADOR COLOMBIANO;135
SOATA;VARGAS SALCEDO JUAN SEGUNDO;PARTIDO CONSERVADOR COLOMBIANO;133
SOATA;VILLARREAL MARQUEZ CAMILO ROBERTO;PARTIDO CONSERVADOR COLOMBIANO;133
SOATA;SANCHEZ PRIETO JOSE DEL CARMEN;PARTIDO SOCIAL DE UNIDAD NACIONAL;116
SOATA;GOMEZ SANTOS MILTON JAVIER;PARTIDO CONSERVADOR COLOMBIANO;101
SOATA;RUBIANO LOPEZ CARLOS GERMAN;PARTIDO CAMBIO RADICAL;100
SOATA;DIAZ DIAZ CARLOS JULIO;PARTIDO CAMBIO RADICAL;97
SOATA;ROJAS CORONADO CARLOS ERNESTO;PARTIDO CAMBIO RADICAL;89
SOATA;MEDINA LOPEZ RAMIRO ANTONIO;PARTIDO LIBERAL COLOMBIANO;86
SOATA;MANCIPE GOMEZ ASTRID SUSANA;PARTIDO SOCIAL DE UNIDAD NACIONAL;75
SOATA;GRANADOS GOMEZ PEDRO ABEL;PARTIDO LIBERAL COLOMBIANO;74
SOATA;BERNAL CARO JAIRO ENRIQUE;PARTIDO LIBERAL COLOMBIANO;67
SOATA;SANDOVAL BUSTOS ODILIA;PARTIDO CONSERVADOR COLOMBIANO;63
SOATA;BRICENO CORDERO FRANCISCO FABIAN;PARTIDO CAMBIO RADICAL;58
SOATA;PARTIDO SOCIAL DE UNIDAD NACIONAL;PARTIDO SOCIAL DE UNIDAD NACIONAL;55
SOATA;ALFONSO BAEZ ZANDRA PATRICIA;PARTIDO CAMBIO RADICAL;51
SOATA;RODRIGUEZ ANGARITA GUSTAVO;PARTIDO VERDE;48
SOATA;UYABAN BENITEZ LUIS ALEJANDRO;PARTIDO LIBERAL COLOMBIANO;45
SOATA;PEREZ SIERRA ANGEL YESID;PARTIDO VERDE;38
SOATA;BUITRAGO PEREZ BLANCA MYRIAM;PARTIDO VERDE;36
SOATA;PARTIDO CONSERVADOR COLOMBIANO;PARTIDO CONSERVADOR COLOMBIANO;35
SOATA;BARAJAS MENESES RUBY CONSUELO;PARTIDO LIBERAL COLOMBIANO;33
SOATA;CUDRIS DUARTE JOSE DANIEL;PARTIDO VERDE;32
SOATA;ARAQUE BAEZ LUZ MARINA;PARTIDO CAMBIO RADICAL;30
SOATA;MANRIQUE GOMEZ HORACIO JOSE;PARTIDO VERDE;28
SOATA;RODRIGUEZ MACHUCA ALVARO;PARTIDO VERDE;28
SOATA;ACONCHA BONILLA CLAUDIA PILAR;PARTIDO VERDE;26
SOATA;MARTINEZ FUENTES JAIME ANDRES;PARTIDO LIBERAL COLOMBIANO;26
SOATA;VELANDIA LLANES MONICA LISETTE;PARTIDO CAMBIO RADICAL;17
SOATA;PARTIDO CAMBIO RADICAL;PARTIDO CAMBIO RADICAL;16
SOATA;PARTIDO LIBERAL COLOMBIANO;PARTIDO LIBERAL COLOMBIANO;16
SOATA;PARTIDO VERDE;PARTIDO VERDE;12
SOATA;DELGADO OLIVEROS ANGELA VIVIANA;PARTIDO LIBERAL COLOMBIANO;11
SOATA;VELANDIA SANCHEZ MARISOL;PARTIDO LIBERAL COLOMBIANO;7
SOATA;MAYORGA DUARTE ALEIDY MARCELA;PARTIDO VERDE;3
SOCHA;HURTADO CARVAJAL OSCAR ANTONIO;PARTIDO LIBERAL COLOMBIANO;263
SOCHA;DIAZ DIAZ JOSE CLEMENTE;PARTIDO CONSERVADOR COLOMBIANO;215
SOCHA;CARRENO CARVAJAL MARIA REBECA;PARTIDO CONSERVADOR COLOMBIANO;211
SOCHA;AMAYA ROJAS JOSE ROBERTO;PARTIDO CONSERVADOR COLOMBIANO;210
SOCHA;ARAQUE GARCIA MARIANELA DE LA COROMOTO;PARTIDO LIBERAL COLOMBIANO;173
SOCHA;CRISTIANO ESTUPINAN GILBERTO ALEXANDER;PARTIDO CAMBIO RADICAL;171
SOCHA;ANGEL ESTUPINAN ANGEL MARIA;PARTIDO LIBERAL COLOMBIANO;160
SOCHA;TORRES GOMEZ SUSAN CARLIN;PARTIDO SOCIAL DE UNIDAD NACIONAL;150
SOCHA;SOCADAGUI LEON RAFAEL AUGUSTO;PARTIDO CONSERVADOR COLOMBIANO;131
SOCHA;BENITEZ PATINO MARIA ENIDE;PARTIDO CONSERVADOR COLOMBIANO;128
SOCHA;PARTIDO SOCIAL DE UNIDAD NACIONAL;PARTIDO SOCIAL DE UNIDAD NACIONAL;124
SOCHA;SANTOS PEREZ HILDEBRANDO;PARTIDO LIBERAL COLOMBIANO;116
SOCHA;ESTEPA GOMEZ EDGAR ALFONSO;PARTIDO VERDE;115
SOCHA;CUEVAS GOYENECHE ALONSO;PARTIDO CONSERVADOR COLOMBIANO;108
SOCHA;FUENTES VARGAS ALEXANDER;PARTIDO CAMBIO RADICAL;102
SOCHA;MALPICA RINCON ALVARO;PARTIDO LIBERAL COLOMBIANO;95
SOCHA;BERNAL LOPEZ GABRIEL ANTONIO;PARTIDO CONSERVADOR COLOMBIANO;93
SOCHA;ARCINIEGAS VARGAS JOSE ORLANDO;PARTIDO SOCIAL DE UNIDAD NACIONAL;91
SOCHA;PEREZ ESTUPINAN PEDRO MARCELIANO;PARTIDO LIBERAL COLOMBIANO;87
SOCHA;LOPEZ TOCA CARLOS ALFONSO;PARTIDO CONSERVADOR COLOMBIANO;84
SOCHA;CARRENO MANRIQUE JUAN PABLO;PARTIDO CAMBIO RADICAL;82
SOCHA;MALPICA MALPICA HELBER ENRIQUE;PARTIDO SOCIAL DE UNIDAD NACIONAL;75
SOCHA;PARTIDO LIBERAL COLOMBIANO;PARTIDO LIBERAL COLOMBIANO;73
SOCHA;USCATEGUI MALPICA JOSE BELARMINO;PARTIDO SOCIAL DE UNIDAD NACIONAL;70
SOCHA;ESPINDOLA DIAZ JUAN DE JESUS;PARTIDO LIBERAL COLOMBIANO;68
SOCHA;USCATEGUI SARMIENTO LIZETH OLIVA;PARTIDO CONSERVADOR COLOMBIANO;68
SOCHA;CELY SOLEDAD PEDRO JOSE;PARTIDO VERDE;66
SOCHA;ROMERO MALPICA CARMEN ELIZA;PARTIDO LIBERAL COLOMBIANO;66
SOCHA;MORALES DE MEJIA ANA EUGENIA;PARTIDO LIBERAL COLOMBIANO;64
SOCHA;BARON GOYENECHE ASTRID GUISLA;PARTIDO SOCIAL DE UNIDAD NACIONAL;60
SOCHA;PARTIDO CONSERVADOR COLOMBIANO;PARTIDO CONSERVADOR COLOMBIANO;52
SOCHA;GARCIA ARAQUE GERMAN ALONSO;PARTIDO SOCIAL DE UNIDAD NACIONAL;48
SOCHA;CARDENAS ABRIL DIANA ISABEL;PARTIDO VERDE;43
SOCHA;BALLESTEROS SALAMANCA ALICIA;PARTIDO SOCIAL DE UNIDAD NACIONAL;42
SOCHA;FONSECA MOJICA MARIA FERNANDA;PARTIDO VERDE;28
SOCHA;PARTIDO VERDE;PARTIDO VERDE;22
SOCHA;TOCA SOTO MARIA ESTELA;PARTIDO CAMBIO RADICAL;20
SOCHA;MANRIQUE ESTUPINAN DORA LUZ;PARTIDO CAMBIO RADICAL;19
SOCHA;HERNANDEZ LOPEZ MARIA ANTONIA;PARTIDO CAMBIO RADICAL;17
SOCHA;DURAN MANRIQUE CARLOS ALFONSO;PARTIDO VERDE;14
SOCHA;PARTIDO CAMBIO RADICAL;PARTIDO CAMBIO RADICAL;7
SOCOTA;PANQUEBA CHIA ADIEL;PARTIDO LIBERAL COLOMBIANO;174
SOCOTA;CANDIDATO RETIRADO;CANDIDATO RETIRADO;148
SOCOTA;SIEMPIRA VARGAS EULISES;PARTIDO VERDE;142
SOCOTA;CASTRO DIAZ MARIA EUGENIA;PARTIDO LIBERAL COLOMBIANO;125
SOCOTA;NINO MENDIVELSO JESUS;MOVIMIENTO POLITICO AFROVIDES;123
SOCOTA;CUCUNUBA DURAN ROSEBEL;PARTIDO CAMBIO RADICAL;111
SOCOTA;MENDIVELSO BENITEZ ELIAS;PARTIDO LIBERAL COLOMBIANO;108
SOCOTA;MENDIVELSO LEAL REINALDO;PARTIDO CAMBIO RADICAL;106
SOCOTA;GOMEZ CARDENAS JOSE OLIVERIO;PARTIDO ALIANZA SOCIAL INDEPENDIENTE;101
SOCOTA;CRISTIANO OJEDA LUZ POHEMA;PARTIDO CAMBIO RADICAL;99
SOCOTA;GOYENECHE CARRENO FREDY ALEXANDER;PARTIDO LIBERAL COLOMBIANO;98
SOCOTA;BOLANOS TONCON EDWIN ALEXANDER;MOVIMIENTO POLITICO AFROVIDES;97
SOCOTA;RODRIGUEZ MASMELA HERMES ELIAS;MOVIMIENTO POLITICO AFROVIDES;96
SOCOTA;RODRIGUEZ OJEDA LUIS GUILLERMO;PARTIDO SOCIAL DE UNIDAD NACIONAL;89
SOCOTA;GOMEZ GARCIA JULIO RAUL;PARTIDO LIBERAL COLOMBIANO;80
SOCOTA;MONTOYA ROMERO PEDRO;PARTIDO CAMBIO RADICAL;80
SOCOTA;MONTOYA JAIRO;PARTIDO LIBERAL COLOMBIANO;78
SOCOTA;CHIA DURAN ISRAEL;PARTIDO VERDE;77
SOCOTA;BENITEZ VELANDIA YAMILE;PARTIDO SOCIAL DE UNIDAD NACIONAL;75
SOCOTA;PEREZ CRISTIANO LUIS ALBERTO;PARTIDO LIBERAL COLOMBIANO;72
SOCOTA;GOYENECHE ANGARITA JOSE DIOMEDES;PARTIDO ALIANZA SOCIAL INDEPENDIENTE;69
SOCOTA;VELANDIA MENDIVELSO EDUARDO;PARTIDO VERDE;66
SOCOTA;VELANDIA OJEDA AGUEDA YANETH;PARTIDO CAMBIO RADICAL;65
SOCOTA;TORRES RIANO CARLOS ARTURO;PARTIDO CAMBIO RADICAL;62
SOCOTA;GALLO PASACHOA PABLO EMILIO;PARTIDO VERDE;60
SOCOTA;VELANDIA CARVAJAL AMPARO ALEXANDRA;PARTIDO ALIANZA SOCIAL INDEPENDIENTE;58
SOCOTA;SUA SALCEDO MARTIN;PARTIDO VERDE;57
SOCOTA;RODRIGUEZ DIAZ BAYARDO;PARTIDO LIBERAL COLOMBIANO;56
SOCOTA;PARTIDO LIBERAL COLOMBIANO;PARTIDO LIBERAL COLOMBIANO;55
SOCOTA;MONTOYA RODRIGUEZ MELBA LEONITH;PARTIDO LIBERAL COLOMBIANO;54
SOCOTA;RODRIGUEZ LEAL SAMIR EDUARDO;PARTIDO ALIANZA SOCIAL INDEPENDIENTE;52
SOCOTA;COGOLLO AVELLANEDA NUVIA EDID;PARTIDO LIBERAL COLOMBIANO;51
SOCOTA;BLANCO SALAMANCA JOSE DOMINGO;PARTIDO CONSERVADOR COLOMBIANO;50
SOCOTA;RAVELO VELANDIA MAXIMILIANO;PARTIDO SOCIAL DE UNIDAD NACIONAL;49
SOCOTA;GARCIA MESA LUIS ALFREDO;PARTIDO ALIANZA SOCIAL INDEPENDIENTE;47
SOCOTA;BELLO NINO LULIO;PARTIDO VERDE;45
SOCOTA;ACERO COLMENARES MERCEDES;PARTIDO SOCIAL DE UNIDAD NACIONAL;41
SOCOTA;OJEDA CRUZ PEDRO;PARTIDO SOCIAL DE UNIDAD NACIONAL;41
SOCOTA;ROMERO HORMAZA DUBIN JAVIER;PARTIDO SOCIAL DE UNIDAD NACIONAL;41
SOCOTA;BENITEZ MENDIVELSO ORLANDO;PARTIDO CAMBIO RADICAL;34
SOCOTA;MOVIMIENTO POLITICO AFROVIDES;MOVIMIENTO POLITICO AFROVIDES;34
SOCOTA;PARTIDO VERDE;PARTIDO VERDE;32
SOCOTA;DURAN CARDENAS MARIA ELENA;PARTIDO SOCIAL DE UNIDAD NACIONAL;31
SOCOTA;PARTIDO SOCIAL DE UNIDAD NACIONAL;PARTIDO SOCIAL DE UNIDAD NACIONAL;31
SOCOTA;GOYENECHE CANTOR JOSE LOMBARDO;PARTIDO VERDE;29
SOCOTA;PARTIDO CAMBIO RADICAL;PARTIDO CAMBIO RADICAL;28
SOCOTA;CALDERON VEGA LUZ NEYLA;PARTIDO CONSERVADOR COLOMBIANO;27
SOCOTA;ESTEPA MENDIVELSO JOSE VICENTE;PARTIDO CONSERVADOR COLOMBIANO;26
SOCOTA;RAVELO TONCON JULIO CESAR;PARTIDO DE INTEGRACION NACIONAL;26
SOCOTA;VEGA ARISMENDY EDUIN MAURICIO;PARTIDO SOCIAL DE UNIDAD NACIONAL;26
SOCOTA;MEDINA JARA MARICELA;PARTIDO ALIANZA SOCIAL INDEPENDIENTE;24
SOCOTA;RIOS CAICEDO IRI YOHANA;PARTIDO VERDE;24
SOCOTA;CRUZ MERCHAN CLIMACO;PARTIDO DE INTEGRACION NACIONAL;23
SOCOTA;CALDERON VEGA JUAN SANTOS;PARTIDO CAMBIO RADICAL;22
SOCOTA;GOMEZ GRANADOS MONICA JOHANA;PARTIDO ALIANZA SOCIAL INDEPENDIENTE;20
SOCOTA;HERRERA CUEVAS HERMINDA;MOVIMIENTO POLITICO AFROVIDES;20
SOCOTA;MEDINA CRISTIANO YOMARA;MOVIMIENTO POLITICO AFROVIDES;20
SOCOTA;PARTIDO ALIANZA SOCIAL INDEPENDIENTE;PARTIDO ALIANZA SOCIAL INDEPENDIENTE;20
SOCOTA;PANQUEVA MENDIVELSO HUGO;PARTIDO DE INTEGRACION NACIONAL;18
SOCOTA;SOTO VEGA ARIEL;PARTIDO ALIANZA SOCIAL INDEPENDIENTE;17
SOCOTA;NINO NINO MARY NELSA;PARTIDO CAMBIO RADICAL;16
SOCOTA;PEREZ PEREZ CARLOS ARTURO;MOVIMIENTO POLITICO AFROVIDES;14
SOCOTA;GOMEZ BARON ALEXI JAZMIN;PARTIDO DE INTEGRACION NACIONAL;12
SOCOTA;MORENO LEAL CLAUDIA;PARTIDO VERDE;12
SOCOTA;BARRERA BONILLA EDITH;PARTIDO DE INTEGRACION NACIONAL;11
SOCOTA;LEAL GUALTEROS ANA DELIA;PARTIDO CAMBIO RADICAL;9
SOCOTA;PARTIDO CONSERVADOR COLOMBIANO;PARTIDO CONSERVADOR COLOMBIANO;9
SOCOTA;GOMEZ FERNANDEZ JUAN MANUEL;PARTIDO ALIANZA SOCIAL INDEPENDIENTE;8
SOCOTA;PARTIDO DE INTEGRACION NACIONAL;PARTIDO DE INTEGRACION NACIONAL;7
SOCOTA;MENDIVELSO ALICIA AZUCENA;PARTIDO VERDE;6
SOCOTA;MENDIVELSO GOMEZ ANA ZULMA;PARTIDO CONSERVADOR COLOMBIANO;6
SOCOTA;VELANDIA PORRAS LUIS GERMAN;PARTIDO CAMBIO RADICAL;5
SOGAMOSO;CONDIA PEREZ SANDRO NESTOR;PARTIDO LIBERAL COLOMBIANO;1201
SOGAMOSO;MOVIMIENTO MIRA;MOVIMIENTO MIRA;1105
SOGAMOSO;MARQUEZ QUINTERO MARCO ALIRIO;PARTIDO LIBERAL COLOMBIANO;990
SOGAMOSO;FERNANDEZ CHAPARRO LUZ STELLA;PARTIDO LIBERAL COLOMBIANO;918
SOGAMOSO;ESTEPA ESTEPA DIANA CAROLINA;PARTIDO SOCIAL DE UNIDAD NACIONAL;872
SOGAMOSO;CAMARGO PUERTO PABLO;PARTIDO LIBERAL COLOMBIANO;857
SOGAMOSO;FARFAN SIACHOQUE LUIS ANTONIO;PARTIDO SOCIAL DE UNIDAD NACIONAL;842
SOGAMOSO;PARTIDO LIBERAL COLOMBIANO;PARTIDO LIBERAL COLOMBIANO;831
SOGAMOSO;BARRERA BENAVIDES HUGO ALBERTO;PARTIDO SOCIAL DE UNIDAD NACIONAL;791
SOGAMOSO;RODRIGUEZ LEMUS JUAN PABLO;PARTIDO SOCIAL DE UNIDAD NACIONAL;790
SOGAMOSO;FIGUEROA COGOLLOS HELENA SOFIA;PARTIDO CAMBIO RADICAL;728
SOGAMOSO;SUAREZ NORATO LUIS EDUARDO;PARTIDO SOCIAL DE UNIDAD NACIONAL;709
SOGAMOSO;LEAL PEREZ WILMER;PARTIDO VERDE;701
SOGAMOSO;PALACIOS ALVARADO WILLIAN RODRIGO;PARTIDO SOCIAL DE UNIDAD NACIONAL;691
SOGAMOSO;FAGUA TORRES DIEGO FERNANDO;PARTIDO LIBERAL COLOMBIANO;660
SOGAMOSO;CHAPARRO BARRERA JAIME ANTONIO;PARTIDO LIBERAL COLOMBIANO;659
SOGAMOSO;PARTIDO SOCIAL DE UNIDAD NACIONAL;PARTIDO SOCIAL DE UNIDAD NACIONAL;650
SOGAMOSO;ROJAS AVELLA URIEL ERNESTO;PARTIDO CAMBIO RADICAL;641
SOGAMOSO;CARO GUEVARA RICARDO ANDRES;PARTIDO LIBERAL COLOMBIANO;640
SOGAMOSO;ORTEGA HERNANDEZ ROMAN HERNANDO;MOVIMIENTO DE INCLUSION Y OPORTUNIDADES;572
SOGAMOSO;PARRA ISAZA JUAN PABLO;PARTIDO CAMBIO RADICAL;568
SOGAMOSO;ALARCON LOPEZ GUSTAVO ADOLFO;PARTIDO VERDE;564
SOGAMOSO;BLANCO LEGUIZAMO RICARDO ANDRES;PARTIDO VERDE;528
SOGAMOSO;CELY CONDIA RODOLFO;PARTIDO LIBERAL COLOMBIANO;497
SOGAMOSO;PORRAS CASTRO CARLOS ALBERTO;PARTIDO DE INTEGRACION NACIONAL;494
SOGAMOSO;BENAVIDES BENAVIDES EDWIN JARDIEL;PARTIDO VERDE;493
SOGAMOSO;GOMEZ JAIME;PARTIDO SOCIAL DE UNIDAD NACIONAL;490
SOGAMOSO;PEREZ PENA HUGO JAIRO;PARTIDO LIBERAL COLOMBIANO;487
SOGAMOSO;SANCHEZ MORENO JORGE DILKER;PARTIDO DE INTEGRACION NACIONAL;486
SOGAMOSO;RODRIGUEZ CALIXTO ANDRES;PARTIDO DE INTEGRACION NACIONAL;456
SOGAMOSO;NARANJO AMAYA JOSE ANYELO;PARTIDO DE INTEGRACION NACIONAL;454
SOGAMOSO;AVELLANEDA PEDRAZA WILLIAM;PARTIDO ALIANZA SOCIAL INDEPENDIENTE;447
SOGAMOSO;RINCON HERRERA GERMAN;PARTIDO DE INTEGRACION NACIONAL;442
SOGAMOSO;POVEDA POVEDA JOSE UBALDO;PARTIDO SOCIAL DE UNIDAD NACIONAL;441
SOGAMOSO;BARRERA MARTINEZ CESAR AUGUSTO;PARTIDO VERDE;437
SOGAMOSO;MARTINEZ ORTIZ BLANCA CECILIA;PARTIDO VERDE;435
SOGAMOSO;CASTILLO LOPEZ JUAN JOSE;MOVIMIENTO DE INCLUSION Y OPORTUNIDADES;433
SOGAMOSO;PEREZ PINTO FREDY ALEXANDER;PARTIDO CAMBIO RADICAL;426
SOGAMOSO;GONZALEZ BARRERA YANETH;PARTIDO LIBERAL COLOMBIANO;424
SOGAMOSO;TORRES SUPELANO WILSON;MOVIMIENTO AUTORIDADES INDIGENAS DE COLOMBIA;394
SOGAMOSO;ARAQUE VARGAS MIGUEL ARMANDO;PARTIDO LIBERAL COLOMBIANO;385
SOGAMOSO;RIVERA COGUA WHILFREDO;PARTIDO VERDE;376
SOGAMOSO;MEDINA CELY JHON JAIRO;PARTIDO CAMBIO RADICAL;371
SOGAMOSO;ALARCON LEON HECTOR FERNANDO;PARTIDO ALIANZA SOCIAL INDEPENDIENTE;367
SOGAMOSO;ORDUZ OJEDA LUIS ENRIQUE;PARTIDO SOCIAL DE UNIDAD NACIONAL;362
SOGAMOSO;CAMARGO MONTANA JULIAN MAURICIO;PARTIDO DE INTEGRACION NACIONAL;360
SOGAMOSO;ALVAREZ PULIDO MANUEL STEVEN;PARTIDO ALIANZA SOCIAL INDEPENDIENTE;355
SOGAMOSO;MARQUEZ RODRIGUEZ ESTELLA;PARTIDO DE INTEGRACION NACIONAL;354
SOGAMOSO;PARTIDO VERDE;PARTIDO VERDE;348
SOGAMOSO;VEGA PINTO BENITO;PARTIDO CAMBIO RADICAL;341
SOGAMOSO;FERNANDEZ ALARCON REYES;PARTIDO ALIANZA SOCIAL INDEPENDIENTE;334
SOGAMOSO;PEREZ PRIETO LEONOR;PARTIDO SOCIAL DE UNIDAD NACIONAL;324
SOGAMOSO;QUINTERO BARAJAS HOLMAN;PARTIDO LIBERAL COLOMBIANO;323
SOGAMOSO;CASTRO RUIZ PABLO;PARTIDO VERDE;317
SOGAMOSO;QUIJANO CORTES MARISOL;PARTIDO SOCIAL DE UNIDAD NACIONAL;313
SOGAMOSO;RIANO ORLANDO;MOVIMIENTO AUTORIDADES INDIGENAS DE COLOMBIA;312
