MUNNOMBRE;CANNOMBRE;PARNOMBRE;VOTOS
ALMEIDA;Jairo Antonio Calderon Cardenas;Partido de la U;420
ALMEIDA;Fraiver Hernando Calderon Perilla;Partido de la U;105
ALMEIDA;Juan Carlos Sanchez Lesmes;Cambio Radical;72
ALMEIDA;Jorge Alonso Calderon Cardenas;Partido de la U;63
ALMEIDA;Gloria Ines Pinzon Vaca;Partido de la U;60
ALMEIDA;Manuel Antonio Alvarado Mondragon;Cambio Radical;57
ALMEIDA;Ana Leonila Vallejo Calderon;Cambio Radical;50
ALMEIDA;Alba Ines Sanchez Alfonso;Cambio Radical;45
ALMEIDA;Nubia Marcela Lopez Lopez;Partido de la U;45
ALMEIDA;Jose Hernando Sanchez Martin;Partido de la U;43
ALMEIDA;Flor Stella Gutierrez Daza;Partido Conservador Colombiano;39
ALMEIDA;Partido Social De Unidad Nacional;Partido de la U;25
ALMEIDA;Sandra Patricia Castaneda Vargas;Partido de la U;24
ALMEIDA;Elba Maria Romero Sanchez;Partido Conservador Colombiano;23
ALMEIDA;Lilia Ines Martinez De Gonzalez;Alianza Social Independiente;23
ALMEIDA;Ericzon Vargas Sanchez;Partido Conservador Colombiano;22
ALMEIDA;Alba Hermelinda Romero Gonzalez;Cambio Radical;20
ALMEIDA;Yan Ester Lesmes Sanchez;Cambio Radical;17
ALMEIDA;Jose Manuel Antonio Lopez Sanchez;Cambio Radical;15
ALMEIDA;Erika Viviana Rosero Duenas;Partido Conservador Colombiano;12
ALMEIDA;Partido Cambio Radical;Cambio Radical;12
ALMEIDA;Wilber Ernesto Morales Daza;Partido Conservador Colombiano;12
ALMEIDA;Carlos Hernan Montenegro Castaneda;Alianza Social Independiente;9
ALMEIDA;Wilson Henry Daza Vaca;Partido Conservador Colombiano;7
ALMEIDA;Partido Conservador Colombiano;Partido Conservador Colombiano;6
ALMEIDA;Claudia Merced Rodriguez Oliveros;Alianza Social Independiente;4
ALMEIDA;Nelce Yaneth Castillo Novoa;Partido Conservador Colombiano;3
ALMEIDA;Alicia Mery Martin Daza;Alianza Social Independiente;2
ALMEIDA;Adelaida Lopez Acosta;Alianza Social Independiente;1
ALMEIDA;Felix Chivata Castillo;Alianza Social Independiente;1
ALMEIDA;Partido Alianza Social Independiente  Asi;Partido Alianza Social Independiente  Asi;0
AQUITANIA;Ivan Elias Plazas Bolivar;AICO;302
AQUITANIA;Luis Angel Rojas Rodriguez;Alianza Verde;256
AQUITANIA;Julio Enrique Piragauta Pesca;Opción Ciudadana;248
AQUITANIA;German Chaparro Munevar;Partido Conservador Colombiano;231
AQUITANIA;Segundo Venancio Rios Trujillo;Alianza Verde;219
AQUITANIA;Lucio Leonel Torres Riveros;Cambio Radical;206
AQUITANIA;Partido Liberal Colombiano;Partido Liberal Colombiano;199
AQUITANIA;Albeiro Armando Cepeda Cepeda;AICO;188
AQUITANIA;Crispolo German Montana Montana;Partido de la U;187
AQUITANIA;Omar Hernando Cepeda Ariza;Alianza Verde;179
AQUITANIA;Rafael Angel Camargo Montana;Partido Conservador Colombiano;179
AQUITANIA;Partido Verde;Alianza Verde;178
AQUITANIA;Herney Arturo Santos Camargo;Partido Conservador Colombiano;165
AQUITANIA;Segundo Gilberto Gutierrez Perez;Cambio Radical;164
AQUITANIA;Hector Orlando Lemus Chaparro;Alianza Verde;155
AQUITANIA;Jorge Guanume Alarcon;MOVIMIENTO DE INCLUSION Y OPORTUNIDADES;152
AQUITANIA;Javier Albeiro Preciado Gutierrez;Partido Conservador Colombiano;148
AQUITANIA;Edgar Orlando Plazas Mesa;Partido de la U;147
AQUITANIA;Mauricio Chaparro Alarcon;Alianza Verde;147
AQUITANIA;Luis Fernando Leon;MOVIMIENTO DE INCLUSION Y OPORTUNIDADES;146
AQUITANIA;Andrea Del Pilar Preciado Munevar;Alianza Verde;144
AQUITANIA;Reyes Montana Alarcon;Partido Conservador Colombiano;141
AQUITANIA;Edgar Andres Parada Hernandez;Opción Ciudadana;135
AQUITANIA;Jose Nairo Alarcon Cadena;Alianza Verde;134
AQUITANIA;Luis Octavio Montana Perez;Opción Ciudadana;130
AQUITANIA;Nelson Rene Cardenas Rodriguez;MOVIMIENTO DE INCLUSION Y OPORTUNIDADES;130
AQUITANIA;Miguel Antonio Salamanca Rico;Partido de la U;125
AQUITANIA;Franky Hernan Sanchez Munevar;MOVIMIENTO DE INCLUSION Y OPORTUNIDADES;123
AQUITANIA;Ignacio Montana Montana;Partido de la U;114
AQUITANIA;Ary Yanerith Rincon Perez;AICO;113
AQUITANIA;Nairo Ernesto Martinez Moreno;MOVIMIENTO DE INCLUSION Y OPORTUNIDADES;113
AQUITANIA;Luis Enrique Cadena Acevedo;Opción Ciudadana;109
AQUITANIA;Nilson Albeiro Barrera Castillo;AICO;105
AQUITANIA;Candidata Retirada;Candidata Retirada;100
AQUITANIA;Elba Lucero Rojas Vargas;Alianza Social Independiente;94
AQUITANIA;Marco Isaac Pesca Contreras;Opción Ciudadana;92
AQUITANIA;Maria Alejandra Urrutia Montana;Opción Ciudadana;92
AQUITANIA;Victor German Lopez Figueredo;Opción Ciudadana;92
AQUITANIA;Ligia Paola Riveros Sanchez;MOVIMIENTO DE INCLUSION Y OPORTUNIDADES;90
AQUITANIA;Luz Dary Ramirez Mesa;Partido Conservador Colombiano;85
AQUITANIA;Danilo Antonio Mesa Mesa;AICO;84
AQUITANIA;Erika Patricia Samaca Pesca;MOVIMIENTO DE INCLUSION Y OPORTUNIDADES;80
AQUITANIA;Partido Conservador Colombiano;Partido Conservador Colombiano;73
AQUITANIA;Milton Armando Gutierrez Lemus;Partido de la U;72
AQUITANIA;Carolina Chaparro Torres;Alianza Verde;71
AQUITANIA;Edson Gilberto Perez Chaparro;Partido Conservador Colombiano;71
AQUITANIA;Hector Emiro Moreno Perez;MOVIMIENTO DE INCLUSION Y OPORTUNIDADES;65
AQUITANIA;Luis Alfredo Chaparro Ramirez;Opción Ciudadana;65
AQUITANIA;Eliecer Rico Patino;Alianza Social Independiente;49
AQUITANIA;Partido Social De Unidad Nacional;Partido de la U;49
AQUITANIA;Rosana Riveros Lemus;Partido Conservador Colombiano;49
AQUITANIA;Partido De Integracion Nacional;Opción Ciudadana;48
AQUITANIA;Diana Paola Fonseca Vargas;Partido de la U;46
AQUITANIA;Jose Miguel Plazas Leguizamon;Alianza Verde;46
AQUITANIA;Maria Luisa Chaparro Lemus;Alianza Verde;44
AQUITANIA;Saul Moreno Alvarez;Partido Conservador Colombiano;44
AQUITANIA;Carlos Dario Moreno Vargas;Alianza Social Independiente;43
AQUITANIA;Deycy Carolina Ramirez Vargas;Alianza Social Independiente;43
AQUITANIA;Libia Maria Casas Abril;AICO;43
AQUITANIA;Olga Yanira Aguilar Aguilar;Opción Ciudadana;39
AQUITANIA;Edgar Fabian Satoba Chaparro;AICO;38
AQUITANIA;Carlos Gilberto Acevedo Nomezque;Alianza Social Independiente;37
AQUITANIA;Isaura Edilia Amezquita Florez;Alianza Verde;35
AQUITANIA;Maria Alejandra Sarmiento Avella;Cambio Radical;35
AQUITANIA;Movimiento De Inclusion Y Oportunidades;Movimiento De Inclusion Y Oportunidades;32
AQUITANIA;Gustavo Chaparro Sanchez;Partido de la U;31
AQUITANIA;William Javier Rodriguez Cardozo;AICO;30
AQUITANIA;Wilmer Hernando Acevedo Correa;Cambio Radical;30
AQUITANIA;Cesar Augusto Moreno Pesca;Partido de la U;29
AQUITANIA;Prospero Antonio Rosas Riveros;Cambio Radical;28
AQUITANIA;Elia Carmenza Barinas Macias;Cambio Radical;27
AQUITANIA;Yuly Carolina Chaparro Alarcon;Opción Ciudadana;27
AQUITANIA;Cristian Camilo Rosas Daza;MOVIMIENTO DE INCLUSION Y OPORTUNIDADES;26
AQUITANIA;Movimiento Autoridades Indigenas De Colombia;AICO;25
AQUITANIA;Otilia Cepeda Perez;AICO;24
AQUITANIA;Nelsy Yaneth Ramirez Aguilar;Opción Ciudadana;23
AQUITANIA;Mauro Ernesto Costo Chaparro;Alianza Social Independiente;22
AQUITANIA;Favio Humberto Naranjo;AICO;21
AQUITANIA;Consuelo Del Carmen Moreno Vargas;Partido de la U;20
AQUITANIA;Diana Yusliba Duque Diaz;Partido Conservador Colombiano;20
AQUITANIA;Doris Gomez Rincon;MOVIMIENTO DE INCLUSION Y OPORTUNIDADES;19
AQUITANIA;Gloria Yolima Montana Chaparro;Cambio Radical;17
AQUITANIA;Marco Antonio Lemus Patarroyo;Cambio Radical;17
AQUITANIA;Marisol Torres Torres;Alianza Social Independiente;16
AQUITANIA;Partido Cambio Radical;Cambio Radical;16
AQUITANIA;Yeni Andrea Rincon Perez;Partido Conservador Colombiano;12
AQUITANIA;Partido Alianza Social Independiente;Alianza Social Independiente;9
AQUITANIA;Aura Alicia Alarcon Pedraza;Partido de la U;8
AQUITANIA;Keith Madelein Rodriguez Perez;Cambio Radical;6
AQUITANIA;Rosa Helena Salamanca Figueredo;AICO;5
AQUITANIA;Diana Carolina Moreno Castro;Partido de la U;4
AQUITANIA;Fabio Orlando Cepeda Aguirre;Alianza Social Independiente;4
AQUITANIA;Camilo Andres Naranjo;Cambio Radical;3
AQUITANIA;Javier Sanchez Caballero;Alianza Social Independiente;1
ARCABUCO;Ivan Alirio Alba;Partido de la U;210
ARCABUCO;Wilfredo Benitez Roncancio;Alianza Verde;179
ARCABUCO;Jaime Antonio Guerrero Forero;Partido Conservador Colombiano;176
ARCABUCO;Sonia Jimenez Cadena;Partido de la U;174
ARCABUCO;Jose Eduardo Aunta Suarez;Partido de la U;143
ARCABUCO;Hector Jaime Poveda Aguilera;Partido Liberal Colombiano;131
ARCABUCO;Luis Alfredo Avila Rojas;Partido de la U;117
ARCABUCO;Jonh Freddy Lizcano Hernandez;Partido Conservador Colombiano;106
ARCABUCO;Israel Rodriguez Castellanos;Alianza Verde;103
ARCABUCO;Diogenes Camargo Robles;Partido Liberal Colombiano;99
ARCABUCO;Edilberto Leon Guzman Guzman;Partido Conservador Colombiano;89
ARCABUCO;Maria Yolanda Buitrago Rios;Partido Conservador Colombiano;89
ARCABUCO;Fernando Bustos Raba;Partido de la U;81
ARCABUCO;Ana Bety Molina Alba;Alianza Verde;75
ARCABUCO;Alexis Armando Guerrero Saavedra;Partido Conservador Colombiano;72
ARCABUCO;Rafael Eduardo Cuesta Hernandez;Cambio Radical;70
ARCABUCO;Reinaldo Suarez Bustos;Alianza Verde;70
ARCABUCO;Giovanny Ballen Torres;Partido de la U;63
ARCABUCO;Gladys Amparo Guarin Acero;Cambio Radical;60
ARCABUCO;Berceli Lopez Torres;Partido Conservador Colombiano;57
ARCABUCO;Martin Emilio Fuquene Cative;Alianza Verde;57
ARCABUCO;Diego Armando Pacheco Villamil;Alianza Verde;54
ARCABUCO;Hector Julio Ruiz Torres;Partido Liberal Colombiano;48
ARCABUCO;Edwin Alejandro Rodriguez Cortes;Partido de la U;47
ARCABUCO;Marcela Janneth Guzman Poveda;Partido Conservador Colombiano;43
ARCABUCO;Yamid Manuel Moreno Torres;Partido Conservador Colombiano;41
ARCABUCO;Mario Alfonso Paez Tarazona;Cambio Radical;38
ARCABUCO;Gina Milena Malagon Poveda;Alianza Verde;37
ARCABUCO;Abel Arnulfo Robles Simijaca;Cambio Radical;35
ARCABUCO;Partido Social De Unidad Nacional;Partido de la U;35
ARCABUCO;Carlos Andres Castelblanco;Partido Liberal Colombiano;31
ARCABUCO;Partido Verde;Alianza Verde;31
ARCABUCO;Flor Maria Cuadros Roldan;Partido de la U;27
ARCABUCO;Mauro Ismael Cruz Rodriguez;Partido Liberal Colombiano;27
ARCABUCO;Jose Melquisedec Benitez Hernandez;Alianza Verde;23
ARCABUCO;Nohora Hermelinda Saenz Saavedra;Partido de la U;23
ARCABUCO;Eliana Cristina Orrego Ortiz;Partido Liberal Colombiano;21
ARCABUCO;Fausto Ricardo Poveda Alfonso;Cambio Radical;21
ARCABUCO;Partido Conservador Colombiano;Partido Conservador Colombiano;21
ARCABUCO;Maricel Rojas Perez;Partido Liberal Colombiano;17
ARCABUCO;Wilmar Pinilla Bermudez;Cambio Radical;15
ARCABUCO;Luis Hernando Contreras Cabrera;Cambio Radical;14
ARCABUCO;Maria Leonor Meza Severiche;Cambio Radical;13
ARCABUCO;Partido Liberal Colombiano;Partido Liberal Colombiano;11
ARCABUCO;Nubia Acero Pinilla;Cambio Radical;9
ARCABUCO;Teresa Isabel Tellez Rodriguez;Partido Liberal Colombiano;9
ARCABUCO;Partido Cambio Radical;Cambio Radical;8
ARCABUCO;Yudy Tatiana Aguilera;Partido Conservador Colombiano;6
ARCABUCO;Jose Ismael Gonzalez Santiago;Partido Liberal Colombiano;5
ARCABUCO;Yeny Constanza Tovar Puentes;Alianza Verde;2
BELEN;Hermes Silva Alarcon;Partido Conservador Colombiano;309
BELEN;Segundo Arcenio Porras Sandoval;Partido Conservador Colombiano;288
BELEN;Willton Emilio Torres Castro;Partido Conservador Colombiano;262
BELEN;Jon Fredy Ayala Ojeda;Partido Liberal Colombiano;260
BELEN;Luis Adrian Gallo Pineda;Partido Liberal Colombiano;239
BELEN;Aldemar Gomez Guerrero;Partido Liberal Colombiano;225
BELEN;Orlando Guerrero Morantes;Partido Conservador Colombiano;221
BELEN;Alvaro Toledo Uribe;Partido Liberal Colombiano;218
BELEN;Orlando Perez Diaz;Partido Liberal Colombiano;191
BELEN;Victor Humberto Rojas Balaguera;Partido Conservador Colombiano;185
BELEN;Mauricio Valderrama Vega;Partido de la U;184
BELEN;Fabio Rincon Guerrero;Partido Liberal Colombiano;177
BELEN;Esgar Ferney Fernandez Fernandez;Partido Liberal Colombiano;169
BELEN;Arturo Espindola Mateus;Partido Liberal Colombiano;167
BELEN;Isidro De Jesus Castellanos Diaz;Partido Conservador Colombiano;165
BELEN;Carlos Hely Vargas Chiquillo;Partido de la U;159
BELEN;Wilson Dario Balaguera Rodriguez;Partido Conservador Colombiano;150
BELEN;Martha Cecilia Amado Rincon;Partido Conservador Colombiano;133
BELEN;Mauricio Rodriguez Mendoza;Partido de la U;129
BELEN;Oswaldo Cristancho Albarracin;Partido Conservador Colombiano;127
BELEN;Maria Cristina Machuca Balaguera;Partido de la U;111
BELEN;Luis Alfredo Rojas Silva;Partido de la U;81
BELEN;Juan Pablo Montanez;Partido Liberal Colombiano;79
BELEN;Salvador Diaz;Partido de la U;61
BELEN;Partido Liberal Colombiano;Partido Liberal Colombiano;57
BELEN;Partido Conservador Colombiano;Partido Conservador Colombiano;50
BELEN;Rosalba Torres Barrera;Partido de la U;41
BELEN;Luis Augusto Balaguera Daza;Partido de la U;36
BELEN;Partido Social De Unidad Nacional;Partido de la U;19
BELEN;Yolanda Diaz Balaguera;Partido de la U;15
BERBEO;Daniel Lopez Vallejo;Alianza Verde;79
BERBEO;Disander Arnaldo Cubides Martinez;Alianza Social Independiente;67
BERBEO;Rolfe Uriel Vega Roa;Partido de la U;62
BERBEO;Miyer Jose Vargas Contreras;Partido de la U;60
BERBEO;Marlen Mendoza Alfonso;Cambio Radical;50
BERBEO;Alba Mercedes Moreno Camacho;Opción Ciudadana;46
BERBEO;Berto Julio Martinez Granados;Alianza Social Independiente;43
BERBEO;Carlos Andres Cruz Manrique;Opción Ciudadana;43
BERBEO;Carlos Alberto Cortes Hernandez;Partido Liberal Colombiano;41
BERBEO;Jorge Edilgar Buitrago Buitrago;Cambio Radical;41
BERBEO;Maria Betania Roa Umana;Partido de la U;37
BERBEO;Yuber Daniel Vega Pena;Alianza Verde;35
BERBEO;Daniel Gustavo Vargas;Alianza Social Independiente;32
BERBEO;Claudia Rodriguez Pirateque;Alianza Verde;31
BERBEO;Cristobal Leguizamo Bohorquez;Partido Liberal Colombiano;30
BERBEO;Leonel Cadena Valero;Cambio Radical;29
BERBEO;Yalile Cadena Rojas;Alianza Verde;28
BERBEO;Ofiralid Granados Obando;Cambio Radical;26
BERBEO;Jairo Adrian Martinez Lopez;Partido Liberal Colombiano;25
BERBEO;Beymar Salamanca Castelblanco;Cambio Radical;24
BERBEO;Edgar Mario Bautista Herrera;Alianza Social Independiente;24
BERBEO;Hector Hernan Juez Vargas;Opción Ciudadana;23
BERBEO;Gloria Ines Guzman Preciado;Partido Liberal Colombiano;22
BERBEO;Maria Nelcy Diaz Castano;Partido Liberal Colombiano;22
BERBEO;Martha Cecilia Diaz Diaz;Partido de la U;20
BERBEO;Elson Ismael Montanez Vargas;Partido de la U;15
BERBEO;Nelson Nolberto Cifuentes Pulido;Alianza Verde;15
BERBEO;Mauricio Higua Espitia;Opción Ciudadana;12
BERBEO;Partido Liberal Colombiano;Partido Liberal Colombiano;11
BERBEO;Emilcen Monroy Vega;Opción Ciudadana;10
BERBEO;Milton Julio Mendoza Colmenares;Alianza Verde;10
BERBEO;Partido Social De Unidad Nacional;Partido de la U;10
BERBEO;Carmelina Lopez Mahecha;Cambio Radical;8
BERBEO;Fredy Jhoane Bohorquez Carranza;Opción Ciudadana;8
BERBEO;Sandra Patricia Castro Martinez;Alianza Verde;8
BERBEO;Alejandro Bohada Riano;Partido de la U;7
BERBEO;Leydy Johana Vargas Reinoso;Alianza Social Independiente;7
BERBEO;Partido Alianza Social Independiente;Alianza Social Independiente;7
BERBEO;Jose Donaldo Martinez Quintana;Cambio Radical;6
BERBEO;Mayra Rocio Granados Parra;Partido de la U;5
BERBEO;Rocio Monroy Diaz;Alianza Social Independiente;5
BERBEO;Luz Angela Alfonso Vallejo;Alianza Social Independiente;4
BERBEO;Partido Verde;Alianza Verde;4
BERBEO;Partido Cambio Radical;Cambio Radical;3
BERBEO;Edgar Yesid Munoz Gamba;Partido Liberal Colombiano;2
BERBEO;Partido De Integracion Nacional;Opción Ciudadana;1
BETEITIVA;Victor Julio Perez Araque;Cambio Radical;127
BETEITIVA;Willman Correa Cardenas;Partido de la U;115
BETEITIVA;Daniel Rojas Cely;Cambio Radical;114
BETEITIVA;Mary Luz Cely Cely;Partido Liberal Colombiano;87
BETEITIVA;Sara Yasmid Correa Cely;Partido de la U;71
BETEITIVA;Juan Carlos Alfonso Moreno;Partido de la U;66
BETEITIVA;Edilberto Gil Cardenas;Partido Liberal Colombiano;63
BETEITIVA;Robinson Javier Vargas Vargas;Alianza Verde;62
BETEITIVA;Wilmer Alfonso Correa Alvarez;Partido Liberal Colombiano;61
BETEITIVA;Cristobal Angarita Cardenas;Cambio Radical;59
BETEITIVA;Justo Luis Cristancho Saavedra;Partido de la U;51
BETEITIVA;Alvaro Perez Saavedra;Alianza Verde;47
BETEITIVA;Maria Gemma Perico De Becerra;Partido de la U;42
BETEITIVA;Maria De La Cruz Solano Perez;Alianza Verde;41
BETEITIVA;Maria Elvia Berdugo Gonzalez;Partido de la U;39
BETEITIVA;Jose Martin Silva Gil;Opción Ciudadana;38
BETEITIVA;Merardo Antonio Rojas Vargas;Partido Liberal Colombiano;38
BETEITIVA;Hector Julio Gallo Cardenas;Partido de la U;36
BETEITIVA;Josefa Cristancho De Rojas;Alianza Verde;33
BETEITIVA;Elias Vargas Rojas;Partido Liberal Colombiano;32
BETEITIVA;Yolanda Amado De Cardenas;Cambio Radical;28
BETEITIVA;Candelaria Leon Perez;Alianza Verde;25
BETEITIVA;Jose Antonio Acero Cely;Alianza Verde;25
BETEITIVA;Ana Reina Silva Cely;Cambio Radical;20
BETEITIVA;Luis Antonio Daza Fernandez;Alianza Verde;18
BETEITIVA;Irma Ines Rojas Gonzalez;Opción Ciudadana;16
BETEITIVA;Doris Angarita Angarita;Opción Ciudadana;9
BETEITIVA;Partido Liberal Colombiano;Partido Liberal Colombiano;9
BETEITIVA;Partido Verde;Alianza Verde;8
BETEITIVA;Partido Social De Unidad Nacional;Partido de la U;7
BETEITIVA;Leonel Uchamocha Daza;Opción Ciudadana;6
BETEITIVA;Carlos Alirio Mogollon Fernandez;Opción Ciudadana;5
BETEITIVA;Sonia Hernandez Rincon;Partido Liberal Colombiano;5
BETEITIVA;Partido Cambio Radical;Cambio Radical;4
BETEITIVA;Partido De Integracion Nacional;Opción Ciudadana;1
BOAVITA;Marlen Osorio Lizarazo;Alianza Verde;276
BOAVITA;Oliva Aponte Garcia;Alianza Verde;211
BOAVITA;Jorge Arturo Diaz Sanchez;Partido Conservador Colombiano;210
BOAVITA;Jairo Diaz Lagos;Partido de la U;159
BOAVITA;Fabio Tarazona Angarita;Partido Conservador Colombiano;138
BOAVITA;Pedro Jose Gallo Umana;Alianza Social Independiente;138
BOAVITA;Luis Daniel Duitama;Partido Conservador Colombiano;127
BOAVITA;Herminio Galvis Cordoba;Alianza Verde;123
BOAVITA;Alberto Sandoval Valcarcel;Partido Conservador Colombiano;114
BOAVITA;Lucas Armando Osorio Sepulveda;Partido de la U;113
BOAVITA;Angela Rocio Baez Gomez;Alianza Social Independiente;104
BOAVITA;Ignacio Hernandez Ayala;Partido de la U;102
BOAVITA;Carlos Enrique Ayala Sanchez;Partido Conservador Colombiano;100
BOAVITA;Carlos Rafael Baron Medina;Partido de la U;98
BOAVITA;Silvia Osorio De Duenas;Partido Conservador Colombiano;92
BOAVITA;Ignacio Lizarazo Maldonado;Alianza Verde;89
BOAVITA;Ines Diaz Burgos;Alianza Verde;86
BOAVITA;Luis Ariel Velasco;Partido Conservador Colombiano;78
BOAVITA;Maria Imelda Fuentes Garcia;Alianza Social Independiente;67
BOAVITA;Domingo Rojas Arias;Partido de la U;65
BOAVITA;Catalina Garcia Tarazona;Alianza Social Independiente;63
BOAVITA;Hildebrando Correa;Alianza Social Independiente;59
BOAVITA;Cleotilde Medina Cabrejo;Partido Conservador Colombiano;55
BOAVITA;Victor Manuel Quintero Davila;Partido de la U;49
BOAVITA;Aristobulo Diaz Diaz;Alianza Verde;46
BOAVITA;Monica Maria Rivera Bonilla;Alianza Social Independiente;45
BOAVITA;Partido Verde;Alianza Verde;41
BOAVITA;Partido Conservador Colombiano;Partido Conservador Colombiano;39
BOAVITA;Adriano Baron Diaz;Alianza Verde;23
BOAVITA;Aminta Arias De Vega;Alianza Verde;23
BOAVITA;Beatriz Arias De Velasco;Partido Conservador Colombiano;22
BOAVITA;Jose Domingo Veloza Medina;Cambio Radical;21
BOAVITA;Julio Daniel Aponte;Alianza Social Independiente;18
BOAVITA;Ruth Carolina Lizarazo Carrillo;Partido de la U;18
BOAVITA;Partido Alianza Social Independiente;Alianza Social Independiente;17
BOAVITA;Partido Social De Unidad Nacional;Partido de la U;14
BOAVITA;Myriam Pinzon Burgos;Cambio Radical;11
BOAVITA;Maria Eugenia Hernandez Carreno;Partido de la U;9
BOAVITA;Partido Cambio Radical;Cambio Radical;6
BOAVITA;Sandra Carolina Guio Fuentes;Partido de la U;5
BOYACA;Jose Dario Cupa Bernal;Opción Ciudadana;195
BOYACA;Alejandro Boada Mora;Partido de la U;150
BOYACA;Jose Pepe Cifuentes Sosa;Partido Liberal Colombiano;145
BOYACA;Jose Edilberto Bermudez Barajas;Partido Liberal Colombiano;144
BOYACA;Jairo Enrique Caro Camargo;Partido Liberal Colombiano;137
BOYACA;Pedro Julio Parada Rativa;Partido Liberal Colombiano;132
BOYACA;Ana Edelmira Mancilla Gaona;Partido de la U;125
BOYACA;Alfonso Camelo Torres;Partido Liberal Colombiano;121
BOYACA;Wilson Montes Suarique;Partido de la U;106
BOYACA;Rafael Humberto Munoz Cifuentes;Opción Ciudadana;97
BOYACA;Maxima Abigail Leguizamon De Bohorquez;Partido Liberal Colombiano;93
BOYACA;Partido Liberal Colombiano;Partido Liberal Colombiano;90
BOYACA;Omar De Jesus Cifuentes Cifuentes;Partido de la U;89
BOYACA;Luis Antonio Merchan Callejas;Opción Ciudadana;88
BOYACA;Luis Enrique Bohorquez Tobar;Partido de la U;79
BOYACA;Olga Lucia Cruz Arcos;Partido de la U;78
BOYACA;Jorge Tiberio Tovar Cifuentes;Cambio Radical;73
BOYACA;Aura Jeanet Torres Sora;Partido Liberal Colombiano;71
BOYACA;Pedro Jose Sora Arias;Partido Liberal Colombiano;71
BOYACA;Jorge Enrique Cupa Garcia;Partido de la U;60
BOYACA;Carlos Alberto Sanchez Molano;Alianza Verde;55
BOYACA;Sandra Milena Gutierrez Bohorquez;Cambio Radical;50
BOYACA;Alveiro Plazas Ortiz;Alianza Verde;46
BOYACA;Partido Social De Unidad Nacional;Partido de la U;40
BOYACA;Delio Sanabria Munoz;Cambio Radical;38
BOYACA;Pedro Moreno Rincon;Partido de la U;38
BOYACA;Maria Cristina Granados Calderon;Partido Liberal Colombiano;36
BOYACA;Maria Claudia Quintero Malagon;Opción Ciudadana;33
BOYACA;Omar Yesid Mancilla Mancilla;Opción Ciudadana;33
BOYACA;Rodrigo Martinez Ortiz;Alianza Verde;32
BOYACA;Luz Marina Vargas Quintero;Opción Ciudadana;25
BOYACA;Partido De Integracion Nacional;Opción Ciudadana;20
BOYACA;Alirio Rativa Garcia;Opción Ciudadana;19
BOYACA;Carolina Vargas Sosa;Alianza Verde;19
BOYACA;Myriam Yulie Vargas Rativa;Opción Ciudadana;19
BOYACA;Jaime Vargas Rativa;Cambio Radical;13
BOYACA;Alicia Callejas;Partido de la U;12
BOYACA;Fredy Alonso Aponte Paez;Opción Ciudadana;11
BOYACA;Partido Cambio Radical;Cambio Radical;11
BOYACA;Henry Rios Gaona;Alianza Verde;10
BOYACA;Maria Emilce Romero Barajas;Alianza Verde;10
BOYACA;Reinel Sosa Sanchez;Cambio Radical;10
BOYACA;Segundo Neira Sosa;Alianza Verde;10
BOYACA;Berenice Ramirez Castelblanco;Cambio Radical;9
BOYACA;Partido Verde;Alianza Verde;8
BOYACA;Martha Cecilia Cifuentes Cifuentes;Alianza Verde;7
BRICENO;Nayibe Alexandra Florian Cortes;Cambio Radical;114
BRICENO;Fabio Enrique Rocha Pena;Alianza Verde;105
BRICENO;Malely Duran Gomez;Partido Conservador Colombiano;98
BRICENO;Celio Gonzalo Ramirez Pena;Alianza Social Independiente;94
BRICENO;Evelia Pena Masmela;Opción Ciudadana;74
BRICENO;Marcos Florindo Montanez Abril;Partido Conservador Colombiano;64
BRICENO;Wauldino Parra Figueredo;Alianza Social Independiente;64
BRICENO;Reinaldo Humberto Ortiz Murcia;Alianza Social Independiente;61
BRICENO;Gregorio Hernando Sanchez Ortiz;Alianza Verde;57
BRICENO;Publio Joaquin Ortiz Pedroza;Alianza Social Independiente;55
BRICENO;Marco Tulio Pena Carvajal;Partido Conservador Colombiano;54
BRICENO;Javier Emilio Benitez Medina;Partido Conservador Colombiano;53
BRICENO;Ferney Saza Lemus;Opción Ciudadana;41
BRICENO;Abel Alfonso Cortes Ballares;Partido de la U;34
BRICENO;Richard Antonio Rodriguez Pineda;Alianza Verde;31
BRICENO;Fabio Hernando Leon Pena;Cambio Radical;30
BRICENO;Marionel Poveda Gonzalez;Cambio Radical;29
BRICENO;Jose Ramiro Garcia Torres;Cambio Radical;28
BRICENO;Juan Ortiz Rodriguez;Alianza Verde;25
BRICENO;Dario Gilberto Antonio Nunez;Cambio Radical;24
BRICENO;Griceldino Hernandez;Partido Conservador Colombiano;24
BRICENO;Willan Ferney Vargas Paez;Partido de la U;24
BRICENO;Arnulfo Vallares Murcia;Partido de la U;17
BRICENO;Bertha Delianey Ramos Guerrero;Partido de la U;16
BRICENO;Partido Cambio Radical;Cambio Radical;16
BRICENO;Gerardo Moreno Buitrago;Opción Ciudadana;13
BRICENO;Partido Conservador Colombiano;Partido Conservador Colombiano;11
BRICENO;Florindo Silva Villamil;Opción Ciudadana;10
BRICENO;Partido Alianza Social Independiente;Alianza Social Independiente;9
BRICENO;Flor Esmira Ortiz Cuellar;Alianza Verde;8
BRICENO;Pablo Enrique Wilches;Opción Ciudadana;8
BRICENO;Edilia Murillo;Alianza Verde;7
BRICENO;Edy Yoana Tinjaca Sierra;Partido de la U;7
BRICENO;Marisol Melo Salinas;Opción Ciudadana;7
BRICENO;Olga Yaned Pena Rincon;Cambio Radical;7
BRICENO;Partido De Integracion Nacional;Opción Ciudadana;7
BRICENO;Partido Verde;Alianza Verde;7
BRICENO;Carmen Elisa Laiton Cortes;Cambio Radical;6
BRICENO;Gilma Cortez Garavito;Partido Conservador Colombiano;6
BRICENO;Partido Social De Unidad Nacional;Partido de la U;6
BRICENO;Jenny Rocio Mendoza Martinez;Alianza Social Independiente;4
BRICENO;Julie Milena Cubides Cubides;Alianza Social Independiente;3
BRICENO;Odilia Umana Canon;Opción Ciudadana;2
BRICENO;Karen Yesenia Bravo Cortes;Partido Conservador Colombiano;1
BUENAVISTA;Ovidio Parra Pena;Cambio Radical;180
BUENAVISTA;Luis Humberto Arevalo;Cambio Radical;154
BUENAVISTA;Baudilio Castillo Bernal;Cambio Radical;150
BUENAVISTA;Florencio Buitrago;Alianza Social Independiente;145
BUENAVISTA;Leidy Andrea Forero Arevalo;Cambio Radical;128
BUENAVISTA;Angel Maria Antonio Forero;Cambio Radical;120
BUENAVISTA;Yaneth Alarcon Forero;Cambio Radical;100
BUENAVISTA;Jose De Jesus Ballen Avendano;Partido Conservador Colombiano;97
BUENAVISTA;Cristian Camilo Ortiz Fandino;Cambio Radical;89
BUENAVISTA;Luis Alberto Cubides;Partido Conservador Colombiano;87
BUENAVISTA;Marina Redondo Benitez;Partido Conservador Colombiano;75
BUENAVISTA;Javier Arevalo Sosa;Partido de la U;72
BUENAVISTA;Leidy Marcela Parra Canon;Partido de la U;70
BUENAVISTA;Ovidio Alexander Ballen Cortes;Partido de la U;68
BUENAVISTA;Nelly Azucena Romero Ramirez;Cambio Radical;65
BUENAVISTA;Pedro Orlando Robayo Sierra;Partido Conservador Colombiano;65
BUENAVISTA;Patricia Chavarro Clavijo;Partido de la U;63
BUENAVISTA;Edgar Octavio Arevalo Veloza;Partido de la U;60
BUENAVISTA;Gerardo Espitia Suarez;Alianza Social Independiente;60
BUENAVISTA;Tito Coca Ortiz;Partido Conservador Colombiano;60
BUENAVISTA;Jose Alvaro Ballen Cortes;Cambio Radical;59
BUENAVISTA;Alba Luz Alarcon Castiblanco;Partido Conservador Colombiano;55
BUENAVISTA;Hector Fidel Coca Salinas;Partido de la U;53
BUENAVISTA;Partido Social De Unidad Nacional;Partido de la U;53
